{"run":279,"commit":"5381f9a","metric":4111918,"metrics":{"altseed_classical_total":0,"altseed_phase_batches_total":0,"altseed_ancilla_batches_total":0,"avg_clifford":24423006.99,"qubits":2716,"emitted_ops":30748978,"correctness_ok":1,"by_tests_passed":109,"inverse_negr_ccx":1145760,"two_fast_replay_projected":2637286,"by_replay_bench_avg_toffoli":5278510,"by_replay_bench_qubits":2716,"by_replay_bench_emitted_ops":42250936,"centered_body_bench_avg_toffoli":4985518,"centered_body_bench_qubits":2716,"centered_body_bench_emitted_ops":38874541,"centered_body_replay_ccx":873600,"centered_inverse_replay_ccx":873600,"centered_budget_if_folded":2640622,"centered_phase96_fast_mbu_ccx":299616,"centered_phase96_exact_signed_ccx":399264,"centered_phase96_exact_parity_ccx":448800,"centered_phase96_all_exact_ccx":548448,"centered_clean_all_exact_roundtrip_ccx":3199280,"centered_clean_all_exact_peak":2464,"centered_exact_parity_fast_signed_roundtrip_ccx":2618000,"centered_negpatch_phase_saw0":1,"centered_negpatch_phase_saw1":1,"centered_clean_roundtrip_bench_avg_toffoli":7311738,"centered_clean_roundtrip_bench_avg_clifford":32532302.269,"centered_clean_roundtrip_bench_qubits":2976,"centered_clean_roundtrip_bench_emitted_ops":42092380,"centered_clean_roundtrip_bench_altseed_phase":0,"centered_fixed_trace_hook_phase":0,"centered_fast_clean_roundtrip_bench_avg_toffoli":5860218,"centered_fast_clean_roundtrip_bench_avg_clifford":38190533.993,"centered_fast_clean_roundtrip_bench_qubits":3235,"centered_fast_clean_roundtrip_bench_emitted_ops":47024860,"centered_fast_clean_roundtrip_bench_altseed_phase":0,"centered_fast_clean_increment_toffoli":1747760,"centered_denom_controls_bench_avg_toffoli":7868378,"centered_denom_controls_bench_avg_clifford":44313822.825,"centered_denom_controls_bench_qubits":4964,"centered_denom_controls_bench_emitted_ops":55824052,"centered_denom_controls_bench_altseed_phase":0,"centered_live_num_bench_avg_toffoli":7870438,"centered_live_num_bench_avg_clifford":44320460.712,"centered_live_num_bench_qubits":4965,"centered_live_num_bench_emitted_ops":55834807,"centered_live_num_bench_altseed_phase":0,"centered_pair1_replace_avg_toffoli":8172700,"centered_pair1_replace_avg_clifford":40780745.214,"centered_pair1_replace_qubits":5589,"centered_pair1_replace_emitted_ops":51801485,"centered_pair1_replace_altseed_phase":0,"centered_pair1_replace_altseed_classical":0},"status":"keep","description":"Wire first functional BY pair1 replacement behind env flag","timestamp":1777428732425,"segment":3,"confidence":5.970334101382488,"iterationTokens":27877,"asi":{"hypothesis":"The fastest route from components to real integration is to replace pair1's Kaliski inverse and first multiplication with a centered BY tagged-DIV Bennett computation that writes lam=-dy/dx, while leaving existing pair1 mul2 and pair2 Kaliski in place for cleanup/output correctness.","result":"Added BY_CENTERED_PAIR1_REPLACE=1. It copies dx into a full-width signed BY denominator state, generates 576 odd/A controls, builds a tagged numerator copy dy+dx, runs fast centered replay forward, copies lam=1-sign(f)*r, inverse-replays to clean parity/numerator scratch, reverses denominator generation to clean controls, then uses existing pair1 mul2 to zero ty. The env path passes the full harness: avg_toffoli=8,172,700, avg_clifford=40,780,745.214, qubits=5,589, emitted_ops=51,801,485, altseed/classical/phase/ancilla all zero. Default remains 4,111,918 Toffoli @ 2,716q.","structural_learning":"This is the first real point-add path where a Kaliski-sized pair1 piece is replaced by BY tagged division inside build_standard_point_add. The initial 560-step replacement had one main-shot classical miss; moving the pair1 BY computation to 576 steps made the checked workload clean. Tapered denominator generation was insufficient for quotient extraction because it discards the final f sign; pair1 uses full-width signed denominator evolution to preserve sign(f).","caveat":"The replacement is intentionally ugly and worse than baseline: direct full-width 576-step denominator generation, Bennett replay, pair1 mul2 still present, pair2 still Kaliski, and peak 5,589q. This proves integration, not performance.","next_action_hint":"Now optimize toward the intended architecture: replace full-width denominator generation with selected/window denominator compute that preserves sign(f), and delete pair1 mul2 by letting the forward replay consume/zero the tagged numerator instead of Bennett-restoring it. In parallel, wire pair2 inverse/product-clean BY replacement behind an env flag."}}
{"run":280,"commit":"e4d88ee","metric":4111918,"metrics":{"altseed_classical_total":0,"altseed_phase_batches_total":0,"altseed_ancilla_batches_total":0,"avg_clifford":24423006.99,"qubits":2716,"emitted_ops":30748978,"correctness_ok":1,"by_tests_passed":109,"inverse_negr_ccx":1145760,"two_fast_replay_projected":2637286,"by_replay_bench_avg_toffoli":5278510,"by_replay_bench_qubits":2716,"by_replay_bench_emitted_ops":42250936,"centered_body_bench_avg_toffoli":4985518,"centered_body_bench_qubits":2716,"centered_body_bench_emitted_ops":38874541,"centered_body_replay_ccx":873600,"centered_inverse_replay_ccx":873600,"centered_budget_if_folded":2640622,"centered_phase96_fast_mbu_ccx":299616,"centered_phase96_exact_signed_ccx":399264,"centered_phase96_exact_parity_ccx":448800,"centered_phase96_all_exact_ccx":548448,"centered_clean_all_exact_roundtrip_ccx":3199280,"centered_clean_all_exact_peak":2464,"centered_exact_parity_fast_signed_roundtrip_ccx":2618000,"centered_negpatch_phase_saw0":1,"centered_negpatch_phase_saw1":1,"centered_clean_roundtrip_bench_avg_toffoli":7311738,"centered_clean_roundtrip_bench_avg_clifford":32532302.269,"centered_clean_roundtrip_bench_qubits":2976,"centered_clean_roundtrip_bench_emitted_ops":42092380,"centered_clean_roundtrip_bench_altseed_phase":0,"centered_fixed_trace_hook_phase":0,"centered_fast_clean_roundtrip_bench_avg_toffoli":5860218,"centered_fast_clean_roundtrip_bench_avg_clifford":38190533.993,"centered_fast_clean_roundtrip_bench_qubits":3235,"centered_fast_clean_roundtrip_bench_emitted_ops":47024860,"centered_fast_clean_roundtrip_bench_altseed_phase":0,"centered_fast_clean_increment_toffoli":1747760,"centered_denom_controls_bench_avg_toffoli":7868378,"centered_denom_controls_bench_avg_clifford":44313822.825,"centered_denom_controls_bench_qubits":4964,"centered_denom_controls_bench_emitted_ops":55824052,"centered_denom_controls_bench_altseed_phase":0,"centered_live_num_bench_avg_toffoli":7870438,"centered_live_num_bench_avg_clifford":44320460.712,"centered_live_num_bench_qubits":4965,"centered_live_num_bench_emitted_ops":55834807,"centered_live_num_bench_altseed_phase":0,"centered_pair1_replace_avg_toffoli":8172700,"centered_pair1_replace_avg_clifford":40780745.214,"centered_pair1_replace_qubits":5589,"centered_pair1_replace_emitted_ops":51801485,"centered_pair1_replace_altseed_phase":0,"centered_pair1_replace_altseed_classical":0,"centered_pair2_replace_avg_toffoli":8189908,"centered_pair2_replace_avg_clifford":40876699.034,"centered_pair2_replace_qubits":5589,"centered_pair2_replace_emitted_ops":51930771,"centered_pair2_replace_altseed_phase":0,"centered_pair2_replace_altseed_classical":0,"centered_pair12_replace_avg_toffoli":12251174,"centered_pair12_replace_qubits":5589,"centered_pair12_replace_emitted_ops":72970707},"status":"keep","description":"Wire functional BY pair2 replacement and verify both Kaliski replacements together","timestamp":1777435640265,"segment":3,"confidence":5.970334101382488,"iterationTokens":20116,"asi":{"hypothesis":"The same centered BY tagged-DIV machinery can replace pair2 Kaliski by computing -(ty/tx) and adding it directly into the live lam accumulator, avoiding a dirty quotient output register.","result":"Added BY_CENTERED_PAIR2_REPLACE=1. Pair2 replacement computes -(ty/tx) with the 576-step full-width signed BY tagged-DIV and adds it directly into lam, then keeps the existing ty-=Qy cleanup. Pair2-only env path passes: avg_toffoli=8,189,908, avg_clifford=40,876,699.034, qubits=5,589, emitted_ops=51,930,771, all altseed/classical/phase/ancilla zero. Enabling both BY_CENTERED_PAIR1_REPLACE=1 and BY_CENTERED_PAIR2_REPLACE=1 also passes: avg_toffoli=12,251,174, qubits=5,589, emitted_ops=72,970,707. Default remains 4,111,918 Toffoli @ 2,716q.","structural_learning":"Both Kaliski inverse-sized objects in the real affine point-add can now be replaced by centered BY tagged-DIV objects and pass the full exact checker. Pair2 needed in-accumulator quotient addition rather than a separate correction output, because a nonzero correction register would be dirty after zeroing lam. This confirms the product-clean idea can be integrated in accumulator form.","caveat":"These replacements are much worse than baseline due to full-width 576-step denominator generation, Bennett replay, and remaining scaffold multiplications. This is an integration milestone, not performance.","next_action_hint":"Now stop using full-width direct denominator generation: wire selected/window denominator compute or consumed-lowword window to replace the 576-step generator. Also delete pair1 mul2 by consuming the tagged numerator channel instead of Bennett-restoring it."}}
{"run":281,"commit":"795e2d6","metric":4111918,"metrics":{"altseed_classical_total":0,"altseed_phase_batches_total":0,"altseed_ancilla_batches_total":0,"avg_clifford":24423006.99,"qubits":2716,"emitted_ops":30748978,"correctness_ok":1,"by_tests_passed":109,"inverse_negr_ccx":1145760,"two_fast_replay_projected":2637286,"by_replay_bench_avg_toffoli":5278510,"by_replay_bench_qubits":2716,"by_replay_bench_emitted_ops":42250936,"centered_body_bench_avg_toffoli":4985518,"centered_body_bench_qubits":2716,"centered_body_bench_emitted_ops":38874541,"centered_body_replay_ccx":873600,"centered_inverse_replay_ccx":873600,"centered_budget_if_folded":2640622,"centered_phase96_fast_mbu_ccx":299616,"centered_phase96_exact_signed_ccx":399264,"centered_phase96_exact_parity_ccx":448800,"centered_phase96_all_exact_ccx":548448,"centered_clean_all_exact_roundtrip_ccx":3199280,"centered_clean_all_exact_peak":2464,"centered_exact_parity_fast_signed_roundtrip_ccx":2618000,"centered_negpatch_phase_saw0":1,"centered_negpatch_phase_saw1":1,"centered_clean_roundtrip_bench_avg_toffoli":7311738,"centered_clean_roundtrip_bench_avg_clifford":32532302.269,"centered_clean_roundtrip_bench_qubits":2976,"centered_clean_roundtrip_bench_emitted_ops":42092380,"centered_clean_roundtrip_bench_altseed_phase":0,"centered_fixed_trace_hook_phase":0,"centered_fast_clean_roundtrip_bench_avg_toffoli":5860218,"centered_fast_clean_roundtrip_bench_avg_clifford":38190533.993,"centered_fast_clean_roundtrip_bench_qubits":3235,"centered_fast_clean_roundtrip_bench_emitted_ops":47024860,"centered_fast_clean_roundtrip_bench_altseed_phase":0,"centered_fast_clean_increment_toffoli":1747760,"centered_denom_controls_bench_avg_toffoli":7868378,"centered_denom_controls_bench_avg_clifford":44313822.825,"centered_denom_controls_bench_qubits":4964,"centered_denom_controls_bench_emitted_ops":55824052,"centered_denom_controls_bench_altseed_phase":0,"centered_live_num_bench_avg_toffoli":7870438,"centered_live_num_bench_avg_clifford":44320460.712,"centered_live_num_bench_qubits":4965,"centered_live_num_bench_emitted_ops":55834807,"centered_live_num_bench_altseed_phase":0,"centered_pair1_replace_avg_toffoli":8172700,"centered_pair1_replace_avg_clifford":40780745.214,"centered_pair1_replace_qubits":5589,"centered_pair1_replace_emitted_ops":51801485,"centered_pair1_replace_altseed_phase":0,"centered_pair1_replace_altseed_classical":0,"centered_pair2_replace_avg_toffoli":8189908,"centered_pair2_replace_avg_clifford":40876699.034,"centered_pair2_replace_qubits":5589,"centered_pair2_replace_emitted_ops":51930771,"centered_pair2_replace_altseed_phase":0,"centered_pair2_replace_altseed_classical":0,"centered_pair12_replace_avg_toffoli":12251174,"centered_pair12_replace_qubits":5589,"centered_pair12_replace_emitted_ops":72970707,"centered_pair1_fast_accum_avg_toffoli":8171417,"centered_pair1_fast_accum_qubits":5589,"centered_pair1_fast_accum_emitted_ops":51826551,"centered_pair2_fast_accum_avg_toffoli":8187601,"centered_pair2_fast_accum_qubits":5589,"centered_pair2_fast_accum_emitted_ops":51944268,"centered_pair12_fast_accum_avg_toffoli":12246560,"centered_pair12_fast_accum_qubits":5589,"centered_pair12_fast_accum_emitted_ops":72997701,"signed_copy_fast_phase_batches":1},"status":"keep","description":"Use fast quotient accumulation in centered BY replacements and record signed-copy phase blocker","timestamp":1777436989535,"segment":3,"confidence":5.970334101382488,"iterationTokens":22052,"asi":{"hypothesis":"Now that pair1 and pair2 BY replacements pass, use fast MBU controlled modular add/sub for quotient accumulation into lam/acc to shave cost while preserving phase cleanliness; keep the signed-to-modular copy exact unless proven safe.","result":"Changed by_add_neg_quotient_from_centered_r_for_bench to use cmod_add_qq/cmod_sub_qq for accumulating the recovered quotient into lam/acc. Pair1 env path stayed clean and improved from 8,172,700 to 8,171,417 Toffoli. Pair2 env path stayed clean and improved from 8,189,908 to 8,187,601. Both replacements together stayed clean and improved from 12,251,174 to 12,246,560. A separate attempt to make the signed-to-modular copy's sign-controlled ±c correction fast caused one phase-garbage batch, so it was reverted and remains exact. Default path is env-gated and unchanged at 4,111,918 Toffoli @ 2,716q.","structural_learning":"Fast MBU quotient accumulation is safe in this replacement schedule, unlike the signed-copy correction. The exact signed-copy ±c correction is a small but real phase-sensitive boundary; do not fasten it without a dedicated cleanup/witness. The main remaining cost is still full-width 576-step denominator generation and Bennett replay, not quotient accumulation.","dead_end":"cadd/csub_nbit_const_fast for by_copy_signed_mod_p_for_bench/by_uncopy_signed_mod_p_for_bench produced phase garbage (one main phase batch) and was reverted.","next_action_hint":"Focus on replacing full-width denominator generation with selected/window denominator compute. Secondary: remove Bennett replay/pair1 mul2 by consuming the tagged numerator channel directly."}}
{"run":282,"commit":"e6f25df","metric":8790041,"metrics":{"altseed_classical_total":0,"altseed_phase_batches_total":0,"altseed_ancilla_batches_total":0,"avg_clifford":42856022.157,"qubits":5589,"emitted_ops":55077495,"correctness_ok":1,"by_tests_passed":109,"inverse_negr_ccx":1145760,"two_fast_replay_projected":2637286,"by_replay_bench_avg_toffoli":5278510,"by_replay_bench_qubits":2716,"by_replay_bench_emitted_ops":42250936,"centered_body_bench_avg_toffoli":4985518,"centered_body_bench_qubits":2716,"centered_body_bench_emitted_ops":38874541,"centered_body_replay_ccx":873600,"centered_inverse_replay_ccx":873600,"centered_budget_if_folded":2640622,"centered_phase96_fast_mbu_ccx":299616,"centered_phase96_exact_signed_ccx":399264,"centered_phase96_exact_parity_ccx":448800,"centered_phase96_all_exact_ccx":548448,"centered_clean_all_exact_roundtrip_ccx":3199280,"centered_clean_all_exact_peak":2464,"centered_exact_parity_fast_signed_roundtrip_ccx":2618000,"centered_negpatch_phase_saw0":1,"centered_negpatch_phase_saw1":1,"centered_clean_roundtrip_bench_avg_toffoli":7311738,"centered_clean_roundtrip_bench_avg_clifford":32532302.269,"centered_clean_roundtrip_bench_qubits":2976,"centered_clean_roundtrip_bench_emitted_ops":42092380,"centered_clean_roundtrip_bench_altseed_phase":0,"centered_fixed_trace_hook_phase":0,"centered_fast_clean_roundtrip_bench_avg_toffoli":5860218,"centered_fast_clean_roundtrip_bench_avg_clifford":38190533.993,"centered_fast_clean_roundtrip_bench_qubits":3235,"centered_fast_clean_roundtrip_bench_emitted_ops":47024860,"centered_fast_clean_roundtrip_bench_altseed_phase":0,"centered_fast_clean_increment_toffoli":1747760,"centered_denom_controls_bench_avg_toffoli":7868378,"centered_denom_controls_bench_avg_clifford":44313822.825,"centered_denom_controls_bench_qubits":4964,"centered_denom_controls_bench_emitted_ops":55824052,"centered_denom_controls_bench_altseed_phase":0,"centered_live_num_bench_avg_toffoli":7870438,"centered_live_num_bench_avg_clifford":44320460.712,"centered_live_num_bench_qubits":4965,"centered_live_num_bench_emitted_ops":55834807,"centered_live_num_bench_altseed_phase":0,"centered_pair1_replace_avg_toffoli":8172700,"centered_pair1_replace_avg_clifford":40780745.214,"centered_pair1_replace_qubits":5589,"centered_pair1_replace_emitted_ops":51801485,"centered_pair1_replace_altseed_phase":0,"centered_pair1_replace_altseed_classical":0,"centered_pair2_replace_avg_toffoli":8189908,"centered_pair2_replace_avg_clifford":40876699.034,"centered_pair2_replace_qubits":5589,"centered_pair2_replace_emitted_ops":51930771,"centered_pair2_replace_altseed_phase":0,"centered_pair2_replace_altseed_classical":0,"centered_pair12_replace_avg_toffoli":12251174,"centered_pair12_replace_qubits":5589,"centered_pair12_replace_emitted_ops":72970707,"centered_pair1_fast_accum_avg_toffoli":8171417,"centered_pair1_fast_accum_qubits":5589,"centered_pair1_fast_accum_emitted_ops":51826551,"centered_pair2_fast_accum_avg_toffoli":8187601,"centered_pair2_fast_accum_qubits":5589,"centered_pair2_fast_accum_emitted_ops":51944268,"centered_pair12_fast_accum_avg_toffoli":12246560,"centered_pair12_fast_accum_qubits":5589,"centered_pair12_fast_accum_emitted_ops":72997701,"signed_copy_fast_phase_batches":1,"centered_pair1_window_denom_avg_toffoli":8790041,"centered_pair1_window_denom_qubits":5589,"centered_pair1_window_denom_emitted_ops":55077495},"status":"keep","description":"Wire lowword-window BY denominator controls into pair1 replacement","timestamp":1777437502152,"segment":3,"confidence":5.970334101382488,"iterationTokens":22052,"asi":{"hypothesis":"A 16-step lowword signed BY oracle can source pair1 denominator branch controls in the real replacement path; full-width f/g are then updated from those selected controls so final sign(f) is still available.","result":"Added BY_CENTERED_WINDOW_DENOM_REPLACE=1. In pair1 replacement, each 16-step window copies low f/g and delta into a 34-bit local signed 2-adic simulator, generates odd/A controls, applies those controls to the full-width denominator state, runs the existing centered replay, then reverses full state and reruns the lowword oracle to clear histories. Pair1 window-control path passes: avg_toffoli=8,790,041, avg_clifford=42,856,022.157, qubits=5,589, emitted_ops=55,077,495, all altseed/classical/phase/ancilla zero.","structural_learning":"The lowword-window control source is now wired into a real quotient-producing BY replacement, not just a test. This confirms 16 low signed bits plus delta are sufficient to drive the full-width signed denominator evolution and preserve quotient-frame correctness/sign(f). Cost is worse because this still applies 576 full-width microsteps and adds the local oracle; selected fixed-matrix full-state update remains the needed next deletion.","caveat":"This is an integration milestone and intentionally worse than the direct full generator. It does not yet use q corrections or fixed-matrix/window updates, only window-derived branch controls.","next_action_hint":"Next replace the per-step full-width selected-control application with a 16-step fixed-matrix/q-correction update so the window oracle cost can buy down denominator generation rather than adding overhead."}}
