{"type":"config","name":"plusminus controlled active-chain unary generator circuit","metricName":"plusminus_controlled_active_chain_ccx","metricUnit":"","bestDirection":"lower"}
{"run":484,"commit":"cf37441","metric":32,"metrics":{"plusminus_controlled_active_chain_width":16,"plusminus_controlled_active_chain_peak_q":50,"altseed_classical_total":0,"altseed_phase_batches_total":0,"altseed_ancilla_batches_total":0,"avg_toffoli":4089274,"avg_clifford":24292787.153,"qubits":2713,"emitted_ops":30575944,"correctness_ok":1},"status":"keep","description":"Validate controlled active-chain generator for fixed-loop terminal steps","timestamp":1777585712302,"segment":51,"confidence":null,"iterationTokens":165,"asi":{"hypothesis":"A fixed-bound plus-minus DIV loop can avoid a separate active history bit by making inactive iterations write an all-zero k-history word through a controlled active-chain generator.","result":"Controlled active-chain generator passed for start=0 and start=1 over 1024 width-16 inputs with phase and active-chain clean. It costs the same 2W=32 CCX as the uncontrolled generator and peak 50q. This is the terminal-loop building block needed to represent inactive post-convergence iterations as zero history.","next_action_hint":"Build an active-aware no-op step skeleton: compute d=u-v, active=(d!=0), use controlled generator and active-gated coefficient/order updates, then clear active from hist!=0. Verify u==v inputs are no-ops and active inputs match the existing step."}}
{"type":"config","name":"plusminus active-aware terminal step circuit","metricName":"plusminus_active_step_roundtrip_ccx","metricUnit":"","bestDirection":"lower"}
{"run":485,"commit":"e35c9c6","metric":1168,"metrics":{"plusminus_active_step_width":12,"plusminus_active_step_forward_ccx":591,"plusminus_active_step_forward_peak_q":101,"plusminus_active_step_roundtrip_peak_q":101,"altseed_classical_total":0,"altseed_phase_batches_total":0,"altseed_ancilla_batches_total":0,"avg_toffoli":4089274,"avg_clifford":24292787.153,"qubits":2713,"emitted_ops":30575944,"correctness_ok":1},"status":"keep","description":"Validate active-aware plusminus terminal no-op step","timestamp":1777585921133,"segment":52,"confidence":null,"iterationTokens":164,"asi":{"hypothesis":"A fixed-iteration plus-minus DIV loop can represent inactive post-convergence steps by an all-zero k-history word, without storing a separate active flag.","result":"Width-12 active-aware one-step circuit passed targeted autoresearch.sh and full checks. Forward active cases match the ordinary k-only update; u==v cases are no-ops with zero history. Forward+inverse restores all lanes and clears hist/active/spill/flag with phase zero. Cost: forward 591 CCX, roundtrip 1168 CCX, peak 101q. Active is temporary: forward clears it from hist!=0, inverse clears it by recomputing restored u-v.","next_action_hint":"Compose a fixed-bound multi-step loop using active-aware steps and packed slack slots, with cases that converge before the bound, to validate terminal no-op behavior in LIFO cleanup."}}
{"type":"config","name":"plusminus fixed-bound packed active loop circuit","metricName":"plusminus_fixed_bound_roundtrip_ccx","metricUnit":"","bestDirection":"lower"}
{"run":486,"commit":"8323692","metric":9344,"metrics":{"plusminus_fixed_bound_live_width":12,"plusminus_fixed_bound_total_width":36,"plusminus_fixed_bound_steps":8,"plusminus_fixed_bound_packed_slots":96,"plusminus_fixed_bound_forward_ccx":4728,"plusminus_fixed_bound_forward_peak_q":185,"plusminus_fixed_bound_roundtrip_peak_q":185,"altseed_classical_total":0,"altseed_phase_batches_total":0,"altseed_ancilla_batches_total":0,"avg_toffoli":4089274,"avg_clifford":24292787.153,"qubits":2713,"emitted_ops":30575944,"correctness_ok":1},"status":"keep","description":"Compose fixed-bound packed active plusminus loop","timestamp":1777586084980,"segment":53,"confidence":null,"iterationTokens":164,"asi":{"hypothesis":"A wireable fixed-bound plus-minus loop can combine active-aware terminal no-ops with high-bit slack slots, so convergence before the public bound does not require separate active/direction history.","result":"Toy fixed-bound loop passed targeted autoresearch.sh and full checks. Eight public iterations over 12 live bits use 96 packed history slots drawn from high bits of four 36-bit lanes. Forward cases that converge early have all-zero later history words; roundtrip cleans every packed slot, active chain, spill, and flag with phase zero. Cost forward 4728 CCX, roundtrip 9344 CCX, peak 185q.","next_action_hint":"Update the low-scratch notes/frontier: the plusminus route now has circuit-level evidence for in-place k-only steps, direction recovery, packed high-bit history, and terminal no-ops. Next blocker is variable-S Solinas history-carry scale correction as an actual circuit."}}
{"type":"config","name":"scratch600 frontier update after plusminus wiring","metricName":"scratch600_plusminus_scaled_solinas_gap_max_to_2700k","metricUnit":"","bestDirection":"lower"}
{"run":487,"commit":"b9070c0","metric":-672962,"metrics":{"scratch600_frontier_best_scratch_bits":510,"scratch600_frontier_best_charged_scratch_bits":510,"scratch600_frontier_best_charged_toffoli":2765676,"scratch600_frontier_best_charged_gap_to_2700k":65676,"scratch600_streamed_replay_body_projected_toffoli":2645196,"scratch600_streamed_unfunded_selector_budget_ccx":54804,"scratch600_streamed_selector_budget_ccx":87840,"scratch600_streamed_lowword_selector_ccx":208320,"scratch600_streamed_selector_shortfall_ccx":120480,"scratch600_centered_raw_scratch_bits":592,"scratch600_centered_boundary_scratch_p99":710,"scratch600_centered_parser_over_strict_bits":110,"scratch600_plusminus_raw_scratch_bits":564,"scratch600_plusminus_unary_scratch_p99":640,"scratch600_plusminus_parser_over_strict_bits":40,"scratch600_plusminus_scaled_slack_scratch_max":517,"scratch600_plusminus_scaled_solinas_projected_max":2027038,"scratch600_halfgcd_matrix_only_bits":524,"scratch600_halfgcd_matrix_tail_raw_bits":689,"scratch600_halfgcd_tail_over_google_bits":26,"altseed_classical_total":0,"altseed_phase_batches_total":0,"altseed_ancilla_batches_total":0,"avg_toffoli":4089274,"avg_clifford":24292787.153,"qubits":2713,"emitted_ops":30575944,"correctness_ok":1},"status":"keep","description":"Update scratch600 frontier after plusminus wiring validation","timestamp":1777586245528,"segment":54,"confidence":null,"iterationTokens":168,"asi":{"hypothesis":"The scratch600 frontier and ideas backlog should reflect the new circuit-level validation: plusminus has moved past pure proxy/UI tests for the step/history shell, but remains uncharged until production envelope and Solinas scale circuits exist.","result":"Frontier targeted test passed. Plusminus scaled k-only slack row now records scratch=517 and active-chain Solinas projected max=2,027,038 (gap -672,962), while charged best remains BY near-miss 2,765,676. Ideas backlog pruned active priority away from stale BY selector/plumbing work and records new reversible evidence: in-place k-only steps, direction recovery, packed high-bit history, active terminal no-ops, and fixed-bound packed loop.","next_action_hint":"Do not promote plusminus as solved. Next experiments should implement variable-S Solinas history-carry scale correction as a phase-clean circuit or find a formal bound for S/steps that keeps production envelope under 663 scratch."}}
{"type":"config","name":"plusminus physical shift scaling tax","metricName":"plusminus_physical_shift_extrap257_forward_ccx","metricUnit":"","bestDirection":"lower"}
{"run":488,"commit":"d362e35","metric":150578,"metrics":{"plusminus_physical_shift_w8_forward_ccx":266,"plusminus_physical_shift_w16_forward_ccx":794,"plusminus_physical_shift_w32_forward_ccx":2618,"plusminus_physical_shift_w64_forward_ccx":9338,"altseed_classical_total":0,"altseed_phase_batches_total":0,"altseed_ancilla_batches_total":0,"avg_toffoli":4089274,"avg_clifford":24292787.153,"qubits":2713,"emitted_ops":30575944,"correctness_ok":1},"status":"keep","description":"Expose quadratic cost of physical repeated shifts in plusminus skeleton","timestamp":1777586448237,"segment":55,"confidence":null,"iterationTokens":167,"asi":{"hypothesis":"The wireable plusminus step skeleton should be cost-checked for width scaling before any 257-bit integration; repeated controlled single-bit shifts may be W^2, not the optimistic per-unary-one cost model.","result":"Cost-only circuit scaling passed and exposed a major blocker: k-only forward step costs W=8/16/32/64 as 266/794/2618/9338 CCX, extrapolating to about 150,578 CCX per 257-bit forward step with the current physical repeated-shift implementation. That would be catastrophic over ~200 steps. The previously validated toy wiring is correct, but production cannot physically shift lanes this way; it needs a relabel/offset/delayed-shift representation or a truly O(W) variable shift.","next_action_hint":"Pivot the plusminus step circuit from physical cv<<k and d>>k shifts to an offset/relabel representation. First build a toy offset-lane step where k updates a classical/quantum offset history and arithmetic reads aligned slices, or explicitly invalidate if alignment makes adds dense."}}
{"type":"config","name":"plusminus unsigned barrel shift primitive","metricName":"plusminus_barrel_shift_extrap257_left_ccx","metricUnit":"","bestDirection":"lower"}
{"run":489,"commit":"fb2eef4","metric":2056,"metrics":{"plusminus_barrel_shift_w16_left_ccx":64,"plusminus_barrel_shift_w16_inverse_ccx":64,"plusminus_barrel_shift_w16_peak_q":36,"plusminus_barrel_shift_w64_left_ccx":384,"altseed_classical_total":0,"altseed_phase_batches_total":0,"altseed_ancilla_batches_total":0,"avg_toffoli":4089274,"avg_clifford":24292787.153,"qubits":2713,"emitted_ops":30575944,"correctness_ok":1},"status":"keep","description":"Validate O(W log W) unsigned barrel shift replacement primitive","timestamp":1777586611019,"segment":56,"confidence":null,"iterationTokens":167,"asi":{"hypothesis":"The physical W^2 variable-shift blocker can be addressed if k is available in binary and denominator shifts use a reversible barrel network.","result":"Unsigned barrel left-shift roundtrip passed basis/phase tests for width16, k<8, with exact spill cleanup. Cost is W*logW: width16 left=64 CCX/inverse=64, width64 left=384, extrapolated 257-bit left≈2056 CCX versus ~66k for repeated W single-bit shifts. This reopens the denominator-shift part, but binary-k generation/storage and signed coefficient barrel shifts remain unbuilt.","next_action_hint":"Build signed no-overflow barrel shift for coefficient lanes next, then a unary-to-binary k generator cost test. If both are O(W logW) or better, update plusminus step budget away from the W^2 physical-shift blocker."}}
{"type":"config","name":"plusminus signed barrel shift primitive","metricName":"plusminus_signed_barrel_extrap257_left_ccx","metricUnit":"","bestDirection":"lower"}
{"run":490,"commit":"a523e2e","metric":2393,"metrics":{"plusminus_signed_barrel_w16_left_ccx":79,"plusminus_signed_barrel_w16_inverse_ccx":79,"plusminus_signed_barrel_w16_peak_q":36,"plusminus_signed_barrel_w64_left_ccx":447,"altseed_classical_total":0,"altseed_phase_batches_total":0,"altseed_ancilla_batches_total":0,"avg_toffoli":4089274,"avg_clifford":24292787.153,"qubits":2713,"emitted_ops":30575944,"correctness_ok":1},"status":"keep","description":"Validate signed no-overflow barrel shift for coefficient lanes","timestamp":1777586751155,"segment":57,"confidence":null,"iterationTokens":164,"asi":{"hypothesis":"Coefficient lanes can avoid the W^2 repeated-shift tax using a signed no-overflow barrel shift whose spilled sign bits are cleaned from the post-shift sign bit.","result":"Signed barrel left-shift roundtrip passed basis/phase tests for width16, k<8. Cost width16 left/inverse=79 CCX, width64 left=447, extrapolated 257-bit left≈2393 CCX. This resolves the coefficient-shift half of the physical-shift blocker at primitive level. Remaining missing piece is producing/storing binary k cheaply enough or integrating barrel shifts with the active-chain history.","next_action_hint":"Build unary-to-binary trailing-zero generator/cost test, or modify active-chain generator to emit binary k alongside/slack instead of full unary. Then recompute plusminus step budget with barrel shifts."}}
{"type":"config","name":"plusminus unary history to binary k converter","metricName":"plusminus_unary_to_binary_extrap257_roundtrip_ccx","metricUnit":"","bestDirection":"lower"}
{"run":491,"commit":"6890f9a","metric":3525,"metrics":{"plusminus_unary_to_binary_w16_compute_ccx":64,"plusminus_unary_to_binary_w16_compute_peak_q":31,"plusminus_unary_to_binary_w16_roundtrip_ccx":128,"plusminus_unary_to_binary_w16_roundtrip_peak_q":31,"plusminus_unary_to_binary_w64_roundtrip_ccx":768,"altseed_classical_total":0,"altseed_phase_batches_total":0,"altseed_ancilla_batches_total":0,"avg_toffoli":4089274,"avg_clifford":24292787.153,"qubits":2713,"emitted_ops":30575944,"correctness_ok":1},"status":"keep","description":"Validate unary-history to binary-k converter for barrel shifts","timestamp":1777586909031,"segment":58,"confidence":null,"iterationTokens":168,"asi":{"hypothesis":"The barrel-shift repair remains viable if unary k-history can be converted to binary k, used for shifts, then uncomputed from the stored unary history at O(W log W) cost.","result":"Unary-prefix popcount converter passed compute and compute/uncompute phase tests. Width16 compute=64 CCX, roundtrip=128; width64 roundtrip=768; extrapolated 257-bit roundtrip≈3525 CCX. This plus unsigned/signed barrel shifts replaces the catastrophic ~150k physical shift step with an O(W log W) shift/control stack, though it adds nontrivial per-step cost and still needs integration into the step circuit.","next_action_hint":"Build an integrated barrel-shift k-only step at toy width and compare scaling against the repeated-shift step. Then update the plusminus all-in budget with converter+barrel costs."}}
{"type":"config","name":"plusminus integrated barrel-shift k-only step","metricName":"plusminus_barrel_step_extrap257_forward_ccx","metricUnit":"","bestDirection":"lower"}
{"run":492,"commit":"4c75717","metric":14355,"metrics":{"plusminus_barrel_step_w16_roundtrip_ccx":1074,"plusminus_barrel_step_w16_peak_q":152,"plusminus_barrel_step_w64_forward_ccx":2681,"altseed_classical_total":0,"altseed_phase_batches_total":0,"altseed_ancilla_batches_total":0,"avg_toffoli":4089274,"avg_clifford":24292787.153,"qubits":2713,"emitted_ops":30575944,"correctness_ok":1},"status":"keep","description":"Integrate barrel shifts into k-only plusminus step skeleton","timestamp":1777587071782,"segment":59,"confidence":null,"iterationTokens":169,"asi":{"hypothesis":"Replacing repeated physical shifts with unary-to-binary conversion plus unsigned/signed barrel shifts should give a phase-clean k-only step with much better width scaling.","result":"Integrated barrel k-only step passed width16 roundtrip basis/phase tests and full harness. Width64 forward cost is 2,681 CCX, extrapolated 257-bit forward≈14,355 CCX, versus ~150,578 for repeated physical shifts. This is a 10x repair of the wiring-level shift blocker, but still far above the original optimistic ~1k/step model; over ~200 steps it could add ~2.9M per DIV if used naively.","next_action_hint":"Recompute all-in plusminus budget with barrel-step cost. If too high, seek a true relabel/offset representation that avoids doing two barrel shifts per step; otherwise the route remains scratch-shaped but gate-dead."}}
{"type":"config","name":"plusminus barrel physical step budget","metricName":"plusminus_barrel_budget_step_only_gap_to_2700k","metricUnit":"","bestDirection":"lower"}
{"run":493,"commit":"ce2a13f","metric":3099420,"metrics":{"plusminus_barrel_budget_step257_ccx":14355,"plusminus_barrel_budget_steps":202,"plusminus_barrel_budget_two_div_step_only":5799420,"altseed_classical_total":0,"altseed_phase_batches_total":0,"altseed_ancilla_batches_total":0,"avg_toffoli":4089274,"avg_clifford":24292787.153,"qubits":2713,"emitted_ops":30575944,"correctness_ok":1},"status":"keep","description":"Kill naive physical barrel-shift plusminus integration budget","timestamp":1777587240804,"segment":60,"confidence":null,"iterationTokens":169,"asi":{"hypothesis":"After replacing W^2 repeated shifts with barrel shifts, the physically shifted plusminus step might still fit the 2.7M budget.","result":"Budget probe shows it does not: barrel-shift integrated forward step extrapolates to 14,355 CCX at 257 bits; two DIVs over 202 public steps cost 5,799,420 CCX in step bodies alone, gap +3,099,420 before scaffold and Solinas scale correction. The step/history shell is wireable but naive physical shifting is gate-dead.","next_action_hint":"Do not wire 257-bit physical shifts into point-add. Either represent shifts by relabel/offset/delayed alignment so each step does not move O(W log W) bits, or demote plusminus as a Toffoli route despite scratch fit."}}
{"type":"config","name":"plusminus unary to binary threshold-xor converter","metricName":"plusminus_unary_to_binary_xor_compute_ccx","metricUnit":"","bestDirection":"lower"}
{"run":494,"commit":"ce2a13f","metric":0,"metrics":{"altseed_classical_total":0,"altseed_phase_batches_total":0,"altseed_ancilla_batches_total":0,"correctness_ok":0},"status":"crash","description":"First threshold-xor unary-to-binary formula used wrong odd thresholds","timestamp":1777587385619,"segment":61,"confidence":null,"iterationTokens":171,"asi":{"hypothesis":"Unary prefix history can be converted to binary k by XORing selected public threshold bits with zero Toffoli.","result":"Targeted test failed for k=2: computed kbits=3. The idea is still plausible but the formula used only odd thresholds; correct parity of floor(k/2^j) requires XOR over all positive multiples of 2^j, not just odd multiples.","rollback_reason":"Uncommitted threshold-xor helper/test had incorrect formula and was reverted.","next_action_hint":"Re-add threshold-xor converter with t += step (all multiples) for each bit j, then rerun compute and roundtrip tests."}}
{"type":"config","name":"plusminus unary to binary threshold-xor converter fixed","metricName":"plusminus_unary_to_binary_xor_compute_ccx","metricUnit":"","bestDirection":"lower"}
{"run":495,"commit":"42dc94a","metric":0,"metrics":{"plusminus_unary_to_binary_xor_width":16,"plusminus_unary_to_binary_xor_roundtrip_ccx":0,"plusminus_unary_to_binary_xor_peak_q":21,"altseed_classical_total":0,"altseed_phase_batches_total":0,"altseed_ancilla_batches_total":0,"avg_toffoli":4089274,"avg_clifford":24292787.153,"qubits":2713,"emitted_ops":30575944,"correctness_ok":1},"status":"keep","description":"Fix and validate Clifford unary-to-binary k extraction","timestamp":1777587531025,"segment":62,"confidence":null,"iterationTokens":172,"asi":{"hypothesis":"Unary prefix k-history can produce binary k for barrel shifts by Clifford-only XOR of public threshold bits; the corrected formula should use all multiples of 2^j, not odd multiples.","result":"Corrected threshold-XOR converter passed targeted autoresearch.sh and full checks. Compute and roundtrip are 0 CCX with peak 21q at width16; compute-only output matches k=0..16 and roundtrip clears kbits with zero phase. This deletes the 3,525-CCX unary-popcount conversion tax from the barrel-shift repair.","next_action_hint":"Update the integrated barrel-step to use threshold-XOR instead of popcount, recompute step scaling, then reassess whether barrel shifts are still too expensive or if only true relabel/offset remains necessary."}}
{"type":"config","name":"plusminus integrated barrel-step with Clifford k extraction","metricName":"plusminus_barrel_step_extrap257_forward_ccx","metricUnit":"","bestDirection":"lower"}
{"run":496,"commit":"95ad5e0","metric":10243,"metrics":{"plusminus_barrel_step_w16_roundtrip_ccx":818,"plusminus_barrel_step_w16_peak_q":152,"plusminus_barrel_step_w64_forward_ccx":1913,"altseed_classical_total":0,"altseed_phase_batches_total":0,"altseed_ancilla_batches_total":0,"avg_toffoli":4089274,"avg_clifford":24292787.153,"qubits":2713,"emitted_ops":30575944,"correctness_ok":1},"status":"keep","description":"Reduce integrated barrel-step cost with Clifford k extraction","timestamp":1777587684648,"segment":63,"confidence":null,"iterationTokens":169,"asi":{"hypothesis":"Replacing unary-popcount k extraction in the integrated barrel-shift step with Clifford threshold-XOR extraction should reduce the physically shifted plusminus step while preserving reversible cleanup.","result":"Targeted barrel-step roundtrip passed with full checks. Width16 roundtrip fell from 1074 to 818 CCX; width64 forward fell from 2681 to 1913; extrapolated 257-bit forward fell from 14,355 to 10,243. This is a real repair, but two DIVs over ~202 steps still cost ~4.14M in step bodies before scaffold/scale, so naive per-step barrel shifting remains likely gate-dead.","next_action_hint":"Recompute explicit budget with 10,243/step; then investigate offset/relabel lanes or amortized/batched shifting rather than per-step physical shifts."}}
{"type":"config","name":"plusminus barrel physical step budget after Clifford k","metricName":"plusminus_barrel_budget_step_only_gap_to_2700k","metricUnit":"","bestDirection":"lower"}
