{"run":333,"commit":"4604c18","metric":4097542,"metrics":{"altseed_ancilla_batches_total":0,"altseed_classical_total":0,"altseed_phase_batches_total":0,"attempted_pair2_560_altseed_phase_batches":1,"attempted_q18_altseed_phase_batches":1,"attempted_q_local_altseed_phase_batches":1,"avg_clifford":24337169.27,"by_replay_bench_avg_toffoli":5278510,"by_replay_bench_emitted_ops":42250936,"by_replay_bench_qubits":2716,"by_tests_passed":111,"centered_body_bench_avg_toffoli":4985518,"centered_body_bench_emitted_ops":38874541,"centered_body_bench_qubits":2716,"centered_body_replay_ccx":873600,"centered_budget_if_folded":2640622,"centered_clean_all_exact_peak":2464,"centered_clean_all_exact_roundtrip_ccx":3199280,"centered_clean_roundtrip_bench_altseed_phase":0,"centered_clean_roundtrip_bench_avg_clifford":32532302.269,"centered_clean_roundtrip_bench_avg_toffoli":7311738,"centered_clean_roundtrip_bench_emitted_ops":42092380,"centered_clean_roundtrip_bench_qubits":2976,"centered_denom_controls_bench_altseed_phase":0,"centered_denom_controls_bench_avg_clifford":44313822.825,"centered_denom_controls_bench_avg_toffoli":7868378,"centered_denom_controls_bench_emitted_ops":55824052,"centered_denom_controls_bench_qubits":4964,"centered_exact_parity_fast_signed_roundtrip_ccx":2618000,"centered_fast_clean_increment_toffoli":1747760,"centered_fast_clean_roundtrip_bench_altseed_phase":0,"centered_fast_clean_roundtrip_bench_avg_clifford":38190533.993,"centered_fast_clean_roundtrip_bench_avg_toffoli":5860218,"centered_fast_clean_roundtrip_bench_emitted_ops":47024860,"centered_fast_clean_roundtrip_bench_qubits":3235,"centered_fixed_trace_hook_phase":0,"centered_inverse_replay_ccx":873600,"centered_live_num_bench_altseed_phase":0,"centered_live_num_bench_avg_clifford":44320460.712,"centered_live_num_bench_avg_toffoli":7870438,"centered_live_num_bench_emitted_ops":55834807,"centered_live_num_bench_qubits":4965,"centered_negpatch_phase_saw0":1,"centered_negpatch_phase_saw1":1,"centered_pair12_fast_accum_avg_toffoli":12246560,"centered_pair12_fast_accum_emitted_ops":72997701,"centered_pair12_fast_accum_qubits":5589,"centered_pair12_replace_avg_toffoli":12251174,"centered_pair12_replace_emitted_ops":72970707,"centered_pair12_replace_qubits":5589,"centered_pair12_window_denom_avg_toffoli":13483808,"centered_pair12_window_denom_emitted_ops":79499589,"centered_pair12_window_denom_qubits":5589,"centered_pair12_window_q_payload_avg_toffoli":13483808,"centered_pair12_window_q_payload_emitted_ops":79514277,"centered_pair12_window_q_payload_qubits":8037,"centered_pair1_fast_accum_avg_toffoli":8171417,"centered_pair1_fast_accum_emitted_ops":51826551,"centered_pair1_fast_accum_qubits":5589,"centered_pair1_replace_altseed_classical":0,"centered_pair1_replace_altseed_phase":0,"centered_pair1_replace_avg_clifford":40780745.214,"centered_pair1_replace_avg_toffoli":8172700,"centered_pair1_replace_emitted_ops":51801485,"centered_pair1_replace_qubits":5589,"centered_pair1_window_denom_avg_toffoli":8790041,"centered_pair1_window_denom_emitted_ops":55077495,"centered_pair1_window_denom_qubits":5589,"centered_pair1_window_q18_avg_toffoli":8790881,"centered_pair1_window_q18_emitted_ops":55108598,"centered_pair1_window_q18_qubits":6885,"centered_pair1_window_q_payload_avg_toffoli":8790041,"centered_pair1_window_q_payload_emitted_ops":55084839,"centered_pair1_window_q_payload_qubits":8037,"centered_pair2_fast_accum_avg_toffoli":8187601,"centered_pair2_fast_accum_emitted_ops":51944268,"centered_pair2_fast_accum_qubits":5589,"centered_pair2_replace_altseed_classical":0,"centered_pair2_replace_altseed_phase":0,"centered_pair2_replace_avg_clifford":40876699.034,"centered_pair2_replace_avg_toffoli":8189908,"centered_pair2_replace_emitted_ops":51930771,"centered_pair2_replace_qubits":5589,"centered_pair2_window_denom_avg_toffoli":8806225,"centered_pair2_window_denom_emitted_ops":55195212,"centered_pair2_window_denom_qubits":5589,"centered_pair2_window_q_payload_avg_toffoli":8806225,"centered_pair2_window_q_payload_emitted_ops":55202556,"centered_pair2_window_q_payload_qubits":8037,"centered_phase96_all_exact_ccx":548448,"centered_phase96_exact_parity_ccx":448800,"centered_phase96_exact_signed_ccx":399264,"centered_phase96_fast_mbu_ccx":299616,"consumed_branchless_depth16_predecessor_patterns":589824,"consumed_branchless_depth16_predecessor_states":589824,"correctness_ok":1,"destructive_montgomery_test_passed":1,"destructive_montgomery_window_preimages":512,"emitted_ops":30636308,"inverse_negr_ccx":1145760,"last_shot_fixed_window_max_ccx":27641,"last_shot_fixed_window_max_peak":2224,"last_shot_fixed_window_mean_ccx":20323.5,"last_shot_fixed_window_p90_ccx":24382,"last_shot_two_denominators_ccx":1463292,"mbuc_quotient_phase_anf_density":32518,"mbuc_quotient_phase_degree":15,"mbuc_quotient_phase_truth_table":65536,"qubits":2714,"scaled_pair2_product_avg_clifford":35226095.994,"scaled_pair2_product_avg_toffoli":8038619,"scaled_pair2_product_emitted_ops":49073481,"scaled_pair2_product_qubits":4236,"signed_copy_fast_phase_batches":1,"strategy_e_current_known_total":2988510,"strategy_e_if_new_inplace_mul":2022750,"strategy_e_needed_mul_saving":965760,"strategy_e_tests_passed":2,"two_fast_replay_projected":2637286},"status":"keep","description":"Probe pair1=405 with pair2=402 Kaliski iterations","timestamp":1777450338972,"segment":3,"confidence":6.660426267281106,"iterationTokens":9003,"asi":{"hypothesis":"Pair1 may have more than one safe iteration of slack; with pair2 held at the clean 402 setting, try pair1=405","result":"KAL_PAIR1_ITERS=405 KAL_PAIR2_ITERS=402 passes full harness clean at avg_toffoli=4,097,542, qubits=2,714, emitted_ops=30,636,308","next_action_hint":"Continue lowering pair1 to find the cliff; pair1 iteration reductions also lower peak qubits in this schedule"}}
{"run":334,"commit":"58cb340","metric":4093426,"metrics":{"altseed_ancilla_batches_total":0,"altseed_classical_total":0,"altseed_phase_batches_total":0,"attempted_pair2_560_altseed_phase_batches":1,"attempted_q18_altseed_phase_batches":1,"attempted_q_local_altseed_phase_batches":1,"avg_clifford":24315062.278,"by_replay_bench_avg_toffoli":5278510,"by_replay_bench_emitted_ops":42250936,"by_replay_bench_qubits":2716,"by_tests_passed":111,"centered_body_bench_avg_toffoli":4985518,"centered_body_bench_emitted_ops":38874541,"centered_body_bench_qubits":2716,"centered_body_replay_ccx":873600,"centered_budget_if_folded":2640622,"centered_clean_all_exact_peak":2464,"centered_clean_all_exact_roundtrip_ccx":3199280,"centered_clean_roundtrip_bench_altseed_phase":0,"centered_clean_roundtrip_bench_avg_clifford":32532302.269,"centered_clean_roundtrip_bench_avg_toffoli":7311738,"centered_clean_roundtrip_bench_emitted_ops":42092380,"centered_clean_roundtrip_bench_qubits":2976,"centered_denom_controls_bench_altseed_phase":0,"centered_denom_controls_bench_avg_clifford":44313822.825,"centered_denom_controls_bench_avg_toffoli":7868378,"centered_denom_controls_bench_emitted_ops":55824052,"centered_denom_controls_bench_qubits":4964,"centered_exact_parity_fast_signed_roundtrip_ccx":2618000,"centered_fast_clean_increment_toffoli":1747760,"centered_fast_clean_roundtrip_bench_altseed_phase":0,"centered_fast_clean_roundtrip_bench_avg_clifford":38190533.993,"centered_fast_clean_roundtrip_bench_avg_toffoli":5860218,"centered_fast_clean_roundtrip_bench_emitted_ops":47024860,"centered_fast_clean_roundtrip_bench_qubits":3235,"centered_fixed_trace_hook_phase":0,"centered_inverse_replay_ccx":873600,"centered_live_num_bench_altseed_phase":0,"centered_live_num_bench_avg_clifford":44320460.712,"centered_live_num_bench_avg_toffoli":7870438,"centered_live_num_bench_emitted_ops":55834807,"centered_live_num_bench_qubits":4965,"centered_negpatch_phase_saw0":1,"centered_negpatch_phase_saw1":1,"centered_pair12_fast_accum_avg_toffoli":12246560,"centered_pair12_fast_accum_emitted_ops":72997701,"centered_pair12_fast_accum_qubits":5589,"centered_pair12_replace_avg_toffoli":12251174,"centered_pair12_replace_emitted_ops":72970707,"centered_pair12_replace_qubits":5589,"centered_pair12_window_denom_avg_toffoli":13483808,"centered_pair12_window_denom_emitted_ops":79499589,"centered_pair12_window_denom_qubits":5589,"centered_pair12_window_q_payload_avg_toffoli":13483808,"centered_pair12_window_q_payload_emitted_ops":79514277,"centered_pair12_window_q_payload_qubits":8037,"centered_pair1_fast_accum_avg_toffoli":8171417,"centered_pair1_fast_accum_emitted_ops":51826551,"centered_pair1_fast_accum_qubits":5589,"centered_pair1_replace_altseed_classical":0,"centered_pair1_replace_altseed_phase":0,"centered_pair1_replace_avg_clifford":40780745.214,"centered_pair1_replace_avg_toffoli":8172700,"centered_pair1_replace_emitted_ops":51801485,"centered_pair1_replace_qubits":5589,"centered_pair1_window_denom_avg_toffoli":8790041,"centered_pair1_window_denom_emitted_ops":55077495,"centered_pair1_window_denom_qubits":5589,"centered_pair1_window_q18_avg_toffoli":8790881,"centered_pair1_window_q18_emitted_ops":55108598,"centered_pair1_window_q18_qubits":6885,"centered_pair1_window_q_payload_avg_toffoli":8790041,"centered_pair1_window_q_payload_emitted_ops":55084839,"centered_pair1_window_q_payload_qubits":8037,"centered_pair2_fast_accum_avg_toffoli":8187601,"centered_pair2_fast_accum_emitted_ops":51944268,"centered_pair2_fast_accum_qubits":5589,"centered_pair2_replace_altseed_classical":0,"centered_pair2_replace_altseed_phase":0,"centered_pair2_replace_avg_clifford":40876699.034,"centered_pair2_replace_avg_toffoli":8189908,"centered_pair2_replace_emitted_ops":51930771,"centered_pair2_replace_qubits":5589,"centered_pair2_window_denom_avg_toffoli":8806225,"centered_pair2_window_denom_emitted_ops":55195212,"centered_pair2_window_denom_qubits":5589,"centered_pair2_window_q_payload_avg_toffoli":8806225,"centered_pair2_window_q_payload_emitted_ops":55202556,"centered_pair2_window_q_payload_qubits":8037,"centered_phase96_all_exact_ccx":548448,"centered_phase96_exact_parity_ccx":448800,"centered_phase96_exact_signed_ccx":399264,"centered_phase96_fast_mbu_ccx":299616,"consumed_branchless_depth16_predecessor_patterns":589824,"consumed_branchless_depth16_predecessor_states":589824,"correctness_ok":1,"destructive_montgomery_test_passed":1,"destructive_montgomery_window_preimages":512,"emitted_ops":30606258,"inverse_negr_ccx":1145760,"last_shot_fixed_window_max_ccx":27641,"last_shot_fixed_window_max_peak":2224,"last_shot_fixed_window_mean_ccx":20323.5,"last_shot_fixed_window_p90_ccx":24382,"last_shot_two_denominators_ccx":1463292,"mbuc_quotient_phase_anf_density":32518,"mbuc_quotient_phase_degree":15,"mbuc_quotient_phase_truth_table":65536,"qubits":2713,"scaled_pair2_product_avg_clifford":35226095.994,"scaled_pair2_product_avg_toffoli":8038619,"scaled_pair2_product_emitted_ops":49073481,"scaled_pair2_product_qubits":4236,"signed_copy_fast_phase_batches":1,"strategy_e_current_known_total":2988510,"strategy_e_if_new_inplace_mul":2022750,"strategy_e_needed_mul_saving":965760,"strategy_e_tests_passed":2,"two_fast_replay_projected":2637286},"status":"keep","description":"Probe pair1=404 with pair2=402 Kaliski iterations","timestamp":1777450386526,"segment":3,"confidence":6.858006912442396,"iterationTokens":9003,"asi":{"hypothesis":"Continue lowering pair1 iterations with pair2 fixed at the clean 402 lower bound","result":"KAL_PAIR1_ITERS=404 KAL_PAIR2_ITERS=402 passes full harness clean at avg_toffoli=4,093,426, qubits=2,713, emitted_ops=30,606,258","next_action_hint":"Probe pair1=403 with pair2=402; if it fails, update defaults to pair1=404/pair2=402"}}
{"run":335,"commit":"58cb340","metric":0,"metrics":{"altseed_ancilla_batches_total":0,"altseed_classical_total":0,"altseed_phase_batches_total":1,"attempted_pair2_560_altseed_phase_batches":1,"attempted_q18_altseed_phase_batches":1,"attempted_q_local_altseed_phase_batches":1,"avg_clifford":24315062.278,"by_replay_bench_avg_toffoli":5278510,"by_replay_bench_emitted_ops":42250936,"by_replay_bench_qubits":2716,"by_tests_passed":111,"centered_body_bench_avg_toffoli":4985518,"centered_body_bench_emitted_ops":38874541,"centered_body_bench_qubits":2716,"centered_body_replay_ccx":873600,"centered_budget_if_folded":2640622,"centered_clean_all_exact_peak":2464,"centered_clean_all_exact_roundtrip_ccx":3199280,"centered_clean_roundtrip_bench_altseed_phase":0,"centered_clean_roundtrip_bench_avg_clifford":32532302.269,"centered_clean_roundtrip_bench_avg_toffoli":7311738,"centered_clean_roundtrip_bench_emitted_ops":42092380,"centered_clean_roundtrip_bench_qubits":2976,"centered_denom_controls_bench_altseed_phase":0,"centered_denom_controls_bench_avg_clifford":44313822.825,"centered_denom_controls_bench_avg_toffoli":7868378,"centered_denom_controls_bench_emitted_ops":55824052,"centered_denom_controls_bench_qubits":4964,"centered_exact_parity_fast_signed_roundtrip_ccx":2618000,"centered_fast_clean_increment_toffoli":1747760,"centered_fast_clean_roundtrip_bench_altseed_phase":0,"centered_fast_clean_roundtrip_bench_avg_clifford":38190533.993,"centered_fast_clean_roundtrip_bench_avg_toffoli":5860218,"centered_fast_clean_roundtrip_bench_emitted_ops":47024860,"centered_fast_clean_roundtrip_bench_qubits":3235,"centered_fixed_trace_hook_phase":0,"centered_inverse_replay_ccx":873600,"centered_live_num_bench_altseed_phase":0,"centered_live_num_bench_avg_clifford":44320460.712,"centered_live_num_bench_avg_toffoli":7870438,"centered_live_num_bench_emitted_ops":55834807,"centered_live_num_bench_qubits":4965,"centered_negpatch_phase_saw0":1,"centered_negpatch_phase_saw1":1,"centered_pair12_fast_accum_avg_toffoli":12246560,"centered_pair12_fast_accum_emitted_ops":72997701,"centered_pair12_fast_accum_qubits":5589,"centered_pair12_replace_avg_toffoli":12251174,"centered_pair12_replace_emitted_ops":72970707,"centered_pair12_replace_qubits":5589,"centered_pair12_window_denom_avg_toffoli":13483808,"centered_pair12_window_denom_emitted_ops":79499589,"centered_pair12_window_denom_qubits":5589,"centered_pair12_window_q_payload_avg_toffoli":13483808,"centered_pair12_window_q_payload_emitted_ops":79514277,"centered_pair12_window_q_payload_qubits":8037,"centered_pair1_fast_accum_avg_toffoli":8171417,"centered_pair1_fast_accum_emitted_ops":51826551,"centered_pair1_fast_accum_qubits":5589,"centered_pair1_replace_altseed_classical":0,"centered_pair1_replace_altseed_phase":0,"centered_pair1_replace_avg_clifford":40780745.214,"centered_pair1_replace_avg_toffoli":8172700,"centered_pair1_replace_emitted_ops":51801485,"centered_pair1_replace_qubits":5589,"centered_pair1_window_denom_avg_toffoli":8790041,"centered_pair1_window_denom_emitted_ops":55077495,"centered_pair1_window_denom_qubits":5589,"centered_pair1_window_q18_avg_toffoli":8790881,"centered_pair1_window_q18_emitted_ops":55108598,"centered_pair1_window_q18_qubits":6885,"centered_pair1_window_q_payload_avg_toffoli":8790041,"centered_pair1_window_q_payload_emitted_ops":55084839,"centered_pair1_window_q_payload_qubits":8037,"centered_pair2_fast_accum_avg_toffoli":8187601,"centered_pair2_fast_accum_emitted_ops":51944268,"centered_pair2_fast_accum_qubits":5589,"centered_pair2_replace_altseed_classical":0,"centered_pair2_replace_altseed_phase":0,"centered_pair2_replace_avg_clifford":40876699.034,"centered_pair2_replace_avg_toffoli":8189908,"centered_pair2_replace_emitted_ops":51930771,"centered_pair2_replace_qubits":5589,"centered_pair2_window_denom_avg_toffoli":8806225,"centered_pair2_window_denom_emitted_ops":55195212,"centered_pair2_window_denom_qubits":5589,"centered_pair2_window_q_payload_avg_toffoli":8806225,"centered_pair2_window_q_payload_emitted_ops":55202556,"centered_pair2_window_q_payload_qubits":8037,"centered_phase96_all_exact_ccx":548448,"centered_phase96_exact_parity_ccx":448800,"centered_phase96_exact_signed_ccx":399264,"centered_phase96_fast_mbu_ccx":299616,"consumed_branchless_depth16_predecessor_patterns":589824,"consumed_branchless_depth16_predecessor_states":589824,"correctness_ok":0,"destructive_montgomery_test_passed":1,"destructive_montgomery_window_preimages":512,"emitted_ops":30606258,"inverse_negr_ccx":1145760,"last_shot_fixed_window_max_ccx":27641,"last_shot_fixed_window_max_peak":2224,"last_shot_fixed_window_mean_ccx":20323.5,"last_shot_fixed_window_p90_ccx":24382,"last_shot_two_denominators_ccx":1463292,"mbuc_quotient_phase_anf_density":32518,"mbuc_quotient_phase_degree":15,"mbuc_quotient_phase_truth_table":65536,"qubits":2713,"scaled_pair2_product_avg_clifford":35226095.994,"scaled_pair2_product_avg_toffoli":8038619,"scaled_pair2_product_emitted_ops":49073481,"scaled_pair2_product_qubits":4236,"signed_copy_fast_phase_batches":1,"strategy_e_current_known_total":2988510,"strategy_e_if_new_inplace_mul":2022750,"strategy_e_needed_mul_saving":965760,"strategy_e_tests_passed":2,"two_fast_replay_projected":2637286},"status":"crash","description":"Probe pair1=403 with pair2=402; alt-seed phase cliff","timestamp":1777450427332,"segment":3,"confidence":6.858006912442396,"iterationTokens":9003,"asi":{"hypothesis":"Try one more pair1 iteration reduction after clean pair1=404/pair2=402","rollback_reason":"KAL_PAIR1_ITERS=403 KAL_PAIR2_ITERS=402 fails during alt-seed diagnostics with one phase-garbage batch (tag=5) before circuit metrics are emitted","next_action_hint":"Use pair1=404 and pair2=402 as the current clean iteration defaults; do not lower pair1 to 403 without a new phase-fix idea"}}
