{"run":168,"commit":"8b88c4c","metric":4136878,"metrics":{"altseed_classical_total":0,"altseed_phase_batches_total":0,"altseed_ancilla_batches_total":0,"avg_clifford":24436575.094,"qubits":2716,"emitted_ops":31223346,"correctness_ok":1},"status":"keep","description":"Deep research-only session. Read 8 primary-source PDFs in depth (Google 2026, HRSL 2020, Kim 2026, Litinski 2023+2024, Gidney-Ekera 2021, Gidney 2019, Chevignard 2026, Luongo 2025). Produced three research artifacts: (1) cost_model.md — ground-truth cost model from measurements + literature; (2) blockers_and_paths.md — structural blockers with cited evidence + 5 candidate paths; (3) research_log_2026_04_27.md — full investigation log. Key findings: (a) Google's 2.7M is for the WINDOWED task Q+=P[k], not our bare-add task; their implied bare-add cost is ~2.5M. (b) Our 4.14M is already best-in-published-lit by 3x vs HRSL/Kim, competitive with Litinski 2023. (c) Under approximate correctness (user-confirmed Option A), coset representation cuts non-Kaliski mod-add by 60%. (d) Coset breaks comparators, so can't apply inside Kaliski body. (e) 1-invocation scaffold faces cleanup obstruction that might relax under approximation — unresolved. Baseline unchanged 4.14M/2716q.","timestamp":1777338959951,"segment":3,"confidence":null,"iterationTokens":142839,"asi":{"hypothesis":"Build a proper mental model from primary sources before any more experiments. Identify real structural blockers vs surmountable engineering gaps. Let the user pick the path based on the model.","primary_sources_read":["Google 2026 App A.1/A.3","HRSL 2020 sec 4.2, 5, Table 1","Kim 2026 sec 3.3.1, Table 3","Litinski 2023 sec 1.3, Fig 7, sec 2.1","Litinski 2024 Table 1","Gidney-Ekera 2021 sec 2.4, 2.5, 2.6, 2.9","Gidney 2019 sec 2","Chevignard 2026 abstract + sec 1","Luongo 2025 (briefly)"],"key_structural_findings":["Google 2.7M is windowed Q+=P[k], not bare add. Implied bare ~2.5M.","Our 4.14M is best-in-public-lit for bare add at n=256.","Coset rep cuts mod-add 60% but breaks comparators.","Kaliski per-iter ~1970 CCX/iter already below Litinski 2023's 3328 (13n) and Kim 2026.","Step 3+9 cswaps = 32% of total Toffoli, structural elimination unpublished.","1300q target requires m_hist elim + tx/ty/r folding + possibly windowed Kaliski."],"candidate_paths_documented":["A: coset on non-Kaliski ops (~300k save, medium risk)","B: m_hist elim + karatsuba at pair1_mul2 (~30k save, low risk)","C: step 3+9 cswap restructuring (~1M save, high risk)","D: approximate single-invocation (~1.6M save, highest risk)","E: port to windowed task to match Google harness"],"unresolved_critical_question":"Can approximate correctness enable a 1-invocation scaffold? If yes, Path D unlocks 2.7M target. If no, stuck in 3-4M range with public techniques.","next_session_should":"Start with 1-2 hour investigation of approximate-cleanup for Kaliski backward. Classical test: can we stop Kaliski backward at iter 2n-k for some k and bound the residual? If deviation is bounded, Path D is live."}}
{"run":169,"commit":"4f624e4","metric":4132750,"metrics":{"altseed_classical_total":0,"altseed_phase_batches_total":0,"altseed_ancilla_batches_total":0,"avg_clifford":24414411.956,"qubits":2716,"emitted_ops":31193208,"correctness_ok":1},"status":"keep","description":"pair2 Kaliski iter floor retune 404→403: small verified baseline tightening before structural work","timestamp":1777340216875,"segment":3,"confidence":null,"iterationTokens":142839,"asi":{"hypothesis":"Probe whether pair2's second inversion still has one iteration of slack under the current op stream; if safe, bank the free baseline improvement before returning to structural SOTA work.","result":"Passed benchmark, 24-seed alt gate, and checks rerun with 0 classical/phase/ancilla failures.","pair1_iters":407,"pair2_iters":403,"improvement_vs_documented_best":4128,"user_direction":"User explicitly requested no micro-optimization focus; this was a completed in-flight retune and will not define the next research direction.","next_action_hint":"Stop doing local iter/cost tweaks. Move to structural breakthrough analysis/implementation: one-inversion cleanup impossibility proof, windowed Kaliski/cswap reduction, or new low-qubit scaffold."}}
{"run":170,"commit":"1a3a6f6","metric":4132750,"metrics":{"altseed_classical_total":0,"altseed_phase_batches_total":0,"altseed_ancilla_batches_total":0,"avg_clifford":24414411.956,"qubits":2716,"emitted_ops":31193208,"correctness_ok":1},"status":"keep","description":"Structural SOTA plan: refocus on one-inversion obstruction and jumped/windowed Kaliski, no micro-tuning","timestamp":1777340545608,"segment":3,"confidence":null,"iterationTokens":142839,"asi":{"hypothesis":"A principled structural plan is needed before further implementation: quantify whether SOTA requires deleting one inversion or cutting Kaliski per-step cost, and set invalidation criteria for jump/window Kaliski vs one-inversion cleanup.","result":"Added src/point_add/structural_sota_plan_2026_04_28.md. No build path changes; benchmark metric intentionally unchanged from current best.","tool_note":"A custom cargo-test run_experiment was refused because autoresearch.sh is mandatory; this keep logs the research artifact rather than a circuit run.","structural_conclusion":"Toffoli SOTA needs either one full Kaliski invocation removed (~1.6M saving) or both invocations made ~45% cheaper. Qubit SOTA needs >=400q m_hist/state-layout changes plus folding/low-workspace transients.","next_action_hint":"Implement Program A fast-falsification: extend kaliski_jump.rs with a t=2/t=3 reversible matrix-application cost lower-bound/synthesis search, then only code a real jumped Kaliski if the lower bound beats current step cost by >=30%."}}
{"run":171,"commit":"47f7130","metric":4132750,"metrics":{"altseed_classical_total":0,"altseed_phase_batches_total":0,"altseed_ancilla_batches_total":0,"avg_clifford":24414411.956,"qubits":2716,"emitted_ops":31193208,"correctness_ok":1},"status":"keep","description":"Structural jump-Kaliski survey: low-bit matrix lookup invalidated; comparator-aware t=2/t=3 synthesis required","timestamp":1777340691144,"segment":3,"confidence":null,"iterationTokens":41231,"asi":{"hypothesis":"A windowed/jumped Kaliski could be the structural route to SOTA if multiple binary-GCD microsteps can be replaced by one cheap matrix update keyed by a small lookup.","result":"Documented survey: t=2 has 13 matrices, t=4 has 125, t=6 has 1133; at w=8,t=4 low-bit classes still average 4.49 possible matrices and max 16, so low-bit-only QROM selection is not viable.","structural_learning":"Jumped Kaliski remains possible only if the branch/comparator sequence is computed coherently or replaced by a BY/divstep-like control variable; cheap low-bit matrix lookup is dead.","metric_note":"No build path change; benchmark remains 4,132,750 Toffoli / 2716q and passes checks.","next_action_hint":"Build a comparator-aware t=2 synthesis/cost model. If t=2 cannot beat two ordinary Kaliski iterations by at least 30%, pivot to Bernstein-Yang/windowed divstep or one-inversion triangular cleanup."}}
{"run":172,"commit":"eb3c64d","metric":4132750,"metrics":{"altseed_classical_total":0,"altseed_phase_batches_total":0,"altseed_ancilla_batches_total":0,"avg_clifford":24414411.956,"qubits":2716,"emitted_ops":31193208,"correctness_ok":1},"status":"keep","description":"600-scratch ground-up model: coefficient-transform Kaliski probe with tested algebra","timestamp":1777341109835,"segment":3,"confidence":null,"iterationTokens":12701,"asi":{"hypothesis":"Under ~600 scratch, Kaliski must use tx/ty as data-path registers. Seed Kaliski's coefficient register with dy and view the coefficient update as a linear transform T(dx) to see whether backward Kaliski can write Ry instead of restoring dy.","result":"Added scratch600_ground_up.md and kaliski_linear_transform.rs. Tests pass: canonical coefficient transform has shape T=[[a,k],[dx,0]] with k*dx=-2^407; dy-seeded forward gives (k*dy,0), i.e. scaled slope and ty consumed to zero.","structural_learning":"The one-inversion cleanup problem becomes crisp: before backward we need (k*Ry,0) but dy-seeded forward gives (k*dy,0), so the missing operation is add k*(Ry-dy) without raw k or a second inversion. This identifies the exact algebraic obstruction and possible routes (shifted-Y, two-channel coefficient initialization, r_initial channel).","metric_note":"No build path change except cfg(test) module; benchmark remains 4,132,750 Toffoli / 2716q and passes checks.","next_action_hint":"Run a shifted-Y/two-channel symbolic search: allow initial coefficient seeds affine in {dy,Qy,1} and final targets affine in {Ry,Qy,1}; find whether the required final pair can be computed from forward pair using only L=k*dy, dx, Rx, and classical constants."}}
{"run":173,"commit":"211d3af","metric":4132750,"metrics":{"altseed_classical_total":0,"altseed_phase_batches_total":0,"altseed_ancilla_batches_total":0,"avg_clifford":24414411.956,"qubits":2716,"emitted_ops":31193208,"correctness_ok":1},"status":"keep","description":"600-scratch model refinement: identify in-place DIV primitive and invalidate affine shifted-Y escape","timestamp":1777341261675,"segment":3,"confidence":50.75588235294118,"iterationTokens":6813,"asi":{"hypothesis":"A 600-scratch SOTA architecture should be formulated around an in-place modular division primitive DIV:(x,y)->(x,y/x), not around materializing x^-1 as an ancilla. Shifted Y-coordinate conventions might make the Kaliski coefficient-transform cleanup possible.","result":"Refined scratch600_ground_up.md. Derived that affine Y shifts S0=Py+aQy, S1=Ry+bQy can remove the k*Qy term only by leaving L*(Qx-Rx-dx)/dx, which still requires raw k / a second inverse. Shifted-Y escape invalidated.","structural_learning":"The target primitive is now explicit: clean DIV under ~600 scratch. Coefficient-transform Kaliski is a candidate route, but simple output shifts do not solve the missing raw-inverse term.","metric_note":"Docs only; benchmark unchanged and checks pass.","next_action_hint":"Run two-channel coefficient search or design a direct DIV Euclidean map. Search over initial/final coefficient affine forms to see whether using both r and s channels exposes raw k and scaled lambda simultaneously without a second inversion."}}
{"run":174,"commit":"0cc1cbc","metric":4132750,"metrics":{"altseed_classical_total":0,"altseed_phase_batches_total":0,"altseed_ancilla_batches_total":0,"avg_clifford":24414411.956,"qubits":2716,"emitted_ops":31193208,"correctness_ok":1},"status":"keep","description":"600-scratch DIV lower bound: quotient-copy Kaliski needs 3 n-bit scratch, so output must be written by backward transform","timestamp":1777341451140,"segment":3,"confidence":25.37794117647059,"iterationTokens":9093,"asi":{"hypothesis":"Under a ~600 scratch cap, an in-place DIV primitive cannot simply copy the quotient across Kaliski backward; count the registers to prove whether that Bennett pattern fits.","result":"Documented lower bound: during backward, tx/ty must serve as v/s state and scratch u/r are needed, so a quotient_copy would be a third n-bit scratch register (u,r,copy=768q) before flags/history. This exceeds 600 scratch.","structural_learning":"Low-qubit DIV must have the backward coefficient transform itself write the output y/x into ty; a quotient-copy design is structurally too wide. This makes the coefficient-transform equation, not multiplier engineering, the core problem.","metric_note":"Docs/backlog only; benchmark unchanged and checks pass.","next_action_hint":"Focus on solving or proving impossible the coefficient-transform equation for direct-output DIV. If impossible, the 600q architecture needs a non-Kaliski division algorithm rather than Kaliski+Bennett copy."}}
{"run":175,"commit":"927e0ea","metric":4132750,"metrics":{"altseed_classical_total":0,"altseed_phase_batches_total":0,"altseed_ancilla_batches_total":0,"avg_clifford":24414411.956,"qubits":2716,"emitted_ops":31193208,"correctness_ok":1},"status":"keep","description":"600-scratch coefficient search: affine two-channel Kaliski reduces to shifted-Y unless r becomes an output","timestamp":1777341701540,"segment":3,"confidence":16.869012707722383,"iterationTokens":20193,"asi":{"hypothesis":"Maybe using both Kaliski coefficient channels r and s with affine initial/final seeds can expose raw k and scaled lambda simultaneously, solving direct-output DIV under 600 scratch.","result":"Derived in scratch600_ground_up.md: T=[[a,k],[dx,0]] implies body delta a*(rF-r0)+k*(sF-s0). If scratch r must end known/freeable and we avoid unknown a, then rF=r0=constant, reducing exactly to the already-dead shifted-Y case.","structural_learning":"Simple two-channel affine coefficient seeding does not rescue coefficient-transform Kaliski. Remaining viable branches are: (1) make r itself an output register; (2) synthesize a different triangular DIV Euclidean transform; (3) abandon one-inversion DIV and return to jumped/windowed Kaliski.","metric_note":"Docs/backlog only; benchmark unchanged and checks pass.","next_action_hint":"Explore output-register use of r: can Kaliski r become final ty (or tx) while old ty is consumed and denominator state cleaned, without a quotient copy? If no, pivot to alternative triangular DIV transform search."}}
{"run":176,"commit":"e3520d6","metric":4132750,"metrics":{"altseed_classical_total":0,"altseed_phase_batches_total":0,"altseed_ancilla_batches_total":0,"avg_clifford":24414411.956,"qubits":2716,"emitted_ops":31193208,"correctness_ok":1},"status":"keep","description":"600-scratch output-r route: self-cleaning forward Kaliski branch recovery needs coefficient state","timestamp":1777341882279,"segment":3,"confidence":12.633235724743777,"iterationTokens":9609,"asi":{"hypothesis":"If Kaliski r becomes the output register, a 600-scratch DIV can avoid quotient-copy and backward transform, but only if forward Kaliski can be self-cleaning without m_hist. Test whether end-state branch recovery is locally possible.","result":"Added test end_state_needs_coefficient_registers_to_recover_branch. It shows denominator-only end state (u,v,f) has branch collisions, while full canonical coefficient state (u,v,r,s,f) has no collisions over 200×407 sampled steps.","structural_learning":"Forward-only DIV is not information-theoretically impossible, but the branch-erasure predicate must use coefficient registers, not the cheap 4-bit start-state formula. This turns SOTA into a concrete synthesis problem: derive a cheap end-state branch predicate for Kaliski.","metric_note":"Test/docs only; benchmark unchanged and checks pass.","next_action_hint":"Derive inverse-branch predicate from end-state candidates (UE/VE/UG/VG) using coefficient relations and iter bounds. Cost it; if more than ~one comparator per iter, forward-only DIV likely loses and we should pivot to alternative Euclidean transforms."}}
{"run":177,"commit":"ce4bb22","metric":4132750,"metrics":{"altseed_classical_total":0,"altseed_phase_batches_total":0,"altseed_ancilla_batches_total":0,"avg_clifford":24414411.956,"qubits":2716,"emitted_ops":31193208,"correctness_ok":1},"status":"keep","description":"Approx-DIV note: zero-coefficient branch issue only matters for exactness; approximate tolerance reopens tagged/exceptional-state route","timestamp":1777341985871,"segment":3,"confidence":12.633235724743777,"iterationTokens":4781,"asi":{"hypothesis":"If approximate incorrectness is tolerated, the zero-coefficient obstruction for self-cleaning DIV may be acceptable or taggable; record tests/docs before context rollover.","result":"Added zero_coefficient_seed_loses_branch_information test and updated scratch600/ideas: nonzero coefficient full-state branch recovery works on samples, denominator-only fails, zero seed loses branch information. User clarified approximate incorrectness is tolerated, which reopens ignoring rare dy=0-like exceptional subspaces or adding a small nonzero tag.","structural_learning":"Approximate tolerance changes the decision: self-cleaning forward Kaliski/DIV may be viable if branch recovery works for overwhelming nonzero coefficient states and failures are confined to negligible/controllable exceptional sets.","metric_note":"No build path changes; prior benchmark remains 4,132,750 Toffoli / 2716q. kaliski_linear_transform tests passed locally before this docs update.","next_action_hint":"Next session: quantify exceptional-set probability under harness/Shor distribution (dy=0 and tag collisions), then design a tagged coefficient seed s=y+c that preserves quotient recovery while making branch recovery nonzero almost always."}}
{"run":178,"commit":"9261c51","metric":4132750,"metrics":{"altseed_classical_total":0,"altseed_phase_batches_total":0,"altseed_ancilla_batches_total":0,"avg_clifford":24414411.956,"qubits":2716,"emitted_ops":31193208,"correctness_ok":1},"status":"keep","description":"Tagged DIV validation path: seed y+x recovers quotient; default-off circuit probe passes","timestamp":1777342548042,"segment":3,"confidence":12.633235724743777,"iterationTokens":22415,"asi":{"hypothesis":"Approximate tolerance allows a nonzero coefficient tag. Try denominator tag s0=y+x so Kaliski output is k*(y+x)=k*y-2^407, allowing quotient recovery by adding a known constant without raw k.","result":"Added dx_tagged_seed_recovers_division_with_negligible_exception test and KAL_TAGGED_DIV_VALIDATE=1 default-off integration. Custom validation run with env passed 9024 shots + 5 alt seeds: 4,138,926 Toffoli / 2716q / 0 failures. Default benchmark path unchanged at 4,132,750.","structural_learning":"This is the first tag algebra that does not introduce an unremovable raw-k term. It validates the core DIV idea in the real circuit, though still using old Bennett-clean Kaliski/m_hist so no performance win yet.","approx_failure_model":"Tag-zero exceptional set is y=-x mod p, probability about 1/p for random field inputs; well below 1% tolerance.","rollback_reason":"","next_action_hint":"Next session: replace the old Kaliski m_hist/backward with a forward-only/self-cleaning tagged DIV scaffold, or first synthesize the end-state branch predicate over full coefficient state. If branch predicate is too expensive, pivot to alternative triangular Euclidean transform."}}
{"run":179,"commit":"23cddbe","metric":4132750,"metrics":{"altseed_classical_total":0,"altseed_phase_batches_total":0,"altseed_ancilla_batches_total":0,"avg_clifford":24414411.956,"qubits":2716,"emitted_ops":31193208,"correctness_ok":1},"status":"keep","description":"Wire tagged coefficient-channel DIV probe and invalidate naive side-channel cost","timestamp":1777343197087,"segment":3,"confidence":12.633235724743777,"iterationTokens":22415,"asi":{"hypothesis":"Try to move from algebra-only tagged DIV to a real circuit scaffold: carry an external coefficient pair (lam,ty) through live Kaliski branch controls so ty is consumed to zero and lam receives the tagged quotient, then compare against the SOTA constraints.","result":"Default path remains unchanged and passes ./autoresearch.sh at 4,132,750 Toffoli / 2716q / 0 failures. Env probe KAL_TAGGED_DIV_COEFF_CHANNEL=1 passes 9024 shots + 5 alt seeds but costs 4,672,021 Toffoli / 2,977q.","structural_learning":"The y+x tag algebra works in-circuit and the coefficient side channel can replace pair1's two multiplications functionally, but naively running it beside full Kaliski inverse state is worse: per-iteration cswap+cmodadd+double and extra live lam dominate, exceeding the 2800q cap.","invalidated":"Naive parallel coefficient side-channel with full inverse (r,s)+m_hist is not a SOTA path; it is too wide and too expensive despite correctness.","next_positive_step":"Test a branch-only Kaliski generator that replaces full inverse (r,s) sentinel with stored a_hist plus existing m_hist. New test stored_a_and_m_bits_recover_branch_pair confirms add=f&!(a xor m), but this still stores history and is only an intermediate scaffold toward self-cleaning/600 scratch."}}
{"run":180,"commit":"a567e18","metric":4132750,"metrics":{"altseed_classical_total":0,"altseed_phase_batches_total":0,"altseed_ancilla_batches_total":0,"avg_clifford":24414411.956,"qubits":2716,"emitted_ops":31193208,"correctness_ok":1},"status":"keep","description":"Add branch-stream tagged DIV scaffold; passes under 2800q but too costly","timestamp":1777344917287,"segment":3,"confidence":12.633235724743777,"iterationTokens":7077,"asi":{"hypothesis":"Replace naive parallel coefficient side-channel with a branch-stream architecture: record only branch histories, free final denominator state, replay histories into tagged coefficient channel, then uncompute histories. This should lower qubits and test a cleaner reversible DIV scaffold.","result":"Default path unchanged and passes ./autoresearch.sh at 4,132,750 Toffoli / 2716q. Env probe KAL_TAGGED_DIV_BRANCH_STREAM=1 passes 9024 shots + 5 alt seeds with 0 classical/phase/ancilla failures at 4,729,076 Toffoli / 2,763q.","structural_learning":"This is the first fully clean tagged-DIV scaffold below the current 2800q cap. It validates y+x tagged DIV as a reversible point-add sub-architecture and fixes the phase issue from the interleaved branch_hist probe by separating branch recording from coefficient replay and freeing known final denominator state.","invalidated":"Stored-history replay is not SOTA as-is: m_hist+a_hist+add_hist (1221 bits) plus full coefficient replay makes Toffoli much worse than baseline, despite lower qubits. Interleaved branch_hist also had an alt-seed phase failure and 2870q, so branch-stream dominates it.","next_action_hint":"Next: compress/delete the three branch history streams. Options: derive add from a/m plus a compact termination bitstream; window branch replay; or synthesize an end-state predicate using the tagged coefficient state so histories can be uncomputed locally."}}
