{"run":522,"commit":"932c3a5","metric":313998,"metrics":{"by_partial_prefix_strategy_e_div_body_ccx":1891248,"by_partial_prefix_strategy_e_current_product_gap_ccx":1279758,"altseed_classical_total":0,"altseed_phase_batches_total":0,"altseed_ancilla_batches_total":0,"avg_toffoli":4089274,"avg_clifford":24292787.153,"qubits":2713,"emitted_ops":30575944,"correctness_ok":1},"status":"keep","description":"Kill Strategy-E escape using partial-prefix one-DIV cost","timestamp":1777594865430,"segment":88,"confidence":null,"iterationTokens":170,"asi":{"hypothesis":"Although partial-prefix qoffset fails naive two-denominator BY, maybe its one-DIV body can power Strategy E/slope-coordinate point-add if paired with a future in-place multiply.","result":"No: partial-prefix DIV body is 1891248 CCX. Strategy E with current product-clean multiply misses by +1279758; even granting a hypothetical 180k schoolbook-like in-place product-clean multiply still misses by +313998.","decision":"Partial-prefix qoffset is not the missing one-DIV primitive for Strategy E. Keep it as an arithmetic subprimitive only; do not pursue Strategy-E integration around it.","next_action_hint":"Pivot away from partial-prefix BY/qoffset unless a new algebra deletes the second denominator or reduces the DIV body below roughly 900k."}}
{"type":"config","name":"Scratch600 frontier after partial-prefix demotion","metricName":"scratch600_partial_prefix_two_den_gap_to_2700k","metricUnit":"","bestDirection":"lower"}
{"run":523,"commit":"2bef1ee","metric":1368262,"metrics":{"scratch600_frontier_best_scratch_bits":510,"scratch600_frontier_best_charged_scratch_bits":510,"scratch600_frontier_best_charged_toffoli":2765676,"scratch600_frontier_best_charged_gap_to_2700k":65676,"scratch600_streamed_replay_body_projected_toffoli":2645196,"scratch600_streamed_unfunded_selector_budget_ccx":54804,"scratch600_streamed_selector_budget_ccx":87840,"scratch600_streamed_lowword_selector_ccx":208320,"scratch600_streamed_selector_shortfall_ccx":120480,"scratch600_partial_prefix32_projected_toffoli":2697524,"scratch600_partial_prefix32_gap_to_2700k":-2476,"scratch600_partial_prefix48_projected_toffoli":2652404,"scratch600_partial_prefix48_gap_to_2700k":-47596,"scratch600_partial_prefix80_projected_toffoli":2562164,"scratch600_partial_prefix80_gap_to_2700k":-137836,"scratch600_partial_prefix90_projected_toffoli":2533964,"scratch600_partial_prefix90_gap_to_2700k":-166036,"scratch600_partial_prefix_two_den_projected_toffoli":4068262,"scratch600_centered_raw_scratch_bits":592,"scratch600_centered_boundary_scratch_p99":710,"scratch600_centered_parser_over_strict_bits":110,"scratch600_plusminus_raw_scratch_bits":564,"scratch600_plusminus_unary_scratch_p99":640,"scratch600_plusminus_parser_over_strict_bits":40,"scratch600_plusminus_scaled_slack_scratch_max":517,"scratch600_plusminus_scaled_solinas_projected_max":2027038,"scratch600_plusminus_scaled_solinas_gap_max_to_2700k":-672962,"scratch600_halfgcd_matrix_only_bits":524,"scratch600_halfgcd_matrix_tail_raw_bits":689,"scratch600_halfgcd_tail_over_google_bits":26,"altseed_classical_total":0,"altseed_phase_batches_total":0,"altseed_ancilla_batches_total":0,"avg_toffoli":4089274,"avg_clifford":24292787.153,"qubits":2713,"emitted_ops":30575944,"correctness_ok":1},"status":"keep","description":"Validate scratch600 frontier after partial-prefix BY demotion","timestamp":1777594979656,"segment":89,"confidence":null,"iterationTokens":168,"asi":{"hypothesis":"The scratch600 frontier should reflect the corrected state: partial-prefix qoffset rows are one-DIV local models only, while the two-denominator ledger blocks promotion.","result":"Frontier test passes. Best charged row remains old streamed-mask+lowword selector at 2765676 (+65676). Partial-prefix one-DIV rows show negative gaps, but two-denominator projection is 4068262 (+1368262), so charged_toffoli remains None for partial-prefix rows.","decision":"Scratch600 frontier is honest again: no BY candidate is counted solved after the user-skepticism correction.","next_action_hint":"Future work should pivot to non-BY structural primitives or prove a charged one-denominator algebra before touching BY integration."}}
{"type":"config","name":"Denominator-shift-free bounded quotient history lower bound","metricName":"bounded_no_shift_q15_scratch_p99","metricUnit":"","bestDirection":"lower"}
{"run":524,"commit":"802b614","metric":6276,"metrics":{"bounded_no_shift_q7_p99_steps":3086,"bounded_no_shift_q7_scratch_p99":9514,"bounded_no_shift_q15_p90_steps":338,"bounded_no_shift_q15_p99_steps":1505,"bounded_no_shift_q15_max_steps":20000,"bounded_no_shift_q15_scratch_p90":1608,"altseed_classical_total":0,"altseed_phase_batches_total":0,"altseed_ancilla_batches_total":0,"avg_toffoli":4089274,"avg_clifford":24292787.153,"qubits":2713,"emitted_ops":30575944,"correctness_ok":1},"status":"keep","description":"Kill bounded-quotient no-shift DIV by q-history lower bound","timestamp":1777596184157,"segment":90,"confidence":null,"iterationTokens":172,"asi":{"hypothesis":"A denominator-shift-free recurrence using bounded quotient subtracts might avoid plusminus denominator barrels, but may require too much reversible quotient history.","result":"Optimistic lower bound fails badly: q<=15 needs p99 1505 subtract steps and q-history scratch p99 6276 bits; q<=7 is worse at 9514 scratch. This grants free q computation and no controlled multiply cost, so the real circuit can only be worse.","decision":"Demote bounded small-quotient no-shift recurrence. It removes physical shifts by creating an unaffordable parser/history stream, so it does not provide a <3M low-scratch path.","next_action_hint":"Future denominator-shift-free work must avoid both per-step physical denominator shifts and long q-history; look for large-block algebra with local inverse/cleanup, not tiny-quotient subtractive Euclid."}}
{"type":"config","name":"Strategy E 3M selector budget risk ledger","metricName":"strategy_e_3m_lowword_selector_gap_ccx","metricUnit":"","bestDirection":"lower"}
{"run":525,"commit":"9dd9b33","metric":240318,"metrics":{"strategy_e_3m_max_div_body_ccx":911490,"strategy_e_3m_selector_budget_after_fixed_replay_ccx":37890,"strategy_e_3m_decoder_only_gap_ccx":26046,"strategy_e_3m_partial_prefix_gap_ccx":979758,"altseed_classical_total":0,"altseed_phase_batches_total":0,"altseed_ancilla_batches_total":0,"avg_toffoli":4089274,"avg_clifford":24292787.153,"qubits":2713,"emitted_ops":30575944,"correctness_ok":1},"status":"keep","description":"Show Strategy E still lacks selector budget for 3M","timestamp":1777596377027,"segment":91,"confidence":null,"iterationTokens":172,"asi":{"hypothesis":"The relaxed 3M target might make Strategy E viable by deleting BY's second denominator, if a fixed-control one-DIV replay plus current product-clean multiply fits.","result":"It still lacks budget for denominator controls: Strategy E can afford only 911490 CCX for the single DIV body; best fixed-control replay 873600 leaves 37890, but measured decoder alone is 63936 and lowword selector+decoder leaves a +240318 gap to 3M. Partial-prefix DIV is +979758 to 3M in Strategy E.","decision":"Do not count Strategy E as a <3M low-scratch path unless a new integrated one-DIV selector/parser is found or product-clean multiply is made much cheaper.","next_action_hint":"If pursuing <3M, attack the selector/parser coupling directly: can branch controls be generated and consumed without a separate 36-window decoder+lowword oracle? Otherwise pivot away from BY/Strategy-E."}}
{"type":"config","name":"Strategy E product-clean second-denominator risk ledger","metricName":"strategy_e_optimistic_two_den_gap_to_3m_ccx","metricUnit":"","bestDirection":"lower"}
{"run":526,"commit":"17b3978","metric":246366,"metrics":{"strategy_e_second_den_selector_decoder_ccx":278208,"strategy_e_forgotten_second_selector_gap_ccx":-31842,"strategy_e_current_two_den_gap_to_3m_ccx":518526,"strategy_e_missing_second_selector_swing_ccx":278208,"strategy_e_product_clean_budget_after_partial_prefix_ccx":166002,"altseed_classical_total":0,"altseed_phase_batches_total":0,"altseed_ancilla_batches_total":0,"avg_toffoli":4089274,"avg_clifford":24292787.153,"qubits":2713,"emitted_ops":30575944,"correctness_ok":1},"status":"keep","description":"Charge Strategy-E product-clean as a second denominator","timestamp":1777596601932,"segment":92,"confidence":null,"iterationTokens":173,"asi":{"hypothesis":"The previous Strategy-E 3M ledger may still be missing that the known product-clean multiply is itself a BY/product-clean replay with its own denominator controls.","result":"Confirmed. If the product-clean replay is treated as denominator-controlled, forgetting the second selector makes an optimistic centered ledger look -31842 under 3M, but charging the second selector/parser adds 278208 and leaves +246366 even with centered product-clean replay; the current product-clean replay leaves +518526. Partial-prefix Strategy E can afford only 166002 for a non-DIV product-clean multiply to hit 3M.","decision":"Strategy E is not a solved <3M low-scratch path with current primitives. It needs a genuinely non-DIV product-clean multiply near schoolbook cost or a proof that the product denominator controls share/delete with the slope DIV controls.","next_action_hint":"Do not reuse current product-clean BY replay as if it were a generic IMUL. Next hard-piece probes should target non-DIV product-clean multiply cleanup or a control-sharing algebra between dx and Rx-Qx."}}
{"type":"config","name":"Strategy E denominator branch sharing probe","metricName":"strategy_e_branch_case_mi_millibits","metricUnit":"","bestDirection":"lower"}
{"run":527,"commit":"f2d81b8","metric":4.846,"metrics":{"strategy_e_branch_share_samples":256,"strategy_e_branch_odd_match_ppm":531792,"strategy_e_branch_case_match_ppm":431464,"strategy_e_branch_odd_mi_millibits":2.444,"altseed_classical_total":0,"altseed_phase_batches_total":0,"altseed_ancilla_batches_total":0,"avg_toffoli":4089274,"avg_clifford":24292787.153,"qubits":2713,"emitted_ops":30575944,"correctness_ok":1},"status":"keep","description":"Check Strategy-E denominator branch streams do not simply share","timestamp":1777596843279,"segment":93,"confidence":null,"iterationTokens":167,"asi":{"hypothesis":"Maybe Strategy E can avoid the product-clean second-denominator cost by reusing or deriving the Rx-Qx BY controls from the original dx branch stream.","result":"No simple sharing signal: on 256 secp point-add samples over 576 steps, dx vs Rx-Qx odd controls have only 2.444 millibits mutual information and branch cases 4.846 millibits; case match is 431464 ppm. This is essentially independent for control-sharing purposes.","decision":"Do not assume pair1 branch controls can feed the product-clean denominator. Any control-sharing revival needs a concrete invariant, not empirical correlation.","next_action_hint":"Next product-clean work should target a non-DIV in-place multiply cleanup; BY control sharing between dx and Rx-Qx is not a promising cheap patch."}}
{"type":"config","name":"BY fixed-window 3M budget ledger","metricName":"by_3m_free_mq_projected_gap_ccx","metricUnit":"","bestDirection":"lower"}
{"run":528,"commit":"881ebd2","metric":338943.976,"metrics":{"by_3m_fixed_window_budget_per_window_ccx":13431.028,"by_3m_last_shot_projected_gap_ccx":496258,"by_3m_free_mq_needed_reduction_per_window_ccx":4707.555,"altseed_classical_total":0,"altseed_phase_batches_total":0,"altseed_ancilla_batches_total":0,"avg_toffoli":4089274,"avg_clifford":24292787.153,"qubits":2713,"emitted_ops":30575944,"correctness_ok":1},"status":"keep","description":"Check BY fixed-window arithmetic still misses relaxed 3M budget","timestamp":1777597093613,"segment":94,"confidence":null,"iterationTokens":173,"asi":{"hypothesis":"Maybe relaxing the target to 3M makes the known BY fixed-window denominator primitive viable under the low-scratch ledger.","result":"No. With two centered 873600 replays and deleted-Kaliski scaffold, two denominator windows can spend 13431 CCX/window. Even granting free m/q history, the known window body projects +338944 over 3M and needs 4708 CCX/window reduction; the actual last-shot fixed-window object is +496258.","decision":"Current BY fixed-window arithmetic is still not a <3M solution. A BY revival needs a new selected-window primitive, not just the relaxed target.","next_action_hint":"If BY is revisited, work on a genuinely cheaper selected-window arithmetic body or stop; do not wire current fixed-window objects into point-add."}}
{"type":"config","name":"Stored Euclid quotient stream 2800q 3M candidate ledger","metricName":"euclid_2800_projected_gap_to_3m_ccx","metricUnit":"","bestDirection":"lower"}
{"run":529,"commit":"2692cc4","metric":-493190,"metrics":{"euclid_2800_payload_p99_bits":349,"euclid_2800_payload_max_bits":355,"euclid_2800_count_p99":173,"euclid_2800_one_boundary_scratch_p99":777,"euclid_2800_longdiv_weight_p99":45449,"euclid_2800_per_qbit_replay_ccx":587,"euclid_2800_one_div_projected_ccx":932047,"euclid_2800_longdiv_unit_budget_for_3m_ccx":10.713,"euclid_2800_conservative_peak_qubits":1801,"altseed_classical_total":0,"altseed_phase_batches_total":0,"altseed_ancilla_batches_total":0,"avg_toffoli":4089274,"avg_clifford":24292787.153,"qubits":2713,"emitted_ops":30575944,"correctness_ok":1},"status":"keep","description":"Reopen stored Euclid quotient stream for relaxed 3M under 2800q","timestamp":1777597355937,"segment":95,"confidence":null,"iterationTokens":184,"asi":{"hypothesis":"The ordinary Euclid quotient stream was killed for ~600 scratch, but may be viable for a relaxed 3M target under the current <=2800q cap if parser boundaries are stored explicitly.","result":"Optimistic ledger is SOTA-shaped for 3M: p99 payload 349 bits, p99 one-boundary scratch 777 beyond tx/ty, conservative peak 1801q. With per-qbit replay 587 CCX and 8 CCX per long-division weighted trial, one DIV projects 932047 and point-add 2506810, margin -493190 to 3M. The long-division unit budget is only 10.713 CCX/trial, so extraction must be quite cheap.","decision":"Promote stored quotient stream to a relaxed-2800q candidate only, not a Google-low-qubit candidate. It needs a toy reversible extractor/replayer next; no integration until bit-trial and boundary cleanup are measured.","next_action_hint":"Build the hardest piece first at toy widths: generate quotient bits plus boundaries reversibly, replay coefficients, reverse denominator, and clean parser state; measure cost per weighted trial and qbit."}}
{"type":"config","name":"Stored Euclid quotient fixed-scan longdivision risk","metricName":"euclid_fixedscan_gap_to_3m_at_1ccx","metricUnit":"","bestDirection":"lower"}
{"run":530,"commit":"0721c17","metric":43403354,"metrics":{"euclid_fixedscan_count_p99":173,"euclid_fixedscan_payload_p99_bits":349,"euclid_fixedscan_weighted_trials_p99":45442,"euclid_fixedscan_static_trials_p99":11337728,"euclid_fixedscan_dynamic_vs_fixed_ratio":249.499,"euclid_fixedscan_unit_budget_for_3m_ccx":0.042944,"altseed_classical_total":0,"altseed_phase_batches_total":0,"altseed_ancilla_batches_total":0,"avg_toffoli":4089274,"avg_clifford":24292787.153,"qubits":2713,"emitted_ops":30575944,"correctness_ok":1},"status":"keep","description":"Expose fixed-scan long-division risk for stored quotient stream","timestamp":1777597592105,"segment":96,"confidence":null,"iterationTokens":175,"asi":{"hypothesis":"The stored Euclid quotient stream 3M ledger may hide a dynamic-loop assumption in long-division quotient extraction.","result":"Confirmed. A fixed reversible scan over all 256 shifts for each quotient has p99 11337728 static bit-trials, 249.5x the weighted-trial proxy. Even at 1 CCX per bit-trial, point-add is +43403354 over 3M; the unit budget would be 0.042944 CCX.","decision":"Demote the simple stored-parser quotient plan. It remains a speculative relaxed-2800q route only if a dynamic/packed reversible quotient extractor scales with weighted payload instead of count*n^2.","next_action_hint":"Do not proceed to integration. If revisiting Euclid quotient streams, first build a toy dynamic/packed extractor or prove a cheap bitlength/pointer mechanism; fixed-scan long division is dead."}}
{"type":"config","name":"Stored Euclid packed extractor alignment budget","metricName":"euclid_packed_alignment_budget_per_quotient_ccx","metricUnit":"","bestDirection":"higher"}
{"run":531,"commit":"0eefbf5","metric":1009.069,"metrics":{"euclid_packed_extraction_oneway_budget_ccx":486889,"euclid_packed_payload_floor_ccx":268032,"euclid_packed_leading_scan_floor_ccx":44288,"euclid_packed_log_barrel_gap_pointadd_ccx":718940,"altseed_classical_total":0,"altseed_phase_batches_total":0,"altseed_ancilla_batches_total":0,"avg_toffoli":4089274,"avg_clifford":24292787.153,"qubits":2713,"emitted_ops":30575944,"correctness_ok":1},"status":"keep","description":"Bound alignment budget for packed Euclid quotient extractor","timestamp":1777597761460,"segment":97,"confidence":null,"iterationTokens":168,"asi":{"hypothesis":"A stored Euclid quotient stream might survive if quotient extraction iterates over packed quotient bits rather than fixed-scanning all shifts; the critical risk is shifted-divisor alignment cost.","result":"The alignment budget is tight. One-way extraction can spend 486889 CCX; an optimistic compare/sub floor is 268032 and leading scans are 44288, leaving about 1009 CCX per quotient for v<<shift alignment. A generic log barrel at ~2048 per quotient would miss by about +718940 point-add CCX.","decision":"The route remains speculative, not active: it needs an offset/metadata shifted comparator or shared alignment below ~1k CCX/quotient. Generic barrel or fixed-scan extraction is dead.","next_action_hint":"If pursuing Euclid quotient stream, prototype an offset/metadata compare-and-subtract that maintains shifted v by pointer/Clifford relabels; otherwise pivot."}}
{"type":"config","name":"Centered Euclid relaxed 2800q packed extractor risk","metricName":"centered_2800_alignment_budget_per_quotient_ccx","metricUnit":"","bestDirection":"higher"}
{"run":532,"commit":"0eefbf5","metric":5874.186,"metrics":{"centered_2800_payload_p99_bits":336,"centered_2800_payload_max_bits":341,"centered_2800_count_p99":118,"centered_2800_one_boundary_scratch_p99":710,"centered_2800_weighted_trials_p99":43935,"centered_2800_projected_gap_to_3m_ccx":-556900,"centered_2800_fixedscan_gap_to_3m_at_1ccx":28970172},"status":"crash","description":"Centered Euclid relaxed ledger assertion was too pessimistic","timestamp":1777597939746,"segment":98,"confidence":null,"iterationTokens":179,"asi":{"hypothesis":"Centered Euclid may improve the relaxed-2800q quotient-stream ledger and leave more room for a packed extractor than ordinary Euclid.","result":"The test failed only because the go/no-go assertion expected alignment budget <1500, but the measured budget was much better: payload_p99=336, count_p99=118, scratch_p99=710, weighted gap=-556900 to 3M, fixed-scan still dead at +28970172, alignment budget≈5874 CCX/quotient.","rollback_reason":"Assertion encoded demotion when the data actually indicated a promising relaxed-2800q candidate. Need rerun with corrected assertions and documentation.","next_action_hint":"Recreate the centered Euclid relaxed ledger with assertions that keep it as speculative-positive: fixed scan remains dead, but packed alignment budget is comfortable enough to prototype metadata alignment."}}
{"run":533,"commit":"ae7c40e","metric":5874.186,"metrics":{"centered_2800_payload_p99_bits":336,"centered_2800_payload_max_bits":341,"centered_2800_count_p99":118,"centered_2800_one_boundary_scratch_p99":710,"centered_2800_weighted_trials_p99":43935,"centered_2800_projected_gap_to_3m_ccx":-556900,"centered_2800_fixedscan_gap_to_3m_at_1ccx":28970172,"altseed_classical_total":0,"altseed_phase_batches_total":0,"altseed_ancilla_batches_total":0,"avg_toffoli":4089274,"avg_clifford":24292787.153,"qubits":2713,"emitted_ops":30575944,"correctness_ok":1},"status":"keep","description":"Promote centered Euclid as better relaxed-2800q quotient candidate","timestamp":1777598102643,"segment":98,"confidence":null,"iterationTokens":3268,"asi":{"hypothesis":"Centered/nearest quotients may be a better relaxed-2800q version of the stored Euclid quotient stream, with fewer quotient records and more room for packed alignment.","result":"Positive but still speculative: payload p99/max 336/341 bits, count p99 118, boundary scratch p99 710, weighted p99 43935. Projected point-add is 2443100 (-556900 to 3M). Fixed scan remains dead at +28970172, but packed alignment budget is ~5874 CCX/quotient, much better than ordinary Euclid's ~1009.","decision":"Promote centered Euclid to the best relaxed-2800q candidate, not a Google-low-qubit candidate. Next hard piece is a reversible packed extractor with offset/metadata alignment and boundary cleanup.","next_action_hint":"Prototype toy centered quotient extractor/replayer: explicit boundaries, signed q from residual signs, offset comparator/subtractor, reverse denominator, phase-clean cleanup. Do not integrate before this hard piece is measured."}}
{"type":"config","name":"Correct centered Euclid packed extractor compute/uncompute budget","metricName":"centered_2800_alignment_budget_per_quotient_ccx","metricUnit":"","bestDirection":"higher"}
