{"run":246,"commit":"cbcf1a5","metric":4132750,"metrics":{"altseed_classical_total":0,"altseed_phase_batches_total":0,"altseed_ancilla_batches_total":0,"avg_clifford":24414411.956,"qubits":2716,"emitted_ops":31193208,"correctness_ok":1,"by_tests_passed":76,"inverse_negr_ccx":1145760,"two_fast_replay_projected":2637286,"by_replay_bench_avg_toffoli":5278510,"by_replay_bench_qubits":2716,"by_replay_bench_emitted_ops":42250936},"status":"keep","description":"Integrate clean BY pattern decoder around full 560-step tagged-DIV replay","timestamp":1777412014276,"segment":3,"confidence":null,"iterationTokens":17546,"asi":{"hypothesis":"The raw-pattern BY replay should be made into a clean reversible circuit by expanding A controls from pattern+delta, running the 560 scaled-BY steps, and reversing the decoder to clean A/delta. This validates exact decoder integration and quantifies overhead before denominator generation is solved.","result":"Added scaled_by_pattern_decoder_560_tagged_div_scaffold_is_clean. It decodes all 35 raw 16-bit patterns into A controls with a 10-bit delta register, runs the full 560-step tagged-DIV replay, then reverses all decoders. The circuit is exact on the sampled tagged-DIV basis instance, cleans A history, restores delta=1, and is phase-clean. Metrics: decode_forward=62,160 CCX, replay+decode=1,207,920 CCX, roundtrip clean=1,270,080 CCX, peak=2,415q. Also changed the one-window decoder to exact small delta arithmetic after fast/MBU arithmetic left phase when A bits were used by intervening modular replay; one-window decoder is now 1,776 CCX forward / 3,552 roundtrip / 53q. Full BY suite passes: 76 tests. Default autoresearch/checks pass unchanged at 4,132,750 Toffoli / 2716q.","structural_learning":"A-control decoding from raw pattern history is now a clean circuit component. The all-A-history schedule is under the current 2800q cap and adds ~124k per replay for decode+clean. Forward-only decode overhead is ~62k per replay, close to the previous 60k two-replay budget but not enough by itself for final low-qubit SOTA if branch generation remains costly. The phase failure with measurement-based small delta arithmetic is an important scheduling lesson: decoder components whose outputs control later quantum arithmetic should use exact reversible arithmetic or a carefully proven phase fix.","caveat":"This still assumes raw pattern bits are available. It keeps 560 A controls live during replay, so it is not the final low-scratch schedule. It does not solve denominator branch-pattern generation.","next_action_hint":"Next remove persistent A history by using a window-local A schedule: decode one window, apply 16 scaled microsteps, preserve delta_next, and clear A without keeping all 560 A bits. A small delta pebble or reverse-from-delta_next clearer could recover ~60k-120k margin and reduce peak before integrating denominator generation."}}
{"run":247,"commit":"6b5d6db","metric":4123978,"metrics":{"altseed_classical_total":0,"altseed_phase_batches_total":0,"altseed_ancilla_batches_total":0,"avg_clifford":24404913.719,"qubits":2716,"emitted_ops":31040038,"correctness_ok":1,"by_tests_passed":76,"inverse_negr_ccx":1145760,"two_fast_replay_projected":2637286,"by_replay_bench_avg_toffoli":5278510,"by_replay_bench_qubits":2716,"by_replay_bench_emitted_ops":42250936},"status":"keep","description":"Probe larger Kaliski bulk-prefix threshold at 330 iterations","timestamp":1777412130701,"segment":3,"confidence":null,"iterationTokens":4203,"asi":{"hypothesis":"The guaranteed-bulk Kaliski prefix may be longer than the current default 313 iterations. Increasing KAL_BULK3_ITERS to 330 could reduce comparator/flag work while preserving exact phase-clean correctness.","result":"Env probe KAL_BULK3_ITERS=330 passed autoresearch and checks: avg_toffoli=4,123,978, avg_clifford=24,404,913.719, qubits=2,716, emitted_ops=31,040,038, correctness_ok=1, altseed failures all zero. This is an 8,772 Toffoli improvement over the current default 4,132,750.","structural_learning":"There is additional safe bulk-prefix slack in the current Kaliski implementation. This is not a SOTA-level breakthrough, but it gives a real benchmark-path improvement and may indicate the bulk-prefix proof/invariant can be tightened beyond the conservative constant.","caveat":"Env-only probe; default constant not changed yet. This is a small improvement and should not distract from BY/DIV, but it is safe to fold into default if a direct edit passes.","next_action_hint":"Edit BULK_PREFIX_SAFE_ITERS from 313 to 330, run default autoresearch, then continue BY window/self-cleaning work. Also test higher values (340/350) to find the safe cliff if time permits."}}
{"run":248,"commit":"23060b7","metric":4116618,"metrics":{"altseed_classical_total":0,"altseed_phase_batches_total":0,"altseed_ancilla_batches_total":0,"avg_clifford":24405203.802,"qubits":2716,"emitted_ops":30890178,"correctness_ok":1,"by_tests_passed":76,"inverse_negr_ccx":1145760,"two_fast_replay_projected":2637286,"by_replay_bench_avg_toffoli":5278510,"by_replay_bench_qubits":2716,"by_replay_bench_emitted_ops":42250936},"status":"keep","description":"Probe larger Kaliski bulk-prefix threshold at 350 iterations","timestamp":1777412205895,"segment":3,"confidence":57.98158914728682,"iterationTokens":1458,"asi":{"hypothesis":"The safe Kaliski bulk-prefix region may extend substantially past 330 iterations; try 350 to locate a larger exact benchmark-path gain.","result":"KAL_BULK3_ITERS=350 passed autoresearch and checks: avg_toffoli=4,116,618, avg_clifford=24,405,203.802, qubits=2,716, emitted_ops=30,890,178, correctness_ok=1, altseed failures all zero. Improvement vs current default is 16,132 Toffoli.","structural_learning":"The old 313 bulk-prefix guard is conservative by at least 37 iterations under the real harness. This suggests the bit-length invariant used by bulk_prefix3 may be tightened further, though the payoff remains far below the SOTA gap.","caveat":"Env-only result and still a small improvement. Need edit default only after finding the cliff or choosing a robust value with margin.","next_action_hint":"Test 370 or 390 next to locate the phase/correctness cliff; then set default to the highest robust value with some safety margin."}}
{"run":249,"commit":"94ef4a9","metric":4112458,"metrics":{"altseed_classical_total":0,"altseed_phase_batches_total":0,"altseed_ancilla_batches_total":0,"avg_clifford":24417894.27,"qubits":2716,"emitted_ops":30773118,"correctness_ok":1,"by_tests_passed":76,"inverse_negr_ccx":1145760,"two_fast_replay_projected":2637286,"by_replay_bench_avg_toffoli":5278510,"by_replay_bench_qubits":2716,"by_replay_bench_emitted_ops":42250936},"status":"keep","description":"Probe Kaliski bulk-prefix threshold at 370 iterations","timestamp":1777412276591,"segment":3,"confidence":29.998546511627907,"iterationTokens":1222,"asi":{"hypothesis":"The Kaliski bulk-prefix specialization may remain correct at 370 iterations, giving a larger real benchmark-path saving while retaining exact phase cleanliness.","result":"KAL_BULK3_ITERS=370 passed autoresearch and checks: avg_toffoli=4,112,458, avg_clifford=24,417,894.270, qubits=2,716, emitted_ops=30,773,118, correctness_ok=1, all altseed totals zero. Improvement vs current default is 20,292 Toffoli.","structural_learning":"Bulk-prefix safe region extends at least to 370 under the harness. Clifford count begins to rise relative to 350, but primary Toffoli improves. The invariant likely has more slack, but the returns diminish.","caveat":"Env-only. This is still not SOTA-scale and should be folded in only after cliff testing.","next_action_hint":"Test KAL_BULK3_ITERS=390. If it passes, test closer to pair iteration count; if it fails, choose 370 or binary search the cliff."}}
{"run":250,"commit":"94ef4a9","metric":0,"metrics":{"altseed_classical_total":0,"altseed_phase_batches_total":0,"altseed_ancilla_batches_total":0,"avg_clifford":0,"qubits":0,"emitted_ops":0,"correctness_ok":0,"by_tests_passed":76,"inverse_negr_ccx":1145760,"two_fast_replay_projected":2637286,"by_replay_bench_avg_toffoli":5278510,"by_replay_bench_qubits":2716,"by_replay_bench_emitted_ops":42250936},"status":"crash","description":"Kaliski bulk-prefix threshold 390 fails main phase guard","timestamp":1777412318093,"segment":3,"confidence":29.998546511627907,"iterationTokens":1222,"asi":{"hypothesis":"The Kaliski bulk-prefix specialization may remain safe at 390 iterations and save more Toffoli.","result":"KAL_BULK3_ITERS=390 passed altseed totals but failed the main 9024-shot correctness phase guard: classical mismatches=0, phase-garbage batches=1, first global_phase=0x0000000040000000.","rollback_reason":"Env-only threshold experiment failed phase-clean correctness.","structural_learning":"The bulk-prefix cliff lies between 370 and 390. As with iteration cutoff, phase cleanliness is the limiting predicate, not classical output correctness.","next_action_hint":"Binary search 370..390; likely default around 380 if phase-clean. Then edit BULK_PREFIX_SAFE_ITERS to the highest robust passing value and run default checks."}}
{"run":251,"commit":"94ef4a9","metric":0,"metrics":{"altseed_classical_total":0,"altseed_phase_batches_total":0,"altseed_ancilla_batches_total":0,"avg_clifford":0,"qubits":0,"emitted_ops":0,"correctness_ok":0,"by_tests_passed":76,"inverse_negr_ccx":1145760,"two_fast_replay_projected":2637286,"by_replay_bench_avg_toffoli":5278510,"by_replay_bench_qubits":2716,"by_replay_bench_emitted_ops":42250936},"status":"crash","description":"Kaliski bulk-prefix threshold 380 fails main phase guard","timestamp":1777412358950,"segment":3,"confidence":29.998546511627907,"iterationTokens":1028,"asi":{"hypothesis":"Bulk-prefix 380 may be below the phase cliff seen at 390 while saving more than 370.","result":"KAL_BULK3_ITERS=380 failed the main phase guard: classical mismatches=0, phase_batches=1, first global_phase=0x20. Altseed precheck totals were zero.","rollback_reason":"Env-only threshold experiment failed phase-clean correctness.","structural_learning":"The phase cliff is below 380; 370 is currently the highest known passing value. The unsafe region can have zero altseed failures but still fail the main Fiat-Shamir seed, so full autoresearch is required for threshold selection.","next_action_hint":"Test 375/374 to refine the cliff, then set default to the highest passing threshold with margin."}}
{"run":252,"commit":"b6ce810","metric":4111918,"metrics":{"altseed_classical_total":0,"altseed_phase_batches_total":0,"altseed_ancilla_batches_total":0,"avg_clifford":24423006.99,"qubits":2716,"emitted_ops":30748978,"correctness_ok":1,"by_tests_passed":76,"inverse_negr_ccx":1145760,"two_fast_replay_projected":2637286,"by_replay_bench_avg_toffoli":5278510,"by_replay_bench_qubits":2716,"by_replay_bench_emitted_ops":42250936},"status":"keep","description":"Probe Kaliski bulk-prefix threshold at 375 iterations","timestamp":1777412426872,"segment":3,"confidence":30.129360465116278,"iterationTokens":1011,"asi":{"hypothesis":"Bulk-prefix 375 may be the highest safe value below the 380 phase cliff.","result":"KAL_BULK3_ITERS=375 passed autoresearch and checks: avg_toffoli=4,111,918, avg_clifford=24,423,006.990, qubits=2,716, emitted_ops=30,748,978, correctness_ok=1, altseed failures all zero. This improves current default by 20,832 Toffoli and beats the 370 probe by 540 Toffoli.","structural_learning":"The safe phase-clean bulk-prefix threshold extends at least to 375 but not to 380. Diminishing returns are small near the cliff; 375 appears a reasonable robust default candidate.","caveat":"Env-only. Need edit BULK_PREFIX_SAFE_ITERS and rerun default checks before keeping as code.","next_action_hint":"Optionally test 377/378, but 375 is already close to the cliff. To avoid brittle phase behavior, set default to 375 or 376 with full checks."}}
{"run":253,"commit":"b6ce810","metric":0,"metrics":{"altseed_classical_total":0,"altseed_phase_batches_total":1,"altseed_ancilla_batches_total":0,"avg_clifford":0,"qubits":0,"emitted_ops":0,"correctness_ok":0,"by_tests_passed":76,"inverse_negr_ccx":1145760,"two_fast_replay_projected":2637286,"by_replay_bench_avg_toffoli":5278510,"by_replay_bench_qubits":2716,"by_replay_bench_emitted_ops":42250936},"status":"crash","description":"Kaliski bulk-prefix threshold 377 fails altseed phase guard","timestamp":1777412450972,"segment":3,"confidence":30.129360465116278,"iterationTokens":1230,"asi":{"hypothesis":"Bulk-prefix 377 might squeeze a little more Toffoli out while staying below the 380 main-seed phase cliff.","result":"KAL_BULK3_ITERS=377 failed during altseed diagnostics: classical_total=0, phase_batches=1, ancilla=0. The phase guard panicked before the main benchmark.","rollback_reason":"Env-only threshold experiment failed phase-clean contract.","structural_learning":"The cliff is extremely sharp: 375 passes, 377 fails altseed phase. This makes 375 the highest robust value found so far; 376 might be possible but has little value vs risk.","next_action_hint":"Set default BULK_PREFIX_SAFE_ITERS to 375, not 377. Optionally test 376 later, but 375 has a safety margin of two iterations from a known failing value."}}
{"run":254,"commit":"036ccaa","metric":4111918,"metrics":{"altseed_classical_total":0,"altseed_phase_batches_total":0,"altseed_ancilla_batches_total":0,"avg_clifford":24423006.99,"qubits":2716,"emitted_ops":30748978,"correctness_ok":1,"by_tests_passed":76,"inverse_negr_ccx":1145760,"two_fast_replay_projected":2637286,"by_replay_bench_avg_toffoli":5278510,"by_replay_bench_qubits":2716,"by_replay_bench_emitted_ops":42250936},"status":"keep","description":"Set default Kaliski bulk-prefix safe threshold to 375","timestamp":1777412531121,"segment":3,"confidence":30.129360465116278,"iterationTokens":1180,"asi":{"hypothesis":"The env-probed bulk-prefix threshold 375 is phase-clean and should be made the default to capture the real benchmark-path saving while keeping a two-iteration margin from the known 377 phase failure.","result":"Changed BULK_PREFIX_SAFE_ITERS from 313 to 375. Default autoresearch and checks pass: avg_toffoli=4,111,918, avg_clifford=24,423,006.990, qubits=2,716, emitted_ops=30,748,978, correctness_ok=1, altseed failures all zero. Known failing values: 377 fails altseed phase, 380/390 fail main phase. Net default improvement vs prior 4,132,750 is 20,832 Toffoli.","structural_learning":"The Kaliski bulk-prefix proof guard was overly conservative. Extending it to the empirically phase-clean cliff gives a small but real exact improvement. Phase behavior is brittle near the cliff, so 375 is chosen instead of attempting 376/377.","caveat":"This is not SOTA-scale and should not distract from BY/DIV. It is folded in because it is exact, clean, and free once discovered.","next_action_hint":"Continue with SOTA path: remove persistent A history/window-local decoder and synthesize a 16-step self-cleaning BY denominator window. Keep default exact path at 4.1119M while structural replacement work proceeds."}}
{"run":255,"commit":"a96bdf1","metric":4111918,"metrics":{"altseed_classical_total":0,"altseed_phase_batches_total":0,"altseed_ancilla_batches_total":0,"avg_clifford":24423006.99,"qubits":2716,"emitted_ops":30748978,"correctness_ok":1,"by_tests_passed":76,"inverse_negr_ccx":1145760,"two_fast_replay_projected":2637286,"by_replay_bench_avg_toffoli":5278510,"by_replay_bench_qubits":2716,"by_replay_bench_emitted_ops":42250936},"status":"keep","description":"Document updated 4.1119M exact baseline and BY decoder state","timestamp":1777412654816,"segment":3,"confidence":20.598542563762834,"iterationTokens":3192,"asi":{"hypothesis":"After raising the default bulk-prefix threshold and integrating the clean BY pattern decoder, the planning docs should reflect the new exact baseline and decoder costs so future work uses the right margins.","result":"Updated structural_sota_plan_2026_04_28.md and autoresearch.ideas.md: default exact baseline is now 4,111,918 Toffoli @2716q; bulk prefix 375 is documented as phase-clean while 377/380/390 fail; BY pattern decoder costs are updated to 1,776 CCX/window forward, 62,160 CCX for 35 windows, and full clean 560-step pattern-decoder tagged-DIV scaffold is 1,270,080 CCX / 2,415q. Autoresearch/checks pass unchanged at 4,111,918 Toffoli.","structural_learning":"The true remaining low-qubit gap is now ~1.41M Toffoli. The clean raw-pattern replay with all A history is close enough to the 2.7M projection to make A scheduling and denominator generation the decisive blockers, not the decoder itself.","caveat":"Documentation update only; no new circuit improvement beyond the already-committed bulk-prefix default and decoder scaffold.","next_action_hint":"Proceed to a window-local A schedule or a 16-step self-cleaning denominator window; do not spend further time on Kaliski threshold tuning."}}
{"run":256,"commit":"cb988dd","metric":4111918,"metrics":{"altseed_classical_total":0,"altseed_phase_batches_total":0,"altseed_ancilla_batches_total":0,"avg_clifford":24423006.99,"qubits":2716,"emitted_ops":30748978,"correctness_ok":1,"by_tests_passed":77,"inverse_negr_ccx":1145760,"two_fast_replay_projected":2637286,"by_replay_bench_avg_toffoli":5278510,"by_replay_bench_qubits":2716,"by_replay_bench_emitted_ops":42250936},"status":"keep","description":"Invalidate window-local A clearing with current MBU scaled-BY microsteps","timestamp":1777417110548,"segment":3,"confidence":15.648465022647207,"iterationTokens":6297,"asi":{"hypothesis":"A lower-scratch BY replay could decode one 16-step A window, use it immediately, clear it, and move to the next window, keeping only 16 A controls plus boundary deltas instead of all 560 A bits.","result":"Added window_local_a_clear_fails_phase_with_mbu_microsteps. It uses raw patterns plus 350 boundary-delta bits, 10-bit delta work, and 16 A scratch bits. Classical tagged-DIV output and quotient are correct, A/delta scratch cleans, and peak drops to 2,221q, but phase is nonzero (phase=1). Cost is same roundtrip decoder+replay 1,270,080 CCX. Full BY tests pass with this as an expected invalidation: 77 tests. Default autoresearch/checks pass at 4,111,918 Toffoli / 2716q.","structural_learning":"Current scaled-BY microsteps use measurement-based modular arithmetic whose phase corrections can depend on A controls beyond the local window. Clearing A controls before the full replay completes is not phase-safe. Therefore the all-A-history clean scaffold is not just lazy scheduling; with current MBU microsteps, controls must remain live until phase corrections are resolved, or the modular primitives must be made exact/phase-safe for early control clearing.","caveat":"This invalidates a low-scratch schedule, not the BY replay itself. A window-local schedule may still work if cmod_add/halve are replaced by exact reversible or explicitly phase-fixed primitives, but that may cost Toffoli.","next_action_hint":"Do not clear A early with current MBU modular primitives. Next either keep A live in the first integrated replacement, or prototype an exact/phase-safe scaled microstep for one window and measure the Toffoli tax of early A clearing."}}
{"run":257,"commit":"b4b72d3","metric":4111918,"metrics":{"altseed_classical_total":0,"altseed_phase_batches_total":0,"altseed_ancilla_batches_total":0,"avg_clifford":24423006.99,"qubits":2716,"emitted_ops":30748978,"correctness_ok":1,"by_tests_passed":78,"inverse_negr_ccx":1145760,"two_fast_replay_projected":2637286,"by_replay_bench_avg_toffoli":5278510,"by_replay_bench_qubits":2716,"by_replay_bench_emitted_ops":42250936},"status":"keep","description":"Quantify exact scaled-BY microstep tax for phase-safe early A clearing","timestamp":1777417268721,"segment":3,"confidence":14.877272727272727,"iterationTokens":10217,"asi":{"hypothesis":"Window-local A clearing fails phase with measurement-based modular microsteps. The obvious fix is exact reversible modular arithmetic in the scaled-BY microstep; quantify whether that preserves SOTA economics.","result":"Added exact_scaled_microstep_is_phase_safe_but_too_expensive_for_window_local_clear. The exact microstep uses exact controlled modular negation/add and exact modular halve. Cost is 4,350 CCX versus 2,046 for the fast MBU microstep; a 560-step exact replay would be ≈2,436,000 CCX. Full BY tests pass: 78 tests. Default autoresearch/checks pass at 4,111,918 Toffoli / 2716q.","structural_learning":"Wholesale exact modular arithmetic would make early A-control clearing phase-safe, but destroys the scaled-BY replay's SOTA Toffoli shape. The viable options are now narrower: keep A controls live until the end, or invent a surgical phase-fix/phase-safe average primitive that preserves most of the MBU savings.","caveat":"The test quantifies cost but does not simulate full exact window-local replay. It is enough to rule out exact 560-step replay economically unless paired with a much cheaper branch generator or other deletion.","next_action_hint":"Pursue a fused controlled modular average or a phase-fix for cmod_add+halve that supports early A clearing without reverting to exact modular add/halve. Otherwise keep all A live for first integrated BY replacement."}}
