{"run":283,"commit":"852dd85","metric":8806225,"metrics":{"altseed_classical_total":0,"altseed_phase_batches_total":0,"altseed_ancilla_batches_total":0,"avg_clifford":42942480.53,"qubits":5589,"emitted_ops":55195212,"correctness_ok":1,"by_tests_passed":109,"inverse_negr_ccx":1145760,"two_fast_replay_projected":2637286,"by_replay_bench_avg_toffoli":5278510,"by_replay_bench_qubits":2716,"by_replay_bench_emitted_ops":42250936,"centered_body_bench_avg_toffoli":4985518,"centered_body_bench_qubits":2716,"centered_body_bench_emitted_ops":38874541,"centered_body_replay_ccx":873600,"centered_inverse_replay_ccx":873600,"centered_budget_if_folded":2640622,"centered_phase96_fast_mbu_ccx":299616,"centered_phase96_exact_signed_ccx":399264,"centered_phase96_exact_parity_ccx":448800,"centered_phase96_all_exact_ccx":548448,"centered_clean_all_exact_roundtrip_ccx":3199280,"centered_clean_all_exact_peak":2464,"centered_exact_parity_fast_signed_roundtrip_ccx":2618000,"centered_negpatch_phase_saw0":1,"centered_negpatch_phase_saw1":1,"centered_clean_roundtrip_bench_avg_toffoli":7311738,"centered_clean_roundtrip_bench_avg_clifford":32532302.269,"centered_clean_roundtrip_bench_qubits":2976,"centered_clean_roundtrip_bench_emitted_ops":42092380,"centered_clean_roundtrip_bench_altseed_phase":0,"centered_fixed_trace_hook_phase":0,"centered_fast_clean_roundtrip_bench_avg_toffoli":5860218,"centered_fast_clean_roundtrip_bench_avg_clifford":38190533.993,"centered_fast_clean_roundtrip_bench_qubits":3235,"centered_fast_clean_roundtrip_bench_emitted_ops":47024860,"centered_fast_clean_roundtrip_bench_altseed_phase":0,"centered_fast_clean_increment_toffoli":1747760,"centered_denom_controls_bench_avg_toffoli":7868378,"centered_denom_controls_bench_avg_clifford":44313822.825,"centered_denom_controls_bench_qubits":4964,"centered_denom_controls_bench_emitted_ops":55824052,"centered_denom_controls_bench_altseed_phase":0,"centered_live_num_bench_avg_toffoli":7870438,"centered_live_num_bench_avg_clifford":44320460.712,"centered_live_num_bench_qubits":4965,"centered_live_num_bench_emitted_ops":55834807,"centered_live_num_bench_altseed_phase":0,"centered_pair1_replace_avg_toffoli":8172700,"centered_pair1_replace_avg_clifford":40780745.214,"centered_pair1_replace_qubits":5589,"centered_pair1_replace_emitted_ops":51801485,"centered_pair1_replace_altseed_phase":0,"centered_pair1_replace_altseed_classical":0,"centered_pair2_replace_avg_toffoli":8189908,"centered_pair2_replace_avg_clifford":40876699.034,"centered_pair2_replace_qubits":5589,"centered_pair2_replace_emitted_ops":51930771,"centered_pair2_replace_altseed_phase":0,"centered_pair2_replace_altseed_classical":0,"centered_pair12_replace_avg_toffoli":12251174,"centered_pair12_replace_qubits":5589,"centered_pair12_replace_emitted_ops":72970707,"centered_pair1_fast_accum_avg_toffoli":8171417,"centered_pair1_fast_accum_qubits":5589,"centered_pair1_fast_accum_emitted_ops":51826551,"centered_pair2_fast_accum_avg_toffoli":8187601,"centered_pair2_fast_accum_qubits":5589,"centered_pair2_fast_accum_emitted_ops":51944268,"centered_pair12_fast_accum_avg_toffoli":12246560,"centered_pair12_fast_accum_qubits":5589,"centered_pair12_fast_accum_emitted_ops":72997701,"signed_copy_fast_phase_batches":1,"centered_pair1_window_denom_avg_toffoli":8790041,"centered_pair1_window_denom_qubits":5589,"centered_pair1_window_denom_emitted_ops":55077495,"centered_pair2_window_denom_avg_toffoli":8806225,"centered_pair2_window_denom_qubits":5589,"centered_pair2_window_denom_emitted_ops":55195212},"status":"keep","description":"Validate lowword-window BY denominator controls on pair2 replacement","timestamp":1777437591217,"segment":3,"confidence":5.970334101382488,"iterationTokens":6493,"asi":{"hypothesis":"The same 16-step lowword-window control source should work for pair2 quotient cleanup because pair2 also only needs the denominator control trace plus final sign(f).","result":"BY_CENTERED_PAIR2_REPLACE=1 BY_CENTERED_WINDOW_DENOM_REPLACE=1 passes: avg_toffoli=8,806,225, avg_clifford=42,942,480.530, qubits=5,589, emitted_ops=55,195,212, all altseed/classical/phase/ancilla zero.","structural_learning":"The lowword-window source is not pair1-specific; it works in both real BY replacement sites. It confirms the first windowed denominator selection interface can be shared by pair1 and pair2.","caveat":"Still worse than direct full-width generation because the full-width denominator is updated by 576 selected microsteps and the lowword oracle is extra overhead.","next_action_hint":"Wire the q-correction/fixed-matrix window update next so the selected window actually replaces the 16 full-width microsteps per window."}}
{"run":284,"commit":"55f20c8","metric":13483808,"metrics":{"altseed_classical_total":0,"altseed_phase_batches_total":0,"altseed_ancilla_batches_total":0,"avg_clifford":61380623.905,"qubits":5589,"emitted_ops":79499589,"correctness_ok":1,"by_tests_passed":109,"inverse_negr_ccx":1145760,"two_fast_replay_projected":2637286,"by_replay_bench_avg_toffoli":5278510,"by_replay_bench_qubits":2716,"by_replay_bench_emitted_ops":42250936,"centered_body_bench_avg_toffoli":4985518,"centered_body_bench_qubits":2716,"centered_body_bench_emitted_ops":38874541,"centered_body_replay_ccx":873600,"centered_inverse_replay_ccx":873600,"centered_budget_if_folded":2640622,"centered_phase96_fast_mbu_ccx":299616,"centered_phase96_exact_signed_ccx":399264,"centered_phase96_exact_parity_ccx":448800,"centered_phase96_all_exact_ccx":548448,"centered_clean_all_exact_roundtrip_ccx":3199280,"centered_clean_all_exact_peak":2464,"centered_exact_parity_fast_signed_roundtrip_ccx":2618000,"centered_negpatch_phase_saw0":1,"centered_negpatch_phase_saw1":1,"centered_clean_roundtrip_bench_avg_toffoli":7311738,"centered_clean_roundtrip_bench_avg_clifford":32532302.269,"centered_clean_roundtrip_bench_qubits":2976,"centered_clean_roundtrip_bench_emitted_ops":42092380,"centered_clean_roundtrip_bench_altseed_phase":0,"centered_fixed_trace_hook_phase":0,"centered_fast_clean_roundtrip_bench_avg_toffoli":5860218,"centered_fast_clean_roundtrip_bench_avg_clifford":38190533.993,"centered_fast_clean_roundtrip_bench_qubits":3235,"centered_fast_clean_roundtrip_bench_emitted_ops":47024860,"centered_fast_clean_roundtrip_bench_altseed_phase":0,"centered_fast_clean_increment_toffoli":1747760,"centered_denom_controls_bench_avg_toffoli":7868378,"centered_denom_controls_bench_avg_clifford":44313822.825,"centered_denom_controls_bench_qubits":4964,"centered_denom_controls_bench_emitted_ops":55824052,"centered_denom_controls_bench_altseed_phase":0,"centered_live_num_bench_avg_toffoli":7870438,"centered_live_num_bench_avg_clifford":44320460.712,"centered_live_num_bench_qubits":4965,"centered_live_num_bench_emitted_ops":55834807,"centered_live_num_bench_altseed_phase":0,"centered_pair1_replace_avg_toffoli":8172700,"centered_pair1_replace_avg_clifford":40780745.214,"centered_pair1_replace_qubits":5589,"centered_pair1_replace_emitted_ops":51801485,"centered_pair1_replace_altseed_phase":0,"centered_pair1_replace_altseed_classical":0,"centered_pair2_replace_avg_toffoli":8189908,"centered_pair2_replace_avg_clifford":40876699.034,"centered_pair2_replace_qubits":5589,"centered_pair2_replace_emitted_ops":51930771,"centered_pair2_replace_altseed_phase":0,"centered_pair2_replace_altseed_classical":0,"centered_pair12_replace_avg_toffoli":12251174,"centered_pair12_replace_qubits":5589,"centered_pair12_replace_emitted_ops":72970707,"centered_pair1_fast_accum_avg_toffoli":8171417,"centered_pair1_fast_accum_qubits":5589,"centered_pair1_fast_accum_emitted_ops":51826551,"centered_pair2_fast_accum_avg_toffoli":8187601,"centered_pair2_fast_accum_qubits":5589,"centered_pair2_fast_accum_emitted_ops":51944268,"centered_pair12_fast_accum_avg_toffoli":12246560,"centered_pair12_fast_accum_qubits":5589,"centered_pair12_fast_accum_emitted_ops":72997701,"signed_copy_fast_phase_batches":1,"centered_pair1_window_denom_avg_toffoli":8790041,"centered_pair1_window_denom_qubits":5589,"centered_pair1_window_denom_emitted_ops":55077495,"centered_pair2_window_denom_avg_toffoli":8806225,"centered_pair2_window_denom_qubits":5589,"centered_pair2_window_denom_emitted_ops":55195212,"centered_pair12_window_denom_avg_toffoli":13483808,"centered_pair12_window_denom_qubits":5589,"centered_pair12_window_denom_emitted_ops":79499589},"status":"keep","description":"Validate shared lowword-window controls with both BY replacements enabled","timestamp":1777437697357,"segment":3,"confidence":5.970334101382488,"iterationTokens":3537,"asi":{"hypothesis":"The lowword-window denominator control source should be reusable when both pair1 and pair2 BY replacements are active in the same point-add circuit.","result":"BY_CENTERED_PAIR1_REPLACE=1 BY_CENTERED_PAIR2_REPLACE=1 BY_CENTERED_WINDOW_DENOM_REPLACE=1 passes: avg_toffoli=13,483,808, avg_clifford=61,380,623.905, qubits=5,589, emitted_ops=79,499,589, all altseed/classical/phase/ancilla zero.","structural_learning":"Both quotient-producing BY replacement sites can now source denominator controls from 16-step lowword windows. This wires the selected/window interface through the full affine path and confirms the interface composes across both replacements.","caveat":"Cost is intentionally worse; this validates the interface, not performance. Full-width selected-control microsteps must be replaced by fixed-matrix/q updates.","next_action_hint":"Use the q outputs from the lowword window oracle to apply the 16-step scaled matrix to high f/g in one window operation, then reverse; that is the next SOTA-relevant deletion."}}
{"run":285,"commit":"1c2f4cf","metric":4111918,"metrics":{"altseed_classical_total":0,"altseed_phase_batches_total":0,"altseed_ancilla_batches_total":0,"avg_clifford":24423006.99,"qubits":2716,"emitted_ops":30748978,"correctness_ok":1,"by_tests_passed":109,"inverse_negr_ccx":1145760,"two_fast_replay_projected":2637286,"by_replay_bench_avg_toffoli":5278510,"by_replay_bench_qubits":2716,"by_replay_bench_emitted_ops":42250936,"centered_body_bench_avg_toffoli":4985518,"centered_body_bench_qubits":2716,"centered_body_bench_emitted_ops":38874541,"centered_body_replay_ccx":873600,"centered_inverse_replay_ccx":873600,"centered_budget_if_folded":2640622,"centered_phase96_fast_mbu_ccx":299616,"centered_phase96_exact_signed_ccx":399264,"centered_phase96_exact_parity_ccx":448800,"centered_phase96_all_exact_ccx":548448,"centered_clean_all_exact_roundtrip_ccx":3199280,"centered_clean_all_exact_peak":2464,"centered_exact_parity_fast_signed_roundtrip_ccx":2618000,"centered_negpatch_phase_saw0":1,"centered_negpatch_phase_saw1":1,"centered_clean_roundtrip_bench_avg_toffoli":7311738,"centered_clean_roundtrip_bench_avg_clifford":32532302.269,"centered_clean_roundtrip_bench_qubits":2976,"centered_clean_roundtrip_bench_emitted_ops":42092380,"centered_clean_roundtrip_bench_altseed_phase":0,"centered_fixed_trace_hook_phase":0,"centered_fast_clean_roundtrip_bench_avg_toffoli":5860218,"centered_fast_clean_roundtrip_bench_avg_clifford":38190533.993,"centered_fast_clean_roundtrip_bench_qubits":3235,"centered_fast_clean_roundtrip_bench_emitted_ops":47024860,"centered_fast_clean_roundtrip_bench_altseed_phase":0,"centered_fast_clean_increment_toffoli":1747760,"centered_denom_controls_bench_avg_toffoli":7868378,"centered_denom_controls_bench_avg_clifford":44313822.825,"centered_denom_controls_bench_qubits":4964,"centered_denom_controls_bench_emitted_ops":55824052,"centered_denom_controls_bench_altseed_phase":0,"centered_live_num_bench_avg_toffoli":7870438,"centered_live_num_bench_avg_clifford":44320460.712,"centered_live_num_bench_qubits":4965,"centered_live_num_bench_emitted_ops":55834807,"centered_live_num_bench_altseed_phase":0,"centered_pair1_replace_avg_toffoli":8172700,"centered_pair1_replace_avg_clifford":40780745.214,"centered_pair1_replace_qubits":5589,"centered_pair1_replace_emitted_ops":51801485,"centered_pair1_replace_altseed_phase":0,"centered_pair1_replace_altseed_classical":0,"centered_pair2_replace_avg_toffoli":8189908,"centered_pair2_replace_avg_clifford":40876699.034,"centered_pair2_replace_qubits":5589,"centered_pair2_replace_emitted_ops":51930771,"centered_pair2_replace_altseed_phase":0,"centered_pair2_replace_altseed_classical":0,"centered_pair12_replace_avg_toffoli":12251174,"centered_pair12_replace_qubits":5589,"centered_pair12_replace_emitted_ops":72970707,"centered_pair1_fast_accum_avg_toffoli":8171417,"centered_pair1_fast_accum_qubits":5589,"centered_pair1_fast_accum_emitted_ops":51826551,"centered_pair2_fast_accum_avg_toffoli":8187601,"centered_pair2_fast_accum_qubits":5589,"centered_pair2_fast_accum_emitted_ops":51944268,"centered_pair12_fast_accum_avg_toffoli":12246560,"centered_pair12_fast_accum_qubits":5589,"centered_pair12_fast_accum_emitted_ops":72997701,"signed_copy_fast_phase_batches":1,"centered_pair1_window_denom_avg_toffoli":8790041,"centered_pair1_window_denom_qubits":5589,"centered_pair1_window_denom_emitted_ops":55077495,"centered_pair2_window_denom_avg_toffoli":8806225,"centered_pair2_window_denom_qubits":5589,"centered_pair2_window_denom_emitted_ops":55195212,"centered_pair12_window_denom_avg_toffoli":13483808,"centered_pair12_window_denom_qubits":5589,"centered_pair12_window_denom_emitted_ops":79499589},"status":"keep","description":"Document window-control BY integration and verify default exact path unchanged","timestamp":1777437808464,"segment":3,"confidence":5.970334101382488,"iterationTokens":15637,"asi":{"hypothesis":"The lowword-window control integration is fully env-gated, so the default exact benchmark should remain unchanged while docs record the integration milestone.","result":"Default exact path after adding BY_CENTERED_WINDOW_DENOM_REPLACE remains clean: avg_toffoli=4,111,918, avg_clifford=24,423,006.990, qubits=2,716, emitted_ops=30,748,978, all altseed/classical/phase/ancilla zero. Updated structural notes and ideas with the pair1/pair2/both window-control metrics.","structural_learning":"Window-control code is isolated behind BY_CENTERED_WINDOW_DENOM_REPLACE and only changes centered BY replacement paths. Default Kaliski path remains untouched.","next_action_hint":"Implement q-correction/fixed-matrix window update in the new by_generate/by_reverse window hooks, replacing by_signed_branch_apply_step_for_bench loops."}}
{"run":286,"commit":"2e592d4","metric":8790041,"metrics":{"altseed_classical_total":0,"altseed_phase_batches_total":0,"altseed_ancilla_batches_total":0,"avg_clifford":42863377.998,"qubits":8037,"emitted_ops":55084839,"correctness_ok":1,"by_tests_passed":109,"inverse_negr_ccx":1145760,"two_fast_replay_projected":2637286,"by_replay_bench_avg_toffoli":5278510,"by_replay_bench_qubits":2716,"by_replay_bench_emitted_ops":42250936,"centered_body_bench_avg_toffoli":4985518,"centered_body_bench_qubits":2716,"centered_body_bench_emitted_ops":38874541,"centered_body_replay_ccx":873600,"centered_inverse_replay_ccx":873600,"centered_budget_if_folded":2640622,"centered_phase96_fast_mbu_ccx":299616,"centered_phase96_exact_signed_ccx":399264,"centered_phase96_exact_parity_ccx":448800,"centered_phase96_all_exact_ccx":548448,"centered_clean_all_exact_roundtrip_ccx":3199280,"centered_clean_all_exact_peak":2464,"centered_exact_parity_fast_signed_roundtrip_ccx":2618000,"centered_negpatch_phase_saw0":1,"centered_negpatch_phase_saw1":1,"centered_clean_roundtrip_bench_avg_toffoli":7311738,"centered_clean_roundtrip_bench_avg_clifford":32532302.269,"centered_clean_roundtrip_bench_qubits":2976,"centered_clean_roundtrip_bench_emitted_ops":42092380,"centered_clean_roundtrip_bench_altseed_phase":0,"centered_fixed_trace_hook_phase":0,"centered_fast_clean_roundtrip_bench_avg_toffoli":5860218,"centered_fast_clean_roundtrip_bench_avg_clifford":38190533.993,"centered_fast_clean_roundtrip_bench_qubits":3235,"centered_fast_clean_roundtrip_bench_emitted_ops":47024860,"centered_fast_clean_roundtrip_bench_altseed_phase":0,"centered_fast_clean_increment_toffoli":1747760,"centered_denom_controls_bench_avg_toffoli":7868378,"centered_denom_controls_bench_avg_clifford":44313822.825,"centered_denom_controls_bench_qubits":4964,"centered_denom_controls_bench_emitted_ops":55824052,"centered_denom_controls_bench_altseed_phase":0,"centered_live_num_bench_avg_toffoli":7870438,"centered_live_num_bench_avg_clifford":44320460.712,"centered_live_num_bench_qubits":4965,"centered_live_num_bench_emitted_ops":55834807,"centered_live_num_bench_altseed_phase":0,"centered_pair1_replace_avg_toffoli":8172700,"centered_pair1_replace_avg_clifford":40780745.214,"centered_pair1_replace_qubits":5589,"centered_pair1_replace_emitted_ops":51801485,"centered_pair1_replace_altseed_phase":0,"centered_pair1_replace_altseed_classical":0,"centered_pair2_replace_avg_toffoli":8189908,"centered_pair2_replace_avg_clifford":40876699.034,"centered_pair2_replace_qubits":5589,"centered_pair2_replace_emitted_ops":51930771,"centered_pair2_replace_altseed_phase":0,"centered_pair2_replace_altseed_classical":0,"centered_pair12_replace_avg_toffoli":12251174,"centered_pair12_replace_qubits":5589,"centered_pair12_replace_emitted_ops":72970707,"centered_pair1_fast_accum_avg_toffoli":8171417,"centered_pair1_fast_accum_qubits":5589,"centered_pair1_fast_accum_emitted_ops":51826551,"centered_pair2_fast_accum_avg_toffoli":8187601,"centered_pair2_fast_accum_qubits":5589,"centered_pair2_fast_accum_emitted_ops":51944268,"centered_pair12_fast_accum_avg_toffoli":12246560,"centered_pair12_fast_accum_qubits":5589,"centered_pair12_fast_accum_emitted_ops":72997701,"signed_copy_fast_phase_batches":1,"centered_pair1_window_denom_avg_toffoli":8790041,"centered_pair1_window_denom_qubits":5589,"centered_pair1_window_denom_emitted_ops":55077495,"centered_pair2_window_denom_avg_toffoli":8806225,"centered_pair2_window_denom_qubits":5589,"centered_pair2_window_denom_emitted_ops":55195212,"centered_pair12_window_denom_avg_toffoli":13483808,"centered_pair12_window_denom_qubits":5589,"centered_pair12_window_denom_emitted_ops":79499589,"centered_pair1_window_q_payload_avg_toffoli":8790041,"centered_pair1_window_q_payload_qubits":8037,"centered_pair1_window_q_payload_emitted_ops":55084839},"status":"keep","description":"Thread lowword q-correction payload through pair1 BY window denominator path","timestamp":1777438564321,"segment":3,"confidence":5.970334101382488,"iterationTokens":19601,"asi":{"hypothesis":"The lowword window oracle should be extended to persist the q0/q1 correction payload across the real pair1 BY replacement, then clear it by rerunning the same oracle in reverse; this wires the data needed for the next fixed-matrix window update.","result":"Added BY_CENTERED_WINDOW_Q_DENOM_REPLACE=1. It implies the lowword window control path and additionally xors the 34-bit signed q0/q1 rows from each 16-step local simulator into persistent per-window q histories. The histories live across the centered replay/copy stage and are xored clean during denominator reverse. Pair1 q-payload path passes: avg_toffoli=8,790,041, avg_clifford=42,863,377.998, qubits=8,037, emitted_ops=55,084,839, all altseed/classical/phase/ancilla zero.","structural_learning":"The q-correction payload can be generated, stored through the real quotient-producing BY replacement, and cleaned reversibly using the same lowword oracle. Toffoli is unchanged vs window-controls because q copyout is CNOT-only; qubits rise by 2*36*34=2448, as expected for raw q histories.","caveat":"The q payload is not consumed yet. This is intentionally a raw-history wiring step toward replacing the 16 full-width selected microsteps by a fixed-matrix/q update.","next_action_hint":"Make the next flag consume q0/q1 inside each window to update full f/g by the scaled 16-step matrix, then delete by_signed_branch_apply_step_for_bench loops."}}
