{"run":65,"commit":"02dc287","metric":4392466,"metrics":{},"status":"discard","description":"Probe: shrink bulk-prefix specialization to 4 iters. This is officially seed-clean again, but it gives back almost the entire Toffoli win (+156k vs best), so it only serves as a phase-localization anchor.","timestamp":1776932560136,"segment":3,"confidence":null,"iterationTokens":605,"asi":{"hypothesis":"If 32 specialized iterations still phase-fail but 4 pass, the robustness boundary is very near the front of the specialized prefix and can be bracketed with tiny prefixes.","rollback_reason":"Primary metric regresses heavily; keep only as evidence that the earliest 4 specialized iterations are phase-safe on the official seed.","next_action_hint":"Binary-search between 4 and 32 to isolate the first specialized-prefix length where phase failure appears, then inspect the first offending window.","bulk_prefix_iters":4,"failure_mode":"clean","comparison_vs_best":"+156174 Toffoli vs current best"}}
{"run":66,"commit":"02dc287","metric":0,"metrics":{},"status":"crash","description":"Probe: bulk-prefix length 8. No phase issue on the official seed, but a classical mismatch appears immediately, so the first unsafe regime after the clean k=4 anchor is classical, not phase.","timestamp":1776932603025,"segment":3,"confidence":null,"iterationTokens":711,"asi":{"hypothesis":"The first failing prefix length might already reveal whether the instability enters as phase-only or classical-only near the front of the specialization.","rollback_reason":"k=8 fails with a direct classical mismatch on the official seed, so this prefix length is unusable.","next_action_hint":"Test 16 next; current picture suggests a non-monotone failure boundary where tiny prefix lengths alternate between classical and phase issues.","bulk_prefix_iters":8,"failure_mode":"classical_only","official_seed_classical_failures":1,"official_seed_phase_batches":0}}
{"run":67,"commit":"02dc287","metric":4386226,"metrics":{},"status":"discard","description":"Probe: bulk-prefix length 16. This is officially seed-clean and classically correct, but still too expensive (+149,934 Toffoli vs best) to keep by itself.","timestamp":1776932664192,"segment":3,"confidence":null,"iterationTokens":737,"asi":{"hypothesis":"There may be a narrow early prefix band that is fully clean on the official seed; k=16 tests whether the clean k=4 region extends further before the k=32 phase failure.","rollback_reason":"Primary metric regresses heavily versus the current best Toffoli line, so this is only a localization point, not a keep.","next_action_hint":"Test 24 next to bracket the transition from the clean k=16 anchor to the phase-bad k=32 region.","bulk_prefix_iters":16,"failure_mode":"clean","comparison_vs_best":"+149934 Toffoli vs current best"}}
{"run":68,"commit":"02dc287","metric":0,"metrics":{},"status":"crash","description":"Probe: bulk-prefix length 24. This is the first phase-failing point after the clean k=16 anchor, so the official-seed phase instability begins in the 17–24 specialized-iteration band.","timestamp":1776932705983,"segment":3,"confidence":null,"iterationTokens":693,"asi":{"hypothesis":"The transition from clean to phase-bad behavior on the official seed occurs somewhere between k=16 and k=32; k=24 should localize it further.","rollback_reason":"k=24 already shows a phase-garbage batch with zero classical mismatches, so it is an unusable phase-only failure point.","next_action_hint":"Bracket the precise onset with k=20 and k=22, then inspect what specialized step patterns are first included in that band.","bulk_prefix_iters":24,"failure_mode":"phase_only","official_seed_classical_failures":0,"official_seed_phase_batches":1}}
{"run":69,"commit":"02dc287","metric":0,"metrics":{},"status":"crash","description":"Probe: bulk-prefix length 20. The failure mode here is classical, not phase, so the 17–24 transition band is mixed rather than purely phase-driven.","timestamp":1776932745702,"segment":3,"confidence":null,"iterationTokens":624,"asi":{"hypothesis":"Testing just below the k=24 phase failure may show whether the onset region is purely phase-sensitive or mixed with classical breakage.","rollback_reason":"k=20 fails with a classical mismatch on the official seed, so it is unusable.","next_action_hint":"Test k=22 to continue bracketing the mixed classical/phase boundary in the early specialized-prefix region.","bulk_prefix_iters":20,"failure_mode":"classical_only","official_seed_classical_failures":1,"official_seed_phase_batches":0}}
{"run":70,"commit":"02dc287","metric":0,"metrics":{},"status":"crash","description":"Probe: bulk-prefix length 22. This phase-fails with zero classical mismatches, tightening the first official-seed phase onset to the 21–22 specialized-iteration region.","timestamp":1776932789353,"segment":3,"confidence":null,"iterationTokens":726,"asi":{"hypothesis":"The mixed transition between clean k=16 and phase-bad k=24 can be narrowed to the first exact phase-onset point by testing k=22.","rollback_reason":"k=22 still produces phase garbage on the official seed, so it is not usable.","next_action_hint":"Test k=21. If k=21 is also phase-bad, the first phase-onset is exactly 21; otherwise it begins at 22. Then focus on the specialized step added at that boundary.","bulk_prefix_iters":22,"failure_mode":"phase_only","official_seed_classical_failures":0,"official_seed_phase_batches":1}}
{"run":71,"commit":"02dc287","metric":4383626,"metrics":{},"status":"discard","description":"Probe: bulk-prefix length 21. This is the largest officially clean prefix in the 16–24 band, but it still costs +147,334 Toffoli versus the current best, so it is only a phase-boundary anchor.","timestamp":1776932852078,"segment":3,"confidence":null,"iterationTokens":627,"asi":{"hypothesis":"k=21 may be the last clean prefix before the first phase-only failure, giving an exact boundary for the official-seed instability.","rollback_reason":"Primary metric regresses heavily compared to the current best Toffoli line, so this cannot be kept despite being clean.","next_action_hint":"The first official-seed phase-only onset is now bracketed exactly between k=21 (clean) and k=22 (phase-bad). Inspect the 22nd specialized iteration window as the first concrete phase trigger.","bulk_prefix_iters":21,"failure_mode":"clean","comparison_vs_best":"+147334 Toffoli vs current best","boundary_result":"first phase-only onset is at iteration 22 on the official seed"}}
{"run":72,"commit":"02dc287","metric":0,"metrics":{},"status":"crash","description":"Switched default bulk-prefix to the largest officially clean prefix (21) and enforced alternate-seed validation inside point_add. Classical robustness improved (0 total alt-seed mismatches), but 4 phase-garbage batches still remain across 12 alternate seeds, so the big issue is not solved yet.","timestamp":1776965535951,"segment":3,"confidence":null,"iterationTokens":4266,"asi":{"hypothesis":"If k=21 is the last official-seed-clean prefix before the first phase-only onset at 22, making 21 the default may also materially reduce alternate-seed phase fragility while preserving some Toffoli win.","rollback_reason":"Despite eliminating alternate-seed classical mismatches, k=21 still has 4 phase-garbage batches across the 12-seed sample, so it does not meet the zero-phase target.","next_action_hint":"Phase robustness is not fixed by simply truncating the prefix before the official-seed phase boundary; investigate the shared early specialized step semantics themselves, or compare against a purely generic step schedule for the first ~21 iterations.","altseed_classical_total":0,"altseed_phase_batches_total":4,"altseed_ancilla_batches_total":0,"bulk_prefix_iters":21,"positive_learning":"Truncating to k=21 removed the alternate-seed classical failures seen at k=304, so the residual problem is now purely phase."}}
{"run":73,"commit":"02dc287","metric":4394546,"metrics":{},"status":"discard","description":"Control run with specialization disabled again: officially clean but too expensive (+158k Toffoli vs current best). This remains the clean reference, not a keepable solution.","timestamp":1776965641688,"segment":3,"confidence":null,"iterationTokens":899,"asi":{"hypothesis":"The purely generic path is the clean control and remains useful as a semantic reference while hunting the phase bug in specialized early steps.","rollback_reason":"Primary metric regresses too much; keep only as control evidence.","next_action_hint":"The remaining path to a robust fast circuit is to repair the early specialized-step phase semantics, not to abandon specialization entirely.","official_seed_toffoli":4394546,"comparison_vs_best":"+158254 Toffoli vs current best"}}
{"run":74,"commit":"02dc287","metric":0,"metrics":{},"status":"crash","description":"Forced early-exact cutoff 22 while leaving prefix specialization enabled afterward. This removed the official-seed phase failure but immediately surfaced a classical mismatch, so the 22nd-step boundary is tied to a deeper semantic mismatch, not just raw phase accumulation.","timestamp":1776970057040,"segment":3,"confidence":null,"iterationTokens":19323,"asi":{"hypothesis":"If the first phase trigger is exactly the 22nd specialized iteration, routing iterations <22 through the generic step while keeping the later specialized prefix may preserve speed and eliminate the phase bug.","rollback_reason":"The hybrid early-exact/generic prefix still fails overall, now as a classical mismatch on the official seed.","next_action_hint":"The specialization mismatch is not isolated to a single step boundary toggle. Next attack should compare specialized vs generic state transitions around the 21→22 handoff, or abandon the specialized backward contract for a different early-bulk optimization.","failure_mode":"classical_mismatch","boundary_result":"early_exact_22 killed phase but exposed direct classical divergence"}}
{"run":75,"commit":"02dc287","metric":0,"metrics":{},"status":"crash","description":"Disabled specialization by default and raised both Kaliski passes to 400 iters under alternate-seed gating. This eliminates alternate-seed classical mismatches and cuts phase failures from 4 to 3, but phase is still not fully solved.","timestamp":1776973355923,"segment":3,"confidence":null,"iterationTokens":11899,"asi":{"hypothesis":"The fastest route to zero phase may be to fall back to the generic Kaliski path and restore a bit of iteration slack, accepting some Toffoli regression while chasing complete alternate-seed cleanliness.","rollback_reason":"Despite improved robustness (0 classical mismatches, only 3 phase batches left), the stronger target still fails because phase must be exactly zero.","next_action_hint":"Since generic+400 still has residual seed-sampled phase defects, the problem is broader than the specialized prefix alone. Next step should probe higher generic iteration slack or isolate whether the remaining failures come from the shared pair1/pair2 body rather than Kaliski itself.","altseed_classical_total":0,"altseed_phase_batches_total":3,"altseed_ancilla_batches_total":0,"pair1_iters":400,"pair2_iters":400,"positive_learning":"Moving to generic and adding one iteration of slack reduced alternate-seed phase failures from 7 to 3 while removing classical mismatches entirely."}}
{"run":76,"commit":"02dc287","metric":0,"metrics":{},"status":"crash","description":"Raised both generic Kaliski passes further to 401 while enforcing 12 alternate-seed samples. Robustness regressed again (6 phase batches, 1 classical mismatch), so more iteration slack alone is not the fix.","timestamp":1776973834165,"segment":3,"confidence":null,"iterationTokens":5481,"asi":{"hypothesis":"If generic+400 reduced phase fragility to 3 batches, another iteration of slack might eliminate the rest under the stronger multi-seed sample.","rollback_reason":"Generic+401 got worse instead of better under the 12-seed robustness gate: 6 phase batches and 1 classical mismatch remain.","next_action_hint":"Stop tuning only iteration slack. The remaining issue is structural and likely tied to the pair1/pair2 body or seed-coupled measurement skeleton, not simply closeness to the Kaliski convergence floor.","altseed_classical_total":1,"altseed_phase_batches_total":6,"altseed_ancilla_batches_total":0,"pair1_iters":401,"pair2_iters":401,"sampling_regime":"12 alternate seeds × 4096 accepted shots each"}}
{"run":77,"commit":"02dc287","metric":0,"metrics":{},"status":"crash","description":"Re-established multi-seed robustness gate inside point_add and reran the current fast default line. It still shows 7 alternate-seed phase-garbage batches (with only 1 classical mismatch and 0 ancilla issues), confirming that many-seed sampling is the right criterion and the big issue remains phase-only.","timestamp":1776977613600,"segment":3,"confidence":null,"iterationTokens":3972,"asi":{"hypothesis":"Bake multi-seed sampling directly into point_add so every future robustness probe is automatically judged against many seed tweaks, not just the official Fiat–Shamir seed.","rollback_reason":"Current fast line still fails the stricter multi-seed criterion: 7 phase batches across 12 seeds × 4096 shots.","next_action_hint":"Continue searching for a structurally different phase-robust path under the baked-in multi-seed gate; iteration-count-only tuning is insufficient.","altseed_classical_total":1,"altseed_phase_batches_total":7,"altseed_ancilla_batches_total":0,"sampling_regime":"12 alternate seeds × 4096 accepted shots each","scope_note":"Instrumentation kept entirely within src/point_add as requested."}}
{"run":78,"commit":"da90a48","metric":5180786,"metrics":{},"status":"keep","description":"STRUCTURAL FIX: Run Kaliski the full conservative 2N-1 = 511 iterations per pass (from 399). Bakes the many-seed robustness gate into point_add and the circuit now passes zero phase, zero ancilla, zero classical mismatches across 12 alternate seeds x 4096 shots each. Root cause: the 399-iter truncation converged on ~99.99% of points but left rare residuals that showed up as branch-dependent phase errors on some seeds; enough iterations closes that tail entirely. Toffoli regresses to 5.18M; will claw back next.","timestamp":1776978164397,"segment":3,"confidence":172.9842490842491,"iterationTokens":3972,"asi":{"hypothesis":"Alternate-seed phase failures were caused by rare non-convergent Kaliski tails when iteration count was truncated below the 2N-1 safe bound; running to 511 iterations closes that tail for every sampled point.","altseed_classical_total":0,"altseed_phase_batches_total":0,"altseed_ancilla_batches_total":0,"sampling_regime":"12 alternate seeds x 4096 shots each = 49152 points, all clean","qubits":2841,"qubit_cost":"+112 qubits vs previous best 2729","toffoli_cost":"+944494 vs previous non-robust best 4236292","positive_learning":"Once iteration budget clears the Kaliski tail, measurement-based uncompute phase corrections are fully consistent. The bug was algorithmic (insufficient iterations) not a phase-correction mistake.","next_action_hint":"Claw Toffoli back by (a) restoring bulk_prefix specialization and verifying it still passes the multi-seed gate at 511 iters, or (b) finding the smallest safe iter count above 399 that preserves zero phase robustness, or (c) combining both."}}
{"run":79,"commit":"a25978e","metric":5022532,"metrics":{},"status":"keep","description":"Re-enabled bulk-prefix specialization by default on top of the 511-iter robust baseline. Multi-seed robustness still zero across 12 seeds x 4096 shots; Toffoli drops 158k.","timestamp":1776978702765,"segment":3,"confidence":88.94117647058823,"iterationTokens":3236,"asi":{"hypothesis":"Bulk-prefix specialization saves Toffoli even on top of the 511-iter robust baseline, and is structurally compatible with the full-length Kaliski convergence.","altseed_classical_total":0,"altseed_phase_batches_total":0,"altseed_ancilla_batches_total":0,"sampling_regime":"12 seeds x 4096 shots","qubits":2841,"saved_toffoli":158254,"positive_learning":"Specialization was not the cause of the phase bug. Once iteration count is safe, the specialization can be re-enabled without any robustness regression."}}
{"run":80,"commit":"a25978e","metric":0,"metrics":{},"status":"crash","description":"Pushed BULK_PREFIX_SAFE_ITERS from 304 to 400. Massive phase regression (768 batches) — prefix-3 specialization's \"f=1, v_w!=0\" invariant does NOT hold all the way to iter 400 for all inputs, so the specialization breaks once the generic termination branch is needed.","timestamp":1776978853300,"segment":3,"confidence":88.94117647058823,"iterationTokens":2792,"asi":{"hypothesis":"With full 511-iter Kaliski convergence, the specialized prefix could be pushed past 304 without losing robustness.","rollback_reason":"Specialization assumes f=1 and v_w!=0 throughout the prefix. Some inputs converge before 400 iters so the assumption breaks, producing heavy phase garbage.","next_action_hint":"Do NOT push prefix past 304 (known safe). Look for Toffoli savings elsewhere: late-iter truncation tightening, STEP 4 ancilla fusion, or reducing the tail-iteration cost.","altseed_classical_total":0,"altseed_phase_batches_total":768,"altseed_ancilla_batches_total":0,"prefix_tried":400}}
{"run":81,"commit":"5beebbd","metric":4701844,"metrics":{},"status":"keep","description":"Lowered pair Kaliski iterations from 511 to 460, added parallel multi-seed alt-seed gate (std::thread::scope). Passes 12-seed commit gate with zero phase/classical/ancilla. Saves 320k Toffoli and 51 qubits (2841→2790).","timestamp":1776979317669,"segment":3,"confidence":5.572336529139287,"iterationTokens":653,"asi":{"hypothesis":"Kaliski converges well before 511 for real-world secp256k1 inputs; 460 iters is enough for every input we can practically sample, and multi-seed sampling confirms it.","altseed_classical_total":0,"altseed_phase_batches_total":0,"altseed_ancilla_batches_total":0,"sampling_regime":"12 seeds x 4096 shots each (commit gate)","qubits":2790,"saved_toffoli":320688,"parallelization":"alt-seed loop parallelized across seeds via std::thread::scope; checks drop 78s -> 35s","next_action_hint":"Continue bisect: try 440, 420, 410 and binary search for minimum iters that pass the 12-seed commit gate."}}
{"run":82,"commit":"e7a11e3","metric":4559044,"metrics":{},"status":"keep","description":"Lowered pair Kaliski iters 460→440. Passes 12-seed commit gate clean. -142k Toffoli, -20 qubits (2790→2770).","timestamp":1776979465213,"segment":3,"confidence":2.039455558785244,"iterationTokens":639,"asi":{"hypothesis":"440 Kaliski iters is still enough for every sampled secp256k1 input.","altseed_classical_total":0,"altseed_phase_batches_total":0,"altseed_ancilla_batches_total":0,"qubits":2770,"saved_toffoli":142800}}
{"run":83,"commit":"9f7d9f8","metric":4406644,"metrics":{},"status":"keep","description":"Lowered pair Kaliski iters 440→420. Passes 24-seed commit gate (98304 points) zero phase/classical/ancilla. -152k Toffoli, -20 qubits (2770→2750).","timestamp":1776979630480,"segment":3,"confidence":2,"iterationTokens":1060,"asi":{"hypothesis":"420 Kaliski iters is still enough for every sampled secp256k1 input, validated at 24 seeds.","altseed_classical_total":0,"altseed_phase_batches_total":0,"altseed_ancilla_batches_total":0,"sampling_regime":"24 seeds x 4096 shots each (98304 points)","qubits":2750,"saved_toffoli":152400,"next_action_hint":"Try 410 or 405 next. Also try to figure out the real minimum safe iter bound."}}
{"run":84,"commit":"190bb31","metric":4326844,"metrics":{},"status":"keep","description":"Lowered pair Kaliski iters 420→410. Passes 24-seed commit gate. -80k Toffoli, -10 qubits (2750→2740).","timestamp":1776979781198,"segment":3,"confidence":1.337508493102124,"iterationTokens":625,"asi":{"altseed_classical_total":0,"altseed_phase_batches_total":0,"altseed_ancilla_batches_total":0,"qubits":2740,"saved_toffoli":79800}}
{"run":85,"commit":"190bb31","metric":0,"metrics":{},"status":"crash","description":"Lowered pair iters to 405 — failed 24-seed commit gate with 1 phase batch. 5-seed probe was clean but 24-seed revealed the tail. Confirms 410 is near the minimum safe bound.","timestamp":1776979886476,"segment":3,"confidence":1.337508493102124,"iterationTokens":623,"asi":{"hypothesis":"405 Kaliski iters is too close to the rare-input tail edge.","rollback_reason":"1 phase batch at 24-seed gate.","altseed_classical_total":0,"altseed_phase_batches_total":1,"altseed_ancilla_batches_total":0,"next_action_hint":"Keep 410. Look at other Toffoli-saving optimizations: STEP 4 ancilla fusion, tail-iteration specializations, or bulk_prefix widening up to 304 only."}}
{"run":86,"commit":"24c7a7f","metric":4314640,"metrics":{},"status":"keep","description":"Asymmetric iterations: pair1=410 kept, pair2 lowered to 407. Passes 24-seed. -12k Toffoli.","timestamp":1776979978727,"segment":3,"confidence":1.0767412456709362,"iterationTokens":1831,"asi":{"hypothesis":"pair2 inversion is run on structurally easier inputs than pair1 (different algebraic form), so it converges slightly faster.","altseed_classical_total":0,"altseed_phase_batches_total":0,"altseed_ancilla_batches_total":0,"qubits":2740,"saved_toffoli":12204,"pair1":410,"pair2":407}}
{"run":87,"commit":"5df5c5e","metric":4298320,"metrics":{},"status":"keep","description":"Pair iters 408/405 (asymmetric). Passes 24-seed. -16k Toffoli, -2 qubits.","timestamp":1776980071694,"segment":3,"confidence":0.7970087117415774,"iterationTokens":1621,"asi":{"altseed_classical_total":0,"altseed_phase_batches_total":0,"altseed_ancilla_batches_total":0,"qubits":2738,"pair1":408,"pair2":405}}
