{"run":266,"commit":"b1fd460","metric":4111918,"metrics":{"altseed_classical_total":0,"altseed_phase_batches_total":0,"altseed_ancilla_batches_total":0,"avg_clifford":24423006.99,"qubits":2716,"emitted_ops":30748978,"correctness_ok":1,"by_tests_passed":91,"inverse_negr_ccx":1145760,"two_fast_replay_projected":2637286,"by_replay_bench_avg_toffoli":5278510,"by_replay_bench_qubits":2716,"by_replay_bench_emitted_ops":42250936},"status":"keep","description":"Measure live reduction-flag density and rule out sparse cleanup","timestamp":1777421153335,"segment":3,"confidence":6.26127668143375,"iterationTokens":14285,"asi":{"hypothesis":"Maybe the dirty live reduction flags from the phase-safe replay are sparse enough for a cheap position-list or correction-list cleanup. If so, flag garbage might be a compression/scheduling issue rather than a new primitive issue.","result":"Added live_reduction_flag_history_is_dense_and_high_entropy. On 3000 actual converged secp256k1 tagged-DIV trajectories, live reduction flags have mean true count ≈133.8 of 560, p90=145, p99=155, and independent per-position entropy ≈436.1 bits. Full BY suite passed locally: 91 tests. Default benchmark path unchanged at 4,111,918 / 2716q.","structural_learning":"Sparse red-flag lists are dead for the same reason sparse A lists were dead: there are too many true positions. At best the live flags are another ~436-bit compressed history bank, not a tiny correction payload. This reinforces that the right SOTA path is flag absorption/fused average or cleaning during an already-required inverse/window operation, not storing and later listing true flags.","caveat":"Entropy is an independent-position upper estimate, not a reversible compression circuit. This does not solve flag cleanup; it only rules out a tempting shortcut.","next_action_hint":"Do not pursue sparse flag lists. Focus on a fused controlled modular average that never materializes independent red flags, or a cleanup schedule that uses z before/post halve without an extra comparator per flag."}}
{"run":267,"commit":"990cacd","metric":4111918,"metrics":{"altseed_classical_total":0,"altseed_phase_batches_total":0,"altseed_ancilla_batches_total":0,"avg_clifford":24423006.99,"qubits":2716,"emitted_ops":30748978,"correctness_ok":1,"by_tests_passed":93,"inverse_negr_ccx":1145760,"two_fast_replay_projected":2637286,"by_replay_bench_avg_toffoli":5278510,"by_replay_bench_qubits":2716,"by_replay_bench_emitted_ops":42250936},"status":"keep","description":"Validate redundant signed BY replay that removes reduction flags algebraically","timestamp":1777422012542,"segment":3,"confidence":6.194541288973006,"iterationTokens":14285,"asi":{"hypothesis":"The red/reduction flags may be avoidable entirely by changing representation: skip modular reduction before the per-step halve and carry signed redundant representatives, using (T + (T&1)*p)/2 as the representative of T/2 mod p. This could turn the hard red-flag cleanup into a simpler parity-cleaning/range problem and drop replay below the fixed-control target.","result":"Added redundant_signed_scaled_by_replay_avoids_reduction_flags_algebraically. On 2000 secp256k1 tagged-DIV samples, the redundant signed replay is exact modulo p, bottom channel is zero, quotient recovery matches y/x, convergence failures are 0, and representatives stayed within 2p. It removes red flags algebraically but has dense parity: mean parity true 276.5/560, independent entropy ≈559 bits. Added redundant_signed_microstep_is_cheap_if_parity_history_can_be_cleaned: a 260-bit signed live-parity circuit for one scaled BY microstep matches A/B/C samples, costs 1,297 CCX, replay560≈726,320, peak 1,043q. Full BY suite passed locally: 93 tests. Default benchmark path unchanged at 4,111,918 / 2716q.","structural_learning":"This is a new SOTA-shaped replay route. The modular-add reduction comparator is not fundamental: redundant signed representatives eliminate red flags and cut the replay body to ~0.726M if parity can be cleaned or absorbed. The new blocker is dense pre-halve parity history, not red flags. Because representatives stayed within 2p, a narrow 260-bit signed register is plausible, making this more than a pure algebra trick.","caveat":"The circuit probe leaves parity history dirty; parity bits are denser than red flags, so storing them is not viable. A production primitive must clean parity via range discipline, a reversible signed-halving trick, or fuse parity with the denominator/window schedule. This is not integrated into point-add and not a clean replay yet.","next_action_hint":"Attack parity cleanup for redundant signed halve. Derive whether the pre-halve parity is recoverable from the bounded signed output range, or redesign the representative interval so the two parity branches are disjoint. If impossible, use the redundant signed path as a lower bound and return to live red-flag absorption."}}
{"run":268,"commit":"e6128d1","metric":4111918,"metrics":{"altseed_classical_total":0,"altseed_phase_batches_total":0,"altseed_ancilla_batches_total":0,"avg_clifford":24423006.99,"qubits":2716,"emitted_ops":30748978,"correctness_ok":1,"by_tests_passed":94,"inverse_negr_ccx":1145760,"two_fast_replay_projected":2637286,"by_replay_bench_avg_toffoli":5278510,"by_replay_bench_qubits":2716,"by_replay_bench_emitted_ops":42250936},"status":"keep","description":"Tighten redundant signed BY replay with centered representatives","timestamp":1777422148545,"segment":3,"confidence":6.129213483146067,"iterationTokens":14285,"asi":{"hypothesis":"The redundant signed no-reduction replay is promising but used representatives up to about 2p. A centered representative discipline may keep values much narrower, making a signed circuit and range-based parity cleanup more plausible.","result":"Added centered_signed_redundant_replay_stays_within_half_modulus. On 2000 secp256k1 tagged-DIV samples, choosing +p for odd negative pre-halve values and -p for odd nonnegative pre-halve values remains exact modulo p, yields zero convergence failures, recovers y/x, and keeps max observed magnitude below p (255 magnitude bits). Parity remains dense: mean true parity ≈264.9/560. Full BY suite passed locally: 94 tests. Default benchmark path unchanged at 4,111,918 / 2716q.","structural_learning":"The no-red-flag representation can be made narrow: centered signed BY replay keeps the tagged channel within roughly ±p/2 rather than up to 2p. This makes a 257-260 bit signed representation plausible for the replay body and confirms the modular reduction comparator is structurally avoidable. However parity remains the irreducible-looking branch payload; centered range alone does not make it sparse.","caveat":"Still algebraic/classical for the full replay. The existing 1,297-CCX circuit probe uses the simpler +p-on-odd rule with live parity, not the centered sign-conditioned rule, and leaves parity dirty. Need a reversible parity-cleaning construction or proof of impossibility for centered reps.","next_action_hint":"Try a centered signed microstep circuit with sign-conditioned ±p correction and live parity/sign controls. Then test whether parity can be recomputed from output plus sign/case on the promised centered range, or whether collisions force parity history."}}
{"run":269,"commit":"e07f33f","metric":4111918,"metrics":{"altseed_classical_total":0,"altseed_phase_batches_total":0,"altseed_ancilla_batches_total":0,"avg_clifford":24423006.99,"qubits":2716,"emitted_ops":30748978,"correctness_ok":1,"by_tests_passed":98,"inverse_negr_ccx":1145760,"two_fast_replay_projected":2637286,"by_replay_bench_avg_toffoli":5278510,"by_replay_bench_qubits":2716,"by_replay_bench_emitted_ops":42250936},"status":"keep","description":"Synthesize sub-million centered signed BY replay scaffold with range-recoverable parity","timestamp":1777422675907,"segment":3,"confidence":6.048730668222936,"iterationTokens":14285,"asi":{"hypothesis":"Centered redundant signed representatives may provide a true sub-million replay body if the sign-conditioned halve can be synthesized and if parity is range-recoverable rather than information-theoretically dirty. The key questions are circuit cost, full 560-step composition, and whether parity cleanup is only a synthesis problem or impossible.","result":"Added centered signed circuit helpers and tests. centered_signed_microstep_keeps_narrow_reps_at_submillion_cost synthesizes a sign-conditioned centered signed microstep at 1,560 CCX, replay560≈873,600, peak 1,046q. centered_signed_560_scaffold_hits_submillion_replay_with_live_parity composes all 560 centered signed steps with raw odd/A controls: 873,600 CCX, peak 2,723q, exact tagged-DIV quotient, phase clean, parity history dirty. centered_parity_is_recoverable_from_poststate_range_for_add_cases proves in a small exact centered model that parity is recoverable from poststate+case by testing whether the even preimage is centered: B uses 2*s_out-r_out, A uses r_out-2*s_out, C uses 2*s_out. naive_centered_parity_recovery_cost_would_erase_redundant_replay_win measures naive range recovery at 1,296 CCX/flag, or ≈725,760 CCX for 560 flags. Full BY suite passed locally: 98 tests. Default benchmark path unchanged at 4,111,918 / 2716q.","structural_learning":"The centered redundant-signed route is now the best replay body: clean data and phase at 0.874M for 560 steps under the current qubit cap, with no modular reduction flags. Parity is not an information-theoretic blocker in the centered invariant; it is range-recoverable from poststate. But naive post-hoc range recovery is too expensive, so parity cleanup must be folded into inverse/window arithmetic or implemented by a specialized parity-consuming centered halve, not by a separate comparator per bit.","caveat":"The 560-step scaffold keeps raw odd/A controls and dirty parity bits; it is not a clean replacement. The range-recovery proof is a small exact model and the naive cleanup cost probe ignores shift Toffoli but includes full add/sub/comparator cost. Integration into point-add and denominator/window generation are still open.","next_action_hint":"Prototype a specialized parity-consuming centered halve: use the low bit as a consumed control for ±p correction and shift so parity is encoded into output range without a persistent bit. If that is too hard, try cleaning parity during the inverse centered step where the even preimage arithmetic is already being reconstructed."}}
{"run":270,"commit":"bf921ef","metric":4111918,"metrics":{"altseed_classical_total":0,"altseed_phase_batches_total":0,"altseed_ancilla_batches_total":0,"avg_clifford":24423006.99,"qubits":2716,"emitted_ops":30748978,"correctness_ok":1,"by_tests_passed":102,"inverse_negr_ccx":1145760,"two_fast_replay_projected":2637286,"by_replay_bench_avg_toffoli":5278510,"by_replay_bench_qubits":2716,"by_replay_bench_emitted_ops":42250936},"status":"keep","description":"Extend centered signed BY to inverse replay and sharpen parity cleanup target","timestamp":1777423999763,"segment":3,"confidence":5.970334101382488,"iterationTokens":14285,"asi":{"hypothesis":"For integration, the centered signed replay must work in the inverse/product-clean direction too, and the remaining parity cleanup problem must be narrowed enough to know whether the projected point-add can beat 2.7M. A cheap high-bit range approximation might be sufficient because p/2 is close to 2^255.","result":"Added centered_signed_inverse_560_product_clean_scaffold_matches_forward_cost: inverse centered signed replay maps the final centered q frame and zero bottom channel back to the centered q*x product and logical zero at exactly the same 873,600 CCX, peak 2,722q, phase clean. Added centered_signed_replay_budget_hits_google_if_parity_and_denominator_are_folded: scaffold≈285,766 + 2×873,600 centered replays + 2×303,828 selected/tapered denominators ≈2,640,622, below 2.7M if parity cleanup is folded; naive parity cleanup projects ≈4,092,142. Added centered_parity_highbits_recovery_is_too_approximate_without_boundary_fix: high-bit-only range recovery has 65,709/1,120,000 mismatches = 5.87%, above the 1% tolerance. Added highbits_centered_parity_recovery_cost_is_plausible_if_folded: the cheap target would be ≈524 CCX/B-flag, but needs exact boundary correction. Full BY suite passed locally: 102 tests. Default benchmark path unchanged at 4,111,918 / 2716q.","structural_learning":"The centered signed route now has both forward and inverse replay bodies at sub-million cost and a whole-point budget under 2.7M if selected denominator and parity folding succeed. The remaining parity problem is not impossibility but exact range-check economics. Pure high bits are too approximate; full range comparators are too expensive. The viable target is a folded or boundary-corrected centered range recovery that reuses inverse/window arithmetic instead of separate post-hoc cleanup.","caveat":"Still not a clean integrated point-add path: parity bits remain dirty in the replay scaffolds, and selected denominator generation/application is not wired into mod.rs. The budget assumes parity cleanup is folded into existing arithmetic and denominator windows at low overhead.","next_action_hint":"Implement a parity-free centered inverse microstep that reconstructs the even preimage and centers it in-place, using an exact but fused range check. If cost stays far below stored-parity inverse + naive cleanup, adapt the same idea to forward/window replay or use it for pair2 first."}}
{"run":271,"commit":"72b50d3","metric":4111918,"metrics":{"altseed_classical_total":0,"altseed_phase_batches_total":0,"altseed_ancilla_batches_total":0,"avg_clifford":24423006.99,"qubits":2716,"emitted_ops":30748978,"correctness_ok":1,"by_tests_passed":102,"inverse_negr_ccx":1145760,"two_fast_replay_projected":2637286,"by_replay_bench_avg_toffoli":5278510,"by_replay_bench_qubits":2716,"by_replay_bench_emitted_ops":42250936,"centered_body_bench_avg_toffoli":4985518,"centered_body_bench_qubits":2716,"centered_body_bench_emitted_ops":38874541,"centered_body_replay_ccx":873600,"centered_inverse_replay_ccx":873600,"centered_budget_if_folded":2640622},"status":"keep","description":"Wire centered signed BY replay body into benchmark harness behind env flag","timestamp":1777424243194,"segment":3,"confidence":5.970334101382488,"iterationTokens":14285,"asi":{"hypothesis":"Before attempting a real point-add replacement, the centered signed redundant replay body should be exercised inside the production benchmark harness to confirm it compiles, respects phase/ancilla checks, and does not exceed the current qubit cap when appended as a clean smoke hook.","result":"Added BY_CENTERED_REPLAY_BODY_BENCH=1 in src/point_add/mod.rs. The hook appends a clean no-op 560-step centered signed replay body after the exact point-add, reusing one zero odd/A/parity control so it exercises the 873.6k-CCX body without the unsolved persistent parity/history bank. Harness smoke passed: avg_toffoli=4,985,518, avg_clifford=31,309,849.191, qubits=2,716, emitted_ops=38,874,541, all altseed/classical/phase/ancilla checks zero. Default autoresearch also passed unchanged: 4,111,918 Toffoli, 24,423,006.990 Clifford, 2,716q, emitted_ops=30,748,978.","structural_learning":"The centered signed replay body is now production-harness compatible under an env gate, and the default path remains clean. This is not yet the SOTA replacement, but it removes one integration unknown: the 260-bit signed arithmetic body and sign-conditioned centered halve can live in the real circuit machinery and checker. Remaining blockers are still parity cleanup/absorption and selected denominator/window integration.","caveat":"The env hook is a clean no-op and deliberately reuses one zero parity/control qubit; it does not store or clean the real parity history and therefore is not a functional replacement path. It is a harness compatibility step, not a benchmark improvement.","next_action_hint":"Next integration step should be an env-gated functional centered signed replay over real sampled controls/parity in a component harness, then a clean parity-folded inverse/window primitive. Avoid appending more no-op scaffolds unless they remove a specific harness risk."}}
{"run":272,"commit":"9db5982","metric":4111918,"metrics":{"altseed_classical_total":0,"altseed_phase_batches_total":0,"altseed_ancilla_batches_total":0,"avg_clifford":24423006.99,"qubits":2716,"emitted_ops":30748978,"correctness_ok":1,"by_tests_passed":102,"inverse_negr_ccx":1145760,"two_fast_replay_projected":2637286,"by_replay_bench_avg_toffoli":5278510,"by_replay_bench_qubits":2716,"by_replay_bench_emitted_ops":42250936,"centered_body_bench_avg_toffoli":4985518,"centered_body_bench_qubits":2716,"centered_body_bench_emitted_ops":38874541,"centered_body_replay_ccx":873600,"centered_inverse_replay_ccx":873600,"centered_budget_if_folded":2640622},"status":"keep","description":"Record centered roundtrip parity-clear phase failure and keep clean body hook","timestamp":1777424648461,"segment":3,"confidence":5.970334101382488,"iterationTokens":14285,"asi":{"hypothesis":"A stronger production-harness roundtrip could run nonzero centered signed forward replay, inverse replay, and clear parity from restored rows, proving the parity recomputation formula works with the real MBU gate stream.","result":"Tried an env-gated BY_CENTERED_ROUNDTRIP_BENCH prototype locally, then reverted the hook. It was classically correct and ancilla-clean, but failed phase on every altseed batch: altseed_phase_batches_total=320 across 5 seeds, with classical_total=0 and ancilla_total=0. The existing BY_CENTERED_REPLAY_BODY_BENCH clean no-op body hook remains valid and default path remains 4,111,918 / 2716q.","structural_learning":"Naive centered forward+inverse parity clearing does not cancel measurement-based signed add/sub phases, even when data and ancilla are clean. This is the centered-replay analogue of the earlier window-local A-clear phase failure. Parity cleanup must be designed with MBU phase dependencies in mind, or debugged first with exact arithmetic.","caveat":"The failing roundtrip hook was not committed; this entry records the dead end and preserves docs. No benchmark improvement.","next_action_hint":"Build an exact-arithmetic centered roundtrip/parity-clean prototype in by.rs to separate algebra from MBU phase. Then selectively reintroduce MBU pieces to find the minimal phase-safe parity cleanup schedule."}}
{"run":273,"commit":"0ffdb16","metric":4111918,"metrics":{"altseed_classical_total":0,"altseed_phase_batches_total":0,"altseed_ancilla_batches_total":0,"avg_clifford":24423006.99,"qubits":2716,"emitted_ops":30748978,"correctness_ok":1,"by_tests_passed":105,"inverse_negr_ccx":1145760,"two_fast_replay_projected":2637286,"by_replay_bench_avg_toffoli":5278510,"by_replay_bench_qubits":2716,"by_replay_bench_emitted_ops":42250936,"centered_body_bench_avg_toffoli":4985518,"centered_body_bench_qubits":2716,"centered_body_bench_emitted_ops":38874541,"centered_body_replay_ccx":873600,"centered_inverse_replay_ccx":873600,"centered_budget_if_folded":2640622,"centered_phase96_fast_mbu_ccx":299616,"centered_phase96_exact_signed_ccx":399264,"centered_phase96_exact_parity_ccx":448800,"centered_phase96_all_exact_ccx":548448,"centered_clean_all_exact_roundtrip_ccx":3199280,"centered_clean_all_exact_peak":2464},"status":"keep","description":"Isolate centered replay phase blocker and prove all-exact clean fallback","timestamp":1777425464581,"segment":3,"confidence":5.970334101382488,"iterationTokens":14285,"asi":{"hypothesis":"The naive centered parity clear failed phase because measurement-based adders were controlled by qubits that are later cleaned. Replacing only the offending controlled arithmetic with exact adders should separate algebraic parity cleanup from MBU phase cleanup and show whether a clean fallback exists.","result":"Added exact signed-add/sub and exact parity-controlled ±p variants in src/point_add/by.rs. A 96-step forward+inverse+parity-clear isolation shows: fast MBU controls phase=1 at 299,616 CCX; exact signed add/sub only still phase=1 at 399,264; exact parity ±p controls phase=0 at 448,800; all exact phase=0 at 548,448. Full 560-step clean roundtrip needs all exact controls to be phase-clean: 3,199,280 CCX, peak 2,464q, phase=0. Exact parity controls with fast signed add/sub has data-dependent phase over 12 samples (saw phase 0 and 1), so a single global Neg cannot fix it. Full BY suite passed: 105 tests. Default autoresearch remains unchanged: 4,111,918 Toffoli, 2,716q, all altseed/phase/ancilla checks zero.","structural_learning":"A fully clean centered signed replay roundtrip is possible under the current qubit cap, but only with wholesale exact control arithmetic and is far too expensive. The blocker is sharper: parity history is not the only problem; any replay control later cleaned after driving MBU adders can leave data-dependent phase. The next replay design needs phase witnesses/live flags or a phase-aware MBU-control cleanup, not merely range recovery or global phase correction.","cost_interpretation":"All-exact clean roundtrip is a correctness fallback, not SOTA: 3.199M CCX per 560-step forward+inverse roundtrip would erase the 873.6k replay win. The SOTA-shaped budget still requires keeping the 873.6k body and folding/cleaning control phases cheaply.","next_action_hint":"Try to derive a cheap phase witness for MBU controlled adders analogous to live reduction flags: keep or recompute the measurement phase dependency while clearing parity/odd/A controls. Focus first on the centered halve's parity-controlled ±p correction, then signed odd add/sub."}}
