{"run":205,"commit":"86f0e99","metric":4132750,"metrics":{"altseed_classical_total":0,"altseed_phase_batches_total":0,"altseed_ancilla_batches_total":0,"avg_clifford":24414411.956,"qubits":2716,"emitted_ops":31193208,"correctness_ok":1},"status":"keep","description":"Generalize fixed-matrix BY replacement and sample cost distribution","timestamp":1777366750872,"segment":3,"confidence":2.168328028145418,"iterationTokens":10732,"asi":{"hypothesis":"The signed fixed-matrix replacement should generalize beyond one hand-coded matrix. If sampled arbitrary BY matrices stay near 20-30k CCX/window and within peak, fixed-matrix application is no longer the main blocker.","result":"Generalized old-row cleanup into emit_fixed_matrix_old_cleanup_for_test and compute_signed_q_from_m_for_matrix. Added fixed_matrix_replacement_sample_cost_distribution over 32 sampled w=16 BY matrices. Results: mean 20,991 CCX, p90 24,234, max 28,099; peak consistently 2,256q for the full pair replacement. Full BY tests: 36 passed. ./autoresearch.sh default path unchanged and passes at 4,132,750 Toffoli / 2716q.","structural_learning":"Fixed-matrix BY pair replacement is now a parameterized, sampled circuit primitive with plausible cost: about 21k CCX per window for a full signed pair replacement. At 35 windows this is about 0.73M CCX per pair before matrix selection/history overhead, in the right range for a cheaper inversion component.","remaining_gap":"Matrix selection/history remains the structural blocker. A fixed selected matrix is cheap enough; coherent selection among many matrices or storing/recovering the selected sequence under the scratch budget is not solved.","next_action_hint":"Build a BY tagged-DIV scaffold with stored per-window matrix IDs/history as an upper-bound cost, then try to compress selection/history. Alternatively test approximate rank/hint schemes tied to actual trajectory distribution."}}
{"run":206,"commit":"3cc4ef3","metric":4132750,"metrics":{"altseed_classical_total":0,"altseed_phase_batches_total":0,"altseed_ancilla_batches_total":0,"avg_clifford":24414411.956,"qubits":2716,"emitted_ops":31193208,"correctness_ok":1},"status":"keep","description":"Estimate stored-matrix BY tagged-DIV arithmetic upper bound","timestamp":1777366899617,"segment":3,"confidence":2.168328028145418,"iterationTokens":6356,"asi":{"hypothesis":"Now that fixed-matrix replacements are cheap enough, estimate the arithmetic-only BY tagged-DIV upper bound by assuming each window's matrix is already known/stored. This isolates arithmetic from matrix selection/history.","result":"Added by_tagged_div_stored_matrix_upper_bound_model. On 32 sampled w=16 windows, integer denominator replacement plus modular fixed-matrix replacement costs mean 28,607 CCX/window, p90 35,087, max 37,609. A 35-window tagged DIV arithmetic upper bound is ~1,001,258 CCX. Scheduled peak model is ~2804q and selector history would be ~770 bits (35 * 22-bit delta,h key). Full BY tests: 37 passed. ./autoresearch.sh default path unchanged and passes at 4,132,750 Toffoli / 2716q.","structural_learning":"BY arithmetic is now plausibly cheaper than a Kaliski invocation: about 1.0M Toffoli for a tagged DIV if matrices are known, versus ~1.6M Kaliski-scale cost. The remaining dominant obstacle is not row arithmetic but coherent matrix selection/history compression and fitting peak just under the cap.","caveat":"This is an upper-bound arithmetic model with stored/known matrices, not a complete circuit. Selector history (~770 bits) and scheduled peak (~2804q) are above the desired 600-scratch/SOTA shape; both need structural compression.","next_action_hint":"Focus on selection/history: build a small stored-matrix-history scaffold to measure exact overhead, and in parallel search for trajectory-specific compression below 770 bits or a self-cleaning selection invariant. Also trim/reshape peak from ~2804q to below cap by scheduling row temps or narrower q widths."}}
{"run":207,"commit":"ae9670d","metric":4132750,"metrics":{"altseed_classical_total":0,"altseed_phase_batches_total":0,"altseed_ancilla_batches_total":0,"avg_clifford":24414411.956,"qubits":2716,"emitted_ops":31193208,"correctness_ok":1},"status":"keep","description":"Show BY matrix sequence history is sub-600 bits information-theoretically","timestamp":1777367100941,"segment":3,"confidence":2.168328028145418,"iterationTokens":9063,"asi":{"hypothesis":"The stored-matrix BY tagged-DIV upper bound needed 770 raw selector bits (35 windows * 22-bit delta,h key). Actual secp256k1 matrix sequences may be highly nonuniform, making sub-600-bit entropy-coded history possible under the user's scratch target.","result":"Added actual_matrix_sequence_entropy_supports_sub600_history_target. On 10,000 sampled secp256k1 denominators, empirical 35-window matrix-sequence entropy is ~449.0 bits. Independent per-window code lengths: p99 ~463.1 bits, p999 ~465.1 bits, fail>550 = 0. Full BY tests: 38 passed. ./autoresearch.sh default path unchanged and passes at 4,132,750 Toffoli / 2716q.","structural_learning":"The BY selection/history blocker is information-theoretically compatible with the ~600-scratch goal. Raw selectors are 770 bits, but actual matrix sequences appear compressible to ~450-500 bits with plenty of margin under 550 bits. This shifts the problem from impossibility to building a reversible entropy/rank-coded history mechanism.","caveat":"This is not a circuit and uses empirical distributions. A reversible entropy-coded selector needs table/rank circuits and must avoid overfitting; also matrix-sequence compression must compose with the arithmetic peak, which is still around 2804q in the stored-matrix model.","next_action_hint":"Design a reversible per-window rank code: for each window, map matrix to a variable/fixed bucket code from empirical distribution, target <=550 bits total with <1% overflow. Then estimate QROM/rank lookup cost and peak. If feasible, build an env-gated BY tagged-DIV scaffold using compressed matrix history."}}
{"run":208,"commit":"185a294","metric":4132750,"metrics":{"altseed_classical_total":0,"altseed_phase_batches_total":0,"altseed_ancilla_batches_total":0,"avg_clifford":24414411.956,"qubits":2716,"emitted_ops":31193208,"correctness_ok":1},"status":"keep","description":"Trim BY stored-matrix peak by freeing q sign-extension bits","timestamp":1777367527540,"segment":3,"confidence":2.168328028145418,"iterationTokens":11817,"asi":{"hypothesis":"The stored-matrix BY tagged-DIV peak was just above the 2800q cap (~2804q). The signed q correction registers only need 18 live bits after arithmetic right shift, so freeing unused sign-extension bits should bring the scheduled peak under cap without changing arithmetic.","result":"Freed unused q sign-extension bits after computing q=s*adj(P)m/2^16. Signed sample replacement peak drops from 2256q to 2224q. Fixed-matrix replacement sample distribution peak drops to 2224q. Stored-matrix tagged-DIV scheduled peak model drops from ~2804q to ~2772q while arithmetic remains ~1,001,258 CCX for 35 windows. Full BY tests pass locally (38 passed). Default benchmark was previously unchanged at 4,132,750 Toffoli / 2716q; latest autoresearch run was refused by harness context-window guard after local tests.","structural_learning":"The stored-matrix BY arithmetic upper bound now fits the current 2800q session cap on paper. The dominant remaining blocker is not peak or fixed-matrix arithmetic; it is reversible compressed selector/history and integration.","caveat":"This is still not an end-to-end point-add improvement, only a structural BY primitive model and test suite. Needs a fresh session or more context to run further harness iterations without context aborts.","next_action_hint":"Next build reversible matrix-history compression or an env-gated stored-matrix BY tagged-DIV scaffold. Raw 770-bit history is too large; empirical entropy ~449 bits suggests target <=550 bits is plausible."}}
{"run":209,"commit":"9d569da","metric":4132750,"metrics":{"altseed_classical_total":0,"altseed_phase_batches_total":0,"altseed_ancilla_batches_total":0,"avg_clifford":24414411.956,"qubits":2716,"emitted_ops":31193208,"correctness_ok":1},"status":"keep","description":"Show exact 560-bit BY branch-bit selector reconstructs matrices","timestamp":1777396779188,"segment":3,"confidence":2.168328028145418,"iterationTokens":11817,"asi":{"hypothesis":"Instead of raw 22-bit matrix keys or empirical entropy-coded IDs, each w=16 BY jump matrix may be reconstructed exactly from the 16 odd/even divstep branch bits plus starting delta. This could give a concrete selector representation near the 600-scratch target.","result":"Added branch_bits_reconstruct_by_jump_matrix and branch_bit_history_by_tagged_div_budget_model. 10,000 sampled low-word windows confirm 16 branch bits reconstruct the same transition matrix as jump_matrix_direct_lowword. For 35 windows the selector history is exactly 560 bits; combined with the measured modular replacement peak 2224q and 16 delta/control bits gives a model peak of exactly 2800q. Full BY tests pass locally (41 passed).","structural_learning":"BY matrix selection no longer requires 770 raw (delta,h) bits or a huge matrix-ID table in principle. A branch-bit history is exact, compact, and QROM-free for matrix reconstruction. This is a concrete representation at the current cap, and entropy coding still offers margin below it.","caveat":"This does not solve generation of branch bits from the denominator x. A denominator pass or a new branch-bit generator is still needed; otherwise branch bits are just stored advice/history. It also leaves no peak slack at 2800q unless history is compressed or row scheduling is tightened.","next_action_hint":"Model branch-bit generation separately: denominator-only BY microstep/jump pass that emits 560 branch bits, then modular fixed-matrix replay driven by those bits. Estimate whether generation+replay beats Kaliski and whether branch bits can be generated and uncomputed under cap."}}
{"run":210,"commit":"1f94960","metric":4132750,"metrics":{"altseed_classical_total":0,"altseed_phase_batches_total":0,"altseed_ancilla_batches_total":0,"avg_clifford":24414411.956,"qubits":2716,"emitted_ops":31193208,"correctness_ok":1},"status":"keep","description":"Find in-place Hermite factor route for BY scaled windows","timestamp":1777397612727,"segment":3,"confidence":2.168328028145418,"iterationTokens":11817,"asi":{"hypothesis":"The current fixed-matrix BY row replacement cannot meet a true ~600-scratch target because it double-buffers old and new 274-bit row pairs. A 2x2 integer factorization of each scaled window might apply the same P/2^16 map in-place using only the live DIV registers plus a batched shift workspace.","result":"Added Smith and Hermite factorization tests. Naive Smith normal form always diagonalizes sampled w=16 BY windows to diag(1,65536), but factors can grow huge (~3.9e13), so plain SNF is not viable. A small Hermite factorization succeeds on 4096 sampled windows: U P V = [[1,e],[0,65536]], |e|<=32768, and max coefficient in U,V,U^-1,V^-1,e <=65536. Thus a scaled window can algebraically be applied in-place as V^-1, z0=(z0+e*z1)/2^16 via one batched Solinas shift, then U^-1. Full BY tests pass locally (43 passed).","structural_learning":"This is the missing scratch-shape for the BY route: avoid simultaneous old+new row pairs and do not allocate a second 274-bit pair. The DIV-like primitive can in principle live in its two field registers plus carry/shift/control workspace, which is the correct shape for ~600 scratch beyond the point registers.","caveat":"The factors U,V,e depend on quantum branch bits. Fixed-matrix in-place arithmetic is now algebraically plausible, but coherent selected-factor application must avoid generic variable-coefficient multiplications; otherwise Toffoli cost explodes. Branch-bit generation/history is still a separate blocker.","next_action_hint":"Implement a fixed-Hermite-factor in-place modular window circuit for one sampled BY matrix and measure peak/cost versus double-buffer replacement. Then study selected-factor synthesis from 16 branch bits: table-free factor generation, controlled constant shears, or block-pebbled branch histories."}}
{"run":211,"commit":"3c51736","metric":4132750,"metrics":{"altseed_classical_total":0,"altseed_phase_batches_total":0,"altseed_ancilla_batches_total":0,"avg_clifford":24414411.956,"qubits":2716,"emitted_ops":31193208,"correctness_ok":1},"status":"keep","description":"Build fixed Hermite in-place BY modular window circuit","timestamp":1777399265172,"segment":3,"confidence":2.168328028145418,"iterationTokens":11817,"asi":{"hypothesis":"The Hermite factorization U P V=[[1,e],[0,2^16]] should translate into an actual in-place modular BY window using only the two field registers plus transient modular-adder workspace, confirming the ~600-scratch shape instead of double-buffering old/new rows.","result":"Added a fixed sample circuit for matrix [[-8192,24576],[-3,1]]. It applies V^-1, then row0=(row0+e*row1)/2^16 with e=21845 using exact modular halvings, then U^-1. It matches 2^-16*P(x0,x1) on 32 random basis states. Cost: 34,489 CCX, peak 1,285q, factor_ops=10. Added a 24-sample distribution: mean 33,715 CCX/window, p90 43,942, max 44,179, approx35≈1,180,034 CCX, max_peak=1,285q. Full BY tests pass locally (45 passed). ./autoresearch.sh default path unchanged and passes at 4,132,750 Toffoli / 2716q.","structural_learning":"The BY route now has an actual in-place fixed-window circuit, not just algebra. Scratch shape is excellent: peak 1,285q for the window, far below double-buffer replacements. This is the right architecture for ~600 scratch beyond tx,ty. However naive Euclidean shear synthesis is more expensive than double-buffer fixed rows (~1.18M vs ~1.0M arithmetic over 35 windows), so the win is scratch/architecture, not immediate arithmetic cost.","caveat":"This is fixed-matrix and exact-modular-halving. It does not yet handle coherent selected factors from branch bits, nor branch-bit generation/history. Naive selected variable coefficients would still be too expensive. Peak is excellent, but cost must be controlled during selection and integration.","next_action_hint":"Next derive a branch-bit-to-Hermite-factor synthesis model or find a cheaper fixed-factor decomposition. Focus on selected-factor application: can U,V,e be expressed as products of the original 16 BY microstep shears with batched shifts, or can branch bits drive a small set of shears without generic variable multiplication?"}}
{"run":212,"commit":"d43fe41","metric":4132750,"metrics":{"altseed_classical_total":0,"altseed_phase_batches_total":0,"altseed_ancilla_batches_total":0,"avg_clifford":24414411.956,"qubits":2716,"emitted_ops":31193208,"correctness_ok":1},"status":"keep","description":"Find branch-numerator BY window lower bound and control-tax blocker","timestamp":1777399555002,"segment":3,"confidence":2.168328028145418,"iterationTokens":25908,"asi":{"hypothesis":"The Hermite in-place window proves scratch shape, but branch bits themselves may provide a cheaper selected representation: apply the 16 BY numerator microstep matrices A/B/C directly, then perform the common 2^-16 scaling at the end of the window.","result":"Added fixed_branch_numerator_window_matches_scaled_by_matrix: sample matrix exact on 32 random basis states at 18,890 CCX / 1,029q. Added 64-sample distribution: mean 22,883 CCX/window, p90 27,588, max 30,913, approx35≈800,900 CCX, max_peak=1,029q. Added quantum_controlled_branch_numerator_replay_is_too_expensive_naively: generic cmod-add selected microsteps cost 77,728 CCX/window, approx35≈2,720,480 CCX, peak=1,287q. Full BY tests pass locally (48 passed). ./autoresearch.sh default path unchanged and passes at 4,132,750 Toffoli / 2716q.","structural_learning":"The best arithmetic shape is now branch-numerator replay, not Hermite shears: it is lower Toffoli than double-buffer fixed rows and far lower scratch. The remaining SOTA blocker is exactly the quantum-control tax. If branch choices could be turned into fixed-control blocks cheaply, the DIV-like primitive is ~0.8M Toffoli and ~1k peak for the modular pair, compatible with the SOTA target. Naive live quantum controls erase the win at ~2.72M for the modular pair alone.","caveat":"The 0.8M result is a fixed-control/advice lower bound; real point-add inputs are quantum, so branch selection must be coherent. Generic controlled modular additions are too expensive. Need a structural selected-add/mux or block-specialization mechanism, not ordinary variable-coefficient multiplication or 2^16 QROM.","next_action_hint":"Investigate branch block specialization: group windows into small branch-pattern blocks and compare QROM/select cost vs controlled-add tax; or design a signed controlled add/sub mux so the A/B first update costs one controlled modular operation instead of two. Also model lowword branch-generation cost to confirm it is negligible versus modular replay."}}
{"run":213,"commit":"8ed9120","metric":4132750,"metrics":{"altseed_classical_total":0,"altseed_phase_batches_total":0,"altseed_ancilla_batches_total":0,"avg_clifford":24414411.956,"qubits":2716,"emitted_ops":31193208,"correctness_ok":1},"status":"keep","description":"Show BY branch generation needs only low-ratio h state","timestamp":1777399714911,"segment":3,"confidence":2.168328028145418,"iterationTokens":10659,"asi":{"hypothesis":"The branch-numerator BY route may still fail if generating the branch bits requires carrying a full denominator pair. But BY's low-ratio variable h=g/f mod 2^t should generate the same branch stream with only O(w) bits per window.","result":"Added low_ratio_microstep_update_generates_branch_bits_without_full_denominator. For 20,000 sampled lowword states and all 16 microsteps, h parity matches g parity and the closed 2-adic h updates match the full lowword f,g divstep evolution: C h'=h/2, B h'=(h+1)/2, A h'=(h-1)/(2h) mod 2^(t-1). Full BY tests pass locally (49 passed). ./autoresearch.sh default path unchanged and passes at 4,132,750 Toffoli / 2716q.","structural_learning":"Branch generation is not the scratch blocker. A 16-bit h register plus small delta can produce the branch stream; the reversibility payload is the stored branch history. The main blocker remains selected modular replay: converting those branch bits into low-cost fixed-control arithmetic without generic controlled full-width modular adds.","caveat":"This is algebra/classical validation, not a reversible h-update circuit. The A update needs a small 2-adic inverse of h; at 16 bits this is cheap relative to modular replay but still must be synthesized if we build the generator. It also does not reduce the quantum control tax in the modular pair.","next_action_hint":"Build a costed reversible 16-bit h/delta branch generator or proceed directly to selected modular replay. Priority remains a signed add/sub mux or branch-block specialization that narrows the gap between the 0.8M fixed-control lower bound and the 2.72M naive controlled upper bound."}}
{"run":214,"commit":"a07babd","metric":4132750,"metrics":{"altseed_classical_total":0,"altseed_phase_batches_total":0,"altseed_ancilla_batches_total":0,"avg_clifford":24414411.956,"qubits":2716,"emitted_ops":31193208,"correctness_ok":1},"status":"keep","description":"Invalidate sparse-A correction list for BY selected replay","timestamp":1777399915364,"segment":3,"confidence":2.168328028145418,"iterationTokens":9893,"asi":{"hypothesis":"Maybe the branch-numerator selected replay can be split into a common odd add/sub stream plus a sparse correction list for A cases (the extra r+=s in A). If A cases are rare, this could avoid paying an A-controlled modular add at every potential step.","result":"Added actual_branch_cases_are_not_sparse_enough_for_a_correction_list. On 10,000 actual 560-step secp256k1 trajectories: mean(A,B,C)=(133.5,133.0,293.5), p99_A=154, p999_A=162. A naive A-position list would cost ~1540 bits at p99, worse than raw 560 branch bits. Full BY tests pass locally (50 passed). ./autoresearch.sh default path unchanged and passes at 4,132,750 Toffoli / 2716q.","structural_learning":"A-cases are not sparse. The simple correction-list approach does not solve selected replay. The viable target is narrower: either a true signed add/sub mux that reduces the first A/B update to one controlled modular operation, or a block specialization/history mechanism that amortizes controls without enumerating A positions.","caveat":"This only kills one sparse-correction encoding. There may still be structured block decompositions or conjugated corrections with much shorter descriptions, but naive A-position payload is not compatible with the ~600 scratch target.","next_action_hint":"Focus on signed add/sub mux cost and block-level selected replay. Quantify whether an ideal signed-mux plus unavoidable A correction can reach <1.2M, then decide if building the primitive is worthwhile."}}
