{"run":433,"commit":"08249b8","metric":0,"metrics":{"altseed_classical_total":0,"altseed_phase_batches_total":0,"altseed_ancilla_batches_total":0,"avg_toffoli":4089274,"avg_clifford":24292787.153,"qubits":2713,"emitted_ops":30575944,"correctness_ok":1,"scratch_over_tx_ty_q":2201,"fixed_quantum_data_qubits":512,"target_scratch_over_tx_ty_q":600},"status":"crash","description":"Attempt targeted scratch600 frontier test but harness requires autoresearch.sh","timestamp":1777575070759,"segment":5,"confidence":null,"iterationTokens":112,"asi":{"hypothesis":"Run isolated scratch600 frontier test directly to log low-scratch architecture metrics.","rollback_reason":"run_experiment rejected custom cargo test because autoresearch.sh exists and must be used for experiments.","next_action_hint":"Use autoresearch.sh with an optional extra-test hook or run full autoresearch validation after adding the frontier test."}}
{"run":434,"commit":"08249b8","metric":0,"metrics":{"altseed_classical_total":0,"altseed_phase_batches_total":0,"altseed_ancilla_batches_total":0,"avg_toffoli":4089274,"avg_clifford":24292787.153,"qubits":2713,"emitted_ops":30575944,"correctness_ok":0,"scratch_over_tx_ty_q":2201,"fixed_quantum_data_qubits":512,"target_scratch_over_tx_ty_q":600,"scratch600_frontier_best_scratch_bits":510,"scratch600_frontier_best_charged_scratch_bits":510,"scratch600_frontier_best_charged_toffoli":2645196,"scratch600_frontier_best_charged_gap_to_2700k":18446744073709496000,"scratch600_streamed_selector_budget_ccx":87840,"scratch600_streamed_lowword_selector_ccx":208320,"scratch600_streamed_selector_shortfall_ccx":120480,"scratch600_centered_raw_scratch_bits":592,"scratch600_centered_boundary_scratch_p99":710,"scratch600_centered_parser_over_strict_bits":110,"scratch600_plusminus_raw_scratch_bits":564,"scratch600_plusminus_unary_scratch_p99":640,"scratch600_plusminus_parser_over_strict_bits":40,"scratch600_halfgcd_matrix_only_bits":524,"scratch600_halfgcd_matrix_tail_raw_bits":689,"scratch600_halfgcd_tail_over_google_bits":26},"status":"crash","description":"Scratch600 frontier table first attempt underflowed on uncharged selector row","timestamp":1777575162290,"segment":5,"confidence":null,"iterationTokens":16216,"asi":{"hypothesis":"Executable low-scratch frontier table should identify the best fully charged <=600-scratch candidate.","error_details":"Test accidentally treated streamed-mask replay-body-only row as fully charged, so 2_645_196 - 2_700_000 underflowed usize and assertion failed.","rollback_reason":"Fix the candidate classification to exclude uncharged selector/parser rows from fully charged SOTA comparison.","next_action_hint":"Add a charged_selector flag or set charged_toffoli=None for replay-body-only rows, rerun through autoresearch.sh extra-test hook."}}
{"run":435,"commit":"710ef59","metric":510,"metrics":{"altseed_classical_total":0,"altseed_phase_batches_total":0,"altseed_ancilla_batches_total":0,"avg_toffoli":4089274,"avg_clifford":24292787.153,"qubits":2713,"emitted_ops":30575944,"correctness_ok":1,"scratch_over_tx_ty_q":510,"default_scratch_over_tx_ty_q":2201,"fixed_quantum_data_qubits":512,"target_scratch_over_tx_ty_q":600,"scratch600_frontier_best_scratch_bits":510,"scratch600_frontier_best_charged_scratch_bits":510,"scratch600_frontier_best_charged_toffoli":2765676,"scratch600_frontier_best_charged_gap_to_2700k":65676,"scratch600_streamed_replay_body_projected_toffoli":2645196,"scratch600_streamed_unfunded_selector_budget_ccx":54804,"scratch600_streamed_selector_budget_ccx":87840,"scratch600_streamed_lowword_selector_ccx":208320,"scratch600_streamed_selector_shortfall_ccx":120480,"scratch600_centered_raw_scratch_bits":592,"scratch600_centered_boundary_scratch_p99":710,"scratch600_centered_parser_over_strict_bits":110,"scratch600_plusminus_raw_scratch_bits":564,"scratch600_plusminus_unary_scratch_p99":640,"scratch600_plusminus_parser_over_strict_bits":40,"scratch600_halfgcd_matrix_only_bits":524,"scratch600_halfgcd_matrix_tail_raw_bits":689,"scratch600_halfgcd_tail_over_google_bits":26},"status":"keep","description":"Rank scratch-600 architectures and charge selector/parser blockers","timestamp":1777575303214,"segment":5,"confidence":null,"iterationTokens":4254,"asi":{"hypothesis":"After pivoting away from Kaliski, rank only architectures whose persistent state can fit tx,ty plus <=600 scratch and charge known selector/parser/cleanup costs.","result":"Several state shapes fit <=600 scratch, but none is fully solved. The best charged near-miss is streamed-mask BY with scratch≈510 and projected 2,765,676 Toffoli when the lowword selector is included, 65,676 above the 2.7M target; the uncharged replay-body projection is 2,645,196 and leaves only 54,804 CCX for all missing selector work. Centered Euclid, plus-minus, and half-GCD fit only before parser/tail costs are charged.","next_action_hint":"Focus on the streamed-mask BY selector shortfall or a fused half-GCD/parser-free DIV. Do not spend main-loop time on Kaliski state reductions unless they produce <=600-scratch full architecture."}}
{"type":"config","name":"scratch-600 architecture projected Toffoli gap","metricName":"gap_to_2700k_ccx","metricUnit":"","bestDirection":"lower"}
{"run":436,"commit":"92eb629","metric":65676,"metrics":{"scratch600_frontier_best_scratch_bits":510,"scratch600_frontier_best_charged_scratch_bits":510,"scratch600_frontier_best_charged_toffoli":2765676,"scratch600_frontier_best_charged_gap_to_2700k":65676,"scratch600_streamed_replay_body_projected_toffoli":2645196,"scratch600_streamed_unfunded_selector_budget_ccx":54804,"scratch600_streamed_selector_budget_ccx":87840,"scratch600_streamed_lowword_selector_ccx":208320,"scratch600_streamed_selector_shortfall_ccx":120480,"scratch600_centered_raw_scratch_bits":592,"scratch600_centered_boundary_scratch_p99":710,"scratch600_centered_parser_over_strict_bits":110,"scratch600_plusminus_raw_scratch_bits":564,"scratch600_plusminus_unary_scratch_p99":640,"scratch600_plusminus_parser_over_strict_bits":40,"scratch600_halfgcd_matrix_only_bits":524,"scratch600_halfgcd_matrix_tail_raw_bits":689,"scratch600_halfgcd_tail_over_google_bits":26,"altseed_classical_total":0,"altseed_phase_batches_total":0,"altseed_ancilla_batches_total":0,"avg_toffoli":4089274,"avg_clifford":24292787.153,"qubits":2713,"emitted_ops":30575944,"correctness_ok":1,"default_scratch_over_tx_ty_q":2201,"target_scratch_over_tx_ty_q":600},"status":"keep","description":"Baseline projected Toffoli gap for best charged scratch600 candidate","timestamp":1777575431280,"segment":6,"confidence":null,"iterationTokens":163,"asi":{"hypothesis":"Use the fully charged Toffoli gap of the best <=600-scratch candidate as the active optimization metric.","result":"Baseline low-scratch frontier is the streamed-mask BY route with lowword selector charged: 510 scratch bits, projected 2,765,676 Toffoli, gap 65,676 above the 2.7M target.","next_action_hint":"Try to reduce selector production below the lowword-oracle 208,320 CCX, or find another <=600-scratch candidate with lower charged Toffoli."}}
{"run":437,"commit":"50d9b8a","metric":-14964,"metrics":{"scratch600_frontier_best_scratch_bits":510,"scratch600_frontier_best_charged_scratch_bits":510,"scratch600_frontier_best_charged_toffoli":2765676,"scratch600_frontier_best_charged_gap_to_2700k":65676,"scratch600_streamed_replay_body_projected_toffoli":2645196,"scratch600_streamed_unfunded_selector_budget_ccx":54804,"scratch600_streamed_selector_budget_ccx":87840,"scratch600_streamed_lowword_selector_ccx":208320,"scratch600_streamed_selector_shortfall_ccx":120480,"scratch600_centered_raw_scratch_bits":592,"scratch600_centered_boundary_scratch_p99":710,"scratch600_centered_parser_over_strict_bits":110,"scratch600_plusminus_raw_scratch_bits":564,"scratch600_plusminus_unary_scratch_p99":640,"scratch600_plusminus_parser_over_strict_bits":40,"scratch600_halfgcd_matrix_only_bits":524,"scratch600_halfgcd_matrix_tail_raw_bits":689,"scratch600_halfgcd_tail_over_google_bits":26,"altseed_classical_total":0,"altseed_phase_batches_total":0,"altseed_ancilla_batches_total":0,"avg_toffoli":4089274,"avg_clifford":24292787.153,"qubits":2713,"emitted_ops":30575944,"correctness_ok":1,"default_scratch_over_tx_ty_q":2201,"target_scratch_over_tx_ty_q":600,"scratch600_lowword_selector_best_w":4,"scratch600_lowword_selector_best_oracle_ccx":912,"scratch600_lowword_selector_best_decode_ccx":444,"scratch600_lowword_selector_best_total_ccx":189840,"scratch600_lowword_selector_best_projected_toffoli":2685036,"scratch600_lowword_selector_best_gap_to_2700k":-14964,"scratch600_lowword_selector_w8_oracle_ccx":2208,"scratch600_lowword_selector_w8_decode_ccx":888,"scratch600_lowword_selector_w8_total_ccx":216720,"scratch600_lowword_selector_w8_projected_toffoli":2711916,"scratch600_lowword_selector_w8_gap_to_2700k":11916,"scratch600_lowword_selector_w16_oracle_ccx":5952,"scratch600_lowword_selector_w16_decode_ccx":1776,"scratch600_lowword_selector_w16_total_ccx":270480,"scratch600_lowword_selector_w16_projected_toffoli":2765676,"scratch600_lowword_selector_w16_gap_to_2700k":65676},"status":"keep","description":"Find cheaper w4 lowword selector oracle under scratch600 BY model","timestamp":1777575726954,"segment":6,"confidence":null,"iterationTokens":16172,"asi":{"hypothesis":"The old 16-step lowword BY selector may be too coarse; smaller subwindows could reduce reversible lowword simulation and delta-decoder cost enough to close the 65k projected gap under the same selector-oracle model.","result":"w=4 lowword oracle+decoder totals 189,840 CCX for 560 steps versus 270,480 for w=16, improving the streamed-mask BY selector-only projection from 2,765,676 to 2,685,036 (-14,964 vs 2.7M). Full denominator/selector state plumbing between lowword windows is still uncharged, so this is not a production claim.","next_action_hint":"Charge the missing w=4 denominator-state update/cleanup. Try a 4-step ratio/carry update or a compact pair+sidecar schedule; discard if plumbing exceeds ~15k CCX or pushes scratch above 600."}}
{"type":"config","name":"scratch600 BY w4 missing denominator plumbing excess","metricName":"w4_full_pair_excess_ccx","metricUnit":"","bestDirection":"lower"}
{"run":438,"commit":"1999876","metric":903996,"metrics":{"scratch600_w4_full_pair_window_ccx":6564,"scratch600_w4_full_pair_compute_ccx":918960,"scratch600_w4_full_pair_compute_uncompute_ccx":1837920,"scratch600_w4_full_pair_compute_excess_ccx":903996,"scratch600_w4_full_pair_roundtrip_excess_ccx":1822956,"scratch600_w4_full_pair_peak_q":1104,"altseed_classical_total":0,"altseed_phase_batches_total":0,"altseed_ancilla_batches_total":0,"avg_toffoli":4089274,"avg_clifford":24292787.153,"qubits":2713,"emitted_ops":30575944,"correctness_ok":1,"target_scratch_over_tx_ty_q":600},"status":"keep","description":"Charge naive full-pair plumbing for w4 lowword selector","timestamp":1777575901947,"segment":7,"confidence":null,"iterationTokens":16172,"asi":{"hypothesis":"The w4 lowword selector projection only helps if the missing denominator/selector state update is nearly free; measure the obvious exact full-pair update to establish the plumbing floor.","result":"Naive full-pair 4-step denominator update costs 6,564 CCX/window, 918,960 CCX for 560-step compute and 1,837,920 for compute+uncompute, exceeding the w4 selector slack by 903,996 CCX. Peak 1,104q also exceeds scratch600 if counted as extra state. This kills direct full-pair plumbing for the promising w4 selector oracle.","next_action_hint":"Try compact ratio/carry or fixed-matrix update for w4; it must beat the direct full-pair compute by roughly two orders of magnitude relative to the 14,964 slack."}}
{"run":439,"commit":"8a8cd2a","metric":306178,"metrics":{"scratch600_w4_full_pair_window_ccx":6564,"scratch600_w4_full_pair_compute_ccx":918960,"scratch600_w4_full_pair_compute_uncompute_ccx":1837920,"scratch600_w4_full_pair_compute_excess_ccx":903996,"scratch600_w4_full_pair_roundtrip_excess_ccx":1822956,"scratch600_w4_full_pair_peak_q":1104,"scratch600_w4_fixed_matrix_mean_window_ccx":2293.87,"scratch600_w4_fixed_matrix_p90_window_ccx":3288,"scratch600_w4_fixed_matrix_max_window_ccx":3830,"scratch600_w4_fixed_matrix_compute_ccx":321142,"scratch600_w4_fixed_matrix_compute_uncompute_ccx":642284,"scratch600_w4_fixed_matrix_compute_excess_ccx":306178,"scratch600_w4_fixed_matrix_roundtrip_excess_ccx":627320,"scratch600_w4_fixed_matrix_peak_q":1660,"altseed_classical_total":0,"altseed_phase_batches_total":0,"altseed_ancilla_batches_total":0,"avg_toffoli":4089274,"avg_clifford":24292787.153,"qubits":2713,"emitted_ops":30575944,"correctness_ok":1,"target_scratch_over_tx_ty_q":600},"status":"keep","description":"Charge optimistic w4 fixed-matrix denominator update","timestamp":1777576333598,"segment":7,"confidence":null,"iterationTokens":16172,"asi":{"hypothesis":"If w4 lowword matrices are applied as selected fixed windows rather than per-bit full-pair replay, denominator plumbing might drop below the 14,964 CCX slack opened by the w4 selector oracle.","result":"Optimistic fixed-matrix replacement improves over naive full-pair replay but still costs mean 2,293.87 CCX/window, projected 321,142 CCX compute (306,178 over slack) and peak 1,660q before any selector/QROM. This kills fixed-matrix full-pair plumbing for the w4 selector near-miss.","next_action_hint":"Only consumed-denominator or ratio-specific state updates remain plausible for the w4 BY selector; avoid old+new pair replacement even with free selected matrices."}}
{"type":"config","name":"scratch600 full-ratio selector A-inverse proxy","metricName":"full_ratio_gap_to_2700k_ccx","metricUnit":"","bestDirection":"lower"}
{"run":440,"commit":"25f1759","metric":7252686,"metrics":{"scratch600_full_ratio_a_serial_proxy_mean_ccx":7307490,"scratch600_full_ratio_a_serial_proxy_max_ccx":8892999,"scratch600_full_ratio_projected_toffoli":9952686,"scratch600_full_ratio_gap_to_2700k":7252686,"altseed_classical_total":0,"altseed_phase_batches_total":0,"altseed_ancilla_batches_total":0,"avg_toffoli":4089274,"avg_clifford":24292787.153,"qubits":2713,"emitted_ops":30575944,"correctness_ok":1,"target_scratch_over_tx_ty_q":600},"status":"keep","description":"Kill full-ratio BY selector update by A-inverse proxy","timestamp":1777576490056,"segment":8,"confidence":null,"iterationTokens":166,"asi":{"hypothesis":"A 560-bit full 2-adic ratio state fits the scratch600 history budget, but its A-branch update may require a dense variable inverse that erases the selector win.","result":"The serial A-inverse proxy on real 560-step BY traces is mean 7,307,490 CCX and max 8,892,999 before replay body, projecting 9,952,686 Toffoli (gap 7,252,686). This kills full-ratio h-state selector plumbing as a low-scratch SOTA route.","next_action_hint":"Do not pursue full-ratio h updates unless a new sparse formula eliminates the per-A inverse; remaining selector routes must be consumed/window-local rather than ratio-only."}}
{"type":"config","name":"BY consumed denominator poststate ambiguity","metricName":"consumed_w4_ambiguity_bits","metricUnit":"","bestDirection":"higher"}
{"run":441,"commit":"f14ef04","metric":6,"metrics":{"scratch600_consumed_w4_poststate_patterns":48,"scratch600_consumed_w4_poststate_bits":6,"scratch600_consumed_w8_poststate_patterns":1280,"scratch600_consumed_w8_poststate_bits":11,"scratch600_consumed_w16_poststate_states":589824,"scratch600_consumed_w16_poststate_patterns":589824,"scratch600_consumed_w16_poststate_bits":20,"altseed_classical_total":0,"altseed_phase_batches_total":0,"altseed_ancilla_batches_total":0,"avg_toffoli":4089274,"avg_clifford":24292787.153,"qubits":2713,"emitted_ops":30575944,"correctness_ok":1,"target_scratch_over_tx_ty_q":600},"status":"keep","description":"Quantify consumed-denominator poststate ambiguity at w4","timestamp":1777576623350,"segment":9,"confidence":null,"iterationTokens":165,"asi":{"hypothesis":"A consumed denominator schedule might avoid explicit full-pair plumbing if post-window denominator state identifies the branch pattern; quantify the ambiguity for w4/w8/w16 reverse windows.","result":"Even a 4-step consumed window has 48 valid predecessor branch patterns (6 bits) from the same poststate; depth8 has 1,280 (11 bits), and depth16 has 589,824 (20 bits/states). Branchless poststate recovery is not local, so consumed updates still need explicit pattern/rank history or a reversible window inverse.","next_action_hint":"For BY, only designs that consume pattern+q inside a locally reversible window remain; do not assume denominator poststate can erase selector history."}}
{"type":"config","name":"plusminus parser Google-scratch stress","metricName":"plusminus_unary_over_google_frac","metricUnit":"","bestDirection":"lower"}
{"run":442,"commit":"f14ef04","metric":0,"metrics":{"plusminus_kseq_direction_max_bits_n16":2,"plusminus_kseq_direction_p99_bits_n16":1,"plusminus_kseq_boundary_scratch_p99":759,"plusminus_kseq_unary_scratch_p99":640,"plusminus_kseq_entropy_scratch_p99":640.213,"plusminus_kseq_boundary_scratch_max":774,"plusminus_kseq_unary_scratch_max":657,"plusminus_kseq_unary_over_google_frac":0,"plusminus_kseq_entropy_scratch_max":657.125,"plusminus_kseq_entropy_over_google_frac":0},"status":"crash","description":"Probe plusminus unary parser Google scratch but stale assert assumed failure","timestamp":1777576771984,"segment":10,"confidence":null,"iterationTokens":162,"asi":{"hypothesis":"The plus-minus unary/self-delimiting parser might exceed the Google 663 scratch allowance in the tail even though p99 was 640 under the strict 600 target.","result":"Surprise: on 8192 deterministic samples, unary_scratch_max=657 and entropy_scratch_max=657.125, with over_google_frac=0. The test crashed only because the stale assertion expected max>663. This reopens plus-minus under the 663 Google-low-qubit allowance, but parser Toffoli/cleanup and worst-case exactness remain uncharged.","rollback_reason":"Targeted test assertion encoded the old strict-600 conclusion and failed when the Google-663 stress result was actually promising.","next_action_hint":"Reapply the metrics with a non-crashing assertion, then charge plus-minus unary parser cost/cleanup and max/worst-case more honestly before promoting."}}
{"run":443,"commit":"c314dd7","metric":0,"metrics":{"plusminus_kseq_direction_max_bits_n16":2,"plusminus_kseq_direction_p99_bits_n16":1,"plusminus_kseq_boundary_scratch_p99":759,"plusminus_kseq_unary_scratch_p99":640,"plusminus_kseq_entropy_scratch_p99":640.213,"plusminus_kseq_boundary_scratch_max":774,"plusminus_kseq_unary_scratch_max":657,"plusminus_kseq_unary_over_google_frac":0,"plusminus_kseq_entropy_scratch_max":657.125,"plusminus_kseq_entropy_over_google_frac":0,"altseed_classical_total":0,"altseed_phase_batches_total":0,"altseed_ancilla_batches_total":0,"avg_toffoli":4089274,"avg_clifford":24292787.153,"qubits":2713,"emitted_ops":30575944,"correctness_ok":1,"target_scratch_over_tx_ty_q":663},"status":"keep","description":"Reopen plusminus unary parser under Google-663 scratch samples","timestamp":1777576895700,"segment":10,"confidence":null,"iterationTokens":3013,"asi":{"hypothesis":"The plus-minus k-sequence unary/self-delimiting parser was dismissed under a strict 600-scratch filter, but the actual Google allowance is 663; sample max may fit and reopen the route if parser Toffoli/cleanup can be charged.","result":"On the existing 8192 deterministic sample, unary scratch p99=640 and max=657, entropy scratch max=657.125, with zero samples over the 663 Google-low-qubit allowance. Boundary-bit parser remains too large (p99=759, max=774). This reopens plus-minus only under the 663 allowance, not strict 600, and only as a sampled state-size result; parser circuit, exact worst-case, rank/dense cleanup, and live-recompute blockers remain.","next_action_hint":"Stress plus-minus unary parser with more samples and then charge reversible unary consumption/cleanup. Need exact worst-case or a bounded failure policy before promotion."}}
{"type":"config","name":"plusminus unary Google663 replay proxy","metricName":"plusminus_unary_proxy_gap_p99_to_2700k","metricUnit":"","bestDirection":"lower"}
