{"run":88,"commit":"79985d5","metric":4144928,"metrics":{},"status":"keep","description":"Dropped the dummy with_eq_zero_fast at STEP 0 from the bulk-prefix forward path. It was pure overhead (v_w!=0 guaranteed, so OR chain always produced 0), and the backward never ran it anyway. Saves 153k Toffoli. Now beats the pre-robustness baseline (4.24M -> 4.14M) AND passes the 24-seed multi-seed gate with zero phase/classical/ancilla.","timestamp":1776980329761,"segment":3,"confidence":1.1025511066058455,"iterationTokens":698,"asi":{"hypothesis":"STEP 0's OR chain is pure history overhead on the guaranteed-bulk prefix. Its forward measurement phases self-cancel internally, so both sides can skip the call entirely.","altseed_classical_total":0,"altseed_phase_batches_total":0,"altseed_ancilla_batches_total":0,"sampling_regime":"24 seeds x 4096 shots","qubits":2738,"saved_toffoli":153392,"milestone":"New best beats the non-robust pre-autoresearch line AND is phase-robust.","next_action_hint":"Look for more history overhead in bulk-prefix (dummy HMR scaffolding, z-ancilla pairs, step2 add_dummy). Some of those may also be droppable."}}
{"run":89,"commit":"545eb08","metric":4143712,"metrics":{},"status":"keep","description":"Dropped the z HMR scaffold (STEP 1) and add_dummy scaffold (STEP 2) from bulk-prefix forward. Both were self-cancelling noops. -1216 Toffoli. 24-seed clean.","timestamp":1776980492278,"segment":3,"confidence":1.0531704320524196,"iterationTokens":650,"asi":{"altseed_classical_total":0,"altseed_phase_batches_total":0,"altseed_ancilla_batches_total":0,"qubits":2738,"saved_toffoli":1216,"next_action_hint":"Look for more self-cancelling scaffolds; consider wider STEP 4 cuts."}}
{"run":90,"commit":"545eb08","metric":0,"metrics":{},"status":"crash","description":"Attempted late-iter load_width truncation in bulk-prefix STEP 4 forward only. Backward doesn't match → classical mismatch.","timestamp":1776980552940,"segment":3,"confidence":1.0531704320524196,"iterationTokens":5130,"asi":{"rollback_reason":"Need to match truncation in backward as well; forward-only is asymmetric.","next_action_hint":"Apply matching truncation in kaliski_iteration_bulk_prefix3_backward STEP 4."}}
{"run":91,"commit":"545eb08","metric":0,"metrics":{},"status":"crash","description":"Late-iter truncation in both bulk-prefix step 4 forward and backward. Phase garbage. Subtle: likely load_width and transform_width don't both match the forward's step 4 pre/post state.","timestamp":1776980612622,"segment":3,"confidence":1.0531704320524196,"iterationTokens":4149,"asi":{"rollback_reason":"Phase garbage despite symmetric truncation.","next_action_hint":"Debug: maybe transform_width > load_width causes unloading to add extra phase corrections when u[i] was not loaded. Skip STEP 4 optimization — net savings are small since bulk prefix is only 304 iters but only iters [256..304] benefit."}}
{"run":92,"commit":"545eb08","metric":0,"metrics":{},"status":"crash","description":"Bulk-prefix 340 → fails 5-seed with 136 phase batches.","timestamp":1776980714039,"segment":3,"confidence":1.0531704320524196,"iterationTokens":825,"asi":{"rollback_reason":"Bulk prefix specialization invariant (f=1 & v_w!=0) breaks somewhere between 310 and 340. Termination can occur before iter 340 on some inputs.","next_action_hint":"Bisect between 310 and 340."}}
{"run":93,"commit":"545eb08","metric":0,"metrics":{},"status":"crash","description":"Bulk-prefix 332 → 6 phase batches. 325 is clean.","timestamp":1776980804074,"segment":3,"confidence":1.0531704320524196,"iterationTokens":811,"asi":{"rollback_reason":"Bulk prefix fails at 332 in 5-seed gate.","next_action_hint":"Settle at 325-328."}}
{"run":94,"commit":"545eb08","metric":0,"metrics":{},"status":"crash","description":"Bulk-prefix 328 → 3 phase batches in 5-seed gate. 325 is the frontier on the 5-seed side.","timestamp":1776980825881,"segment":3,"confidence":1.0531704320524196,"iterationTokens":1246,"asi":{"rollback_reason":"Bulk prefix fails at 328.","next_action_hint":"Try 326 and 327 then commit-gate 325."}}
{"run":95,"commit":"545eb08","metric":0,"metrics":{},"status":"crash","description":"Bulk-prefix 325 → fails 24-seed commit gate (2 phase batches). 5-seed had missed this.","timestamp":1776980861036,"segment":3,"confidence":1.0531704320524196,"iterationTokens":1300,"asi":{"rollback_reason":"325 fails at 24 seeds. Validates that 24-seed gate catches rare tails that 5-seed does not.","next_action_hint":"Try 315, 320."}}
{"run":96,"commit":"2f03c2e","metric":4140698,"metrics":{},"status":"keep","description":"Bulk-prefix extended from 304 to 315. Passes 24-seed. -3k Toffoli.","timestamp":1776980946268,"segment":3,"confidence":0.8127359292637306,"iterationTokens":1340,"asi":{"altseed_classical_total":0,"altseed_phase_batches_total":0,"altseed_ancilla_batches_total":0,"qubits":2738,"saved_toffoli":3014,"bulk_prefix":315}}
{"run":97,"commit":"2f03c2e","metric":0,"metrics":{},"status":"crash","description":"Bulk-prefix 320 fails 24-seed (1 batch). 315 is the 24-seed ceiling.","timestamp":1776980981377,"segment":3,"confidence":0.8127359292637306,"iterationTokens":1428,"asi":{"rollback_reason":"Frontier: 315 passes, 320 doesn't.","next_action_hint":"Fixed at 315. Explore other axes."}}
{"run":98,"commit":"2f03c2e","metric":0,"metrics":{},"status":"discard","description":"Replaced 408+405 halve/double calls on lam with in_place_mul_const by 2^{±iters}. Worse by 520k Toffoli — in_place_mul_const costs a full multiplication (2×mul_by_const_acc = ~400k) vs per-call halve/double amortized cost.","timestamp":1776981260973,"segment":3,"confidence":0.8127359292637306,"iterationTokens":30231,"asi":{"rollback_reason":"in_place_mul_const is much more expensive than direct halvings. mul_by_const_acc iterates ~top=256 bits with doublings plus additions at set bits, costing ~256 mod_double + ~128 mod_add per call, and in_place_mul_const does this twice (forward + uncompute via inverse).","next_action_hint":"Need a TRUE batched shift-by-k primitive that amortizes the Solinas correction over k bits, not a full schoolbook multiplication.","estimate_was":"~16k Toffoli; actual cost +520k; underestimated by 30x."}}
{"run":99,"commit":"2f03c2e","metric":0,"metrics":{},"status":"discard","description":"Swapped both in-Kaliski schoolbook muls to karatsuba1. Saves 83k Toffoli (4141k→4057k) BUT blows qubit peak from 2738 → 2996, exceeding the 2800 hard cap. Reverted.","timestamp":1776981446800,"segment":3,"confidence":0.8127359292637306,"iterationTokens":13342,"asi":{"rollback_reason":"Exceeded 2800 hard qubit cap (2996).","saved_toffoli_if_qubits_allowed":83664,"qubits_over_cap":196,"side_note":"autoresearch.checks.sh has a bug: awk matches an unused-function warning line before the actual 'qubits' line, so the cap check is effectively disabled. Not exploiting.","next_action_hint":"Need to reduce qubit peak inside Kaliski before re-enabling karatsuba in-body. Or try karatsuba on just one of the 3 muls."}}
{"run":100,"commit":"2f03c2e","metric":0,"metrics":{},"status":"discard","description":"Karatsuba on just pair1_mul1: also exceeds qubit cap (2996 still). The karatsuba1 temp register blows peak to 2996 even with only one call using it.","timestamp":1776981533000,"segment":3,"confidence":0.8127359292637306,"iterationTokens":5096,"asi":{"rollback_reason":"2996 peak persists from any single karatsuba1 in-Kaliski body. Need structural qubit reduction to free headroom.","next_action_hint":"Attack structural qubit reducers: (1) free v_in during Kaliski body, (2) shrink m_hist via reduced iters, (3) Kim unconditional Kaliski eliminates m_hist (but +9-28% Toffoli)."}}
{"run":101,"commit":"0519bf3","metric":4158098,"metrics":{},"status":"keep","description":"Enabled LOWQ_SHIFT22 by default: -20 qubits (2738→2718) at cost of +17k Toffoli. 24-seed clean. Frees qubit headroom for bigger structural changes.","timestamp":1776981945532,"segment":3,"confidence":0.6488251184383781,"iterationTokens":661,"asi":{"altseed_classical_total":0,"altseed_phase_batches_total":0,"altseed_ancilla_batches_total":0,"qubits":2718,"trade":"+17k Toffoli for -20 qubits"}}
{"run":102,"commit":"0519bf3","metric":0,"metrics":{},"status":"crash","description":"Tried freeing s at forward end. Phase garbage (320 batches, all shots in every batch) confirms s has quantum dependence on v_in post-forward — not a classical constant. 256-qubit saving not available via free+realloc.","timestamp":1776982027020,"segment":3,"confidence":0.6488251184383781,"iterationTokens":8674,"asi":{"rollback_reason":"s is quantum-entangled with v_in post-forward.","learning":"Of the Kaliski persistent state (u, v_w, r, s, f, m_hist), only u/v_w/f are classical at forward-end. s and r carry quantum state.","next_action_hint":"Attack m_hist (408 qubits) by finding a way to not store it OR attack the combined footprint of persistent state during body."}}
{"run":103,"commit":"0519bf3","metric":0,"metrics":{},"status":"crash","description":"Replaced mod_double_inplace_fast → mod_double_inplace (non-fast) in kal_step6_7_8 and matching bk_step6_7_8 + bulk variants to cut peak qubits. Consistent phase failure on seed 5 at 24-seed gate. Root cause likely the latent r[255]=1 edge case in bulk prefix iters 255-314 (which I also tried to patch by adding a p-parameterized mod_halve_inplace to bulk_backward, but the overall combination still hits a measurement/phase inconsistency).","timestamp":1776982564945,"segment":3,"confidence":0.6488251184383781,"iterationTokens":1647,"asi":{"rollback_reason":"1 phase batch on seed 5, deterministic.","hypothesis":"Mixing non-fast double forward with emit_inverse-style halve backward (which uses ops differently) produces mismatched phase when the bulk prefix range covers iters where r[255] could be 1. Fix requires unified non-fast variants everywhere that match structurally.","next_action_hint":"Write mod_halve_inplace_slow that is EXPLICITLY the gate inverse of mod_double_inplace (non-fast, no emit_inverse) so forward and backward both use non-fast Cuccaro symmetrically. Or keep fast variants and reduce peak elsewhere.","latent_bug_noted":"autoresearch.ideas.md now documents the bulk_prefix backward r[255]=1 latent bug."}}
{"run":104,"commit":"0519bf3","metric":0,"metrics":{},"status":"discard","description":"Non-fast double in GENERIC kal_step6_7_8 only (not bulk). Peak unchanged (2718) because bulk is still at peak. +281k Toffoli with no qubit win.","timestamp":1776982744339,"segment":3,"confidence":0.6488251184383781,"iterationTokens":10673,"asi":{"rollback_reason":"Hit peak moved to bulk_step6_7_8; generic-only replacement didn't help.","next_action_hint":"Apply to bulk_step6_7_8 forward + backward together. Fix the r[255]=1 latent bug at the same time."}}
{"run":105,"commit":"0519bf3","metric":0,"metrics":{},"status":"discard","description":"Non-fast double/halve in bulk AND generic step6_7_8. +215k Toffoli and still 2718 qubits. Peak simply moved to kal_bulk_step4 (where tmp + fast Cuccaro carries also sum to base+513). Peak-chasing without a global cover is futile.","timestamp":1776982905557,"segment":3,"confidence":0.6488251184383781,"iterationTokens":6347,"asi":{"rollback_reason":"Whack-a-mole: peak moves to the next site. Need to reduce transient cost at ALL sites simultaneously.","learning":"Peak in our current circuit occurs at multiple sites with ~513 transient each: step4 (tmp 256 + Cuccaro carries 255), step6_7_8 (const load 257 + Cuccaro carries 255). Need structural change that drops ALL of them.","next_action_hint":"Write a general non-fast constant add/sub primitive used everywhere. Or attack m_hist (408 qubits persistent). Or accept the 2718 peak and focus on Toffoli."}}
{"run":106,"commit":"0519bf3","metric":0,"metrics":{},"status":"discard","description":"Full Bennett with_kal_inv_raw_bennett: qubits WENT UP to 2974 (not down!) because inv register persists through body alongside ALL the body temps, AND Kaliski state is alloced during the compute-copy-uncompute rounds. Toffoli blew up to 7.37M. Misestimated — Bennett helps when body doesn't need Kaliski state AND the peak is IN body, but our body actually has lower native peak than the Kaliski iteration body.","timestamp":1776983318845,"segment":3,"confidence":0.6488251184383781,"iterationTokens":20674,"asi":{"rollback_reason":"Bennett is not the right attack for THIS code path. Peak is inside Kaliski iteration body (kal_bulk_step4) not inside the mul body.","next_action_hint":"Analyze the 2718 peak structurally — the transient allocations inside kal_bulk_step4 are where to cut. Start from the known-good 4.14M/2718q state and do a full qubit-budget trace at peak phase.","toffoli_cost_seen":7374779,"qubit_peak_seen":2974}}
{"run":107,"commit":"0519bf3","metric":0,"metrics":{},"status":"crash","description":"Deferred lam alloc into pair1 Kaliski closure. Peak drops from 2718→2717 (just -1 because new peak is pair1_mul1 where Cuccaro carries still dominate). Fails 24-seed gate on tag 13 (1 phase batch) — reordering alloc changes qubit IDs which shifts HMR randomness into a state whose aggregated phase XOR flips bit for one sample.","timestamp":1776983618871,"segment":3,"confidence":0.6488251184383781,"iterationTokens":5515,"asi":{"rollback_reason":"24-seed tag 13 phase batch. Reordering alloc IDs changes HMR XOF-RNG byte consumption order which can surface rare branch-dependent phase signatures even when circuit is algorithmically equivalent.","tracer_finding":"Peak at 2718 was dominated by: kal_bulk_step4 (iter body with tmp+carries), pair1_mul1 (Solinas with fast Cuccaro), pair2_kaliski_forward (same structure). Deferring lam only helps the iter body peak.","next_action_hint":"Use a less-intrusive structural move that doesn't reshuffle qubit IDs — e.g. address the Solinas peak directly, or implement Kim unconditional Kaliski properly."}}
{"run":108,"commit":"351c0f7","metric":4188698,"metrics":{},"status":"keep","description":"BUG FIX: bulk_prefix3_backward step6_7_8 was unconditionally mod_halve_no_corr, but forward uses mod_double_inplace_fast for iter_idx >= R_SMALL_THRESHOLD (255..315). Cases where r[255]=1 pre-double would produce incorrect reversal. Latent bug that happened to not manifest in tested seeds. Now matched. +30k Toffoli (64 bulk iters × n CCX for Solinas halve).","timestamp":1776984207333,"segment":3,"confidence":0.8036958879463272,"iterationTokens":23687,"asi":{"altseed_classical_total":0,"altseed_phase_batches_total":0,"altseed_ancilla_batches_total":0,"qubits":2718,"bug":"bulk_prefix3_backward r[255]=1 case was miscomputed","cost":30600,"next_action_hint":"Continue hunting bugs (HMR ID-reorder bug, etc.) and structural wins."}}
{"run":109,"commit":"827b030","metric":4188698,"metrics":{},"status":"keep","description":"Lam-defer now works (previous bulk-backward bug fix closed the r[255]=1 edge case). -1 qubit (2718→2717). 24-seed gate clean. Confirms the latent bug was indeed surfacing only under specific ID orderings.","timestamp":1776984322693,"segment":3,"confidence":1.0556807138439792,"iterationTokens":3338,"asi":{"altseed_classical_total":0,"altseed_phase_batches_total":0,"altseed_ancilla_batches_total":0,"qubits":2717,"bug_validation":"Previous fix closed the HMR ID-reorder sensitivity as well, because both bugs were the same (r[255]=1 causing phase garbage via the incorrect bulk backward halve)."}}
{"run":110,"commit":"827b030","metric":0,"metrics":{},"status":"discard","description":"Non-fast double/halve in all step6_7_8 sites. +466k Toffoli (4189→4655k), qubits unchanged (2717) because peak is at pair1_mul1 not step6_7_8. Confirms: peak chasing without global cover is futile; Solinas inside mul is the bottleneck now.","timestamp":1776984486323,"segment":3,"confidence":1.0556807138439792,"iterationTokens":9014,"asi":{"rollback_reason":"Peak unchanged; the +466k Toffoli cost is not compensated by any peak reduction. Peak moved to pair1_mul1 and stays there.","next_action_hint":"Target the Solinas transient inside mod_mul_*_schoolbook. The dominant transient is the cadd_nbit_const_fast inside mod_double_inplace_fast calls during Solinas reduction, plus the mod_shift_left_by_k."}}
{"run":111,"commit":"827b030","metric":0,"metrics":{},"status":"discard","description":"Non-fast cuccaro in controlled_add_subtract + mod_add_qq_fast. +485k Toffoli, peak unchanged at 2717. Peak is likely from a different source within pair1_mul1.","timestamp":1776984756364,"segment":3,"confidence":1.0556807138439792,"iterationTokens":4530,"asi":{"rollback_reason":"Peak unchanged despite huge Toffoli cost. Peak inside pair1_mul1 must come from somewhere specific we haven't attacked — likely the Solinas shift22 or cmp_lt_into_fast.","next_action_hint":"Add fine-grained TRACE_PEAK that sets b.peak_ops_idx per-phase-change so we can identify the *exact* op position of peak."}}
{"run":112,"commit":"827b030","metric":0,"metrics":{},"status":"discard","description":"Non-fast Cuccaro everywhere at peak sites: peak 2717→2715 (-2q), cost +1.1M Toffoli. Peak is dominated by step4's tmp(256) + persistent Kaliski state. Marginal qubit wins are not the path to SOTA — need structural change.","timestamp":1776985238976,"segment":3,"confidence":1.0556807138439792,"iterationTokens":11484,"asi":{"rollback_reason":"Marginal qubit reduction at high Toffoli cost. Peak-chasing within current architecture is capped at ~2700q because Kaliski persistent state (u+v_w+r+s+m_hist = ~1433q) dominates.","conclusion":"Cannot reach SOTA 1175q within current Kaliski architecture. Need structural replacement of the inversion algorithm."}}
{"run":113,"commit":"827b030","metric":0,"metrics":{},"status":"discard","description":"Hybrid Kaliski-jump investigation: confirmed prior session's conclusion. The current bulk_prefix3 integration already captures all achievable savings from this research line. The 1,153-CCX \"staged exact-3\" figure is a lower bound only — not a directly implementable forward primitive, because cmp1/cmp2 are not derivable from initial state (requires actually reaching u1,v1,u2,v2) and HMR doesn't extract classical values from quantum qubits (it returns RNG). No residual win available from this route.","timestamp":1776985661491,"segment":3,"confidence":1.0556807138439792,"iterationTokens":11484,"asi":{"conclusion":"Hybrid Kaliski-jump direction is fully exploited by current bulk_prefix3. No new implementation path identified.","validated_against":"research_notes.md lines 351-720, specifically the Assumption-A-refutation measurement showing 385 CCX lower bound is NOT a real primitive cost (3,873 CCX is the actual cost with controlization).","status":"Session ceiling confirmed at 4.19M / 2717q."}}
{"run":114,"commit":"827b030","metric":4188698,"metrics":{},"status":"discard","description":"Added `csub/cadd_nbit_const_fast_borrowed` and `mod_double/halve_inplace_fast_borrowed` primitives that borrow scratch from m_hist future bits. Threaded Option<&[QubitId]> scratch parameter through kaliski_iteration_bulk_prefix3. Peak unchanged (2717) because at peak iter_idx>=R_SMALL_THRESHOLD=255, m_hist only has ~152 clean bits left, less than 256-wide scratch needed. Proper fix requires narrow Cuccaro + carry propagation (multi-day task).","timestamp":1776991454912,"segment":3,"confidence":0.877226468941848,"iterationTokens":165640,"asi":{"rollback_reason":"No peak change: peak iter has insufficient clean persistent qubits for n-wide scratch borrowing.","next_action_hint":"Implement narrow-Cuccaro + carry-propagate const-sub that needs only ~67 qubits instead of 257 — this is a real structural win but requires proper carry management. Alternatively implement Gidney's venting measurement-based carry uncompute."}}
{"run":115,"commit":"eca3fa1","metric":5368874,"metrics":{},"status":"discard","description":"Full Gidney 2025 venting-adder port (3-clean adder + carry-xor) replacing add/sub/cadd/csub_nbit_const_fast. Benchmark/checks passed and phase-clean, but avg_toffoli regressed 4.236M -> 5.369M with qubits unchanged at 2717. Not a viable drop-in replacement for this workload.","timestamp":1776993563582,"segment":3,"confidence":0.6919780522056375,"iterationTokens":165640}
