{"run":150,"commit":"1d639dd","metric":4180502,"metrics":{},"status":"keep","description":"Added creative_attempts_log.md documenting all 10 ambitious experiments tried this session. Final conclusion: Google's withheld circuit (1175q/2.7M) achieves SOTA using coset representation + windowed arithmetic + Litinski scaffold combined in ways not publicly detailed. Within current harness constraints (only edit src/point_add/, inputs tx/ty are standard 256-bit registers expecting canonical output), no public method matches that performance. Luo 2025 achieves 1333q but with 200M Toffoli — a 50x Toffoli regression vs our current. Jacobian coordinates analysis showed ~5.5M Toffoli with no peak reduction. Coset representation requires harness modification (out of scope) or c_pad=0 with failure tolerance (fails correctness gate). Montgomery-form would save ~200k CCX but requires full circuit rewrite. The current 4.18M/2716q represents the efficient frontier achievable within these constraints.","timestamp":1777076759298,"segment":3,"confidence":11.6634943875061,"iterationTokens":16818,"asi":{"hypothesis":"After 10 ambitious experiments, the conclusion is: Google's withheld circuit is novel beyond public literature. Public methods cannot simultaneously hit 1200q AND 3M Toffoli. Luo 2025 trades 50x more Toffoli for qubit reduction. Within our harness constraints, 4.18M/2716q is the frontier.","experiments_tried":["classical m_hist via HMR (phase fail)","step 9 removal (trajectory divergence)","rowwise mul (no peak reduction, phase bug at 1/20480)","non-fast cuccaro backward (no peak reduction)","schoolbook_lowq wire-in (pre-existing phase bug)","Jacobian coordinates analysis (5.5M Toffoli, no peak reduction)","coset representation (requires harness change)","Montgomery form (requires full circuit rewrite)","iters 402/402 (-28k Toffoli but below 24-seed threshold)","bulk halve via mul const (3x worse)"],"frontier":"4.18M Toffoli / 2716 qubits. Matches Litinski 2023.","next_session_hint":"Either (A) full Luo rewrite for qubit reduction (accepts 200M Toffoli) or (B) harness modification + coset representation (unblocks 60% modular-add savings) — both require coordination with user on scope."}}
{"run":151,"commit":"04f8958","metric":4180502,"metrics":{},"status":"keep","description":"CONFIRMED harness match with Google 2026 ZKP (Zenodo 10.5281/zenodo.19597130): same 9024 test cases, same SHAKE256 XOF, same 4-register layout (256q+256q+256b+256b), same kickmix-compatible instruction set, same phase-garbage/ancilla-garbage checks. Google achieves 1175q/2.7M Toffoli (low-qubit proof) using coset representation + windowed arithmetic + Gidney's venting adders (arxiv 2507.23079). Their circuits are NOT released, only the ZK proofs. Found and documented the venting adder (4n Toffoli with 3 clean qubits vs our Cuccaro's n-1 carries and n-1 ancilla); saves n-1 ancilla per add site at cost of 3n extra Toffoli. Added src/point_add/google_harness_match.md with full analysis. Current position: 2716q / 4.18M Toffoli is 2.3x their qubits, 1.55x their Toffoli. Real path to close gap requires porting Gidney's venting adder (multi-session, ~500-1000 lines of Rust).","timestamp":1777078386858,"segment":3,"confidence":11.6634943875061,"iterationTokens":17311,"asi":{"hypothesis":"Harness match with Google confirmed. Google's 1175q/2.7M achievement uses: (1) coset representation for cheap non-modular adds, (2) Gidney windowed arithmetic, (3) Gidney 2025 venting adders (arxiv 2507.23079) using 3 clean qubits + n-2 dirty ancilla. We have identified the specific venting adder technique as the most impactful transferable piece.","google_numbers":{"low_qubit_variant":"1175 qubits, 2,700,000 Toffoli, 17M total ops","low_gate_variant":"1425 qubits, 2,100,000 Toffoli, 17M total ops","our_current":"2716 qubits, 4,180,502 Toffoli"},"actionable_next":"Port Gidney's venting adder from arxiv 2507.23079 (Python code at zenodo 15866587). Key primitives: circuit_to_iadd_using_3_clean_qubits, circuit_to_add_using_2_clean_qubits_and_venting_carries, circuit_to_xor_right_shifted_carries_into. Would reduce peak by n per add-site at cost of 3n extra Toffoli per add. Expected final position: ~1800q / ~6M Toffoli (still above Google but closes half the qubit gap).","identified_peak_location":"pair1_mul1 phase correction 3: full-width sub extends x with n+1 pad qubits (wide = 2n+1 bits). At ops_idx=6091381 peak hits 2716 after 254 consecutive alloc_qubit calls for padding. A cleaner fix via 1-pad-bit + borrow-ripple was sketched but requires careful cuccaro borrow analysis that's non-trivial."}}
{"run":152,"commit":"722b8d2","metric":4180502,"metrics":{},"status":"keep","description":"Started porting Gidney's venting adder (arxiv 2507.23079) as new src/point_add/venting.rs module. First primitive implemented + tested: xor_right_shifted_carries_into_classical (Häner-Roetteler-Soeken's carry-xor construction). 160/160 random test cases pass at n=1..8. This is the foundational primitive for the 3-clean-qubit vented add that Google uses internally. Added sota_plan.md with concrete 3-session roadmap: session 2 = full venting port + wiring (expected 2716q→2460q, 4.18M→5.5M Toffoli), session 3 = Luo register sharing (→1800q at 50M Toffoli tradeoff), session 4 = coset representation (→3M Toffoli). Identified specific peak triggers: all 4 peak-2716 sites share cause of n-wide ancilla alloc (mul correction-3 padding OR const-sub's materialized constant). Fix requires Gidney-style venting at all those sites. Baseline metrics unchanged at 4.18M/2716q.","timestamp":1777080021939,"segment":3,"confidence":11.6634943875061,"iterationTokens":24829,"asi":{"hypothesis":"Concrete SOTA roadmap established. Started porting Gidney 2025 venting adder. First primitive (carry-xor, 2n CCX with 0 clean ancilla) fully implemented + tested. This is a MULTI-SESSION path — full venting port = session 2, Luo register sharing = session 3, coset representation = session 4. Target after all 3: ~1500-1800q / ~3-5M Toffoli, within 1.5x of Google on both axes.","venting_port_status":{"carry_xor":"DONE, tested at n=1..8 with 160 trials","add_vented_2clean":"NEXT","iadd_3clean":"After vented_2clean","iadd_dirty_2clean":"After 3clean"},"ref_python_code":"/tmp/gidney_venting/code/src/constadd/","identified_peak_triggers":"All 2716q peaks share the n-wide ancilla alloc pattern. Fix requires replacing csub_nbit_const_fast + schoolbook correction-3 sub with venting versions.","next_action_hint":"In venting.rs: port add_vented_2clean (Figure 2 in Gidney paper) from _add_2_clean_vented.py. Test independently. Then port iadd_3clean (Figure 5). Wire into mod_halve_inplace_fast and schoolbook_mul_into_addsub correction 3. Expected peak drop 2716→2460."}}
{"run":153,"commit":"4ca8f11","metric":4180502,"metrics":{},"status":"keep","description":"Second venting primitive ported + tested: add_vented_2clean_classical (Gidney 2025 Figure 2). Performs n-bit classical-quantum add using only 2 clean ancilla (alternating via k%2) by venting carries via HMR as they're computed. Leaves n-2 phase-flip tasks in classical vent_keys for later correction. Tested n=2..8 × 20 trials each = 140/140 correctness cases pass. Also confirmed first primitive (carry-xor) still passes its 160 tests. Now have building blocks for full iadd_3clean (Figure 5) which is the actual drop-in replacement for our csub_nbit_const_fast. Next: wire the 3-clean adder together + test it + wire into mod_halve_inplace_fast to demonstrate peak reduction 2716→~2460. Baseline 4.18M/2716q still unchanged; added infrastructure is test-only.","timestamp":1777080208965,"segment":3,"confidence":11.6634943875061,"iterationTokens":10242,"asi":{"hypothesis":"Gidney venting adder port progressing well. Two building-block primitives tested and working. Next is to compose them into iadd_3clean (the actual usable const-add with 3 clean ancilla and 4n Toffoli).","progress":{"carry_xor":"DONE + 160 tests passing","add_vented_2clean":"DONE + 140 tests passing","iadd_3clean":"NEXT","wire_into_csub_nbit_const":"AFTER iadd_3clean"},"reference":"/tmp/gidney_venting/code/src/constadd/_add_3_clean.py","next_action_hint":"Port circuit_to_iadd_using_3_clean_qubits: split n-bit add into two halves, each half runs add_vented_2clean, with cross-borrow for dirty ancilla. Main complexity: the phase correction via 2 carry-xors at end, with classically-controlled Z gates to convert vent bits into actual phase flips."}}
{"run":154,"commit":"d856873","metric":4180502,"metrics":{},"status":"keep","description":"Third Gidney venting primitive ported + tested: iadd_linear_clean_classical (HRS 2017, arxiv 1709.06648). Uses n-2 clean ancilla with n±O(1) CCX to perform classical-quantum add. 160/160 tests pass at n=1..8. Together with the prior two primitives (carry_xor + add_vented_2clean), this gives 3 working building blocks. Next step: compose iadd_3clean (Figure 5) which wraps add_vented_2clean + HRS fallback + carry_xor phase corrections into the full drop-in replacement. Once complete, wire into csub_nbit_const_fast (which is THE peak driver in our backward Kaliski step 6-7-8) to demonstrate peak reduction. Baseline 4.18M/2716q unchanged; all 3 primitives are test-only infrastructure.","timestamp":1777080407854,"segment":3,"confidence":11.6634943875061,"iterationTokens":14962,"asi":{"hypothesis":"Venting adder port making concrete progress. Three of four needed primitives are DONE AND TESTED: xor_right_shifted_carries_into_classical (160 tests), add_vented_2clean_classical (140 tests), iadd_linear_clean_classical (160 tests). Next: iadd_3clean composite + wire into csub_nbit_const_fast.","venting_port_status":{"xor_right_shifted_carries_into_classical":"DONE + tested (160 trials)","add_vented_2clean_classical":"DONE + tested (140 trials)","iadd_linear_clean_classical":"DONE + tested (160 trials)","iadd_3clean":"NEXT - composes the above","iadd_dirty_2_clean":"After iadd_3clean for the fallback path","wire_into_csub_nbit_const":"FINAL - to demonstrate peak reduction"},"estimated_remaining_effort":"iadd_3clean = 100-150 lines Rust + ~80 lines test. iadd_dirty_2_clean = 80 lines + 60 tests. Wiring = 50 lines. Total ~500 lines + tests. 2-3 hours focused work.","expected_outcome_when_wired":"peak 2716→2460, Toffoli 4.18M→5.5M. Or if carefully applied at ALL peak sites (mul corrections + halve + Kaliski step 4), peak could drop further. Each wired site yields another ~256q save if it was a peak-trigger."}}
{"run":155,"commit":"b3ac289","metric":4180502,"metrics":{},"status":"keep","description":"Fourth venting primitive initial port: iadd_dirty_2clean_classical (Gidney 2025 Figure 4). Sum in q_target is CORRECT but phase leaks and q_dirty perturbed — needs the vented add's carry_xor_target merging path to be ported. Marked test #[ignore]-d with a clear docstring explaining the gap. Primitive infrastructure is now: (1) carry-xor DONE, (2) add_vented_2clean DONE, (3) iadd_linear_clean DONE, (4) iadd_dirty_2clean PORTED_BUT_INCOMPLETE. To finish: need to either extend add_vented_2clean to accept a carry_xor_target (matching Python's `carry_xor_target=[None]+Q_dirty`) or re-derive the correct phase-correction sequence. Once fixed, wire into csub_nbit_const_fast to reduce backward Kaliski step 6-7-8 peak from 2716 to ~2460. Baseline 4.18M/2716q unchanged.","timestamp":1777080619793,"segment":3,"confidence":11.6634943875061,"iterationTokens":11682,"asi":{"hypothesis":"iadd_dirty_2clean initial port reveals the crucial detail I missed: Python's add_vented_2clean merges the carry-xor into the vented add via carry_xor_target. Our separated port produces correct sum but leaks phase. This is the specific remaining task to unblock the full venting infrastructure.","what_works":"Three primitives fully tested: carry_xor, add_vented_2clean (basic), iadd_linear_clean. Dirty_2clean produces correct sum.","whats_broken":"iadd_dirty_2clean: phase leak + dirty perturbation. Root cause: add_vented_2clean_classical doesn't yet support carry_xor_target=[None]+Q_dirty which is needed to write carries INTO dirty DURING the vented add (so they're absorbed in the right positions).","fix_plan":"Extend add_vented_2clean_classical signature to accept optional carry_xor_target: &[Option<QubitId>]. Inside the k-loop, if carry_xor_target[k].is_some(), apply cx(carries[k], carry_xor_target[k]). This mirrors Python line: `if carry_xor_target is not None and k < len(carry_xor_target) and carry_xor_target[k] is not None: out.cx(carries[k], carry_xor_target[k])`","next_steps_ordered":["Extend add_vented_2clean with carry_xor_target param","Re-port iadd_dirty_2clean using extended vented_add + full phase-correction sandwich","Verify iadd_dirty_2clean passes phase+correctness+dirty-preservation tests","Port iadd_3clean (which just wires iadd_dirty_2clean + iadd_linear_clean)","Wire iadd_3clean into csub_nbit_const (opt-in via env var)","Measure peak reduction"]}}
{"run":156,"commit":"a0cd597","metric":4180502,"metrics":{},"status":"keep","description":"Venting adder infrastructure now has SIX tested primitives, up from three. Fixed iadd_dirty_2clean_classical by merging carry-xor-into-dirty via new add_vented_2clean_classical_cxt (extended with optional carry_xor_target param). Added controlled variants: ciadd_dirty_2clean_classical and cisub_dirty_2clean_classical. All 6 tests pass (n=5..10 × 10 trials each = 300 correctness+phase cases for controlled variants). Attempted to wire cisub into mod_halve_inplace_fast (via new _with_dirty variant) at backward Kaliski step 6-7-8, but that introduced 320 phase-garbage batches in the main experiment. Phase issue likely due to the venting adder's HMR randomness interacting with Kaliski's broader phase-tracking across multiple iters (the primitive is phase-clean standalone but something in the wiring context causes leak). Reverted the wiring; primitives remain as infrastructure. Baseline 4.18M/2716q unchanged.","timestamp":1777081243212,"segment":3,"confidence":15.574128380579994,"iterationTokens":5384,"asi":{"hypothesis":"Venting adder port now has 6 working primitives including the crucial iadd_dirty_2clean and its controlled variant cisub_dirty_2clean. All test phase-clean standalone. Wiring into Kaliski fails with phase leak - something about the Kaliski iteration sequence interacts poorly with the HMR measurement cascade. Need to understand and fix the phase interaction before actual wiring pays off.","primitives_ready":["xor_right_shifted_carries_into_classical (160 tests)","add_vented_2clean_classical + _cxt (140 tests)","iadd_linear_clean_classical (160 tests)","iadd_dirty_2clean_classical (70 tests including phase+dirty checks)","ciadd_dirty_2clean_classical (60 tests)","cisub_dirty_2clean_classical (60 tests)"],"wiring_blocker":"cisub_dirty_2clean wired into mod_halve_inplace_fast at backward Kaliski step 6-7-8 fails with 320 phase-garbage batches. Possible causes: (a) the Kaliski forward uses mod_double_inplace_fast, backward uses mod_halve_inplace_fast which needs to be the gate-inverse; but venting halve uses HMR which isn't gate-invertible. (b) dirty qubit state (u=1, v_w=0 at backward entry) produces specific patterns that don't cancel the vent phases.","next_action_hint":"Next session: debug the phase leak. Possibly wire cisub into FORWARD Kaliski first (not backward) since forward doesn't need gate-inverse reversal. Or wire into sol_halve_tail in mul (used in Solinas). Once phase is clean in wiring, measure peak to confirm n-wide ancilla allocation burst is gone. Target: peak 2716→2460."}}
{"run":157,"commit":"120b219","metric":4180502,"metrics":{},"status":"keep","description":"Major debugging: identified and fixed u64 shift UB bug in venting primitives. Rust's `x >> k` for k>=64 produces undefined (platform-specific) behavior — on x86_64 release, `x >> 64 == x` due to shift-amount masking. This caused my venting adder to treat ghost bits (96, 128, etc.) as set when the offset had bits only below 64. Fixed with `if k >= 64 { false } else { (x >> k) & 1 != 0 }` in all 6 occurrences. After fix: the phase-garbage-batches count dropped from 320 to 1 when venting halve is wired into backward Kaliski step 6-7-8. Added 7th venting primitive: add_vented_2clean_qoffset (quantum-offset variant) with its own iadd_dirty_2clean_qoffset and isub_dirty_2clean_qoffset — these are what we need to replace schoolbook correction-3's full-width sub (which is THE peak trigger). All 7 venting tests pass (n=1..10 × trials = ~600 correctness+phase cases). Baseline 4.18M/2716q still unchanged. Next: actually wire the qoffset variant at correction 3 to reduce peak.","timestamp":1777089022258,"segment":3,"confidence":23.429901960784314,"iterationTokens":19959,"asi":{"hypothesis":"u64 shift UB at k>=64 was the root cause of the earlier 320 phase-garbage batches when wiring venting into Kaliski. Fixed. Now the venting adder is correct at n=256 but still needs the quantum-offset variant for schoolbook correction-3 (which uses a QUANTUM x as offset, not a classical constant).","shift_bug_detail":"Rust debug panics on `x >> k` for k >= bit_width. Rust release (with -O) does masked shift (k % bit_width). So `x >> 64` returns `x` on x86_64, not 0. This silently caused the venting primitive to apply extra Xs at positions 64, 128, 192 in n=256 calls, creating unbalanced phase tasks.","primitives_tested":7,"test_count_cumulative":"approximately 1000 correctness+phase cases across all primitives at n=1..10","wiring_progress":{"backward_kaliski_halve":"achieves 1 residual phase batch out of 20480 shots — promising but still fails assertion","correction_3_sub":"needs quantum-offset venting variant which is now ported but not yet wired"},"next_action_hint":"Wire isub_dirty_2clean_qoffset into schoolbook_mul_into_addsub correction 3. The sub there is 2n+1 wide; use qoffset variant on wide[0..n+1] with x and a pad, capturing borrow into wide[n+1], then explicit borrow-ripple into upper bits of wide. Expected: peak drop from 2716 to ~2460."}}
{"run":158,"commit":"8a9737b","metric":4180502,"metrics":{},"status":"keep","description":"Added 2 more venting tests (total 9 passing): test_cisub_dirty_large verifies cisub at n=256 with 50 random trials (all pass); test_cisub_dirty_kaliski_pattern verifies cisub at n=256 with dirty[0]=1, dirty[1..]=0 Kaliski-like pattern (all pass). The venting primitive is CONFIRMED correct at n=256 in isolation. But when wired into actual Kaliski backward, 1 phase batch out of 20480 shots leaks (deterministic at seed=3). Must be a context-specific interaction between multiple sequential venting calls in the Kaliski iter chain that my standalone tests don't catch. Toffoli metric unchanged at 4.18M; wiring remains reverted.","timestamp":1777089680664,"segment":3,"confidence":46.85980392156863,"iterationTokens":19170,"asi":{"hypothesis":"Venting primitive is correct at n=256 but has a subtle context-dependent phase leak in Kaliski integration. Primitive passes 9 tests + 50 n=256 trials + Kaliski-dirty-pattern trials. The 1/20480 failure at seed=3 in integration suggests an interaction across many sequential calls that standalone tests miss.","primitives_tested_count":9,"total_trial_count_n256":100,"wiring_phase_leak_mystery":"Specific seed-3 shots fail. Could be due to: (a) multiple cisub calls' vent_keys creating non-cancelling phase accumulation, (b) some edge case in dirty register patterns from Kaliski state evolution, (c) interaction with mod_halve's surrounding swap chains.","next_angle":"Try a completely different structural optimization or debug the seed-3 phase leak more systematically via bisection. Alternatively, try wiring venting at a DIFFERENT site (schoolbook correction) where the context is different."}}
