{"run":497,"commit":"d56c115","metric":1438172,"metrics":{"plusminus_barrel_budget_step257_ccx":10243,"plusminus_barrel_budget_steps":202,"plusminus_barrel_budget_two_div_step_only":4138172,"altseed_classical_total":0,"altseed_phase_batches_total":0,"altseed_ancilla_batches_total":0,"avg_toffoli":4089274,"avg_clifford":24292787.153,"qubits":2713,"emitted_ops":30575944,"correctness_ok":1},"status":"keep","description":"Update barrel physical-step budget after Clifford k extraction","timestamp":1777587828493,"segment":64,"confidence":null,"iterationTokens":172,"asi":{"hypothesis":"The Clifford threshold-XOR k extraction should materially reduce the explicit physical barrel-step budget, but likely still leave naive per-step physical shifts above the 2.7M target.","result":"Budget targeted run passed full checks. Step257 drops from 14,355 to 10,243 CCX; two DIVs over 202 steps drop from 5,799,420 to 4,138,172 step-body CCX. Gap to 2.7M is still +1,438,172 before scaffold/scale, so naive physical barrel shifting remains gate-dead despite the zero-Toffoli k extraction improvement.","next_action_hint":"Investigate shifted-lane offset/relabel or amortized/batched shift representations; do not integrate per-step physical barrel shifts into the 257-bit point-add path."}}
{"type":"config","name":"plusminus denominator offset-lane width pressure","metricName":"plusminus_offset_den_over257_max","metricUnit":"","bestDirection":"lower"}
{"run":498,"commit":"313888b","metric":138,"metrics":{"plusminus_offset_den_raw_width_p99":382,"plusminus_offset_den_raw_width_max":395,"plusminus_offset_den_total_align_p99":657,"plusminus_offset_den_total_align_max":714,"plusminus_offset_den_max_align_p99":19,"plusminus_offset_den_max_align_max":26,"altseed_classical_total":0,"altseed_phase_batches_total":0,"altseed_ancilla_batches_total":0,"avg_toffoli":4089274,"avg_clifford":24292787.153,"qubits":2713,"emitted_ops":30575944,"correctness_ok":1},"status":"keep","description":"Quantify denominator offset-lane width pressure for plusminus","timestamp":1777588046395,"segment":65,"confidence":null,"iterationTokens":159,"asi":{"hypothesis":"A shifted-lane offset/relabel representation might avoid per-step physical denominator shifts without blowing scratch, if raw lane widths and alignment deltas stay small.","result":"Sampled denominator offset model shows alignment deltas are modest (max per-step 26, p99 total 657), but raw denominator lane widths grow to p99=382 and max=395 bits, i.e. +138 over a 257-bit lane. So a naive denominator offset representation avoids barrel-shift Toffoli only by exceeding the 600/663 scratch envelope unless widths are periodically normalized or packed into other slack.","next_action_hint":"Try coefficient-only offset representation or periodic denominator renormalization; naive no-shift denominator offsets should not be integrated as-is."}}
{"type":"config","name":"plusminus coefficient offset-lane width pressure","metricName":"plusminus_offset_coeff_over257_max","metricUnit":"","bestDirection":"lower"}
{"run":499,"commit":"02dfb7a","metric":0,"metrics":{"plusminus_offset_coeff_raw_width_p99":257,"plusminus_offset_coeff_raw_width_max":257,"plusminus_offset_coeff_total_align_p99":658,"plusminus_offset_coeff_total_align_max":736,"plusminus_offset_coeff_max_align_p99":19,"plusminus_offset_coeff_max_align_max":31,"altseed_classical_total":0,"altseed_phase_batches_total":0,"altseed_ancilla_batches_total":0,"avg_toffoli":4089274,"avg_clifford":24292787.153,"qubits":2713,"emitted_ops":30575944,"correctness_ok":1},"status":"keep","description":"Show coefficient offset lanes stay within 257-bit envelope","timestamp":1777588204344,"segment":66,"confidence":null,"iterationTokens":161,"asi":{"hypothesis":"Unlike denominator offsets, coefficient-lane offsets may avoid physical cv<<k shifts while keeping raw signed lanes within the 257-bit finite-width envelope.","result":"Sampled coefficient offset model passed: raw width p99/max is exactly 257 bits, over257=0, while exponent alignment deltas are modest (p99 max per-step 19, max 31). This suggests coefficient physical barrel shifts can be replaced by offset metadata without scratch blowup. Denominator offsets remain blocked by 395-bit raw widths.","next_action_hint":"Build a toy reversible coefficient-offset add/sub step or cost model: compute cd=cu*2^a-cv*2^b with small exponent deltas, update exponent metadata, and see if shifted-add alignment is cheaper than per-step signed barrel shifts."}}
{"type":"config","name":"plusminus coefficient-offset denominator-barrel budget","metricName":"plusminus_coeff_offset_budget_gap_to_2700k","metricUnit":"","bestDirection":"lower"}
{"run":500,"commit":"3d427db","metric":471400,"metrics":{"plusminus_coeff_offset_budget_step257_ccx":7850,"plusminus_coeff_offset_budget_steps":202,"plusminus_coeff_offset_budget_two_div_step_only":3171400,"altseed_classical_total":0,"altseed_phase_batches_total":0,"altseed_ancilla_batches_total":0,"avg_toffoli":4089274,"avg_clifford":24292787.153,"qubits":2713,"emitted_ops":30575944,"correctness_ok":1},"status":"keep","description":"Budget coefficient-offset plus physical denominator barrel shifts","timestamp":1777588335576,"segment":67,"confidence":null,"iterationTokens":167,"asi":{"hypothesis":"Since coefficient offsets stay within 257 bits, deleting the signed coefficient barrel shift might make the remaining physical denominator barrel shift budget viable.","result":"It is still not enough. Removing the signed coefficient barrel cost drops the 257-bit step model from 10,243 to 7,850 CCX, but two DIVs over 202 steps still cost 3,171,400 in step bodies alone, gap +471,400 to 2.7M before scaffold and scale correction. Coefficient offsets help but denominator physical shifting remains too expensive.","next_action_hint":"Focus on denominator normalization amortization/offset with periodic renormalization, or a recurrence that avoids per-step denominator barrel shifts. Coefficient-offset arithmetic is useful only if denominator shifts are also reduced."}}
{"type":"config","name":"plusminus denominator periodic normalization profile","metricName":"plusminus_den_norm_bits_p99","metricUnit":"","bestDirection":"lower"}
{"run":501,"commit":"9c0456f","metric":236,"metrics":{"plusminus_den_norm_count_p99":89,"plusminus_den_norm_count_max":98,"plusminus_den_norm_bits_max":310,"plusminus_den_norm_chunk_p99":13,"plusminus_den_norm_chunk_max":20,"altseed_classical_total":0,"altseed_phase_batches_total":0,"altseed_ancilla_batches_total":0,"avg_toffoli":4089274,"avg_clifford":24292787.153,"qubits":2713,"emitted_ops":30575944,"correctness_ok":1},"status":"keep","description":"Profile periodic normalization for denominator offset lanes","timestamp":1777588499200,"segment":68,"confidence":null,"iterationTokens":159,"asi":{"hypothesis":"Although naive denominator offsets need ~395-bit raw lanes, periodic normalization might keep 257-bit lanes while doing fewer physical shifts than every plusminus step.","result":"Profile shows normalization is less than every step but still frequent: p99 count 89, max 98 normalizations per DIV; p99 shifted bits 236, max 310; chunks are small (p99 13, max 20). This is promising only if normalization timing/amount can be made public or cheaply recoverable; a data-dependent bitlength oracle would reintroduce dense parser cost.","next_action_hint":"Search for a public step-index normalization schedule based on sampled worst-case raw widths. If a public schedule with <=~100 small shifts keeps all traces within 257 bits, it may replace per-step denominator barrels without dense bitlength controls."}}
{"type":"config","name":"plusminus public denominator normalization conflict","metricName":"plusminus_public_norm_conflict_count","metricUnit":"","bestDirection":"lower"}
{"run":502,"commit":"4f4c064","metric":49,"metrics":{"plusminus_public_norm_first_conflict_step":2,"plusminus_public_norm_first_conflict_lane":0,"plusminus_public_norm_first_excess_bits":7,"plusminus_public_norm_first_min_exp_bits":0,"altseed_classical_total":0,"altseed_phase_batches_total":0,"altseed_ancilla_batches_total":0,"avg_toffoli":4089274,"avg_clifford":24292787.153,"qubits":2713,"emitted_ops":30575944,"correctness_ok":1},"status":"keep","description":"Show simple public denominator normalization schedule conflicts","timestamp":1777588649862,"segment":69,"confidence":null,"iterationTokens":159,"asi":{"hypothesis":"Periodic denominator normalization might be made public by step index, avoiding a dense data-dependent bitlength oracle.","result":"Necessary-condition check fails early. At step 2, lane 0 already needs max_excess=7 bits of normalization across samples, but some samples have min exponent 0, so a public shift large enough for wide traces would be invalid for other traces. There are 49 sampled step/lane conflicts. Simple public step-index normalization is therefore not viable.","next_action_hint":"If denominator offsets are pursued, normalization must be controlled by exponent/width side information, or use a different representation. This likely reintroduces parser/selector cost; prioritize alternative denominator recurrence or accept barrel-shift cost as a lower bound."}}
{"type":"config","name":"plusminus exponent-only denominator normalization classifier","metricName":"plusminus_exp_only_norm_mismatch_ppm","metricUnit":"","bestDirection":"lower"}
{"run":503,"commit":"8085528","metric":10037,"metrics":{"plusminus_exp_only_norm_mismatches":8428,"plusminus_exp_only_norm_observations":839680,"plusminus_exp_only_norm_worst_step":9,"plusminus_exp_only_norm_worst_lane":1,"plusminus_exp_only_norm_worst_mismatches":440,"altseed_classical_total":0,"altseed_phase_batches_total":0,"altseed_ancilla_batches_total":0,"avg_toffoli":4089274,"avg_clifford":24292787.153,"qubits":2713,"emitted_ops":30575944,"correctness_ok":1},"status":"keep","description":"Kill exponent-only control for denominator normalization","timestamp":1777588846627,"segment":70,"confidence":null,"iterationTokens":164,"asi":{"hypothesis":"Denominator offset normalization might avoid a dense bitlength oracle if the normalize/no-normalize event is exactly determined by the stored exponent and public step/lane.","result":"Best per-step/lane exponent-threshold classifier still mismatches 8,428 of 839,680 observations (10,037 ppm), worst at step 9 lane 1 with 440 mismatches. Exponent alone is not an exact control for raw width overflow. Normalization needs top-bit/bitlength information or another representation.","next_action_hint":"Treat denominator-offset normalization as parser-controlled, not public/exponent-only. Unless a sparse top-bit predicate exists, prefer other denominator recurrences or accept physical barrel-shift lower bound."}}
{"type":"config","name":"plusminus ideas update after offset-lane invalidation","metricName":"plusminus_exp_only_norm_mismatch_ppm","metricUnit":"","bestDirection":"lower"}
{"run":504,"commit":"e9851b6","metric":10037,"metrics":{"plusminus_exp_only_norm_mismatches":8428,"plusminus_exp_only_norm_observations":839680,"plusminus_exp_only_norm_worst_step":9,"plusminus_exp_only_norm_worst_lane":1,"plusminus_exp_only_norm_worst_mismatches":440,"altseed_classical_total":0,"altseed_phase_batches_total":0,"altseed_ancilla_batches_total":0,"avg_toffoli":4089274,"avg_clifford":24292787.153,"qubits":2713,"emitted_ops":30575944,"correctness_ok":1},"status":"keep","description":"Prune plusminus offset-lane ideas after normalization conflicts","timestamp":1777588940379,"segment":71,"confidence":null,"iterationTokens":167,"asi":{"hypothesis":"The ideas backlog should reflect that coefficient offsets help but denominator offset normalization is not public/exponent-only and likely reintroduces parser cost.","result":"Targeted rerun passed and committed the ideas update. Backlog now records the concrete budget chain: physical repeated shifts are W^2 dead, barrel shifts repair but remain too expensive, coefficient offsets fit 257 bits but only reduce two-DIV step bodies to 3.17M, denominator offsets reach 395-bit raw widths, and both simple public and exponent-only normalization controls fail.","next_action_hint":"Next do either a sparse top-bit/width predicate probe for denominator normalization, or pivot away from plusminus physical denominator shifts toward Solinas/alternative DIV recurrence."}}
{"type":"config","name":"plusminus optimistic offset-normalization budget","metricName":"plusminus_offset_norm_gap_before_scale_to_2700k","metricUnit":"","bestDirection":"lower"}
{"run":505,"commit":"83189fb","metric":512222,"metrics":{"plusminus_offset_norm_base_step_ccx":5794,"plusminus_offset_norm_den_norm_count_p99":89,"plusminus_offset_norm_den_norm_barrel_ccx":1285,"plusminus_offset_norm_one_div_step_ccx":1284753,"plusminus_offset_norm_two_div_step_ccx":2569506,"plusminus_offset_norm_total_before_scale":3212222,"altseed_classical_total":0,"altseed_phase_batches_total":0,"altseed_ancilla_batches_total":0,"avg_toffoli":4089274,"avg_clifford":24292787.153,"qubits":2713,"emitted_ops":30575944,"correctness_ok":1},"status":"keep","description":"Show optimistic offset-normalization plusminus budget still misses","timestamp":1777589929117,"segment":72,"confidence":null,"iterationTokens":169,"asi":{"hypothesis":"Even granting a magic exact denominator-normalization oracle and using coefficient offsets, the residual physical denominator normalization may or may not fit the 2.7M budget.","result":"Targeted run passed full harness. The optimistic model gives one DIV step+normalization 1,284,753 CCX; two DIVs 2,569,506; plus scaffold_before_scale 642,716 gives 3,212,222, gap +512,222 to 2.7M before variable-S Solinas scale correction and before charging the normalization oracle. Thus even a very generous normalization model misses.","next_action_hint":"Plusminus is now scratch-shaped and circuit-validated, but gate-dead unless denominator shifts are eliminated more radically or step count/cost is cut. Pivot to alternative denominator recurrences or prove a much cheaper normalization/scale fusion."}}
{"type":"config","name":"BY first16 tail selector low-gate scratch check","metricName":"by_first16_carry_plus_fixed_bits","metricUnit":"","bestDirection":"lower"}
{"run":506,"commit":"c2bf652","metric":736,"metrics":{"by_first16_pattern_entropy_bits":195.404,"by_first16_pattern_fixed_bits":208,"by_tail_carry_core_bits":528,"by_first16_gap_to_lowgate_scratch_bits":-177,"by_first16_gap_to_lowqubit_scratch_bits":73,"altseed_classical_total":0,"altseed_phase_batches_total":0,"altseed_ancilla_batches_total":0,"avg_toffoli":4089274,"avg_clifford":24292787.153,"qubits":2713,"emitted_ops":30575944,"correctness_ok":1},"status":"keep","description":"Literature sweep and BY first16 tail selector scratch checkpoint","timestamp":1777591021084,"segment":73,"confidence":null,"iterationTokens":168,"asi":{"hypothesis":"Use online literature sweep plus existing BY streaming-selector model to reassess future routes with the new introspection discipline. Specifically check whether first-16 pattern history plus tail carry core fits any Google regime.","result":"Targeted test and full harness passed. Online literature found no public exact low-Toffoli low-scratch point-add primitive: Luo/PZ register-sharing EEA is exact and low-space but ~1.97e8 Toffoli per inversion and 1333 ECDLP qubits; Google proof withholds circuit; MBUC adder papers are local 10-15% effects. BY first16+tail carry persistent state is 736 bits: it misses 1175q low-qubit scratch by 73 bits but fits 1425q low-gate scratch by 177 bits, so it is a possible low-gate selector-state direction, not a low-qubit solution.","next_action_hint":"Do not import public EEA as integration. For future experiments, either prove BY first16/tail selector can meet the stricter 2.1M low-gate Toffoli budget, or return to low-qubit structural primitives. Any BY low-gate work must charge first16 pattern generation, tail carry update, history compression/cleanup, and replay cost before promotion."}}
{"type":"config","name":"BY first16 tail selector low-gate Toffoli margin","metricName":"by_first16_pattern_remaining_ccx","metricUnit":"","bestDirection":"higher"}
{"run":507,"commit":"681c87b","metric":66292,"metrics":{"by_first16_lowgate_margin_ccx":161524,"by_first16_pattern_onepass_ccx":95232,"by_first16_pattern_q_onepass_ccx":150528,"by_first16_pattern_q_remaining_ccx":10996,"by_first16_pattern_compute_uncompute_gap_ccx":28940,"altseed_classical_total":0,"altseed_phase_batches_total":0,"altseed_ancilla_batches_total":0,"avg_toffoli":4089274,"avg_clifford":24292787.153,"qubits":2713,"emitted_ops":30575944,"correctness_ok":1},"status":"keep","description":"Gate BY first16/tail low-gate selector by remaining Toffoli margin","timestamp":1777591229916,"segment":74,"confidence":null,"iterationTokens":168,"asi":{"hypothesis":"Before pursuing BY first16/tail low-gate selector, check whether the remaining low-gate Toffoli margin can afford measured first16 pattern generation.","result":"Targeted test and full harness passed. Fast BY projected point-add leaves 161,524 CCX to the 2.1M low-gate target. One-pass first16 lowword pattern generation costs 95,232, leaving 66,292 for tail carry update/compression/cleanup; pattern+q generation costs 150,528 leaving only 10,996; compute+uncompute pattern generation misses by 28,940. This confirms the subpath is extremely tight and only plausible if pattern generation self-cleans and no q rows or second pass are needed.","next_action_hint":"Do not spend many iterations on this. At most one hard-piece experiment: can tail carry update/cleanup be made reversible with no extra Toffoli beyond the one-pass pattern generator? If not, demote BY first16/tail low-gate as too tight."}}
{"type":"config","name":"BY first16 tail carry update low-gate lower bound","metricName":"by_tail_carry_update_lb_gap_to_remaining_ccx","metricUnit":"","bestDirection":"lower"}
{"run":508,"commit":"681c87b","metric":-13956,"metrics":{"by_tail_carry_update_lb_mean_ccx":46008.188,"by_tail_carry_update_lb_p90_ccx":49792,"by_tail_carry_update_lb_p99_ccx":52336,"by_tail_carry_update_lb_max_ccx":56592},"status":"crash","description":"First BY tail carry lower-bound assertion had wrong expected sign","timestamp":1777591362335,"segment":75,"confidence":null,"iterationTokens":171,"asi":{"hypothesis":"Check whether an optimistic CSD lower bound for BY tail carry update already exceeds the 66,292 CCX remaining low-gate margin after first16 pattern generation.","result":"The targeted test failed only because the assertion expected a kill. The actual parsed metrics are promising/tight: p99 lower bound 52,336, gap -13,956 to the remaining margin, max 56,592. This does not prove viability because controls, cleanup, reversibility, and actual circuit costs are uncharged, but it says the tail update is not killed by the first optimistic lower bound.","rollback_reason":"Assertion encoded the wrong prior; code should be rewritten as a tight-viability checkpoint rather than a kill test.","next_action_hint":"Re-add the test with assertion p99_gap < 0 and wording that BY first16/tail survives only as a very tight low-gate subpath; then run again and log keep."}}
{"run":509,"commit":"ae1409b","metric":-13956,"metrics":{"by_tail_carry_update_lb_mean_ccx":46008.188,"by_tail_carry_update_lb_p90_ccx":49792,"by_tail_carry_update_lb_p99_ccx":52336,"by_tail_carry_update_lb_max_ccx":56592,"by_tail_carry_update_lb_max_gap_to_remaining_ccx":-9700,"altseed_classical_total":0,"altseed_phase_batches_total":0,"altseed_ancilla_batches_total":0,"avg_toffoli":4089274,"avg_clifford":24292787.153,"qubits":2713,"emitted_ops":30575944,"correctness_ok":1},"status":"keep","description":"Show BY first16/tail carry lower bound barely fits low-gate margin","timestamp":1777591501649,"segment":75,"confidence":null,"iterationTokens":2820,"asi":{"hypothesis":"Check the hard tail carry-update cost class before pursuing BY first16/tail low-gate selector further.","result":"Targeted test and full harness passed. An unrealistically generous fixed-pattern signed-CSD lower bound for the 19 tail carry windows is mean 46,008, p99 52,336, max 56,592 CCX. Compared to the 66,292 CCX remaining after one-pass first16 pattern generation, this leaves only 13,956 p99 / 9,700 sampled-max CCX for controls, cleanup, low-word extraction, and reversibility. The route is not killed by the first lower bound, but the margin is extremely small.","next_action_hint":"At most one actual-circuit probe is justified: synthesize a representative tail carry update/roundtrip or a precise primitive cost. If it exceeds the CSD lower bound by more than ~10k total, demote BY first16/tail low-gate. Do not treat this as low-qubit."}}
{"type":"config","name":"BY first16 tail fresh carry circuit low-gate go/no-go","metricName":"by_tail_carry_fresh_gap_to_remaining_ccx","metricUnit":"","bestDirection":"lower"}
