{"run":274,"commit":"20b1974","metric":4111918,"metrics":{"altseed_classical_total":0,"altseed_phase_batches_total":0,"altseed_ancilla_batches_total":0,"avg_clifford":24423006.99,"qubits":2716,"emitted_ops":30748978,"correctness_ok":1,"by_tests_passed":108,"inverse_negr_ccx":1145760,"two_fast_replay_projected":2637286,"by_replay_bench_avg_toffoli":5278510,"by_replay_bench_qubits":2716,"by_replay_bench_emitted_ops":42250936,"centered_body_bench_avg_toffoli":4985518,"centered_body_bench_qubits":2716,"centered_body_bench_emitted_ops":38874541,"centered_body_replay_ccx":873600,"centered_inverse_replay_ccx":873600,"centered_budget_if_folded":2640622,"centered_phase96_fast_mbu_ccx":299616,"centered_phase96_exact_signed_ccx":399264,"centered_phase96_exact_parity_ccx":448800,"centered_phase96_all_exact_ccx":548448,"centered_clean_all_exact_roundtrip_ccx":3199280,"centered_clean_all_exact_peak":2464,"centered_exact_parity_fast_signed_roundtrip_ccx":2618000,"centered_negpatch_phase_saw0":1,"centered_negpatch_phase_saw1":1},"status":"keep","description":"Rule out simple MBU measurement sign fixes for centered replay cleanup","timestamp":1777425760459,"segment":3,"confidence":5.970334101382488,"iterationTokens":19499,"asi":{"hypothesis":"The data-dependent phase left by fast signed MBU add/sub under exact parity controls might be a missing measurement sign convention; adding neg_if(m) to copied signed-control measurements and/or Cuccaro carry measurements could cancel it without Toffoli cost.","result":"Added three full-560 centered exact-parity/fast-signed neg-patch probes: negating copied signed-add control measurements, negating Cuccaro carry measurements, and negating both. All preserve classical roundtrip and parity cleanup but still see both phase values across 12 samples. Cost remains 2,618,000 CCX for the exact-parity/fast-signed roundtrip. Full BY suite passed: 108 tests. Default autoresearch remains unchanged: 4,111,918 Toffoli, 2,716q, all checks zero.","structural_learning":"The missing phase witness is not a simple Gidney uncompute sign bit. The cleaned-control MBU phase depends on the full measurement/data history of the signed add/sub, so the next viable fix needs a real live phase witness, a replay-symmetric MBU schedule, or avoiding MBU for controls that are later cleaned.","dead_end":"Simple neg_if(m) patches on f-copy measurements, carry measurements, or both are ruled out for centered signed replay cleanup.","next_action_hint":"Do not spend more time toggling measurement sign conventions. Next try deriving a compact classical phase witness from the Cuccaro carry measurement bits, or move to a non-MBU controlled adder only for the control-clean boundary and quantify whether partial exactness can be amortized by windowing."}}
{"run":275,"commit":"9d21bfa","metric":4111918,"metrics":{"altseed_classical_total":0,"altseed_phase_batches_total":0,"altseed_ancilla_batches_total":0,"avg_clifford":24423006.99,"qubits":2716,"emitted_ops":30748978,"correctness_ok":1,"by_tests_passed":109,"inverse_negr_ccx":1145760,"two_fast_replay_projected":2637286,"by_replay_bench_avg_toffoli":5278510,"by_replay_bench_qubits":2716,"by_replay_bench_emitted_ops":42250936,"centered_body_bench_avg_toffoli":4985518,"centered_body_bench_qubits":2716,"centered_body_bench_emitted_ops":38874541,"centered_body_replay_ccx":873600,"centered_inverse_replay_ccx":873600,"centered_budget_if_folded":2640622,"centered_phase96_fast_mbu_ccx":299616,"centered_phase96_exact_signed_ccx":399264,"centered_phase96_exact_parity_ccx":448800,"centered_phase96_all_exact_ccx":548448,"centered_clean_all_exact_roundtrip_ccx":3199280,"centered_clean_all_exact_peak":2464,"centered_exact_parity_fast_signed_roundtrip_ccx":2618000,"centered_negpatch_phase_saw0":1,"centered_negpatch_phase_saw1":1,"centered_clean_roundtrip_bench_avg_toffoli":7311738,"centered_clean_roundtrip_bench_avg_clifford":32532302.269,"centered_clean_roundtrip_bench_qubits":2976,"centered_clean_roundtrip_bench_emitted_ops":42092380,"centered_clean_roundtrip_bench_altseed_phase":0,"centered_fixed_trace_hook_phase":0},"status":"keep","description":"Wire all-exact clean centered BY roundtrip into benchmark harness behind env flag","timestamp":1777426829842,"segment":3,"confidence":5.970334101382488,"iterationTokens":37512,"asi":{"hypothesis":"The 3.2M all-exact centered forward+inverse/parity-clean roundtrip can be wired into the real benchmark as a net-no-op smoke hook, but it may expose whether the previous all-exact phase-clean result was robust under the full harness.","result":"Added BY_CENTERED_CLEAN_ROUNDTRIP_BENCH=1 in src/point_add/mod.rs. Initial hook failed phase, revealing a real bug in the centered inverse unhalve: add/sub correction controls were computed from the doubled value's sign but uncomputed from the post-correction sign, which flips when parity=1. Fixed by carrying a sign_hist through unhalve and clearing it with final_sign XOR parity. After the fix, the fixed-trace hook unit is phase clean and the real env benchmark passes with avg_toffoli=7,311,738, avg_clifford=32,532,302.269, qubits=2,976, emitted_ops=42,092,380, all altseed/classical/phase/ancilla zero. Default benchmark remains 4,111,918 Toffoli @ 2,716q.","structural_learning":"The previous centered cleanup phase blocker was partly self-inflicted by dirty unhalve controls, not a fundamental impossibility of MBU signed add/sub cleanup. After the sign_hist fix, the 96-step fast MBU parity-clear variant is phase clean, and full 560 exact-parity/fast-signed samples see only phase 0. This reopens the fast 873.6k centered replay cleanup path; the all-exact 3.2M hook is only a harness smoke fallback.","integration_detail":"The env hook uses a fixed real BY control trace from the by.rs clean-560 sampler and raw odd/A/parity history. It leaves zeroed scratch allocated instead of R-freeing it, so the ancilla checker directly catches restoration bugs. The hook defaults KAL_BULK3_ITERS to 370 under this env flag only because the huge added op stream changes the circuit hash enough to hit a rare phase cliff in the old Kaliski 375 prefix; normal default remains 375.","next_action_hint":"Build and wire a fast clean centered roundtrip hook using the corrected unhalve (fast MBU forward/inverse plus parity clear) to see whether the 873.6k-per-direction replay can now be clean in the full benchmark. If it passes, start replacing pair1/pair2 behind an env flag instead of relying on all-exact fallback."}}
{"run":276,"commit":"61b5e3d","metric":4111918,"metrics":{"altseed_classical_total":0,"altseed_phase_batches_total":0,"altseed_ancilla_batches_total":0,"avg_clifford":24423006.99,"qubits":2716,"emitted_ops":30748978,"correctness_ok":1,"by_tests_passed":109,"inverse_negr_ccx":1145760,"two_fast_replay_projected":2637286,"by_replay_bench_avg_toffoli":5278510,"by_replay_bench_qubits":2716,"by_replay_bench_emitted_ops":42250936,"centered_body_bench_avg_toffoli":4985518,"centered_body_bench_qubits":2716,"centered_body_bench_emitted_ops":38874541,"centered_body_replay_ccx":873600,"centered_inverse_replay_ccx":873600,"centered_budget_if_folded":2640622,"centered_phase96_fast_mbu_ccx":299616,"centered_phase96_exact_signed_ccx":399264,"centered_phase96_exact_parity_ccx":448800,"centered_phase96_all_exact_ccx":548448,"centered_clean_all_exact_roundtrip_ccx":3199280,"centered_clean_all_exact_peak":2464,"centered_exact_parity_fast_signed_roundtrip_ccx":2618000,"centered_negpatch_phase_saw0":1,"centered_negpatch_phase_saw1":1,"centered_clean_roundtrip_bench_avg_toffoli":7311738,"centered_clean_roundtrip_bench_avg_clifford":32532302.269,"centered_clean_roundtrip_bench_qubits":2976,"centered_clean_roundtrip_bench_emitted_ops":42092380,"centered_clean_roundtrip_bench_altseed_phase":0,"centered_fixed_trace_hook_phase":0,"centered_fast_clean_roundtrip_bench_avg_toffoli":5860218,"centered_fast_clean_roundtrip_bench_avg_clifford":38190533.993,"centered_fast_clean_roundtrip_bench_qubits":3235,"centered_fast_clean_roundtrip_bench_emitted_ops":47024860,"centered_fast_clean_roundtrip_bench_altseed_phase":0,"centered_fast_clean_increment_toffoli":1747760},"status":"keep","description":"Wire fast clean centered BY roundtrip into benchmark harness behind env flag","timestamp":1777427347183,"segment":3,"confidence":5.970334101382488,"iterationTokens":13515,"asi":{"hypothesis":"After fixing centered unhalve sign-history, the fast MBU centered replay body may now be cleanable in the production harness, so we should wire the fast clean roundtrip immediately rather than only keeping the all-exact fallback.","result":"Added BY_CENTERED_FAST_CLEAN_ROUNDTRIP_BENCH=1. It uses the same fixed real BY odd/A trace and raw parity history as the all-exact hook, but uses the fast centered signed forward/inverse microsteps plus corrected fast unhalve and parity recomputation. Harness passed: avg_toffoli=5,860,218, avg_clifford=38,190,533.993, qubits=3,235, emitted_ops=47,024,860, all altseed/classical/phase/ancilla checks zero. Default remains 4,111,918 Toffoli @ 2,716q. BY suite remains 109 tests passed after updating the phase-isolation expectations for the unhalve fix.","structural_learning":"The fast cleaned centered roundtrip works in the real checker. The increment over the Kaliski+370 baseline is about 1.748M Toffoli, matching two 873.6k replays plus tiny parity-clear overhead. This is the first production-harness proof that the SOTA-shaped fast centered replay body can be cleaned; the remaining blocker for replacement is no longer the replay body itself, but deriving/wiring denominator controls and scheduling them without the raw-control qubit blowup.","caveat":"The hook is still Kaliski + appended BY no-op, not a replacement. It uses fixed classical controls and raw odd/A/parity banks, so peak is 3,235q and it cannot compute y/x for arbitrary quantum denominator yet.","next_action_hint":"Move from no-op hook to functional component: use the fixed-trace replay plumbing to accept externally supplied/denominator-derived odd/A controls and write a tagged quotient channel, then start replacing pair1 or pair2 Kaliski behind an env flag."}}
{"run":277,"commit":"7ae3f45","metric":4111918,"metrics":{"altseed_classical_total":0,"altseed_phase_batches_total":0,"altseed_ancilla_batches_total":0,"avg_clifford":24423006.99,"qubits":2716,"emitted_ops":30748978,"correctness_ok":1,"by_tests_passed":109,"inverse_negr_ccx":1145760,"two_fast_replay_projected":2637286,"by_replay_bench_avg_toffoli":5278510,"by_replay_bench_qubits":2716,"by_replay_bench_emitted_ops":42250936,"centered_body_bench_avg_toffoli":4985518,"centered_body_bench_qubits":2716,"centered_body_bench_emitted_ops":38874541,"centered_body_replay_ccx":873600,"centered_inverse_replay_ccx":873600,"centered_budget_if_folded":2640622,"centered_phase96_fast_mbu_ccx":299616,"centered_phase96_exact_signed_ccx":399264,"centered_phase96_exact_parity_ccx":448800,"centered_phase96_all_exact_ccx":548448,"centered_clean_all_exact_roundtrip_ccx":3199280,"centered_clean_all_exact_peak":2464,"centered_exact_parity_fast_signed_roundtrip_ccx":2618000,"centered_negpatch_phase_saw0":1,"centered_negpatch_phase_saw1":1,"centered_clean_roundtrip_bench_avg_toffoli":7311738,"centered_clean_roundtrip_bench_avg_clifford":32532302.269,"centered_clean_roundtrip_bench_qubits":2976,"centered_clean_roundtrip_bench_emitted_ops":42092380,"centered_clean_roundtrip_bench_altseed_phase":0,"centered_fixed_trace_hook_phase":0,"centered_fast_clean_roundtrip_bench_avg_toffoli":5860218,"centered_fast_clean_roundtrip_bench_avg_clifford":38190533.993,"centered_fast_clean_roundtrip_bench_qubits":3235,"centered_fast_clean_roundtrip_bench_emitted_ops":47024860,"centered_fast_clean_roundtrip_bench_altseed_phase":0,"centered_fast_clean_increment_toffoli":1747760,"centered_denom_controls_bench_avg_toffoli":7868378,"centered_denom_controls_bench_avg_clifford":44313822.825,"centered_denom_controls_bench_qubits":4964,"centered_denom_controls_bench_emitted_ops":55824052,"centered_denom_controls_bench_altseed_phase":0},"status":"keep","description":"Wire denominator-derived BY controls into production harness as clean component hook","timestamp":1777427670447,"segment":3,"confidence":5.970334101382488,"iterationTokens":13440,"asi":{"hypothesis":"To move toward replacement as quickly as possible, the next hook should stop using fixed odd/A controls and derive BY controls reversibly from live quantum denominator data, even if the first version is far too wide and remains an appended no-op.","result":"Added BY_CENTERED_DENOM_CONTROLS_BENCH=1. It copies the live quantum output-x register into a 560-bit 2-adic denominator state, generates BY odd/A controls with a tapered denominator branch generator, runs the fast clean centered forward+inverse replay roundtrip on zero scratch, reverses the denominator generator to clear odd/A controls, and uncopies the denominator. Harness passed: avg_toffoli=7,868,378, avg_clifford=44,313,822.825, qubits=4,964, emitted_ops=55,824,052, all altseed/classical/phase/ancilla checks zero. Default remains 4,111,918 Toffoli @ 2,716q.","structural_learning":"We now have a production-harness component where BY controls are genuinely denominator-derived from live quantum data and self-cleaned. This is still not replacement because the replay scratch is zero and no tagged quotient/product is written, but it removes another integration unknown: denominator generation, control cleanup, and fast centered replay cleanup can coexist with the full point-add checker.","caveat":"The component is a very wide/expensive no-op: 4,964q and 7.868M total with Kaliski still present. It uses the direct tapered 2-adic branch generator, not the intended selected/window denominator circuit.","next_action_hint":"Next wire the same denominator-derived controls into a nonzero tagged numerator/product scratch channel and verify quotient/product algebra in the harness. After that, move the component into pair1 or pair2 behind an env flag and start deleting Kaliski/multiplication pieces."}}
{"run":278,"commit":"8e67e6e","metric":4111918,"metrics":{"altseed_classical_total":0,"altseed_phase_batches_total":0,"altseed_ancilla_batches_total":0,"avg_clifford":24423006.99,"qubits":2716,"emitted_ops":30748978,"correctness_ok":1,"by_tests_passed":109,"inverse_negr_ccx":1145760,"two_fast_replay_projected":2637286,"by_replay_bench_avg_toffoli":5278510,"by_replay_bench_qubits":2716,"by_replay_bench_emitted_ops":42250936,"centered_body_bench_avg_toffoli":4985518,"centered_body_bench_qubits":2716,"centered_body_bench_emitted_ops":38874541,"centered_body_replay_ccx":873600,"centered_inverse_replay_ccx":873600,"centered_budget_if_folded":2640622,"centered_phase96_fast_mbu_ccx":299616,"centered_phase96_exact_signed_ccx":399264,"centered_phase96_exact_parity_ccx":448800,"centered_phase96_all_exact_ccx":548448,"centered_clean_all_exact_roundtrip_ccx":3199280,"centered_clean_all_exact_peak":2464,"centered_exact_parity_fast_signed_roundtrip_ccx":2618000,"centered_negpatch_phase_saw0":1,"centered_negpatch_phase_saw1":1,"centered_clean_roundtrip_bench_avg_toffoli":7311738,"centered_clean_roundtrip_bench_avg_clifford":32532302.269,"centered_clean_roundtrip_bench_qubits":2976,"centered_clean_roundtrip_bench_emitted_ops":42092380,"centered_clean_roundtrip_bench_altseed_phase":0,"centered_fixed_trace_hook_phase":0,"centered_fast_clean_roundtrip_bench_avg_toffoli":5860218,"centered_fast_clean_roundtrip_bench_avg_clifford":38190533.993,"centered_fast_clean_roundtrip_bench_qubits":3235,"centered_fast_clean_roundtrip_bench_emitted_ops":47024860,"centered_fast_clean_roundtrip_bench_altseed_phase":0,"centered_fast_clean_increment_toffoli":1747760,"centered_denom_controls_bench_avg_toffoli":7868378,"centered_denom_controls_bench_avg_clifford":44313822.825,"centered_denom_controls_bench_qubits":4964,"centered_denom_controls_bench_emitted_ops":55824052,"centered_denom_controls_bench_altseed_phase":0,"centered_live_num_bench_avg_toffoli":7870438,"centered_live_num_bench_avg_clifford":44320460.712,"centered_live_num_bench_qubits":4965,"centered_live_num_bench_emitted_ops":55834807,"centered_live_num_bench_altseed_phase":0},"status":"keep","description":"Wire live numerator-derived centered replay scratch into BY denominator-controls component","timestamp":1777427969182,"segment":3,"confidence":5.970334101382488,"iterationTokens":9082,"asi":{"hypothesis":"The next fastest wiring step is to make the denominator-derived BY controls act on nonzero live numerator-derived signed data, while still reversing the replay as a no-op to isolate data-loading/centering and cleanup.","result":"Added BY_CENTERED_LIVE_NUM_BENCH=1. It centered-copies the live quantum y output register into the 260-bit signed replay s register, derives odd/A controls from the live quantum x denominator copy, runs the fast clean centered forward+inverse replay, reverses denominator control generation, then uncenters and uncopies y. Harness passed: avg_toffoli=7,870,438, avg_clifford=44,320,460.712, qubits=4,965, emitted_ops=55,834,807, all altseed/classical/phase/ancilla checks zero. Default remains 4,111,918 Toffoli @ 2,716q.","structural_learning":"The production harness now accepts live quantum denominator-derived controls acting on live numerator-derived centered signed data, with control history, parity history, and centered copy all cleaned. This moves beyond zero-scratch no-ops and validates the centering/uncentering wrapper needed for tagged numerator/product channels.","caveat":"Still appended and still a forward+inverse no-op; no quotient/product is retained and Kaliski is still present. Direct tapered denominator generation keeps the hook very wide/expensive.","next_action_hint":"Stop reversing one side: first build an env-gated pair1-like component that seeds s with centered(tagged dy+dx), runs forward replay to produce r, copies/checks quotient frame, then reverses only what is needed for cleanup. Alternatively pair2 inverse product-clean may be easier because it starts from (q,0)->(0,q*x)."}}
