{"run":139,"commit":"0a95cce","metric":4180502,"metrics":{},"status":"keep","description":"Ground-up analysis sharpened. sota_rebuild_plan.md now records the definitive finding: Kim's real win cannot be obtained by patching narrow-r per-round Kaliski; the existing bulk_prefix3 empirically breaks past iter ~315 because v_w hits 0 inside bulk, and per-round mod-p reduction on a narrow r ties the scaffold to termination-dependent scaling. Kim REQUIRES wide (2n+1)-bit r,s with postponed reduction. Phase A is therefore a new inversion primitive with new register widths, not a small edit. Per-round Toffoli budget under HRSL swap-based wide-r layout comes out to ~10n per round × 2n rounds × 2 inversions ≈ 2.6M, putting 2.7M SOTA within line-of-sight once combined with single-inversion scaffold and Luo sharing.","timestamp":1777022330454,"segment":3,"confidence":2.6492074049440193,"iterationTokens":7653,"asi":{"hypothesis":"The structural-rebuild work has to target wide (2n+1)-bit r,s registers with postponed modular reduction, NOT a patched narrow-r Kaliski. This is the only shape under which Kim 2a+2b actually reduces Toffoli.","evidence_against_narrow_r_path":["existing bulk_prefix3 defaults to safe-iters=315 and phase-fails at 320, because v_w=0 can occur inside the bulk and the narrow-r path cannot absorb that case","extending iters=512 without the wide-r change regressed the metric to 4.91M (+17.5%), proving narrow-r Kim alone is a net loss","per-round narrow-r kaliski_iteration is already near its optimization floor given f+m_hist+step-0 bookkeeping"],"per_round_budget_wide_r":"~10n CCX (HRSL Fig 7b); 2n rounds per inversion; 20n^2 = 1.31M per inversion at n=256","sota_line_of_sight":"2 wide-r inversions (Bennett) = 2.6M + ~0.3M muls + ~0.1M misc ≈ 3.0M Toffoli. Combined with single-inversion scaffold (Strategy C) this approaches Google's 2.7M low-qubit target.","next_step":"Phase A-concrete v2: write a new `kim_inv_wide` reversible primitive with wide r,s (2n+1 bits each), 2n unconditional rounds, HRSL swap-based round shape, single mod-p reduction at end. Test against classical_kim_inv on random inputs via the Simulator before wiring into build()."}}
{"run":140,"commit":"21ad4a7","metric":4180502,"metrics":{},"status":"keep","description":"Phase A of SOTA rebuild LANDED: a working reversible Kim-style wide-r Kaliski inversion primitive at n=256. Added `kim_iteration_forward` in src/point_add/kim_inv_circuit.rs, driving (u:257, v:257, r:513, s:513) wide registers with HRSL swap-based round shape. Validated via `Simulator` on secp256k1-shaped inputs (u=p, v=random) for the full 512 rounds — final r holds ±v0^-1·2^(2n) in its low 256 bits. Width-truncated cswaps and conditional sub/add on (u,v)/(r,s) using iter_idx bounds. Measured cost: 1.25M Toffoli, peak 3079 qubits, for one full forward inversion. Primary metric unchanged (circuit still not wired into build()). Tests: 4 passed, 1 superseded-ignored.","timestamp":1777023097973,"segment":3,"confidence":2.8670745606142405,"iterationTokens":46293,"asi":{"hypothesis":"Ground-up Phase A: a reversible wide-r Kim-style Kaliski primitive can be implemented today in our builder + simulator, and its per-round cost and output scaling are predictable classically. This was never verified at the circuit level before.","results":{"correctness":"64 rounds at full width (n=256) on random u,v,r,s: state matches classical_round_wide 8/8","full_inversion":"512 rounds with u=p, v=random secp256k1 elt: output r's low 256 bits equal ±v0^-1 · 2^(2n) mod p for 3/3 trials","per_inversion_forward_cost":{"toffoli":1252864,"peak_qubits":3079}},"comparison_to_current":{"current_per_forward_toffoli_estimate":"~1.0M","kim_forward_toffoli":"1.25M","kim_advantage":"scaffold-compatible with single-inversion (Strategy C), deletes pair_halve+pair_double (~207k), and removes f/m_hist bookkeeping overhead downstream"},"next_actions":["Phase A-2: write kim_iteration_backward matching the forward. Bennett-uncompute via emit_inverse may work if the primitive is phase-clean when wrapped.","Phase B: compress by eliminating per-iter m qubit (derive classically on backward from u,v). Target: -512 persistent qubits, -1 cswap per round.","Phase C: wire into build() behind KIM_INV=1 gate; also switch affine scaffold to single-inversion (Strategy C). Measure end-to-end."]}}
{"run":141,"commit":"b169233","metric":4180502,"metrics":{},"status":"keep","description":"SOTA rebuild Phase A COMPLETE: reversible round-trip-clean Kim inversion primitive at n=256. Fixed the forward's broken both_odd uncompute (couldn't be reverted from post-sub v[0]) by promoting both_odd to a persistent per-iter flag alongside m. Backward uses (m, both_odd) to cleanly reverse the conditional sub/add, clear both flags, and restore (u,v,r,s) to pre-forward state. Verified with forward+backward round-trip test at NU=257, NR=513, ITERS=512 on secp256k1 inversion inputs — all state restored, all 512 m_bits and 512 both_odd flags cleared. Cost: forward 1.25M Toffoli, peak 3590 qubits. Metric unchanged (primitive not wired into build() yet).","timestamp":1777024517679,"segment":3,"confidence":3.1239869281045753,"iterationTokens":87301,"asi":{"hypothesis":"The ground-up Kim iteration needs per-iter both_odd flag kept live through the body, analogous to m_bit, because after v -= u the v[0] bit is overwritten and both_odd can no longer be uncomputed from (u,v) locally. With both_odd as a persistent flag the backward can cleanly undo the sub/add and clear both flags.","results":{"round_trip_full_scale":"ITERS=512, n=256, secp256k1 inputs (u=p, v=random): 3/3 trials fully restore u,v,r,s and clear all m/both_odd flags","forward_cost":{"toffoli":1252352,"peak_qubits":3590}},"next_actions":["Build `kim_inv` wrapper that allocates u,v,r,s,m_hist,both_odd_hist, runs 2n forward iters, extracts output via single classical const-mul by 2^-2n mod p, then runs 2n backward iters.","Measure total cost of kim_inv (not just forward). Target: 2x forward = ~2.5M Toffoli per inversion.","Compare with current scaffold per-inversion cost ~1M. Expected: kim_inv is 2.5x more expensive than one current Kaliski but unlocks (a) single-inversion scaffold removing one full inversion entirely, and (b) exact Montgomery output with no pair_halve/pair_double correction.","If end-to-end total beats 4.18M, wire behind KIM_INV=1 and iterate."]}}
{"run":142,"commit":"e37b21f","metric":4180502,"metrics":{},"status":"keep","description":"SOTA rebuild Phase B: full Kim-inv primitive assembled end-to-end. New test `kim_inv_primitive_writes_scaled_inverse_and_cleans_up` allocates (u,v,r,s,m_hist,bo_hist), runs init (u:=p, v:=x, s:=1), runs 2n=512 forward Kim iters, and verifies on 5 random secp256k1 x0 that the mod-p residue of the wide r register equals ±x0^-1 * 2^{2n}, AND that x is unchanged. All 6 kim_inv_circuit tests pass. The remaining wiring is: (a) classical mod-p reduction of r into a narrow n-bit output register via Solinas, (b) CX copy to caller's `out`, (c) reverse init and 2n backward iters. Cost baseline: 1.25M Toffoli per forward at n=256, peak 3590q.","timestamp":1777024748856,"segment":3,"confidence":3.26884147175489,"iterationTokens":11807,"asi":{"hypothesis":"Phase B — assembling the inversion primitive as init + 2n forward + copy + 2n backward + reverse init — is mechanical once the per-iter round-trip works. Verify end-to-end produces ±x^-1*2^{2n} and leaves x/ancillas clean.","progress":{"tests_passing":6,"tests_ignored":1,"tests_failing":0,"round_trip_full_scale":"512 iters, n=256, u,v,r,s clean + 512 m_hist + 512 bo_hist flags all cleared","primitive_partial":"init + 512 forward iters → r mod p = ±x^-1*2^{2n}, x unchanged"},"next_steps_remaining":["Add mod-p reduction of r to an n-bit register. secp256k1 Solinas: r_wide = r_low_n + r_high_n * (2^32 + 977), reducible with a short const-mul + add. Estimated cost ~10k Toffoli.","Copy output into caller `out` register via CX.","Run 2n backward iters + reverse init. Expected cost symmetric with forward → ~2.5M total per kim_inv call.","If total cost per kim_inv (~2.5M) × single-inversion scaffold wiring beats current 2-Kaliski 4.18M, land it."]}}
{"run":143,"commit":"a81e467","metric":4180502,"metrics":{},"status":"keep","description":"SOTA rebuild progress doc updated. sota_rebuild_plan.md now records Phase A complete (reversible Kim iteration forward+backward round-trip clean at full scale) and Phase B complete (init+2n forward produces correct scaled inverse). Identified Phase C as the decision point: finish a Bennett kim_inv(x, out) wrapper (C1) vs skip the wrapper and go straight to a single-inversion build_sota() using Kim's wide r inline (C2). C2 is the more SOTA-shaped route because it avoids a separate Solinas rescale and aligns with the HRSL/Google pattern of fusing mod-p reduction with the next multiplication. Primary metric unchanged.","timestamp":1777024870251,"segment":3,"confidence":3.4277825588066553,"iterationTokens":3987,"asi":{"hypothesis":"With Phase A and B landed, the SOTA-shaped next step is a single-inversion build_sota() that inlines the Kim primitive's wide r as a direct multiplicand, eliminating one inversion entirely and avoiding a separate mod-p reduction step.","decision_point":"C1 vs C2. C2 is cheaper because: (i) no need for a separate mod-p Solinas on the 2n-bit r, (ii) single-inversion scaffold already classically validated via single_inv_numeric Strategy C, (iii) total Toffoli budget: 2*1.25M (Kim fw+bw) + 3 quantum muls + exact-affine ≈ 3.0M, close to Google SOTA 2.7M.","next_step":"Start Phase C2 next session: write build_sota() in a new module `src/point_add/build_sota.rs`. Structure: tx,ty in; sub classical Qx,Qy; run Kim init on dx; run 2n Kim forward iters; inside the Kim body compute lam by multiplying ty against wide r (mul into acc then Solinas-reduce); do the affine math; run backward Kim. Test against reference on 200 secp256k1 points via Simulator."}}
{"run":144,"commit":"5b990cc","metric":4180502,"metrics":{},"status":"keep","description":"SOTA rebuild Phase C COMPLETE: end-to-end reversible `kim_inv(x, out)` primitive that (a) allocates all internal state, (b) runs 2n=512 forward Kim iters, (c) reduces wide r mod p into `out` via Solinas (r_lo + c*r_hi + c^2*r_top mod p with c=2^32+977), (d) runs 2n backward iters, (e) reverse-init, (f) frees all state. Verified on 3 random secp256k1 inputs: `out` matches ±x^-1 * 2^{2n} mod p, `x` is preserved, no ancilla leaks. Primitive cost: 2.53M Toffoli, peak 4102 qubits (standalone). All 7 kim_inv_circuit tests pass. Primary metric unchanged (primitive not yet wired into build()).","timestamp":1777025217495,"segment":3,"confidence":5.980605605605605,"iterationTokens":17257,"asi":{"hypothesis":"The full ground-up Kim inversion primitive, including mod-p reduction of the wide accumulator, can be built reversibly end-to-end and produces the correct scaled inverse. This is a standalone milestone — it doesn't yet integrate with the point-add scaffold but proves the primitive works.","primitive_cost":{"toffoli":2530240,"peak_qubits":4102,"n":256},"composition":["init: u:=p, v:=x, s:=1 (~n CX)","2n forward Kim iters (~1.25M Toffoli)","mod-p reduction: r_lo CX-copy to out, +c*r_hi via mul_by_const_acc, +c^2*r_top via controlled const add","2n backward Kim iters (~1.25M Toffoli)","reverse init"],"next_step":"Phase D: wire `kim_inv` into a build_sota() that uses a single-inversion affine scaffold (Strategy C from single_inv_numeric). Given kim_inv is ~2.53M Toffoli and current 2-Kaliski build is 4.18M with 2 inversions totaling ~3.5M+, replacing both with one kim_inv saves ~0.97M. Plus eliminating pair_halve/pair_double saves ~207k. Projected build_sota total: ~3.0M Toffoli. Below the 4.18M baseline by ~28%."}}
{"run":145,"commit":"40fd8e4","metric":4180502,"metrics":{},"status":"keep","description":"Updated sota_rebuild_plan.md with Phase A/B/C complete status and Phase D projections. Projected build_sota() Toffoli budget using the Phase-C kim_inv primitive + single-inversion scaffold: ~3.6M, beating the 4.18M baseline by ~14%. Additional levers (Luo register sharing, HRSL workspace reuse, unscale absorption into first mul's Solinas) projected to reach 2.9-3.1M, within striking distance of the Google 2.7M SOTA target. Primary metric unchanged.","timestamp":1777025353884,"segment":3,"confidence":23.22497570456754,"iterationTokens":7736,"asi":{"hypothesis":"The SOTA rebuild is now architecturally complete and on track. Phase D (wiring kim_inv into build_sota()) is mechanical assembly; the hard structural work is done.","cumulative_session_milestones":["Classical single-inversion validated (200/200, Strategy C)","Classical Kim inversion validated (200/200 narrow and wide)","Reversible Kim iteration forward+backward round-trip clean at full n=256","Reversible kim_inv(x, out) full primitive at 2.53M Toffoli, 4102 peak qubits"],"next_session":"Phase D: implement build_sota() using kim_inv + Strategy C single-inversion affine. Write classical-replay test first via the Simulator, then measure Toffoli and peak against baseline 4.18M/2716q. Target: 3.5-3.7M Toffoli at peak <= 4100q; secondary target: apply Luo/HRSL levers to drop toward 3.0M."}}
{"run":146,"commit":"3b7d3b2","metric":4180502,"metrics":{},"status":"keep","description":"Hard cap reality check. User corrected: qubit budget is 1200. Kim-style primitive built this session has 4102 peak qubits — 3.4x over cap. Rewrote sota_rebuild_plan.md to honestly document the publicly-reachable frontier: at 1200 qubits, the best public algorithm is Luo 2025 at ~1333q with ~976n³ Toffoli (~16B total / ~500M per point-add at n=256), dramatically higher than our current 4.18M. Google's withheld circuit is 1200q / 90M Toffoli / Shor ≈ 2.8M per point-add, not reproducible from public literature alone. Three realistic session targets now documented: (A) rebuild for ~1200q accepting 10-100x higher Toffoli (matches public frontier but explodes our metric), (B) port HRSL 8n ≈ 2060q scaffold (moderate qubit saving, moderate Toffoli cost), (C) optimize current ~2700q scaffold via Kim-style wide-r (the Phase A-C work from this session). Primary metric unchanged.","timestamp":1777064630913,"segment":3,"confidence":15.528589993502274,"iterationTokens":32961,"asi":{"hypothesis":"The Kim-style direction taken earlier was Toffoli-optimizing at 4102q peak, not qubit-optimizing. With the 1200q cap, we must either (a) accept a drastically different Toffoli profile (~100M+) per Luo/Chevignard, or (b) pick a different operating point.","honest_findings":["Google 1200q/2.8M per point-add corresponds to their withheld circuit; public literature doesn't reach this corner.","Luo 2025: 1333q total ECDLP using 3n+O(log n)-qubit inversion register, but 976n^3 Toffoli ≈ 500M per point-add.","Chevignard 2026: 1100q but >100G Toffoli total ≈ 3G+ per point-add.","Our current 4.18M/2716q sits at a Toffoli-competitive but qubit-expensive operating point similar to Litinski 2023's 2500q/6M-per-point-add.","Kim-style wide-r inversion we built is 2.53M Toffoli at 4102q peak — great for Toffoli, wrong for qubits."],"operating_point_decision_needed_from_user":"Which of these directions: (A) 1200q accepting 100x Toffoli blowup to match public SOTA at that qubit count, (B) ~2000q moderate both-axes optimization, (C) stay at ~2700q optimize Toffoli further."}}
{"run":147,"commit":"fa464b9","metric":4180502,"metrics":{},"status":"keep","description":"Deep literature dive: mined Google 2026, Gidney-Ekera 2021 RSA factoring, Gidney 2019 windowed arithmetic, Gidney 2025 RSA (RNS+approximate arithmetic), Kim 2026 ECDLP, HRSL 2020, Litinski 2023, Luo 2025, Chevignard 2026. Measured exact primitive costs (mul=153k, sq=152k, mod_mul_sub=458k) and Kaliski internals (78% of our total). Identified the main public-literature path that could plausibly close gap to Google's 2.7M: coset representation of modular integers (Zalka/GE21) turning modular adds (10n CCX) into non-modular adds (4n CCX), combined with windowed classical-quantum adds (Gidney 2019). Documented findings in src/point_add/sota_gap_analysis.md with three action paths (A: micro-opt to 3.5M, B: coset rep rewrite to ~2.5M, C: windowed point-add for full Shor). Added src/point_add/primitive_costs.rs test harness for future cost accounting.","timestamp":1777067273586,"segment":3,"confidence":11.6634943875061,"iterationTokens":150019,"asi":{"hypothesis":"The gap between our 4.18M/2716q and Google's 2.7M/1175q is closable in principle via literature tricks, most importantly: (1) coset representation of modular integers (Zalka/GE21) which cuts modular-add cost 10n → 4n Toffoli; (2) windowed classical-quantum addition (Gidney2019); (3) tighter Kaliski per-iter cost via step-merging (HRSL Fig 6b).","measurements":{"mul_schoolbook":"153k Toffoli","squaring_sub":"152k Toffoli (already uses symmetric schoolbook)","mod_mul_sub_qq":"458k (worst)","our_per_kaliski_forward":"1.62M Toffoli","our_kaliski_percent_of_total":"78%"},"literature_landscape":"Publicly reachable Toffoli at n=256: Litinski ~4.2M/2500q (we match), HRSL Low T ~19M/2619q, Kim 2026 ~30M/6475q, Luo 2025 ~500M/1333q. Google withheld: 2.7M/1175q. No public circuit hits <3M below 1500q.","action_path":"Path A (micro-opt to ~3.5M): iters 407→402 proven; step4 width truncation; step3/9 cswap fusion. Path B (architectural): coset rep requires harness change. Path C (windowed point-add) for full Shor not single PA."}}
{"run":148,"commit":"0e889a5","metric":4180502,"metrics":{},"status":"keep","description":"April 24 ambitious experiments (all unsuccessful, documented in qubit_target_analysis.md): (1) classical m_hist via HMR + phase correction would save 407q but phase-garbage fails because HMR gives random classical bit, not stored value — Gidney-style measurement-uncompute doesn't let you 'reload' the quantum value later. (2) Kaliski step-9 removal with persistent a_f would save 660k Toffoli but classical simulation shows trajectory divergence after ~10 iters — a_k's value depends on register contents so the two variants compute different algorithms. (3) Rowwise mul with n-wide tmp vs 2n passed correctness but peak qubits didn't drop (other phases hit the same peak). Also documented the hard gap: user wants 1100q ~couple million Toffoli; Luo 2025 achieves 1333q but needs 200-500M Toffoli; Google 2026 claims 1175q/2.7M but withholds the circuit. Public literature cannot simultaneously hit both constraints without coset representation (which requires full harness rewrite).","timestamp":1777074384379,"segment":3,"confidence":11.6634943875061,"iterationTokens":4874,"asi":{"hypothesis":"Three distinct architectural optimizations tried and all failed for fundamental reasons documented in qubit_target_analysis.md. The user's 1100q + couple-M Toffoli budget matches Google's withheld circuit and cannot be reached with current public-literature techniques without major architectural rewrite (Luo's 4-phase EEA with register sharing, OR coset representation per Gidney-Ekera 2021).","failed_experiments":{"m_classical":"HMR gives random classical bit; cannot replace m_i quantum value in backward pass — phase_batches=320","step9_removal":"Classical simulation: 13/30 match after 407 iters — trajectories diverge non-trivially","rowwise_mul":"Peak unchanged (other phases hit 2716); +300k Toffoli"},"next_action_hint":"If continuing: implement Luo's Algorithm 3 with Work1/Work2 register sharing to reach ~1300q at cost of ~200M Toffoli per point-add. Multi-session effort. OR implement coset representation for non-modular adds (Gidney-Ekera 2021) which requires full harness rewrite but potentially reaches ~2.7M Toffoli at 1200q."}}
{"run":149,"commit":"8523296","metric":4180502,"metrics":{},"status":"keep","description":"Added Luo 2025 compact inversion plan (src/point_add/luo_compact_inv_plan.md). Scoped the work needed: implement location-controlled arithmetic with length registers Λuv, Λrs to collapse the 4n+iters Kaliski state to ~3n+O(log n). Expected trade: -50% qubits (2716→~1800 including scaffold), +50x Toffoli (4.18M→~200M). This is the only public-literature path that fits the user's 1100q constraint while being implementable. Estimated 10-20 hours across multiple sessions. Also explored several dead-end micro-optimizations (rowwise mul, non-fast backward step 4) — neither reduces peak because other phases hit the same peak independently.","timestamp":1777075249996,"segment":3,"confidence":11.6634943875061,"iterationTokens":10241,"asi":{"hypothesis":"Continued exploration. All micro-optimizations in current architecture hit the same peak (2716q) because multiple phases independently consume the peak budget. Only way to drop peak is architectural rewrite of Kaliski state — Luo 2025's location-controlled arithmetic is the explicit reference.","explored_dead_ends":["mod_mul_add_rowwise_into_acc with KAL_ROWWISE_MUL flag: passes correctness at mul1 but 1 phase-garbage batch appears somewhere (maybe squaring edge case in some mul site)","non-fast cuccaro in backward step 4: +330k Toffoli, no qubit reduction (backward step 4 peak isn't the binding constraint)","HMR-based m_hist compression: fundamental issue that measurement-random-bit can't replace quantum value for later reuse","step 9 removal: classical simulation shows trajectory divergence"],"next_action_hint":"Next session: implement Luo's Algorithm 3 location-controlled arithmetic. Start with 'loc_controlled_cswap' primitive that swaps between qubit pairs determined by a log-wide length register. Then 'loc_controlled_add/sub'. Then chain into iteration body. Test at small n first."}}
