{"run":258,"commit":"199a441","metric":4111918,"metrics":{"altseed_classical_total":0,"altseed_phase_batches_total":0,"altseed_ancilla_batches_total":0,"avg_clifford":24423006.99,"qubits":2716,"emitted_ops":30748978,"correctness_ok":1,"by_tests_passed":78,"inverse_negr_ccx":1145760,"two_fast_replay_projected":2637286,"by_replay_bench_avg_toffoli":5278510,"by_replay_bench_qubits":2716,"by_replay_bench_emitted_ops":42250936},"status":"keep","description":"Isolate cheap BY lowword pattern oracle and full-width denominator replay blocker","timestamp":1777418872461,"segment":3,"confidence":14.178522571819425,"iterationTokens":8544,"asi":{"hypothesis":"A 16-step windowed BY DIV can separate cheap lowword branch-pattern generation from expensive full-width denominator update. The lowword oracle should be small; the straightforward full-width controlled microstep window should be measured against the fixed-matrix target.","result":"Added lowword_pattern_oracle_is_cheap_and_clean: a 16-step lowword f/g oracle emits the odd pattern to history, reverses local scratch, and is exact/phase-clean at 5,952 CCX and peak 122q. Added full_width_denominator_microstep_window_replay_is_not_enough: given branch controls, a 274-bit denominator 16-step replay costs 26,256 CCX/window, ≈918,960 CCX for 35 windows compute-only, ≈1,837,920 compute+uncompute, peak 1128q. Default autoresearch/checks pass unchanged at 4,111,918 Toffoli / 2716q.","structural_learning":"Window branch-pattern generation is not the blocker; it is cheap enough. The blocker is applying the selected 16-step denominator transform full-width. Per-bit full-width replay is too expensive compared with the ~8k/window fixed-matrix denominator replacement target. The next moonshot object must be a selected/fixed-matrix denominator window with algebraic sharing, or a consumed-denominator point-add schedule.","caveat":"These are component probes, not a benchmark improvement. The full-width denominator replay assertion is an invalidation of the straightforward selected window, not of BY overall.","next_action_hint":"Focus on selected matrix/window application. Try synthesizing a pattern-controlled denominator window via shared matrix factors or QROM-like low-state keyed small hints, and compare to the 26,256/window direct replay and 7,890/window fixed-matrix target."}}
{"run":259,"commit":"0b22bd4","metric":4111918,"metrics":{"altseed_classical_total":0,"altseed_phase_batches_total":0,"altseed_ancilla_batches_total":0,"avg_clifford":24423006.99,"qubits":2716,"emitted_ops":30748978,"correctness_ok":1,"by_tests_passed":78,"inverse_negr_ccx":1145760,"two_fast_replay_projected":2637286,"by_replay_bench_avg_toffoli":5278510,"by_replay_bench_qubits":2716,"by_replay_bench_emitted_ops":42250936},"status":"keep","description":"Show clean current BY replay exceeds SOTA without replay breakthrough","timestamp":1777419059395,"segment":3,"confidence":12.605047126786257,"iterationTokens":7480,"asi":{"hypothesis":"After making the pattern-decoded BY replay clean, the budget may no longer have room for denominator branch generation. We need to quantify whether denominator plumbing alone can still beat 2.7M or whether replay cost itself is now the main moonshot lever.","result":"Added clean_two_replay_by_budget_requires_replay_or_phase_breakthrough. With the updated default baseline and deleted old phases, non-BY scaffold after deletion is ≈285,766 CCX. Two forward decoded replays give ≈2,701,606 CCX before branch generation; two clean decoded replays give ≈2,825,926 CCX. By contrast, two fixed-control branch-numerator replays at 800,900 each plus a hypothetical 300k branch budget would be ≈2,187,566 CCX. Default autoresearch/checks pass at 4,111,918 Toffoli / 2716q.","structural_learning":"The current clean scaled-BY replay is not enough once phase-safe decoder cleanup is included. Denominator branch generation is not the only missing piece; the replay must move toward the fixed-control ~0.8M/replay band or gain a surgical phase-fix for early A clearing. This elevates fused controlled modular average / phase-safe window replay from nice-to-have to mandatory for SOTA.","caveat":"Budget model; no new benchmark improvement. Constants assume the same deleted-phase scaffold as prior BY budgets and a 300k illustrative branch budget for the fixed-control target.","next_action_hint":"Prioritize replay-cost breakthrough: prototype fused controlled modular average or another phase-safe selected replay that can keep window-local A clearing without exact 4,350-CCX microsteps. Denominator window generation remains necessary but no longer sufficient alone."}}
{"run":260,"commit":"ce66f6f","metric":4111918,"metrics":{"altseed_classical_total":0,"altseed_phase_batches_total":0,"altseed_ancilla_batches_total":0,"avg_clifford":24423006.99,"qubits":2716,"emitted_ops":30748978,"correctness_ok":1,"by_tests_passed":83,"inverse_negr_ccx":1145760,"two_fast_replay_projected":2637286,"by_replay_bench_avg_toffoli":5278510,"by_replay_bench_qubits":2716,"by_replay_bench_emitted_ops":42250936},"status":"keep","description":"Narrow BY moonshot to replay breakthrough plus selected denominator window","timestamp":1777419362588,"segment":3,"confidence":11.34592227695676,"iterationTokens":14285,"asi":{"hypothesis":"The moonshot path needs faster progress by isolating which BY components are actually blockers: lowword pattern generation, full-width denominator window update, replay phase/control scheduling, and Toffoli accounting under quantum branch controls.","result":"Added lowword_pattern_oracle_is_cheap_and_clean: a 16-step lowword f/g oracle emits odd pattern to history and reverses local scratch, exact and phase-clean at 5,952 CCX / 122q. Added full_width_denominator_microstep_window_replay_is_not_enough: direct 274-bit controlled denominator replay costs 26,256 CCX/window, ~918,960 compute-only for 35 windows, ~1,837,920 compute+uncompute, peak 1128q. Added exact_cneg_scaled_microstep_may_enable_window_local_a_clearing: making only A-controlled negation exact fixes early A-clearing phase, with full window-local replay cost 1,412,880 CCX / 2221q / phase clean. Added quantum_branch_values_do_not_reduce_replay_toffoli_accounting: quantum branch sparsity gives no benchmark relief; fast replay mean per shot equals static 1,145,760. Added clean_two_replay_by_budget_requires_replay_or_phase_breakthrough: current clean decoded two-replay schedule is ~2,825,926 before branch generation; forward-only decoded is ~2,701,606. Full BY suite passed locally: 83 tests. Latest autoresearch attempt was blocked by context guard, but default benchmark path is unchanged from previous pass at 4,111,918 / 2716q.","structural_learning":"Pattern generation is cheap; full-width denominator update and replay cost are the blockers. Direct denominator microstep windows are too expensive versus the ~8k/window fixed-matrix target. Current clean decoded replays are already over 2.7M before branch generation, so denominator plumbing alone cannot hit SOTA. Exact A-controlled negation provides a surgical phase fix for window-local A clearing but raises replay to ~1.41M, still too high. There is no average-case Toffoli discount from sparse quantum branch values.","caveat":"No SOTA benchmark path yet; these are component probes and budget invalidations. The autoresearch full run could not be repeated after the edits due the harness context guard, but default code path was not changed except tests/docs after the previous clean default run.","next_action_hint":"Stop exploring per-bit denominator replay and naive clean decoded replay. Next synthesize one of two moonshot objects: (1) fixed-control/window replay closer to 0.8M per replay, likely via fused controlled modular average or branch-numerator windowing with phase-safe cleanup; (2) selected/fixed-matrix full-width denominator window near 8k/window using pattern matrix algebra, not microstep replay."}}
{"run":261,"commit":"accde64","metric":4111918,"metrics":{"altseed_classical_total":0,"altseed_phase_batches_total":0,"altseed_ancilla_batches_total":0,"avg_clifford":24423006.99,"qubits":2716,"emitted_ops":30748978,"correctness_ok":1,"by_tests_passed":84,"inverse_negr_ccx":1145760,"two_fast_replay_projected":2637286,"by_replay_bench_avg_toffoli":5278510,"by_replay_bench_qubits":2716,"by_replay_bench_emitted_ops":42250936},"status":"keep","description":"Quantify tapered fixed-matrix denominator target for BY window selection","timestamp":1777419528429,"segment":3,"confidence":10.749697493517719,"iterationTokens":14285,"asi":{"hypothesis":"The direct per-bit denominator replay is too expensive, but a tapered fixed-matrix denominator update may be SOTA-shaped if the 16-step window matrix/pattern selection can be solved. We need a positive arithmetic target, not only invalidations.","result":"Added tapered_fixed_matrix_denominator_budget_is_sota_shaped_if_selection_solved. It samples actual secp256k1 BY trajectories, takes each 16-step branch matrix, applies the existing scaled fixed-matrix replacement cost model at active 2-adic widths 560,544,...,16, and sums 35 windows. Mean denominator compute is ≈303,828 CCX, max sample 329,595, mean compute+uncompute ≈607,657, max standalone peak 3424q due old/new buffers. Full BY tests pass locally: 84 tests. Default benchmark path remains unchanged at 4,111,918 / 2716q.","structural_learning":"There is a SOTA-shaped denominator arithmetic target: selected/tapered fixed-matrix windows are ~3x cheaper than full-width microstep replay and plausibly fit the remaining BY budget if production scheduling eliminates old/new buffer peak. This refocuses the denominator blocker from branch generation to selected matrix application: pattern oracle is cheap, fixed-matrix arithmetic is cheap enough, selection/scheduling is the hard object.","caveat":"The positive cost assumes the window matrix is already selected and uses a standalone double-buffered cost model with high peak. It is not yet a selected quantum circuit and not integrated into point-add.","next_action_hint":"Synthesize selected fixed-matrix denominator window. Start with one 16-step window: pattern oracle produces 16 bits, reconstruct matrix/A mask, and apply a shared algebraic matrix update cheaper than 26,256/window direct replay. Explore factor/Hermite or branch-numerator sharing rather than enumerating all patterns."}}
{"run":262,"commit":"577745e","metric":4111918,"metrics":{"altseed_classical_total":0,"altseed_phase_batches_total":0,"altseed_ancilla_batches_total":0,"avg_clifford":24423006.99,"qubits":2716,"emitted_ops":30748978,"correctness_ok":1,"by_tests_passed":86,"inverse_negr_ccx":1145760,"two_fast_replay_projected":2637286,"by_replay_bench_avg_toffoli":5278510,"by_replay_bench_qubits":2716,"by_replay_bench_emitted_ops":42250936},"status":"keep","description":"Prove BY consumed-window algebra and kill fixed-precision branch shortcut","timestamp":1777420212905,"segment":3,"confidence":10.21300706191493,"iterationTokens":14285,"asi":{"hypothesis":"A self-cleaning BY denominator window may not need to preserve consumed low words if the branch pattern is exactly the determinant history. Conversely, maybe a fixed 256-bit truncated denominator state is an approximate shortcut for branch generation. Both need to be decided before designing the selected/window circuit.","result":"Added consumed_lowword_window_has_exact_quotient_update_and_pattern_inverse. For W=16, with f=f_low+2^16F and g=g_low+2^16G, selected matrix P gives quotient update P·(F,G)+(P·low)/2^16; the lowword correction is integral and small (max sampled |q|=32757), and pattern+full quotient reconstructs the old state via sign(det(P))*adj(P). Added fixed_precision_2adic_denominator_branch_curve. Truncated 64/96/128/160/192/224/256-bit denominator states mismatch essentially 100% of 560-step trajectories, with first mismatch around bits+1; field-width truncation is not a 1% approximate escape. Full BY test suite passed locally: 86 tests. Default benchmark path remains unchanged at 4,111,918 / 2716q.","structural_learning":"The BY denominator window now has an exact consumed-lowword algebra: branch pattern is the right reversibility payload when enough quotient precision is retained, and the lowword q correction is small enough to be produced inside the local window oracle. However a fixed field-width 2-adic state cannot replace the 560-bit/sliding state; it just delays the first wrong branch. This narrows the denominator moonshot to selected fixed-matrix quotient update plus production precision scheduling, not fixed-width approximation.","caveat":"The consumed-window proof is algebraic/classical and retains full quotient precision; it is not yet a selected quantum circuit and does not solve peak scheduling. The fixed-precision curve uses sampled trajectories, but failures are 100% across 800 samples per precision, far above the user's 1% tolerance.","next_action_hint":"Build a one-window selected quotient-update prototype: lowword oracle should emit pattern and small q correction, then a shared fixed-matrix update should apply P to quotient registers without generic coefficient-bit multiplication. Also keep replay-cost work alive: fused modular average remains mandatory because two clean decoded replays still exceed 2.7M before denominator generation."}}
{"run":263,"commit":"3a5e7fa","metric":4111918,"metrics":{"altseed_classical_total":0,"altseed_phase_batches_total":0,"altseed_ancilla_batches_total":0,"avg_clifford":24423006.99,"qubits":2716,"emitted_ops":30748978,"correctness_ok":1,"by_tests_passed":87,"inverse_negr_ccx":1145760,"two_fast_replay_projected":2637286,"by_replay_bench_avg_toffoli":5278510,"by_replay_bench_qubits":2716,"by_replay_bench_emitted_ops":42250936},"status":"keep","description":"Build clean BY lowword pattern-plus-q oracle for consumed denominator windows","timestamp":1777420418399,"segment":3,"confidence":8.786577181208054,"iterationTokens":14285,"asi":{"hypothesis":"The consumed-lowword algebra needs a real local circuit that produces not only branch pattern bits but also the small quotient correction q=(P*low)/2^16, then cleans the lowword simulator. If this oracle is cheap, the selected quotient update can treat pattern and q as its local side information.","result":"Added lowword_pattern_and_q_oracle_is_still_cheap_and_clean. It sign-extends 16-bit low f/g into 34-bit local signed registers, runs 16 signed BY divsteps using reversible arithmetic shifts, copies out the 16-bit pattern and q0/q1, then reverses and cleans f/g/delta/pattern_tmp/A_tmp. It passes basis simulation with phase clean. Cost: 9,408 CCX, peak 262q, qbits=34. Full BY suite passed locally: 87 tests. Default benchmark path remains unchanged at 4,111,918 / 2716q.","structural_learning":"The local side-information part of a consumed BY denominator window is no longer hypothetical. Pattern generation plus lowword quotient correction is cheap and clean, and the q correction fits a tiny signed register. The remaining denominator hard part is now isolated to selected application of P to the quotient/high registers and precision scheduling; not lowword pattern/q extraction.","caveat":"The oracle copies q to persistent registers for the probe. A production circuit should consume q during the selected quotient update and uncompute it, not retain 68 extra bits per window. This does not yet solve selected matrix application or replay cost.","next_action_hint":"Next synthesize a one-window selected quotient update that uses pattern and q from this oracle. Avoid generic coefficient-bit multiplication; try shared branch-numerator/Hermite factor application or a small pattern-derived factorization. In parallel, continue fused modular-average work because replay cost still dominates the two-replay SOTA budget."}}
{"run":264,"commit":"d63f5e0","metric":4111918,"metrics":{"altseed_classical_total":0,"altseed_phase_batches_total":0,"altseed_ancilla_batches_total":0,"avg_clifford":24423006.99,"qubits":2716,"emitted_ops":30748978,"correctness_ok":1,"by_tests_passed":89,"inverse_negr_ccx":1145760,"two_fast_replay_projected":2637286,"by_replay_bench_avg_toffoli":5278510,"by_replay_bench_qubits":2716,"by_replay_bench_emitted_ops":42250936},"status":"keep","description":"Find live reduction-flag BY replay that is phase-safe and near target cost","timestamp":1777420665954,"segment":3,"confidence":7.709769402429953,"iterationTokens":14285,"asi":{"hypothesis":"The MBU phase failure under window-local A clearing may come from immediately uncomputing modular-add reduction flags with the measurement-based comparator. If we keep those flags live, we may both save ~256 CCX/step and remove the phase dependency on A controls, giving a replay path closer to the fixed-control target.","result":"Added mod_add_qq_fast_keep_reduction_flag_for_test, cmod_add_qq_keep_reduction_flag_for_test, and emit_scaled_by_controlled_microstep_live_addflag_for_test. The live-flag microstep is correct on A/B/C basis samples, costs 1,790 CCX, so replay560≈1,002,400 (vs 1,145,760 fast clean microsteps and 2,436,000 exact). Added live_reduction_flags_make_window_local_a_clear_phase_safe_candidate: window-local A decoder schedule with live reduction flags is data-correct, A/delta scratch clean, phase=0, flags nonzero, 1,126,720 CCX, peak 2,780q. Full BY suite passed locally: 89 tests. Default benchmark path remains unchanged at 4,111,918 / 2716q.","structural_learning":"This is the first replay-cost/phase breakthrough after the scaled microstep: paying the cmp_lt flag uncompute immediately is not mandatory for data correctness, and keeping reduction flags live both lowers Toffoli and makes early A clearing phase-safe. The hard problem shifts from A-history phase to reduction-flag cleanup/absorption. If those 560 flags can be cleaned during reverse denominator/window cleanup or recovered by a fused average relation, replay cost is near the fixed-control band and SOTA margin reopens.","caveat":"The live reduction flags are real garbage; the current candidate is not a clean unitary replay. Peak 2,780q is under the current cap but with raw 560 flags and 350 boundary delta bits; compression/cleanup still needed for strict 600-scratch or Google low-qubit target. The default point-add benchmark is unchanged.","next_action_hint":"Attack reduction-flag cleanup. Derive whether each flag can be recomputed from post-halve state plus r/odd/A or from the inverse BY replay, or pair flags with denominator quotient/window history. If direct cleanup costs a full cmp_lt, try fusing modular average so the flag is recoverable from the final doubled output without comparator."}}
{"run":265,"commit":"2493ee1","metric":4111918,"metrics":{"altseed_classical_total":0,"altseed_phase_batches_total":0,"altseed_ancilla_batches_total":0,"avg_clifford":24423006.99,"qubits":2716,"emitted_ops":30748978,"correctness_ok":1,"by_tests_passed":90,"inverse_negr_ccx":1145760,"two_fast_replay_projected":2637286,"by_replay_bench_avg_toffoli":5278510,"by_replay_bench_qubits":2716,"by_replay_bench_emitted_ops":42250936},"status":"keep","description":"Derive live reduction-flag recovery relation and direct-cleanup blocker","timestamp":1777420758487,"segment":3,"confidence":6.910434492721413,"iterationTokens":14285,"asi":{"hypothesis":"If live modular-add reduction flags are recoverable cheaply from post-halve state, the phase-safe 1.126M replay candidate can become clean. The first check is the algebraic recovery relation and the cost of direct cleanup.","result":"Added live_reduction_flag_is_recoverable_from_doubled_output_but_cleanup_is_costly. For canonical nonzero cases, the live flag equals odd && (2*out_s mod p) < r_out; sampled check had 0 nonzero mismatches, with only two fast-negation zero-representative edge mismatches. However direct cleanup needs a doubled-output copy, comparator, and uncompute, lower bounded at about 766 CCX per flag, worse than the 256-CCX cmp_lt uncompute skipped by keeping the flag live. Full BY suite passed locally: 90 tests. Default benchmark path unchanged at 4,111,918 / 2716q.","structural_learning":"The live-flag path is real but direct post-halve cleanup is not the solution. The flag relation explains exactly what information is missing: z=2*out_s mod p compared to the addend. Cleaning flags one-by-one after the halve would erase the replay savings. The next viable route must absorb flags into a fused modular-average primitive, clean them during inverse/window replay while z is already available, or use denominator/history coupling to avoid a separate doubled-output comparator.","caveat":"This is a recovery/cost analysis, not a clean replay. Fast controlled negation has a zero-representative edge where actual live flags can differ from the canonical relation, so production cleanup must handle logical-zero p representatives explicitly.","next_action_hint":"Prototype fused controlled modular average with the reduction flag and parity flag arranged so both are recoverable before z is destroyed, or search for a schedule that delays the halve/inverse enough to use the existing z<r comparator without extra double/uncompute."}}
