{"run":534,"commit":"c1aea55","metric":1715.669,"metrics":{"centered_2800_payload_p99_bits":336,"centered_2800_payload_max_bits":341,"centered_2800_count_p99":118,"centered_2800_one_boundary_scratch_p99":710,"centered_2800_weighted_trials_p99":43935,"centered_2800_projected_gap_to_3m_ccx":-556900,"centered_2800_fixedscan_gap_to_3m_at_1ccx":28970172,"centered_2800_extraction_oneway_budget_ccx":490705,"centered_2800_log_barrel_gap_pointadd_ccx":156860,"altseed_classical_total":0,"altseed_phase_batches_total":0,"altseed_ancilla_batches_total":0,"avg_toffoli":4089274,"avg_clifford":24292787.153,"qubits":2713,"emitted_ops":30575944,"correctness_ok":1},"status":"keep","description":"Correct centered Euclid packed extractor budget for reverse pass","timestamp":1777598325607,"segment":99,"confidence":null,"iterationTokens":178,"asi":{"hypothesis":"The centered Euclid alignment budget must be corrected for the forward+reverse denominator extractor; the previous 5874 CCX/quotient may be too optimistic.","result":"Corrected budget is much tighter but not zero: one-way extraction budget 490705; after compare/sub and leading scans, alignment budget is 1715.669 CCX/quotient. A generic n log n barrel at 2048 CCX/quotient would miss by +156860 point-add CCX. Fixed scan remains dead at +28970172.","decision":"Centered Euclid remains the best relaxed-2800q candidate but requires cheaper-than-generic-barrel offset/metadata alignment. Previous 5874 number is superseded.","next_action_hint":"Prototype or lower-bound an offset/metadata shifted compare-subtract under ~1.7k CCX/quotient; if impossible, demote centered quotient stream too."}}
{"type":"config","name":"Centered Euclid fixed-K public shift slot tradeoff","metricName":"centered_fixedk_best_zero_fail_gap_ccx","metricUnit":"","bestDirection":"lower"}
{"run":535,"commit":"4a984ca","metric":9223372036854776000,"metrics":{"centered_fixedk4_fail_ppm":1000000,"centered_fixedk4_gap_to_3m_ccx":-160308,"centered_fixedk5_fail_ppm":999633,"centered_fixedk5_gap_to_3m_ccx":357704,"centered_fixedk6_fail_ppm":973205,"centered_fixedk6_gap_to_3m_ccx":875716,"centered_fixedk8_fail_ppm":574859,"centered_fixedk8_gap_to_3m_ccx":1911740,"centered_fixedk10_fail_ppm":185546,"centered_fixedk10_gap_to_3m_ccx":2947764,"centered_fixedk12_fail_ppm":49804,"centered_fixedk12_gap_to_3m_ccx":3983788,"centered_fixedk_count_p99":118,"centered_fixedk_count_p999":122,"centered_fixedk_count_max":128,"centered_fixedk_max_qbits_seen":23,"centered_fixedk_best_zero_fail_k":0,"altseed_classical_total":0,"altseed_phase_batches_total":0,"altseed_ancilla_batches_total":0,"avg_toffoli":4089274,"avg_clifford":24292787.153,"qubits":2713,"emitted_ops":30575944,"correctness_ok":1},"status":"keep","description":"Kill fixed-K public-shift slots for centered Euclid extractor","timestamp":1777598552167,"segment":100,"confidence":null,"iterationTokens":170,"asi":{"hypothesis":"Avoid variable-offset alignment by storing every centered quotient in fixed K-bit public-shift slots; public shift positions remove the barrel/mux.","result":"Tradeoff is bad. K=4 is barely under 3M (-160308) but fails all samples. K=5 already misses by +357704 and fails 999633 ppm. K=12 still fails 49804 ppm and misses by +3983788. Max sampled quotient bitlength is 23, no zero-fail K in tested range.","decision":"Fixed-K public shift slots do not solve centered Euclid extraction. The remaining path specifically needs variable-offset/metadata alignment under ~1.7k CCX/quotient.","next_action_hint":"Try to lower-bound or prototype variable-offset comparison directly; do not use fixed slots or generic barrels."}}
{"type":"config","name":"Centered Euclid restoring subtract plus barrel 3M ledger","metricName":"centered_restoring_barrel_gap_to_3m_ccx","metricUnit":"","bestDirection":"lower"}
{"run":536,"commit":"61dd578","metric":-174766,"metrics":{"centered_restoring_payload_p99_bits":337,"centered_restoring_count_p99":119,"centered_restoring_scratch_p99":710,"centered_restoring_extraction_oneway_ccx":446720,"centered_restoring_oneway_margin_ccx":43691,"altseed_classical_total":0,"altseed_phase_batches_total":0,"altseed_ancilla_batches_total":0,"avg_toffoli":4089274,"avg_clifford":24292787.153,"qubits":2713,"emitted_ops":30575944,"correctness_ok":1},"status":"keep","description":"Reopen centered Euclid 3M ledger with restoring subtract plus barrel","timestamp":1777598768908,"segment":101,"confidence":null,"iterationTokens":180,"asi":{"hypothesis":"The centered quotient extractor may fit 3M if quotient generation uses restoring subtract (2n per q bit) rather than separate compare+masked subtract (3n), allowing a generic variable barrel.","result":"Positive but narrow: centered p99 payload/count 337/119, scratch 710. Restoring-subtract + nlogn barrel ledger gives extraction_oneway 446720 and projected point-add gap -174766 to 3M, with only 43691 one-way margin for all missing control/cleanup overhead.","decision":"Centered Euclid remains a narrow relaxed-2800q candidate. The next hard piece must be an actual phase-clean toy restoring-subtract/barrel extractor; the margin is too small for more proxy optimism.","next_action_hint":"Prototype small-width restoring division extractor with quotient bits/boundaries and inverse cleanup. Measure CCX vs 2n q-bit floor and barrel overhead; if overhead exceeds ~44k scaled, demote."}}
{"type":"config","name":"Centered Euclid current qbit primitive 3M budget","metricName":"centered_current_3n_gap_ccx","metricUnit":"","bestDirection":"lower"}
{"run":537,"commit":"55392ee","metric":170322,"metrics":{"centered_current_affordable_per_payload_bit_ccx":641.647,"centered_current_ideal_2n_gap_ccx":-174766,"centered_current_fused_2p5n_gap_ccx":-2222,"centered_current_4n_gap_ccx":515410,"centered_current_5n_gap_ccx":860498,"altseed_classical_total":0,"altseed_phase_batches_total":0,"altseed_ancilla_batches_total":0,"avg_toffoli":4089274,"avg_clifford":24292787.153,"qubits":2713,"emitted_ops":30575944,"correctness_ok":1},"status":"keep","description":"Show centered Euclid needs fused <2.5n qbit primitive","timestamp":1777599000787,"segment":102,"confidence":null,"iterationTokens":174,"asi":{"hypothesis":"The centered Euclid restoring-subtract/barrel opening may be killed by the actual cost of quotient-bit generation with current primitives.","result":"Budget is extremely tight: affordable qbit primitive is 641.647 CCX (~2.51n). Ideal 2n leaves -174766; 2.5n barely leaves -2222. A 3n primitive misses by +170322, and current-style restoring/compare-sub estimates at 4n/5n miss by +515410/+860498.","decision":"Centered Euclid is not viable with existing compare+controlled-add primitives. It remains alive only if we can synthesize a fused borrow-exposing subtract below ~2.5n per quotient payload bit.","next_action_hint":"Prototype the fused borrow subtract at toy widths; if phase-clean cost is >=3n when scaled, demote centered Euclid for relaxed 3M too."}}
{"type":"config","name":"Centered restoring subtract current circuit cost","metricName":"centered_restoring_circuit_gap_to_3m_ccx","metricUnit":"","bestDirection":"lower"}
