{"run":235,"commit":"b123ff6","metric":4132750,"metrics":{"altseed_classical_total":0,"altseed_phase_batches_total":0,"altseed_ancilla_batches_total":0,"avg_clifford":24414411.956,"qubits":2716,"emitted_ops":31193208,"correctness_ok":1,"by_tests_passed":71,"inverse_negr_ccx":1145760,"two_fast_replay_projected":2637286,"by_replay_bench_avg_toffoli":5278510,"by_replay_bench_qubits":2716,"by_replay_bench_emitted_ops":42250936},"status":"keep","description":"Add env-gated Kaliski iteration thresholds for approximate SOTA probes","timestamp":1777409238780,"segment":3,"confidence":17.148393507784036,"iterationTokens":18926,"asi":{"hypothesis":"Google's disclosed point-add proof allows approximate correctness over the 9024 Fiat-Shamir inputs. Before full BY integration, we should expose pair1/pair2 Kaliski iteration thresholds as env-gated knobs so we can quantify whether approximate early cutoff can produce real benchmark savings without dirtying the exact default path.","result":"Added KAL_PAIR1_ITERS and KAL_PAIR2_ITERS overrides in build_standard_point_add. Defaults remain pair1=407 and pair2=403 (or 404 for tagged validation paths). Default autoresearch and checks still pass unchanged at avg_toffoli=4,132,750 / 2716q / correctness_ok=1.","structural_learning":"This gives a clean benchmark-path way to test approximate inversion thresholds under the real harness and altseed checks. It is not a micro-optimization by itself; it tests whether approximate correctness can delete an inversion-sized amount of work, as Google's ZK statement explicitly permits most-input correctness.","caveat":"No threshold reduction has been validated yet. Env variants that pass the benchmark may still have nonzero failure probability; they must be checked with altseed diagnostics and, if promising, a larger sampled threshold survey.","next_action_hint":"Run KAL_PAIR1_ITERS/KAL_PAIR2_ITERS sweeps through ./autoresearch.sh. Start with symmetric reductions (390/390, 370/370, etc.) and separate pair1/pair2 reductions. Keep only variants with zero harness/altseed failures and substantial Toffoli savings; otherwise record failure rates."}}
{"run":236,"commit":"b123ff6","metric":0,"metrics":{"altseed_classical_total":16,"altseed_phase_batches_total":49,"altseed_ancilla_batches_total":0,"avg_clifford":0,"qubits":0,"emitted_ops":0,"correctness_ok":0,"by_tests_passed":71,"inverse_negr_ccx":1145760,"two_fast_replay_projected":2637286,"by_replay_bench_avg_toffoli":5278510,"by_replay_bench_qubits":2716,"by_replay_bench_emitted_ops":42250936},"status":"crash","description":"Approximate Kaliski threshold 390/390 fails altseed phase/classical checks","timestamp":1777409262151,"segment":3,"confidence":17.148393507784036,"iterationTokens":1387,"asi":{"hypothesis":"Symmetrically reducing both Kaliski iteration counts from 407/403 to 390/390 might exploit the approximate-correctness allowance and save a large fraction of inversion work.","result":"KAL_PAIR1_ITERS=390 KAL_PAIR2_ITERS=390 failed during altseed diagnostics before the main benchmark: altseed_classical_total=16, altseed_phase_batches_total=49, ancilla=0. Panic was ALT-SEED PHASE FAILURE.","rollback_reason":"Env-only experiment; no code rollback needed. The threshold is unsafe for the real harness/altseed guard.","structural_learning":"Kaliski early cutoff has a sharp phase-cleanliness cliff. Even when classical mismatches are sparse, phase garbage appears in many batches; approximate iteration reduction cannot be assessed only by output mismatch.","next_action_hint":"Try smaller reductions and isolate pair1 vs pair2. The phase failure may be dominated by one cleanup path; test pair1=400,pair2=403 and pair1=407,pair2=396 before abandoning approximate Kaliski cutoff."}}
{"run":237,"commit":"b123ff6","metric":0,"metrics":{"altseed_classical_total":1,"altseed_phase_batches_total":1,"altseed_ancilla_batches_total":0,"avg_clifford":0,"qubits":0,"emitted_ops":0,"correctness_ok":0,"by_tests_passed":71,"inverse_negr_ccx":1145760,"two_fast_replay_projected":2637286,"by_replay_bench_avg_toffoli":5278510,"by_replay_bench_qubits":2716,"by_replay_bench_emitted_ops":42250936},"status":"crash","description":"Approximate Kaliski pair1=400 still fails altseed","timestamp":1777409289360,"segment":3,"confidence":17.148393507784036,"iterationTokens":1322,"asi":{"hypothesis":"A small pair1-only Kaliski cutoff reduction from 407 to 400 may pass the approximate harness while saving several iterations.","result":"KAL_PAIR1_ITERS=400 KAL_PAIR2_ITERS=403 failed in altseed diagnostics: classical_total=1, phase_batches=1, ancilla=0. The phase guard panicked before the main benchmark.","rollback_reason":"Env-only threshold experiment failed; no code rollback needed.","structural_learning":"Pair1 has little or no safe iteration slack under the current phase-clean exactness guard. Even 7 fewer iterations caused an altseed phase failure and one classical mismatch.","next_action_hint":"Test pair1=403 and/or isolate pair2 reductions. If pair1=403 fails, pair1 cutoff is effectively pinned at 407 for this Kaliski implementation."}}
{"run":238,"commit":"b123ff6","metric":0,"metrics":{"altseed_classical_total":0,"altseed_phase_batches_total":1,"altseed_ancilla_batches_total":0,"avg_clifford":0,"qubits":0,"emitted_ops":0,"correctness_ok":0,"by_tests_passed":71,"inverse_negr_ccx":1145760,"two_fast_replay_projected":2637286,"by_replay_bench_avg_toffoli":5278510,"by_replay_bench_qubits":2716,"by_replay_bench_emitted_ops":42250936},"status":"crash","description":"Approximate Kaliski pair1=403 fails phase guard","timestamp":1777409311268,"segment":3,"confidence":17.148393507784036,"iterationTokens":1121,"asi":{"hypothesis":"Pair1 may tolerate a very small iteration reduction from 407 to 403 with no classical failures.","result":"KAL_PAIR1_ITERS=403 KAL_PAIR2_ITERS=403 had zero altseed classical mismatches but one phase-garbage batch, causing the phase guard to fail.","rollback_reason":"Env-only threshold experiment failed the phase-clean contract.","structural_learning":"The pair1 cutoff is pinned by phase cleanliness, not only classical output correctness. A 4-iteration reduction already leaves phase garbage on some altseed batch.","next_action_hint":"Do not rely on approximate pair1 Kaliski cutoff unless the phase contract is deliberately relaxed. Test pair2-only reductions next; pair2 may have independent slack."}}
{"run":239,"commit":"b123ff6","metric":0,"metrics":{"altseed_classical_total":0,"altseed_phase_batches_total":1,"altseed_ancilla_batches_total":0,"avg_clifford":0,"qubits":0,"emitted_ops":0,"correctness_ok":0,"by_tests_passed":71,"inverse_negr_ccx":1145760,"two_fast_replay_projected":2637286,"by_replay_bench_avg_toffoli":5278510,"by_replay_bench_qubits":2716,"by_replay_bench_emitted_ops":42250936},"status":"crash","description":"Approximate Kaliski pair2=396 fails phase guard","timestamp":1777409330083,"segment":3,"confidence":17.148393507784036,"iterationTokens":1092,"asi":{"hypothesis":"Pair2 might have more approximate iteration slack than pair1 because it runs after affine output formation and only cleans lambda.","result":"KAL_PAIR1_ITERS=407 KAL_PAIR2_ITERS=396 failed altseed phase guard with zero classical mismatches but one phase-garbage batch.","rollback_reason":"Env-only threshold experiment failed phase-clean contract.","structural_learning":"Pair2 also has very little safe cutoff slack under the current measurement-based uncompute/phase contract. Classical correctness alone would miss the failure.","next_action_hint":"Try pair2=400/401 if needed to locate the exact phase cliff, but large approximate Kaliski cutoff savings are unlikely. Return focus to BY/windowed division or phase-relaxed approximate semantics."}}
{"run":240,"commit":"b123ff6","metric":0,"metrics":{"altseed_classical_total":0,"altseed_phase_batches_total":2,"altseed_ancilla_batches_total":0,"avg_clifford":0,"qubits":0,"emitted_ops":0,"correctness_ok":0,"by_tests_passed":71,"inverse_negr_ccx":1145760,"two_fast_replay_projected":2637286,"by_replay_bench_avg_toffoli":5278510,"by_replay_bench_qubits":2716,"by_replay_bench_emitted_ops":42250936},"status":"crash","description":"Approximate Kaliski pair2=400 still fails phase guard","timestamp":1777409351076,"segment":3,"confidence":17.148393507784036,"iterationTokens":1093,"asi":{"hypothesis":"A very small pair2 reduction from 403 to 400 might pass the exact harness while saving three cleanup iterations.","result":"KAL_PAIR1_ITERS=407 KAL_PAIR2_ITERS=400 failed altseed phase guard: classical_total=0, phase_batches=2, ancilla=0.","rollback_reason":"Env-only threshold experiment failed phase-clean contract.","structural_learning":"Even a 3-iteration pair2 reduction is phase-unsafe. The Kaliski iteration counts are effectively tight for this exact phase-clean implementation.","next_action_hint":"Do not spend more time on Kaliski cutoff as a SOTA path. The approximate resource gap must come from a different reversible division architecture, not truncating current Kaliski."}}
{"run":241,"commit":"e9fc5b3","metric":4132750,"metrics":{"altseed_classical_total":0,"altseed_phase_batches_total":0,"altseed_ancilla_batches_total":0,"avg_clifford":24414411.956,"qubits":2716,"emitted_ops":31193208,"correctness_ok":1,"by_tests_passed":72,"inverse_negr_ccx":1145760,"two_fast_replay_projected":2637286,"by_replay_bench_avg_toffoli":5278510,"by_replay_bench_qubits":2716,"by_replay_bench_emitted_ops":42250936},"status":"keep","description":"Invalidate h16 pattern-only BY generator and Kaliski cutoff shortcut","timestamp":1777409486346,"segment":3,"confidence":25.0828488372093,"iterationTokens":5996,"asi":{"hypothesis":"The simplest savings-capable BY generator might keep only h=g/f mod 2^16 plus the 16-bit branch pattern per window; if that state predicted the next h, branch generation could be tiny. Also, approximate Kaliski cutoff might be an easier benchmark-path savings shortcut because Google's disclosed proof permits most-input correctness.","result":"Added pattern_augmented_low_ratio_state_still_not_forward_complete. On 2,000 sampled secp256k1 trajectories, h16+pattern failed to predict the next window h in 66,905 of 70,000 windows (95.58%). Env Kaliski cutoff probes were also run: pair1=403/pair2=403 failed with phase_batches=1; pair1=407/pair2=400 failed with phase_batches=2; pair1=400 had a classical mismatch and phase failure; 390/390 failed badly. Default autoresearch/checks pass unchanged at 4,132,750 Toffoli / 2716q.","structural_learning":"The branch-control problem is sharper now. Current-window branch bits are low-ratio local, but next-window state needs high 2-adic information. A viable generator must use a sliding high-precision state, explicit rank/high-bit payload, or a consumed-denominator schedule. Separately, truncating current Kaliski is not a SOTA shortcut because phase cleanliness fails before useful iteration savings appear.","caveat":"This is an invalidation/probe step, not an improved benchmark. The two-replay BY budget remains promising only if branch/control generation is solved by a non-naive architecture.","next_action_hint":"Prototype a sliding high-precision 2-adic generator cost model: keep R=16+m bits of h/f-g state per window, drop 16 bits each window, and determine the minimum m/rank payload needed for exact next-window prediction on sampled trajectories. If cost stays too high, pivot to consumed-denominator triangular scheduling."}}
{"run":242,"commit":"da66e94","metric":4132750,"metrics":{"altseed_classical_total":0,"altseed_phase_batches_total":0,"altseed_ancilla_batches_total":0,"avg_clifford":24414411.956,"qubits":2716,"emitted_ops":31193208,"correctness_ok":1,"by_tests_passed":73,"inverse_negr_ccx":1145760,"two_fast_replay_projected":2637286,"by_replay_bench_avg_toffoli":5278510,"by_replay_bench_qubits":2716,"by_replay_bench_emitted_ops":42250936},"status":"keep","description":"Measure tapered high-precision BY branch generator and invalidate direct path","timestamp":1777409750934,"segment":3,"confidence":25.0828488372093,"iterationTokens":14824,"asi":{"hypothesis":"A sliding high-precision 2-adic branch generator that drops one active bit per divstep might be much cheaper than the uniform W=560 direct generator and could potentially fit beside the scaled-BY replays.","result":"Added tapered_2adic_branch_generator_cost_is_still_too_high. The principled tapered generator uses 560 initial f/g bits, shrinks the active slices by one per step, and emits all 560 odd/A controls. Measured compute cost is 1,004,080 CCX, compute+uncompute per denominator is 2,008,160 CCX, two denominators are 4,016,320 CCX, peak 3372q. BY tests pass locally: 73 passed. Default autoresearch/checks pass unchanged at 4,132,750 Toffoli / 2716q.","structural_learning":"Tapering halves the naive uniform branch-generator cost but remains far outside the margin: two scaled-BY replays already consume ~2.29M Toffoli, leaving only a small budget before 2.7M. The branch generator must be genuinely windowed/self-cleaning or avoided by triangular denominator consumption; per-bit high-precision generation is not a savings-capable integration path.","caveat":"This is another invalidation/probe, not a benchmark improvement. It measures a generator scaffold with raw controls and high qubit peak, not a production integrated DIV.","next_action_hint":"Stop pursuing per-bit branch generators. Next target a window-level self-cleaning DIV primitive: selected 16-step denominator/numerator update with no persistent branch-history compute/uncompute, or a triangular point-add schedule that consumes denominator state and cleans it from final outputs."}}
{"run":243,"commit":"b400430","metric":4132750,"metrics":{"altseed_classical_total":0,"altseed_phase_batches_total":0,"altseed_ancilla_batches_total":0,"avg_clifford":24414411.956,"qubits":2716,"emitted_ops":31193208,"correctness_ok":1,"by_tests_passed":73,"inverse_negr_ccx":1145760,"two_fast_replay_projected":2637286,"by_replay_bench_avg_toffoli":5278510,"by_replay_bench_qubits":2716,"by_replay_bench_emitted_ops":42250936},"status":"keep","description":"Record fused controlled modular-average idea for scaled-BY replay","timestamp":1777410032672,"segment":3,"confidence":25.0828488372093,"iterationTokens":24823,"asi":{"hypothesis":"Since branch generation remains expensive, the other way to regain SOTA margin is to lower each scaled-BY replay. The sequence cmod_add(s,r,odd) followed by halve(s) is a modular average and may be fusible into one reversible primitive with fewer correction adders.","result":"Recorded a concrete fused controlled modular-average idea in autoresearch.ideas.md. Default autoresearch/checks remain unchanged and pass at 4,132,750 Toffoli / 2716q.","structural_learning":"The fused operation is not a micro-optimization if it removes an entire modular-add correction layer from all 560 scaled-BY steps. The clean-circuit challenge is flag recovery: after case-splitting on T=s+odd*r, odd(T), and T>=p, the carry/comparison bit must be recovered from the final doubled output, analogous to the way mod_add_qq_fast recovers its correction flag with cmp_lt.","caveat":"No circuit has been synthesized yet. The idea could fail if flag recovery costs as much as the saved correction. It is stored so it is not lost while pursuing window/self-cleaning DIV.","next_action_hint":"Prototype an uncontrolled add-then-halve and derive the flag recovery relation. If clean recovery is cheap, lift to controlled addend and substitute into emit_scaled_by_controlled_microstep_for_test to remeasure replay cost."}}
{"run":244,"commit":"636b3a1","metric":4132750,"metrics":{"altseed_classical_total":0,"altseed_phase_batches_total":0,"altseed_ancilla_batches_total":0,"avg_clifford":24414411.956,"qubits":2716,"emitted_ops":31193208,"correctness_ok":1,"by_tests_passed":74,"inverse_negr_ccx":1145760,"two_fast_replay_projected":2637286,"by_replay_bench_avg_toffoli":5278510,"by_replay_bench_qubits":2716,"by_replay_bench_emitted_ops":42250936},"status":"keep","description":"Prove BY denominator branch history can self-clean on reverse","timestamp":1777410867351,"segment":3,"confidence":50.1656976744186,"iterationTokens":24823,"asi":{"hypothesis":"Instead of generating BY branch controls with a separate compute-copy-uncompute oracle, an integrated DIV can produce branch history while consuming the denominator and erase that history while reversing/restoring the denominator. This self-cleaning mechanism is needed for a real windowed DIV.","result":"Added by_denominator_branch_history_self_cleans_on_reverse. It runs a 64-step, 96-bit 2-adic BY denominator pass, stores odd/A history, then reverses the denominator. After reverse it restores f,g,delta, clears all odd/A history bits, and has zero phase garbage. Cost is 87,808 CCX, peak 524q. Full BY suite passes locally: 74 tests. Default autoresearch/checks pass unchanged at avg_toffoli=4,132,750 / 2716q.","structural_learning":"Branch history does not have to be an external oracle payload. It can be created during denominator consumption and cleared from the restored pre-step state on reverse. This makes the right integration target clearer: synthesize the same self-cleaning mechanism at 16-step/window granularity so the denominator branch pass is not per-bit full-width.","caveat":"The validated mechanism is small-width and per-bit. The full per-bit/tapered version is still too expensive; this is a structural construction, not a benchmark improvement yet.","next_action_hint":"Build a 16-step window self-cleaning denominator circuit: compute/store pattern and A scratch for one window, apply the selected window transform to denominator and modular pair, then reverse denominator window and clear pattern from restored low state. Measure against the 7.9k fixed-matrix denominator lower bound and 32.7k modular window replay."}}
{"run":245,"commit":"ba851fb","metric":4132750,"metrics":{"altseed_classical_total":0,"altseed_phase_batches_total":0,"altseed_ancilla_batches_total":0,"avg_clifford":24414411.956,"qubits":2716,"emitted_ops":31193208,"correctness_ok":1,"by_tests_passed":74,"inverse_negr_ccx":1145760,"two_fast_replay_projected":2637286,"by_replay_bench_avg_toffoli":5278510,"by_replay_bench_qubits":2716,"by_replay_bench_emitted_ops":42250936},"status":"keep","description":"Synthesize reversible BY pattern/delta A-control decoder","timestamp":1777411700650,"segment":3,"confidence":null,"iterationTokens":10218,"asi":{"hypothesis":"The branch-pattern route needs a real reversible decoder from a 16-bit odd pattern and small signed delta into the A controls used by scaled-BY microsteps. The previous 23k/60k decoder budget should be validated as an actual clean circuit.","result":"Added reversible_pattern_delta_decoder_matches_and_cleans. For one 16-step window it implements (pattern, delta_start, A=0) -> (pattern, delta_next, A_mask), and the inverse restores delta_start and cleans A. It matches sampled patterns/deltas and is phase clean. Cost: 1,808 CCX forward, 3,616 CCX roundtrip, peak 68q. Full BY suite passed locally with 74 tests; default autoresearch/checks pass unchanged at 4,132,750 Toffoli / 2716q.","structural_learning":"The pattern-history decoder is no longer speculative and fits the integration margin: 35 forward window decodes are ~63k CCX. This confirms that A controls are scratch, not persistent history. The remaining schedule issue is that reversing the decoder also restores delta_start, so production replay needs a delta pebble, a reverse-from-delta_next A-clearer, or on-the-fly A use inside a self-cleaning window.","caveat":"This does not solve branch-pattern generation from the denominator; it only closes the A-control decoder component once patterns exist. No benchmark improvement yet.","next_action_hint":"Integrate this decoder into the raw-pattern scaled-BY scaffold, first with a small delta pebble/copy to preserve delta_next while clearing A. Measure extra cost/peak, then combine with self-cleaning denominator window generation."}}
