{"run":215,"commit":"665bb42","metric":4132750,"metrics":{"altseed_classical_total":0,"altseed_phase_batches_total":0,"altseed_ancilla_batches_total":0,"avg_clifford":24414411.956,"qubits":2716,"emitted_ops":31193208,"correctness_ok":1},"status":"keep","description":"Quantify selected replay target beyond signed mux","timestamp":1777400039112,"segment":3,"confidence":2.168328028145418,"iterationTokens":5372,"asi":{"hypothesis":"A signed add/sub mux might reduce the branch-numerator control tax enough by combining the A-first s-=r and B-first s+=r updates into one controlled modular operation per divstep.","result":"Added selected_replay_budget_requires_more_than_a_signed_mux. Measured primitives: cmod_add=1280 CCX, mod_add=1024, double=255, halve=255. Budgets over 560 steps: naive generic controls≈2.72M, ideal signed mux plus static A at every step≈1.862M, ideal signed mux plus value-proportional A lower bound using measured mean_A=133.5 is≈1.282M, fixed-control lower bound≈0.801M. Full BY tests pass locally (51 passed). ./autoresearch.sh default path unchanged and passes at 4,132,750 Toffoli / 2716q.","structural_learning":"A signed mux alone is not sufficient if the A-only update is still paid at all possible steps. The SOTA-grade selected replay target is now sharper: implement the A contribution in a value-proportional or block-specialized way near the 1.28M lower bound, or find a fixed-control-block mechanism near 0.8M. This is the remaining 0.5-1.0M gap in the BY DIV primitive.","caveat":"The value-proportional A number is a lower bound, not a circuit. Previous naive A-position lists are too large. Need a real block decomposition/conjugation that amortizes A controls without QROM explosion.","next_action_hint":"Explore block-level selected replay: enumerate b-step branch blocks, compute fixed block circuits and matrix/factor support, then estimate SELECT/QROM/control cost for b=2..4. Kill it if block select cost exceeds the 1.28M target; otherwise prototype a block."}}
{"run":216,"commit":"d9cccbe","metric":4132750,"metrics":{"altseed_classical_total":0,"altseed_phase_batches_total":0,"altseed_ancilla_batches_total":0,"avg_clifford":24414411.956,"qubits":2716,"emitted_ops":31193208,"correctness_ok":1},"status":"keep","description":"Kill naive enumerated block-SELECT for BY replay","timestamp":1777400183507,"segment":3,"confidence":2.168328028145418,"iterationTokens":6862,"asi":{"hypothesis":"Block-specializing several BY branch-numerator microsteps might amortize control overhead if we SELECT one fixed block circuit per branch case sequence.","result":"Added enumerated_branch_block_select_explodes_beyond_single_step. Even ignoring equality-control and QROM overhead, summing all fixed case-sequence bodies gives lower bounds including scaling: b=1 has 3 sequences and ≈2.576M; b=2 has 8 sequences and ≈5.725M; b=3 has 22 sequences and ≈15.105M; b=4 has 58 sequences and ≈38.436M. Full BY tests pass locally (52 passed). ./autoresearch.sh default path unchanged and passes at 4,132,750 Toffoli / 2716q.","structural_learning":"Naive block SELECT is dead. Block specialization cannot mean enumerating case sequences and controlling every fixed block. Any viable block method must share algebra between cases, e.g. a factored signed mux, matrix-entry computation with a much cheaper selected apply, or another reversible representation.","caveat":"This is a lower-bound model, not a circuit, but it is deliberately optimistic because it ignores equality-control/QROM costs; the real enumerated SELECT would be worse.","next_action_hint":"Stop pursuing case-sequence enumeration. Either design an algebraically shared selected-add primitive or pivot back to in-place DIV algebra/Kaliski self-cleaning if no shared BY selection emerges."}}
{"run":217,"commit":"27d8a3e","metric":4132750,"metrics":{"altseed_classical_total":0,"altseed_phase_batches_total":0,"altseed_ancilla_batches_total":0,"avg_clifford":24414411.956,"qubits":2716,"emitted_ops":31193208,"correctness_ok":1},"status":"keep","description":"Prototype signed mux add/sub primitive for BY replay","timestamp":1777400337761,"segment":3,"confidence":2.168328028145418,"iterationTokens":9819,"asi":{"hypothesis":"The first odd update in BY branch replay currently pays both cmod_add (B) and cmod_sub (A). A shared signed mux add/sub primitive can compute acc += odd ? (neg ? -a : a) : 0 and might materially reduce the selected replay control tax.","result":"Added signed_mux_controlled_modular_add_works_but_not_enough. The primitive is correct on random basis states for valid controls (neg=>odd). Cost is 1790 CCX, peak 1287q, versus 2560 CCX for separate cmod_add+cmod_sub. However full selected replay with this mux and a static A update at every step still models at ≈2.1476M for 560 steps. Full BY tests pass locally (53 passed). ./autoresearch.sh default path unchanged and passes at 4,132,750 Toffoli / 2716q.","structural_learning":"Algebraic sharing can reduce the A/B first-update control cost by ~30%, but not enough. The A-only r+=s update remains the dominant unresolved selected-replay problem. We need non-static/value-proportional A handling or a deeper block factorization; signed mux alone does not reach the ~0.8-1.3M BY DIV target.","caveat":"The primitive assumes controls are consistent (neg implies odd). It is test-scaffold code, not integrated into point_add. It also uses a controlled negated addend and may need edge-case handling if the addend is zero in a production modular adder.","next_action_hint":"Investigate algebraic ways to absorb the A-only r+=s update into the signed mux stream or conjugate A updates into a smaller set of end-of-window corrections. If that fails, BY selected replay may be structurally blocked."}}
{"run":218,"commit":"3409b44","metric":4132750,"metrics":{"altseed_classical_total":0,"altseed_phase_batches_total":0,"altseed_ancilla_batches_total":0,"avg_clifford":24414411.956,"qubits":2716,"emitted_ops":31193208,"correctness_ok":1},"status":"keep","description":"Prototype coherent scaled BY selected microstep at 1.15M/560","timestamp":1777402653836,"segment":3,"confidence":2.168328028145418,"iterationTokens":4884,"asi":{"hypothesis":"The branch-numerator selected replay was blocked by the A-only r+=s correction. Switching from numerator+final-scale to direct scaled BY microsteps may absorb the A update: A can be implemented as a controlled swap, controlled negation of s, shared cmod_add s+=r under odd, then one halve of s.","result":"Added scaled_by_controlled_microstep_matches_all_cases_and_hits_target_cost. The coherent primitive implements C:(r,s)->(r,s/2), B:(r,s)->(r,(s+r)/2), A:(r,s)->(s,(s-r)/2) using controls (odd,A). It matches all three cases on random basis states. Cost is 2046 CCX per scaled microstep, total560≈1,145,760 CCX, peak=1287q. Full BY tests pass locally (54 passed). ./autoresearch.sh default path unchanged and passes at 4,132,750 Toffoli / 2716q.","structural_learning":"This closes the previous 2.72M naive selected-replay blocker without QROM or enumerated block SELECT. Direct scaled microsteps give a coherent selected BY tagged-DIV arithmetic path in the right Toffoli band (~1.15M for 560 steps). If this replaces the two Kaliski invocations with one DIV-like primitive, the point-add Toffoli model is plausibly SOTA-shaped (~2.1-2.3M before integration overhead).","caveat":"Not a complete DIV yet. Branch history generation/compression/cleanup remains; peak 1287q for the primitive plus live history exceeds a strict 600-scratch goal unless history is compressed/aliased with adder workspace or the controlled add is made no-clean-temp. Controlled neg maps zero to noncanonical p like existing fast neg and needs production handling. Need assemble full 560-step tagged-DIV scaffold and validate failure/correctness.","next_action_hint":"Build the full scaled controlled 560-step BY tagged-DIV scaffold at circuit/model level: generate branch controls from low-ratio h, store/replay history, apply scaled microsteps to tagged pair, and recover sign(f)*r-1. Then attack scratch: compressed history and no-clean-temp controlled add / dirty-history workspace aliasing."}}
{"run":219,"commit":"cf81c88","metric":4132750,"metrics":{"altseed_classical_total":0,"altseed_phase_batches_total":0,"altseed_ancilla_batches_total":0,"avg_clifford":24414411.956,"qubits":2716,"emitted_ops":31193208,"correctness_ok":1},"status":"keep","description":"Show BY branch-pattern history compresses below 500 bits","timestamp":1777402830160,"segment":3,"confidence":2.168328028145418,"iterationTokens":7880,"asi":{"hypothesis":"The scaled controlled BY microstep uses the branch microprogram directly, so history compression should target 16-bit branch patterns per window rather than matrix IDs or individual branch bits. Actual secp256k1 branch-pattern sequences may fit below 500 bits, leaving room for a ~600-scratch design if arithmetic workspace is overlapped/dirty.","result":"Added branch_pattern_entropy_supports_compressed_history_target. On 10,000 secp256k1 trajectories, per-window branch-pattern entropy is ≈440.2 bits; independent code lengths p99≈458.5, p999≈462.1; fail>520=0; fixed per-window distinct-pattern IDs use 481 bits. Full BY tests pass locally (55 passed). ./autoresearch.sh default path unchanged and passes at 4,132,750 Toffoli / 2716q.","structural_learning":"The exact branch microprogram for the new scaled selected replay has a concrete sub-500-bit empirical representation. This is stronger than raw 560 branch bits and more directly usable than matrix IDs. The ~600 scratch path is now: compressed ~480-bit branch-pattern history plus a no-clean-temp/dirty-workspace controlled modular add so arithmetic workspace does not add another 256 clean qubits.","caveat":"Still information-theoretic / coding-level, not a reversible entropy decoder. Independent per-window coding may over/underestimate real reversible code cost. Arithmetic currently uses clean 256-bit addend temporaries, so implementation peak is not yet within 600 scratch unless those temporaries are eliminated or aliased with history.","next_action_hint":"Prototype or cost a no-clean-temp controlled modular add (controlled Cuccaro or dirty-ancilla variant) for the scaled microstep. If its Toffoli remains near 1280 and scratch drops below ~100 over the two field registers, the compressed-history BY DIV primitive fits the user's ~600-scratch model."}}
{"run":220,"commit":"55b95ae","metric":4132750,"metrics":{"altseed_classical_total":0,"altseed_phase_batches_total":0,"altseed_ancilla_batches_total":0,"avg_clifford":24414411.956,"qubits":2716,"emitted_ops":31193208,"correctness_ok":1},"status":"keep","description":"Project scaled-BY DIV point-add budget below 2.7M","timestamp":1777402976694,"segment":3,"confidence":2.168328028145418,"iterationTokens":7720,"asi":{"hypothesis":"If the coherent scaled BY selected microstep becomes a true in-place tagged DIV, it deletes both Kaliski invocations and should put the point-add Toffoli count below Google's 2.7M target even with integration margin.","result":"Added scaled_by_div_point_add_budget_has_sota_margin_if_history_workspace_solved. Budget: current total 4,132,750; current two Kaliski invocations≈3,190,000; non-inversion scaffold≈942,750; scaled BY DIV=2046*560≈1,145,760; branch/decode margin=150,000; projected point-add≈2,238,510 Toffoli. Full BY tests pass locally (56 passed). ./autoresearch.sh default path unchanged and passes at 4,132,750 Toffoli / 2716q.","structural_learning":"The arithmetic economics are now SOTA-shaped: a scaled-BY in-place DIV would land well below 2.7M and near the 2.1M target. The remaining blockers are implementation/scratch: full tagged-DIV scaffold, branch-pattern decoder/history cleanup, no-clean-temp or dirty-workspace controlled modular add, and canonical controlled neg.","caveat":"This is a budget model, not an integrated point-add circuit. The 150k margin is a placeholder; decoder and scratch-overlap costs must be made real. If controlled-add scratch cannot be reduced/aliased, the Toffoli target may still hold but the ~600-scratch target will not.","next_action_hint":"Prioritize a full env-gated BY tagged-DIV scaffold using scaled controlled microsteps, even if over-scratch at first. Then iterate on scratch: compressed branch-pattern history and dirty/no-clean controlled add."}}
{"run":221,"commit":"636ad95","metric":4132750,"metrics":{"altseed_classical_total":0,"altseed_phase_batches_total":0,"altseed_ancilla_batches_total":0,"avg_clifford":24414411.956,"qubits":2716,"emitted_ops":31193208,"correctness_ok":1},"status":"keep","description":"Compose coherent scaled BY controls through a full 16-step window","timestamp":1777403111057,"segment":3,"confidence":2.168328028145418,"iterationTokens":6525,"asi":{"hypothesis":"The new scaled controlled microstep must compose correctly over a whole BY window, matching the same 2^-16 jump matrix used by the algebraic tagged-DIV model.","result":"Added scaled_by_controlled_window_matches_jump_matrix. It builds a 16-step controlled window for the sample lowword trajectory with matrix [[-8192,24576],[-3,1]], drives the (odd,A) controls, and verifies on random basis states that the circuit equals 2^-16*P(r,s). Cost: 32,736 CCX, peak=1,317q. Full BY tests pass locally (57 passed). ./autoresearch.sh default path unchanged and passes at 4,132,750 Toffoli / 2716q.","structural_learning":"The coherent scaled selected replay is no longer just a one-step primitive; it composes over an entire window and matches the jump matrix exactly. This makes a 35-window scaffold mechanically plausible: repeat the same controlled window with branch controls from the low-ratio generator/history.","caveat":"The sample window uses classical preset controls. A production DIV still needs reversible control generation/decoding, cleanup of controls/history, canonical controlled neg, and scratch reduction of the controlled modular add workspace.","next_action_hint":"Build a cost-only 35-window/560-step scaffold with allocated controls to confirm total ops/peak, then replace preset controls with branch-pattern history decoding. Separately implement canonical controlled neg or prove zero exceptions negligible for tagged channel."}}
{"run":222,"commit":"20b8589","metric":4132750,"metrics":{"altseed_classical_total":0,"altseed_phase_batches_total":0,"altseed_ancilla_batches_total":0,"avg_clifford":24414411.956,"qubits":2716,"emitted_ops":31193208,"correctness_ok":1},"status":"keep","description":"Instantiate full 560-step scaled BY arithmetic scaffold","timestamp":1777403242647,"segment":3,"confidence":2.168328028145418,"iterationTokens":5381,"asi":{"hypothesis":"A full 560-step scaled BY selected-replay scaffold with raw controls should fit the current 2800q cap and confirm the one-step 1.145M arithmetic extrapolation as an actual circuit skeleton.","result":"Added scaled_by_controlled_560_scaffold_cost_model_fits_current_cap. It allocates raw odd/A controls for all 560 steps and instantiates the scaled controlled microstep repeatedly. Cost: 1,145,760 CCX, peak=2,405q, raw_control_bits=1120. Full BY tests pass locally (58 passed). ./autoresearch.sh default path unchanged and passes at 4,132,750 Toffoli / 2716q.","structural_learning":"The full selected BY arithmetic scaffold is now concrete and under the current qubit cap even with raw controls. This is a major step toward an env-gated BY tagged-DIV prototype: arithmetic no longer blocks either Toffoli or the 2800q cap. The remaining gap to the user's ~600-scratch goal is history compression/workspace aliasing, not the core replay circuit.","caveat":"Raw controls are advice qubits, not generated/cleaned history. Peak 2405q is under current cap but far above a strict tx,ty+600 target. Need branch-pattern decoding and no-clean-temp/dirty controlled add to avoid history+adder-temp addition.","next_action_hint":"Next connect controls to branch-pattern history: decode one 16-bit window pattern into odd/A controls, run the 16-step window, then uncompute the pattern. In parallel, design a canonical controlled neg to remove the zero->p caveat."}}
{"run":223,"commit":"683afbb","metric":4132750,"metrics":{"altseed_classical_total":0,"altseed_phase_batches_total":0,"altseed_ancilla_batches_total":0,"avg_clifford":24414411.956,"qubits":2716,"emitted_ops":31193208,"correctness_ok":1},"status":"keep","description":"Show BY A-controls decode from 16-bit branch patterns plus delta","timestamp":1777403372250,"segment":3,"confidence":2.731546457025273,"iterationTokens":5274,"asi":{"hypothesis":"For the scaled BY microprogram, raw odd/A controls double the apparent history. A-controls should be reconstructible from the 16 odd bits in a window plus the starting delta, so only branch patterns need to be stored/compressed.","result":"Added window_pattern_and_delta_reconstruct_a_controls. For 20,000 sampled lowword windows, a 16-bit odd-pattern and starting delta reconstruct all 16 A-control bits and the final delta, matching direct lowword divstep evolution. Full BY tests pass locally (59 passed). ./autoresearch.sh default path unchanged and passes at 4,132,750 Toffoli / 2716q.","structural_learning":"A bits are decoder scratch, not persistent history. The compressed branch-pattern history (≈440 entropy / 481 fixed distinct-pattern bits) is the right payload for the 560-step scaled BY scaffold; per-window A controls can be regenerated locally from pattern+delta.","caveat":"This is classical reconstruction, not a reversible decoder circuit. Need synthesize a small delta/A-mask decoder and ensure it uncomputes cleanly after each 16-step controlled window.","next_action_hint":"Implement/cost a reversible 16-bit pattern decoder: pattern + delta -> odd controls + A controls + next delta, feed one controlled window, then uncompute. Keep decoder workspace under ~32 bits so compressed-history + no-clean controlled add can plausibly fit ~600 scratch."}}
{"run":224,"commit":"7a708d1","metric":4132750,"metrics":{"altseed_classical_total":0,"altseed_phase_batches_total":0,"altseed_ancilla_batches_total":0,"avg_clifford":24414411.956,"qubits":2716,"emitted_ops":31193208,"correctness_ok":1},"status":"keep","description":"Budget BY branch-pattern decoder inside integration margin","timestamp":1777403497207,"segment":3,"confidence":3.6900213827512474,"iterationTokens":4866,"asi":{"hypothesis":"The branch-pattern history decoder should be negligible compared with the 1.145M scaled BY modular replay and fit inside the 150k branch/decode margin in the point-add SOTA budget.","result":"Added pattern_decoder_budget_fits_branch_decode_margin. A pessimistic reversible estimate with 10-bit signed delta uses ~41 CCX per divstep (sign/nonzero predicate, A-bit write, controlled delta update), or ~22,960 CCX over 560 steps. Full BY tests pass locally (60 passed). ./autoresearch.sh default path unchanged and passes at 4,132,750 Toffoli / 2716q.","structural_learning":"The branch-pattern decoder is not an arithmetic bottleneck. The 150k branch/decode margin in the 2.238M point-add projection is generous if the decoder is implemented directly. The main remaining scratch problem is controlled modular-add workspace and compressed-history storage, not A-bit reconstruction.","caveat":"This is a budget estimate, not a synthesized reversible decoder. It assumes 10-bit delta remains ample and ignores constant factors in a real comparator/nonzero tree, but has >6x margin under 150k.","next_action_hint":"Proceed to either a reversible decoder prototype or the no-clean-temp/dirty controlled modular add. The latter is higher priority for the ~600 scratch target."}}
{"run":225,"commit":"70b0b1d","metric":4132750,"metrics":{"altseed_classical_total":0,"altseed_phase_batches_total":0,"altseed_ancilla_batches_total":0,"avg_clifford":24414411.956,"qubits":2716,"emitted_ops":31193208,"correctness_ok":1},"status":"keep","description":"Exercise zero inputs in scaled BY controlled microstep","timestamp":1777403638973,"segment":3,"confidence":3.8773966446974235,"iterationTokens":5035,"asi":{"hypothesis":"The scaled controlled microstep uses fast controlled negation that temporarily maps zero to the noncanonical representative p. In valid A cases, the subsequent controlled add should canonicalize this representative, so zero inputs should still behave correctly.","result":"Extended scaled_by_controlled_microstep_matches_all_cases_and_hits_target_cost to include explicit zero cases (r,s)=(0,0),(0,s),(r,0) for all valid C/B/A controls, in addition to random basis states. The test still passes with unchanged cost 2046 CCX and peak 1287q. Full BY tests pass locally (60 passed). ./autoresearch.sh default path unchanged and passes at 4,132,750 Toffoli / 2716q.","structural_learning":"The controlled-neg zero representative is not a blocker for valid scaled BY microstep controls: A always also has odd=1, so the following cmod_add canonicalizes the temporary p representative before the halve. This reduces one production caveat for the scaled BY scaffold.","caveat":"This only validates one microstep and valid controls. A full 560-step scaffold with generated controls still needs end-to-end tagged-DIV basis validation.","next_action_hint":"Build an end-to-end 35-window tagged-DIV basis simulation with controls derived from a sampled denominator, or an env-gated point-add probe once the interface is clear."}}
