{"run":297,"commit":"3aa31ab","metric":4111918,"metrics":{"altseed_classical_total":0,"altseed_phase_batches_total":0,"altseed_ancilla_batches_total":0,"avg_clifford":24423006.99,"qubits":2716,"emitted_ops":30748978,"correctness_ok":1,"by_tests_passed":111,"inverse_negr_ccx":1145760,"two_fast_replay_projected":2637286,"by_replay_bench_avg_toffoli":5278510,"by_replay_bench_qubits":2716,"by_replay_bench_emitted_ops":42250936,"centered_body_bench_avg_toffoli":4985518,"centered_body_bench_qubits":2716,"centered_body_bench_emitted_ops":38874541,"centered_body_replay_ccx":873600,"centered_inverse_replay_ccx":873600,"centered_budget_if_folded":2640622,"centered_phase96_fast_mbu_ccx":299616,"centered_phase96_exact_signed_ccx":399264,"centered_phase96_exact_parity_ccx":448800,"centered_phase96_all_exact_ccx":548448,"centered_clean_all_exact_roundtrip_ccx":3199280,"centered_clean_all_exact_peak":2464,"centered_exact_parity_fast_signed_roundtrip_ccx":2618000,"centered_negpatch_phase_saw0":1,"centered_negpatch_phase_saw1":1,"centered_clean_roundtrip_bench_avg_toffoli":7311738,"centered_clean_roundtrip_bench_avg_clifford":32532302.269,"centered_clean_roundtrip_bench_qubits":2976,"centered_clean_roundtrip_bench_emitted_ops":42092380,"centered_clean_roundtrip_bench_altseed_phase":0,"centered_fixed_trace_hook_phase":0,"centered_fast_clean_roundtrip_bench_avg_toffoli":5860218,"centered_fast_clean_roundtrip_bench_avg_clifford":38190533.993,"centered_fast_clean_roundtrip_bench_qubits":3235,"centered_fast_clean_roundtrip_bench_emitted_ops":47024860,"centered_fast_clean_roundtrip_bench_altseed_phase":0,"centered_fast_clean_increment_toffoli":1747760,"centered_denom_controls_bench_avg_toffoli":7868378,"centered_denom_controls_bench_avg_clifford":44313822.825,"centered_denom_controls_bench_qubits":4964,"centered_denom_controls_bench_emitted_ops":55824052,"centered_denom_controls_bench_altseed_phase":0,"centered_live_num_bench_avg_toffoli":7870438,"centered_live_num_bench_avg_clifford":44320460.712,"centered_live_num_bench_qubits":4965,"centered_live_num_bench_emitted_ops":55834807,"centered_live_num_bench_altseed_phase":0,"centered_pair1_replace_avg_toffoli":8172700,"centered_pair1_replace_avg_clifford":40780745.214,"centered_pair1_replace_qubits":5589,"centered_pair1_replace_emitted_ops":51801485,"centered_pair1_replace_altseed_phase":0,"centered_pair1_replace_altseed_classical":0,"centered_pair2_replace_avg_toffoli":8189908,"centered_pair2_replace_avg_clifford":40876699.034,"centered_pair2_replace_qubits":5589,"centered_pair2_replace_emitted_ops":51930771,"centered_pair2_replace_altseed_phase":0,"centered_pair2_replace_altseed_classical":0,"centered_pair12_replace_avg_toffoli":12251174,"centered_pair12_replace_qubits":5589,"centered_pair12_replace_emitted_ops":72970707,"centered_pair1_fast_accum_avg_toffoli":8171417,"centered_pair1_fast_accum_qubits":5589,"centered_pair1_fast_accum_emitted_ops":51826551,"centered_pair2_fast_accum_avg_toffoli":8187601,"centered_pair2_fast_accum_qubits":5589,"centered_pair2_fast_accum_emitted_ops":51944268,"centered_pair12_fast_accum_avg_toffoli":12246560,"centered_pair12_fast_accum_qubits":5589,"centered_pair12_fast_accum_emitted_ops":72997701,"signed_copy_fast_phase_batches":1,"centered_pair1_window_denom_avg_toffoli":8790041,"centered_pair1_window_denom_qubits":5589,"centered_pair1_window_denom_emitted_ops":55077495,"centered_pair2_window_denom_avg_toffoli":8806225,"centered_pair2_window_denom_qubits":5589,"centered_pair2_window_denom_emitted_ops":55195212,"centered_pair12_window_denom_avg_toffoli":13483808,"centered_pair12_window_denom_qubits":5589,"centered_pair12_window_denom_emitted_ops":79499589,"centered_pair1_window_q_payload_avg_toffoli":8790041,"centered_pair1_window_q_payload_qubits":8037,"centered_pair1_window_q_payload_emitted_ops":55084839,"centered_pair2_window_q_payload_avg_toffoli":8806225,"centered_pair2_window_q_payload_qubits":8037,"centered_pair2_window_q_payload_emitted_ops":55202556,"centered_pair12_window_q_payload_avg_toffoli":13483808,"centered_pair12_window_q_payload_qubits":8037,"centered_pair12_window_q_payload_emitted_ops":79514277,"attempted_pair2_560_altseed_phase_batches":1,"attempted_q_local_altseed_phase_batches":1,"attempted_q18_altseed_phase_batches":1,"centered_pair1_window_q18_avg_toffoli":8790881,"centered_pair1_window_q18_qubits":6885,"centered_pair1_window_q18_emitted_ops":55108598,"scaled_pair2_product_avg_toffoli":8038619,"scaled_pair2_product_avg_clifford":35226095.994,"scaled_pair2_product_qubits":4236,"scaled_pair2_product_emitted_ops":49073481,"consumed_branchless_depth16_predecessor_patterns":589824,"consumed_branchless_depth16_predecessor_states":589824,"last_shot_fixed_window_mean_ccx":20323.5,"last_shot_fixed_window_p90_ccx":24382,"last_shot_fixed_window_max_ccx":27641,"last_shot_fixed_window_max_peak":2224,"last_shot_two_denominators_ccx":1463292},"status":"keep","description":"Invalidate current fixed-matrix BY window consumption against SOTA budget","timestamp":1777440688991,"segment":3,"confidence":5.970334101382488,"iterationTokens":20830,"asi":{"hypothesis":"The only remaining BY route after product-clean replay and branchless cleanup failure is explicit 16-step fixed-matrix/q window consumption. Measure the actual reversible one-window object before any more point-add wiring.","result":"Added and ran last_shot_fixed_matrix_window_consumption_misses_sota_budget. The current reversible fixed-matrix/q window object (scaled rows + old-row cleanup + m/q/z cleanup) costs mean=20,323.5 CCX/window, p90=24,382, max=27,641, max_peak=2,224q. Two 576-step denominators project to ≈1,463,292 CCX. Default exact benchmark remains clean and unchanged at 4,111,918 Toffoli @ 2,716q.","structural_learning":"The known fixed-matrix/q window consumption object misses the SOTA-shaped target (~10k/window) by roughly 2x before replay/scaffold costs. Combined with the branchless-poststate ambiguity result, this means BY cannot reach SOTA with the current arithmetic primitives and scheduling. A revival would require a genuinely new selected-window arithmetic primitive, not more raw-history or production wiring.","caveat":"This is a negative early invalidation, not a performance improvement. It intentionally avoids late point-add integration of a window object that is already too expensive.","next_action_hint":"Declare the current BY denominator route dead for SOTA unless a new arithmetic primitive can do selected fixed-matrix/q consumption under ~10k CCX/window with local inverse and no raw history."}}
{"run":298,"commit":"404a58e","metric":4111918,"metrics":{"altseed_classical_total":0,"altseed_phase_batches_total":0,"altseed_ancilla_batches_total":0,"avg_clifford":24423006.99,"qubits":2716,"emitted_ops":30748978,"correctness_ok":1,"by_tests_passed":111,"inverse_negr_ccx":1145760,"two_fast_replay_projected":2637286,"by_replay_bench_avg_toffoli":5278510,"by_replay_bench_qubits":2716,"by_replay_bench_emitted_ops":42250936,"centered_body_bench_avg_toffoli":4985518,"centered_body_bench_qubits":2716,"centered_body_bench_emitted_ops":38874541,"centered_body_replay_ccx":873600,"centered_inverse_replay_ccx":873600,"centered_budget_if_folded":2640622,"centered_phase96_fast_mbu_ccx":299616,"centered_phase96_exact_signed_ccx":399264,"centered_phase96_exact_parity_ccx":448800,"centered_phase96_all_exact_ccx":548448,"centered_clean_all_exact_roundtrip_ccx":3199280,"centered_clean_all_exact_peak":2464,"centered_exact_parity_fast_signed_roundtrip_ccx":2618000,"centered_negpatch_phase_saw0":1,"centered_negpatch_phase_saw1":1,"centered_clean_roundtrip_bench_avg_toffoli":7311738,"centered_clean_roundtrip_bench_avg_clifford":32532302.269,"centered_clean_roundtrip_bench_qubits":2976,"centered_clean_roundtrip_bench_emitted_ops":42092380,"centered_clean_roundtrip_bench_altseed_phase":0,"centered_fixed_trace_hook_phase":0,"centered_fast_clean_roundtrip_bench_avg_toffoli":5860218,"centered_fast_clean_roundtrip_bench_avg_clifford":38190533.993,"centered_fast_clean_roundtrip_bench_qubits":3235,"centered_fast_clean_roundtrip_bench_emitted_ops":47024860,"centered_fast_clean_roundtrip_bench_altseed_phase":0,"centered_fast_clean_increment_toffoli":1747760,"centered_denom_controls_bench_avg_toffoli":7868378,"centered_denom_controls_bench_avg_clifford":44313822.825,"centered_denom_controls_bench_qubits":4964,"centered_denom_controls_bench_emitted_ops":55824052,"centered_denom_controls_bench_altseed_phase":0,"centered_live_num_bench_avg_toffoli":7870438,"centered_live_num_bench_avg_clifford":44320460.712,"centered_live_num_bench_qubits":4965,"centered_live_num_bench_emitted_ops":55834807,"centered_live_num_bench_altseed_phase":0,"centered_pair1_replace_avg_toffoli":8172700,"centered_pair1_replace_avg_clifford":40780745.214,"centered_pair1_replace_qubits":5589,"centered_pair1_replace_emitted_ops":51801485,"centered_pair1_replace_altseed_phase":0,"centered_pair1_replace_altseed_classical":0,"centered_pair2_replace_avg_toffoli":8189908,"centered_pair2_replace_avg_clifford":40876699.034,"centered_pair2_replace_qubits":5589,"centered_pair2_replace_emitted_ops":51930771,"centered_pair2_replace_altseed_phase":0,"centered_pair2_replace_altseed_classical":0,"centered_pair12_replace_avg_toffoli":12251174,"centered_pair12_replace_qubits":5589,"centered_pair12_replace_emitted_ops":72970707,"centered_pair1_fast_accum_avg_toffoli":8171417,"centered_pair1_fast_accum_qubits":5589,"centered_pair1_fast_accum_emitted_ops":51826551,"centered_pair2_fast_accum_avg_toffoli":8187601,"centered_pair2_fast_accum_qubits":5589,"centered_pair2_fast_accum_emitted_ops":51944268,"centered_pair12_fast_accum_avg_toffoli":12246560,"centered_pair12_fast_accum_qubits":5589,"centered_pair12_fast_accum_emitted_ops":72997701,"signed_copy_fast_phase_batches":1,"centered_pair1_window_denom_avg_toffoli":8790041,"centered_pair1_window_denom_qubits":5589,"centered_pair1_window_denom_emitted_ops":55077495,"centered_pair2_window_denom_avg_toffoli":8806225,"centered_pair2_window_denom_qubits":5589,"centered_pair2_window_denom_emitted_ops":55195212,"centered_pair12_window_denom_avg_toffoli":13483808,"centered_pair12_window_denom_qubits":5589,"centered_pair12_window_denom_emitted_ops":79499589,"centered_pair1_window_q_payload_avg_toffoli":8790041,"centered_pair1_window_q_payload_qubits":8037,"centered_pair1_window_q_payload_emitted_ops":55084839,"centered_pair2_window_q_payload_avg_toffoli":8806225,"centered_pair2_window_q_payload_qubits":8037,"centered_pair2_window_q_payload_emitted_ops":55202556,"centered_pair12_window_q_payload_avg_toffoli":13483808,"centered_pair12_window_q_payload_qubits":8037,"centered_pair12_window_q_payload_emitted_ops":79514277,"attempted_pair2_560_altseed_phase_batches":1,"attempted_q_local_altseed_phase_batches":1,"attempted_q18_altseed_phase_batches":1,"centered_pair1_window_q18_avg_toffoli":8790881,"centered_pair1_window_q18_qubits":6885,"centered_pair1_window_q18_emitted_ops":55108598,"scaled_pair2_product_avg_toffoli":8038619,"scaled_pair2_product_avg_clifford":35226095.994,"scaled_pair2_product_qubits":4236,"scaled_pair2_product_emitted_ops":49073481,"consumed_branchless_depth16_predecessor_patterns":589824,"consumed_branchless_depth16_predecessor_states":589824,"last_shot_fixed_window_mean_ccx":20323.5,"last_shot_fixed_window_p90_ccx":24382,"last_shot_fixed_window_max_ccx":27641,"last_shot_fixed_window_max_peak":2224,"last_shot_two_denominators_ccx":1463292,"strategy_e_tests_passed":2,"strategy_e_current_known_total":2988510,"strategy_e_if_new_inplace_mul":2022750,"strategy_e_needed_mul_saving":965760},"status":"keep","description":"Validate and invalidate non-BY slope-coordinate Strategy E while preserving default exact benchmark","timestamp":1777443509181,"segment":3,"confidence":5.970334101382488,"iterationTokens":20830,"asi":{"hypothesis":"After declaring BY dead, try a ground-up affine slope-coordinate permutation: compute m=dy/dx, update x by dx->Rx=m^2-dx-2Qx, then convert m to Ry via an in-place variable multiply. Validate the algebra and kill it early if existing product-clean primitives make it non-SOTA.","result":"Added Strategy E numeric replay and tests. The formula passes 200 random secp256k1 point additions. Budget guard shows current known product-clean route projects ≈2,988,510 Toffoli before margin, whereas a genuinely new schoolbook-like in-place variable multiply would project ≈2,022,750. Default exact benchmark remains unchanged and clean at 4,111,918 Toffoli @ 2,716q.","structural_learning":"The slope-coordinate map is algebraically clean and non-BY, but the hard primitive is not the affine formula; it is phase-clean in-place variable multiplication/division without a product-clean inverse/history bank. Current primitives collapse Strategy E back to the measured product-clean world, so point-add wiring would be busywork and not SOTA-shaped.","next_action_hint":"Do not wire Strategy E with current Kaliski/BY product-clean machinery. Only revive it by inventing a new in-place variable multiply/divide primitive near schoolbook cost; otherwise continue to another ground-up primitive-level candidate."}}
{"run":299,"commit":"f0f3827","metric":4111918,"metrics":{"altseed_classical_total":0,"altseed_phase_batches_total":0,"altseed_ancilla_batches_total":0,"avg_clifford":24423006.99,"qubits":2716,"emitted_ops":30748978,"correctness_ok":1,"by_tests_passed":111,"inverse_negr_ccx":1145760,"two_fast_replay_projected":2637286,"by_replay_bench_avg_toffoli":5278510,"by_replay_bench_qubits":2716,"by_replay_bench_emitted_ops":42250936,"centered_body_bench_avg_toffoli":4985518,"centered_body_bench_qubits":2716,"centered_body_bench_emitted_ops":38874541,"centered_body_replay_ccx":873600,"centered_inverse_replay_ccx":873600,"centered_budget_if_folded":2640622,"centered_phase96_fast_mbu_ccx":299616,"centered_phase96_exact_signed_ccx":399264,"centered_phase96_exact_parity_ccx":448800,"centered_phase96_all_exact_ccx":548448,"centered_clean_all_exact_roundtrip_ccx":3199280,"centered_clean_all_exact_peak":2464,"centered_exact_parity_fast_signed_roundtrip_ccx":2618000,"centered_negpatch_phase_saw0":1,"centered_negpatch_phase_saw1":1,"centered_clean_roundtrip_bench_avg_toffoli":7311738,"centered_clean_roundtrip_bench_avg_clifford":32532302.269,"centered_clean_roundtrip_bench_qubits":2976,"centered_clean_roundtrip_bench_emitted_ops":42092380,"centered_clean_roundtrip_bench_altseed_phase":0,"centered_fixed_trace_hook_phase":0,"centered_fast_clean_roundtrip_bench_avg_toffoli":5860218,"centered_fast_clean_roundtrip_bench_avg_clifford":38190533.993,"centered_fast_clean_roundtrip_bench_qubits":3235,"centered_fast_clean_roundtrip_bench_emitted_ops":47024860,"centered_fast_clean_roundtrip_bench_altseed_phase":0,"centered_fast_clean_increment_toffoli":1747760,"centered_denom_controls_bench_avg_toffoli":7868378,"centered_denom_controls_bench_avg_clifford":44313822.825,"centered_denom_controls_bench_qubits":4964,"centered_denom_controls_bench_emitted_ops":55824052,"centered_denom_controls_bench_altseed_phase":0,"centered_live_num_bench_avg_toffoli":7870438,"centered_live_num_bench_avg_clifford":44320460.712,"centered_live_num_bench_qubits":4965,"centered_live_num_bench_emitted_ops":55834807,"centered_live_num_bench_altseed_phase":0,"centered_pair1_replace_avg_toffoli":8172700,"centered_pair1_replace_avg_clifford":40780745.214,"centered_pair1_replace_qubits":5589,"centered_pair1_replace_emitted_ops":51801485,"centered_pair1_replace_altseed_phase":0,"centered_pair1_replace_altseed_classical":0,"centered_pair2_replace_avg_toffoli":8189908,"centered_pair2_replace_avg_clifford":40876699.034,"centered_pair2_replace_qubits":5589,"centered_pair2_replace_emitted_ops":51930771,"centered_pair2_replace_altseed_phase":0,"centered_pair2_replace_altseed_classical":0,"centered_pair12_replace_avg_toffoli":12251174,"centered_pair12_replace_qubits":5589,"centered_pair12_replace_emitted_ops":72970707,"centered_pair1_fast_accum_avg_toffoli":8171417,"centered_pair1_fast_accum_qubits":5589,"centered_pair1_fast_accum_emitted_ops":51826551,"centered_pair2_fast_accum_avg_toffoli":8187601,"centered_pair2_fast_accum_qubits":5589,"centered_pair2_fast_accum_emitted_ops":51944268,"centered_pair12_fast_accum_avg_toffoli":12246560,"centered_pair12_fast_accum_qubits":5589,"centered_pair12_fast_accum_emitted_ops":72997701,"signed_copy_fast_phase_batches":1,"centered_pair1_window_denom_avg_toffoli":8790041,"centered_pair1_window_denom_qubits":5589,"centered_pair1_window_denom_emitted_ops":55077495,"centered_pair2_window_denom_avg_toffoli":8806225,"centered_pair2_window_denom_qubits":5589,"centered_pair2_window_denom_emitted_ops":55195212,"centered_pair12_window_denom_avg_toffoli":13483808,"centered_pair12_window_denom_qubits":5589,"centered_pair12_window_denom_emitted_ops":79499589,"centered_pair1_window_q_payload_avg_toffoli":8790041,"centered_pair1_window_q_payload_qubits":8037,"centered_pair1_window_q_payload_emitted_ops":55084839,"centered_pair2_window_q_payload_avg_toffoli":8806225,"centered_pair2_window_q_payload_qubits":8037,"centered_pair2_window_q_payload_emitted_ops":55202556,"centered_pair12_window_q_payload_avg_toffoli":13483808,"centered_pair12_window_q_payload_qubits":8037,"centered_pair12_window_q_payload_emitted_ops":79514277,"attempted_pair2_560_altseed_phase_batches":1,"attempted_q_local_altseed_phase_batches":1,"attempted_q18_altseed_phase_batches":1,"centered_pair1_window_q18_avg_toffoli":8790881,"centered_pair1_window_q18_qubits":6885,"centered_pair1_window_q18_emitted_ops":55108598,"scaled_pair2_product_avg_toffoli":8038619,"scaled_pair2_product_avg_clifford":35226095.994,"scaled_pair2_product_qubits":4236,"scaled_pair2_product_emitted_ops":49073481,"consumed_branchless_depth16_predecessor_patterns":589824,"consumed_branchless_depth16_predecessor_states":589824,"last_shot_fixed_window_mean_ccx":20323.5,"last_shot_fixed_window_p90_ccx":24382,"last_shot_fixed_window_max_ccx":27641,"last_shot_fixed_window_max_peak":2224,"last_shot_two_denominators_ccx":1463292,"strategy_e_tests_passed":2,"strategy_e_current_known_total":2988510,"strategy_e_if_new_inplace_mul":2022750,"strategy_e_needed_mul_saving":965760,"destructive_montgomery_window_preimages":512,"destructive_montgomery_test_passed":1},"status":"keep","description":"Invalidate destructive Montgomery as missing Strategy E in-place multiply primitive","timestamp":1777444094593,"segment":3,"confidence":5.970334101382488,"iterationTokens":71138,"asi":{"hypothesis":"Try to realize Strategy E's missing in-place variable multiply using a destructive Montgomery add-and-halve accumulator that scans multiplier bits into the product and locally clears consumed bits.","result":"Forward algebra works on the small exact test: n Montgomery steps output a*b*2^-n mod p. However, local reversibility fails badly: for p=251,a=173, an 8-bit reachable post-window accumulator t=223 has 512 valid (old_t, consumed_bits) predecessors. The full default harness remains unchanged and clean at 4,111,918 Toffoli @ 2,716q.","structural_learning":"Destructive Montgomery multiplication does not provide a product-clean IMUL primitive. Consumed multiplier bits are not recoverable from the accumulator alone; a reversible implementation must keep history/checkpoints or compute a nonlocal inverse, collapsing back to the product-clean obstruction. This kills the first concrete IMUL revival path for Strategy E.","next_action_hint":"Do not pursue local bit-clearing Montgomery IMUL. If continuing Strategy E, search for a different IMUL structure; otherwise move to a different non-BY coordinate/representation attempt."}}
