{"run":226,"commit":"b34e9dd","metric":4132750,"metrics":{"altseed_classical_total":0,"altseed_phase_batches_total":0,"altseed_ancilla_batches_total":0,"avg_clifford":24414411.956,"qubits":2716,"emitted_ops":31193208,"correctness_ok":1},"status":"keep","description":"Simulate full 560-step scaled BY tagged-DIV basis circuit","timestamp":1777403793404,"segment":3,"confidence":4.084819315133344,"iterationTokens":8052,"asi":{"hypothesis":"The full 560-step scaled controlled scaffold should not only have the right cost; with controls derived from a denominator it should perform the tagged-DIV transformation (0,y+x)->(r,0) and recover y/x as sign(f)*r-1.","result":"Added scaled_by_controlled_560_tagged_div_basis_simulation. For one sampled denominator that converges within 560 steps, the test derives all odd/A controls, instantiates and simulates the full 1,145,760-CCX circuit with raw controls, starts (r,s)=(0,y+x), verifies the simulated r,s match classical scaled BY, verifies s=0, and checks sign(f)*r-1 equals y/x. Peak is 2405q. Full BY tests pass locally (61 passed). ./autoresearch.sh default path unchanged and passes at 4,132,750 Toffoli / 2716q.","structural_learning":"This is the first end-to-end circuit-level tagged-DIV evidence for the scaled BY route. The arithmetic core is no longer just cost/model algebra; it simulates through all 560 controlled steps and recovers the quotient. The remaining work is replacing raw advice controls with reversible branch-pattern history/decoder and reducing scratch, then integrating into point_add.","caveat":"The simulation uses preset controls derived classically from x and only one sampled converged denominator. It does not yet generate/uncompute controls inside the circuit, and raw control qubits inflate peak to 2405q. Need broader samples or an env-gated scaffold with branch decoder.","next_action_hint":"Build a 35-window branch-pattern-history scaffold: store/decode patterns instead of raw odd/A controls, generate A controls from delta, run each 16-step window, and uncompute decoder scratch. Then integrate as KAL/BY tagged-DIV probe."}}
{"run":227,"commit":"75da22d","metric":4132750,"metrics":{"altseed_classical_total":0,"altseed_phase_batches_total":0,"altseed_ancilla_batches_total":0,"avg_clifford":24414411.956,"qubits":2716,"emitted_ops":31193208,"correctness_ok":1},"status":"keep","description":"Quantify 600-scratch condition for compressed BY history","timestamp":1777403938314,"segment":3,"confidence":4.5802884190038045,"iterationTokens":5536,"asi":{"hypothesis":"The scaled BY DIV arithmetic and compressed branch-pattern history should fit the user's ~600 scratch target only if the controlled modular add does not allocate a clean 256-bit addend/carry workspace in addition to history.","result":"Added compressed_pattern_history_scratch_model_is_600q_if_add_workspace_is_removed. Current local microstep peak is 1287q for the two 256-bit data rows, i.e. 775 scratch. Compressed pattern history is 481q and one-window A/delta decoder scratch is ~26q, so current additive scratch≈1282q. If the controlled modular add is implemented without a clean n-bit temp or borrows the history bank as dirty workspace, using a 90q local target gives total scratch≈597q. Full BY tests pass locally (62 passed). ./autoresearch.sh default path unchanged and passes at 4,132,750 Toffoli / 2716q.","structural_learning":"The exact remaining scratch condition is now clear. The branch-pattern history is small enough; the current clean-temp modular add is the reason the design is not yet tx,ty+600. A no-clean-temp/dirty controlled modular add is not optional for the user's scratch target, but if achieved the scaled BY route fits both Toffoli and scratch models.","caveat":"The 90q local workspace target is aspirational and requires a new controlled modular adder or dirty-history borrowing scheme. This test is a scratch accounting model, not a circuit implementation.","next_action_hint":"Design/prototype a controlled modular add that uses no clean n-bit addend register: e.g. controlled Cuccaro with one/few clean ancillae, or a dirty-ancilla version borrowing the compressed history bank and restoring it."}}
{"run":228,"commit":"fe25214","metric":4132750,"metrics":{"altseed_classical_total":0,"altseed_phase_batches_total":0,"altseed_ancilla_batches_total":0,"avg_clifford":24414411.956,"qubits":2716,"emitted_ops":31193208,"correctness_ok":1},"status":"keep","description":"Replace raw BY controls with raw branch-pattern history scaffold","timestamp":1777404581287,"segment":3,"confidence":5.212545308095046,"iterationTokens":5536,"asi":{"hypothesis":"A-controls are decoder scratch, not persistent history. Replacing 1120 raw odd/A controls by 560 raw odd-pattern bits plus one 16-bit A scratch window should preserve the tagged-DIV simulation and substantially reduce peak.","result":"Added scaled_by_pattern_history_560_tagged_div_scaffold_reduces_peak. For one sampled converged denominator, it allocates 560 raw pattern bits and a 16-bit per-window A scratch register, runs the same 560 scaled controlled microsteps, simulates (0,y+x), verifies bottom channel zero, and recovers y/x. Cost remains 1,145,760 CCX; peak drops from 2,405q with raw odd/A controls to 1,861q. Full BY tests pass locally (63 passed). ./autoresearch.sh default path unchanged and passes at 4,132,750 Toffoli / 2716q.","structural_learning":"The branch-pattern history scaffold is concrete and works at circuit level with preset per-window A scratch. This narrows the implementation gap: the next decoder only needs to turn pattern+delta into one window's A scratch, not carry a full A history. Peak is now dominated by raw pattern bits plus current clean-temp cmod_add workspace.","caveat":"A scratch is loaded classically in this scaffold, not computed reversibly from pattern+delta. Pattern bits are still raw 560 bits, not entropy-compressed 481 bits. Current cmod_add clean temp still prevents the strict ~600-scratch target.","next_action_hint":"Implement reversible pattern+delta -> A-window decoder, then attack cmod_add workspace. If a no-clean/dirty controlled add lands, replace raw pattern with compressed pattern IDs."}}
{"run":229,"commit":"4821112","metric":4132750,"metrics":{"altseed_classical_total":0,"altseed_phase_batches_total":0,"altseed_ancilla_batches_total":0,"avg_clifford":24414411.956,"qubits":2716,"emitted_ops":31193208,"correctness_ok":1},"status":"keep","description":"Identify dirty qoffset adder substrate for 600-scratch BY","timestamp":1777404859979,"segment":3,"confidence":6.462892453654578,"iterationTokens":18162,"asi":{"hypothesis":"The remaining 600-scratch blocker is no-clean-temp controlled modular add. The existing venting module may already provide a dirty quantum-offset adder with the right workspace/cost scale, which can be adapted into the missing controlled modular add substrate.","result":"Added dirty_quantum_offset_adder_is_plausible_cmod_add_substrate. Existing venting::iadd_dirty_2clean_qoffset adds a 256-bit quantum offset using 762 CCX, with exactly 2 clean qubits and 254 dirty qubits, no hidden clean n-register. Full BY tests pass locally (64 passed). ./autoresearch.sh default path unchanged and passes at 4,132,750 Toffoli / 2716q.","structural_learning":"The desired adder family is present in the codebase: dirty quantum-offset addition already has SOTA-shaped workspace and cost. The next step is controlled dirty q-offset modular addition. If adapted, the compressed branch-pattern history bank can plausibly serve as dirty workspace and bring the scaled BY DIV primitive to the ~600-scratch target.","caveat":"The measured primitive is not controlled and not modular reduction by p. It is only the addition substrate. Controlled qoffset logic and modular reduction/canonicalization must be implemented and simulated before claiming the scratch target.","next_action_hint":"Implement a controlled variant of venting::iadd_dirty_2clean_qoffset or a wrapper suitable for cmod_add_qq: effective offset = ctrl ? q_offset : 0, using dirty history qubits and 2 clean ancillae. Then plug it into the scaled BY microstep cost/peak probe."}}
{"run":230,"commit":"233f15c","metric":4132750,"metrics":{"altseed_classical_total":0,"altseed_phase_batches_total":0,"altseed_ancilla_batches_total":0,"avg_clifford":24414411.956,"qubits":2716,"emitted_ops":31193208,"correctness_ok":1},"status":"keep","description":"Prototype controlled dirty qoffset adder and invalidate naive control cost","timestamp":1777406250234,"segment":3,"confidence":8.502381343406142,"iterationTokens":15779,"asi":{"hypothesis":"The remaining 600-scratch blocker is controlled modular addition without a clean 256-bit addend. A controlled dirty quantum-offset adder adapted from venting may preserve the scratch shape; measure whether naive control is also Toffoli-viable.","result":"Added ciadd_dirty_3clean_qoffset in venting.rs and tests in by.rs. Small n=8 basis check passes with target updated iff ctrl=1, offset preserved, dirty restored, and phase clean. n=256 naive controlled dirty qoffset costs 3557 CCX and peak 770q with 254 dirty + 3 clean; scratch shape is right, but scaled BY step would be ~4323 CCX and 560-step replay ~2.42M, too high. Full BY tests passed locally (66 passed). Latest autoresearch run was blocked by the context-window guard before benchmarking; default path was unchanged in prior runs at 4,132,750 Toffoli / 2716q.","structural_learning":"Dirty qoffset addition solves the clean-workspace/scratch direction, but naively controlling every qoffset interaction destroys the Toffoli win. The needed primitive is not just dirty and controlled; it must share the control efficiently, likely by fusing control into modular reduction or by computing a ctrl-masked offset once using dirty/history workspace without generic triple-control overhead.","caveat":"ciadd_dirty_3clean_qoffset is a prototype substrate, not a modular add by p and not integrated into scaled BY. The n=256 cost is an invalidation of naive control, not a production primitive.","next_action_hint":"Derive a control-efficient dirty cmod_add: options are pre-mask offset into dirty history once then use uncontrolled iadd_dirty_2clean_qoffset, controlled modular reduction with classical p using ciadd_dirty_2clean_classical, or a measurement/phase trick to avoid CCCX-per-bit control."}}
{"run":231,"commit":"e241bd6","metric":4132750,"metrics":{"altseed_classical_total":0,"altseed_phase_batches_total":0,"altseed_ancilla_batches_total":0,"avg_clifford":24414411.956,"qubits":2716,"emitted_ops":31193208,"correctness_ok":1},"status":"keep","description":"Account for tagged-DIV deleting pair1 multiplications in SOTA budget","timestamp":1777406707716,"segment":3,"confidence":8.949178910976665,"iterationTokens":7747,"asi":{"hypothesis":"The whole-point scaled-BY DIV budget was conservative because it removed the two Kaliski invocations but kept pair1's two schoolbook multiplications. A true tagged DIV maps (0,dy+dx)->(lambda+1,0), so those multiplications should also disappear, giving enough Toffoli margin for the low-scratch/vented variant even if it is slower.","result":"Added low_scratch_scaled_by_budget_still_beats_27m_after_pair1_mul_deletion. It uses measured schoolbook costs 149,889 and 150,145 CCX. After deleting both Kaliski invocations and pair1's two multiplications, scaffold_after_div≈642,716. Fast scaled BY projection: ≈1,938,476 Toffoli. Low-scratch vented scaled BY projection (3318*560 plus 150k margin): ≈2,650,796 Toffoli, still under Google's 2.7M low-qubit target. Full BY tests passed locally (67 passed). Latest autoresearch run was blocked by context-window guard before benchmark; default path unchanged from prior passing runs at 4,132,750 Toffoli / 2716q.","structural_learning":"The low-scratch path has more Toffoli margin than previously modeled. Even if the no-clean/vented modular-add route costs ~1.86M for the BY DIV core, deleting pair1's two multiplications keeps the whole point-add projection under 2.7M. This makes the 600-scratch engineering path viable without needing the fastest clean-temp adder.","caveat":"Still a budget model, not integrated point_add. It assumes tagged DIV can replace the pair1 Kaliski+mul cleanup and that the remaining scaffold remains roughly unchanged. Pair2 cleanup integration must be made explicit.","next_action_hint":"Next formalize the replacement schedule in point_add: identify exactly which current phases disappear (pair1 Kaliski, pair1_mul1, pair1_mul2, pair2 Kaliski) and what BY-DIV output registers feed into lam/tx/ty. Then build an env-gated scaffold or a circuit-level phase budget."}}
{"run":232,"commit":"ca5b2dc","metric":4132750,"metrics":{"altseed_classical_total":0,"altseed_phase_batches_total":0,"altseed_ancilla_batches_total":0,"avg_clifford":24414411.956,"qubits":2716,"emitted_ops":31193208,"correctness_ok":1,"by_tests_passed":69,"inverse_negr_ccx":1145760,"two_fast_replay_projected":2637286},"status":"keep","description":"Prove neg-r inverse scaled-BY replay cleans pair2 product at forward cost","timestamp":1777407618545,"segment":3,"confidence":9.445539135194307,"iterationTokens":4286,"asi":{"hypothesis":"The pair2 cleanup can be performed by running scaled BY backwards: forward maps (0,q*x)->(sign*q,0), so inverse maps (sign*q,0)->(0,q*x). If the inverse replay uses u=-r as the first channel, the inverse B case uses addition rather than subtraction and should match the forward 2046-CCX step cost.","result":"Added inverse_scaled_by_560_negr_frame_recovers_fast_cost. It simulates a full 560-step inverse product-clean replay with controls from a sampled converged denominator and input u=-sign*q, s=0. Output is logical zero in u and q*x in s. Cost is 1,145,760 CCX and peak 2,405q, matching the forward replay. BY suite passes locally: 69 tests passed.","structural_learning":"The full replacement is now two scaled-BY replays, not one replay plus an ordinary product cleanup: forward tagged DIV for pair1 to produce lambda+1, and neg-r inverse scaled BY for pair2 to clean lambda while writing q*tx=Ry+Qy. This deletes the two Kaliski bodies and the surrounding schoolbook product cleanup. The two-fast-replay budget with measured decoder margin is ≈2,637,286 Toffoli, below Google's 2.7M low-qubit target.","caveat":"This is still a circuit scaffold/budget model under test controls, not wired into build_standard_point_add. Logical zero can be the noncanonical representative p because of fast controlled negation; canonical unloading or a canonical neg variant remains to be synthesized.","next_action_hint":"Build the env-gated point-add phase schedule next: pair1 forward tagged-DIV on (0,dy+dx), sign/frame correction to lambda; tx=lambda^2-Px-Qx; pair2 neg-r inverse BY on (u=-q,0) with x=tx to write Ry+Qy and clean lambda; final subtract Qy. Then replace raw controls by recompute/decode history."}}
{"run":233,"commit":"2473a14","metric":4132750,"metrics":{"altseed_classical_total":0,"altseed_phase_batches_total":0,"altseed_ancilla_batches_total":0,"avg_clifford":24414411.956,"qubits":2716,"emitted_ops":31193208,"correctness_ok":1,"by_tests_passed":69,"inverse_negr_ccx":1145760,"two_fast_replay_projected":2637286,"by_replay_bench_avg_toffoli":5278510,"by_replay_bench_qubits":2716,"by_replay_bench_emitted_ops":42250936},"status":"keep","description":"Wire scaled-BY replay scaffold into benchmark path behind env flag","timestamp":1777407934564,"segment":3,"confidence":10.951031200423056,"iterationTokens":4286,"asi":{"hypothesis":"A safe way to test the scaled-BY thesis in the benchmark path immediately is to append a clean, env-gated no-op 560-step raw-pattern replay after the exact point-add output. This should exercise the real scaled-BY gate body, harness correctness, alternate-seed diagnostics, free-clean checks, and qubit analyzer without risking default correctness.","result":"Added BY_REPLAY_BENCH_SCAFFOLD=1 in src/point_add/mod.rs. It appends the actual 560-step scaled-BY microstep body using 560 persistent odd-pattern qubits plus a 16-qubit A scratch window and zero data/controls. Benchmark with the flag passed: avg_toffoli=5,278,510, emitted_ops=42,250,936, qubits=2,716, correctness_ok=1, altseed failures all zero. Default autoresearch path remains unchanged and passed: avg_toffoli=4,132,750, emitted_ops=31,193,208, qubits=2,716.","structural_learning":"The replay body can live inside the production point-add harness without increasing peak qubits beyond the current 2,716 because it reuses freed scratch after the exact output is computed. The measured delta from default is exactly the expected 1,145,760 Toffoli, validating that the benchmark path sees the same scaled-BY cost as the unit scaffolds.","caveat":"This is not yet the replacement path and does not beat SOTA by itself; it is a benchmark-path smoke hook. The next integration step must move the replay from no-op shadow registers onto tx/ty/lam and replace the Kaliski+mul phases instead of appending to them.","next_action_hint":"Use this hook to keep benchmark-path regressions visible while wiring the actual env-gated replacement: pair1 forward tagged DIV on (0,dy+dx), then pair2 neg-r inverse BY product-clean. Next expose real branch-pattern generation/decode or temporarily derive controls from an existing exact branch generator for a hybrid correctness probe."}}
{"run":234,"commit":"ad6f832","metric":4132750,"metrics":{"altseed_classical_total":0,"altseed_phase_batches_total":0,"altseed_ancilla_batches_total":0,"avg_clifford":24414411.956,"qubits":2716,"emitted_ops":31193208,"correctness_ok":1,"by_tests_passed":71,"inverse_negr_ccx":1145760,"two_fast_replay_projected":2637286,"by_replay_bench_avg_toffoli":5278510,"by_replay_bench_qubits":2716,"by_replay_bench_emitted_ops":42250936},"status":"keep","description":"Prove naive quantum BY branch generation is real but not savings-capable","timestamp":1777408779803,"segment":3,"confidence":13.027428283844992,"iterationTokens":4286,"asi":{"hypothesis":"The missing benchmark-path component is the reversible branch generator. A direct 2-adic f/g generator should be algebraically valid, but if it uses per-step full-width swap/neg/add and compute-uncompute it will erase the scaled-BY replay savings. We need to prove this before wiring a bad replacement.","result":"Added two_adic_branch_generator_matches_classical_prefix_on_small_width: a 96-bit 2-adic f/g circuit with quantum delta emits 64 BY odd/A branch controls matching the classical divstep prefix; cost 43,904 CCX, peak 524q. Added naive_quantum_branch_generator_would_erase_scaled_by_savings: optimistic W=560 direct generator step≈2,880 CCX, one denominator compute+uncompute≈3,225,600 CCX, two generators≈6,451,200 CCX, projected point-add≈9,028,486 CCX. Full BY tests pass locally: 71 passed. Default autoresearch/checks pass unchanged at avg_toffoli=4,132,750 / 2716q.","structural_learning":"The branch generator is not optional, and the naive exact generator is the wrong first integration: it would be correct but much worse than baseline. The scaled-BY modular replay remains good; the first savings-capable integration must either window the denominator/control generator or use a triangular point-add schedule that consumes the denominator state and cleans it from the output instead of compute-copy-uncompute branch generation.","caveat":"No SOTA benchmark path yet. The prior two-replay 2.637M projection is a replay/scaffold budget before branch generation; it is only valid if branch patterns come from a cheap windowed/triangular mechanism. Direct branch generation invalidates that projection.","next_action_hint":"Do not wire naive 2-adic generator. Next synthesize a windowed branch/control generator: use 16-step pattern plus starting delta, update denominator by selected low-ratio/matrix transformations, and compare its compute+uncompute cost against the <~450k per denominator budget needed for actual savings. Alternatively pursue a triangular consumed-denominator schedule."}}
