{"run":294,"commit":"a0a9b95","metric":8038619,"metrics":{"altseed_classical_total":0,"altseed_phase_batches_total":0,"altseed_ancilla_batches_total":0,"avg_clifford":35226095.994,"qubits":4236,"emitted_ops":49073481,"correctness_ok":1,"by_tests_passed":109,"inverse_negr_ccx":1145760,"two_fast_replay_projected":2637286,"by_replay_bench_avg_toffoli":5278510,"by_replay_bench_qubits":2716,"by_replay_bench_emitted_ops":42250936,"centered_body_bench_avg_toffoli":4985518,"centered_body_bench_qubits":2716,"centered_body_bench_emitted_ops":38874541,"centered_body_replay_ccx":873600,"centered_inverse_replay_ccx":873600,"centered_budget_if_folded":2640622,"centered_phase96_fast_mbu_ccx":299616,"centered_phase96_exact_signed_ccx":399264,"centered_phase96_exact_parity_ccx":448800,"centered_phase96_all_exact_ccx":548448,"centered_clean_all_exact_roundtrip_ccx":3199280,"centered_clean_all_exact_peak":2464,"centered_exact_parity_fast_signed_roundtrip_ccx":2618000,"centered_negpatch_phase_saw0":1,"centered_negpatch_phase_saw1":1,"centered_clean_roundtrip_bench_avg_toffoli":7311738,"centered_clean_roundtrip_bench_avg_clifford":32532302.269,"centered_clean_roundtrip_bench_qubits":2976,"centered_clean_roundtrip_bench_emitted_ops":42092380,"centered_clean_roundtrip_bench_altseed_phase":0,"centered_fixed_trace_hook_phase":0,"centered_fast_clean_roundtrip_bench_avg_toffoli":5860218,"centered_fast_clean_roundtrip_bench_avg_clifford":38190533.993,"centered_fast_clean_roundtrip_bench_qubits":3235,"centered_fast_clean_roundtrip_bench_emitted_ops":47024860,"centered_fast_clean_roundtrip_bench_altseed_phase":0,"centered_fast_clean_increment_toffoli":1747760,"centered_denom_controls_bench_avg_toffoli":7868378,"centered_denom_controls_bench_avg_clifford":44313822.825,"centered_denom_controls_bench_qubits":4964,"centered_denom_controls_bench_emitted_ops":55824052,"centered_denom_controls_bench_altseed_phase":0,"centered_live_num_bench_avg_toffoli":7870438,"centered_live_num_bench_avg_clifford":44320460.712,"centered_live_num_bench_qubits":4965,"centered_live_num_bench_emitted_ops":55834807,"centered_live_num_bench_altseed_phase":0,"centered_pair1_replace_avg_toffoli":8172700,"centered_pair1_replace_avg_clifford":40780745.214,"centered_pair1_replace_qubits":5589,"centered_pair1_replace_emitted_ops":51801485,"centered_pair1_replace_altseed_phase":0,"centered_pair1_replace_altseed_classical":0,"centered_pair2_replace_avg_toffoli":8189908,"centered_pair2_replace_avg_clifford":40876699.034,"centered_pair2_replace_qubits":5589,"centered_pair2_replace_emitted_ops":51930771,"centered_pair2_replace_altseed_phase":0,"centered_pair2_replace_altseed_classical":0,"centered_pair12_replace_avg_toffoli":12251174,"centered_pair12_replace_qubits":5589,"centered_pair12_replace_emitted_ops":72970707,"centered_pair1_fast_accum_avg_toffoli":8171417,"centered_pair1_fast_accum_qubits":5589,"centered_pair1_fast_accum_emitted_ops":51826551,"centered_pair2_fast_accum_avg_toffoli":8187601,"centered_pair2_fast_accum_qubits":5589,"centered_pair2_fast_accum_emitted_ops":51944268,"centered_pair12_fast_accum_avg_toffoli":12246560,"centered_pair12_fast_accum_qubits":5589,"centered_pair12_fast_accum_emitted_ops":72997701,"signed_copy_fast_phase_batches":1,"centered_pair1_window_denom_avg_toffoli":8790041,"centered_pair1_window_denom_qubits":5589,"centered_pair1_window_denom_emitted_ops":55077495,"centered_pair2_window_denom_avg_toffoli":8806225,"centered_pair2_window_denom_qubits":5589,"centered_pair2_window_denom_emitted_ops":55195212,"centered_pair12_window_denom_avg_toffoli":13483808,"centered_pair12_window_denom_qubits":5589,"centered_pair12_window_denom_emitted_ops":79499589,"centered_pair1_window_q_payload_avg_toffoli":8790041,"centered_pair1_window_q_payload_qubits":8037,"centered_pair1_window_q_payload_emitted_ops":55084839,"centered_pair2_window_q_payload_avg_toffoli":8806225,"centered_pair2_window_q_payload_qubits":8037,"centered_pair2_window_q_payload_emitted_ops":55202556,"centered_pair12_window_q_payload_avg_toffoli":13483808,"centered_pair12_window_q_payload_qubits":8037,"centered_pair12_window_q_payload_emitted_ops":79514277,"attempted_pair2_560_altseed_phase_batches":1,"attempted_q_local_altseed_phase_batches":1,"attempted_q18_altseed_phase_batches":1,"centered_pair1_window_q18_avg_toffoli":8790881,"centered_pair1_window_q18_qubits":6885,"centered_pair1_window_q18_emitted_ops":55108598,"scaled_pair2_product_avg_toffoli":8038619,"scaled_pair2_product_avg_clifford":35226095.994,"scaled_pair2_product_qubits":4236,"scaled_pair2_product_emitted_ops":49073481},"status":"keep","description":"Wire scaled BY inverse product-clean replacement for pair2","timestamp":1777440028578,"segment":3,"confidence":5.970334101382488,"iterationTokens":13858,"asi":{"hypothesis":"A ground-up BY pair2 cleanup should not compute ty=lam*tx and then divide it back out. Instead, use scaled BY inverse/product-clean directly: generate denominator controls, frame lam as u=-sign(f)*lam, run inverse scaled replay to map (u,0)->(0,lam*tx), then subtract Qy.","result":"Added BY_SCALED_PAIR2_PRODUCT_REPLACE=1. It skips the mul3_between_pair product multiplication and skips pair2 Kaliski/centered quotient cleanup. The scaled inverse replay has no centered parity history and uses canonical controlled negation so lam frees as exact zero. Full harness passes: avg_toffoli=8,038,619, avg_clifford=35,226,095.994, qubits=4,236, emitted_ops=49,073,481, all altseed/classical/phase/ancilla zero.","structural_learning":"This is the first integrated BY path that actually uses the inverse/product-clean idea in the affine point-add schedule. It is significantly cleaner than centered pair2 quotient replacement: 8,038,619 vs 8,187,601 Toffoli and 4,236q vs 5,589q, and it deletes the ordinary q*x multiplication. It also validates that scaled modular BY can avoid centered parity history for pair2 product generation.","caveat":"Still far worse than default because denominator generation is still the direct 576-step full-width compute/uncompute. This confirms the bottleneck: product-clean replay is viable, but denominator generation must become selected/window/consumed or BY cannot beat SOTA.","next_action_hint":"If continuing BY, build around this product-clean pair2 architecture, not the centered quotient-add pair2 path. The next design must delete direct denominator generation; otherwise the path is dead for SOTA."}}
{"run":295,"commit":"7351665","metric":4111918,"metrics":{"altseed_classical_total":0,"altseed_phase_batches_total":0,"altseed_ancilla_batches_total":0,"avg_clifford":24423006.99,"qubits":2716,"emitted_ops":30748978,"correctness_ok":1,"by_tests_passed":109,"inverse_negr_ccx":1145760,"two_fast_replay_projected":2637286,"by_replay_bench_avg_toffoli":5278510,"by_replay_bench_qubits":2716,"by_replay_bench_emitted_ops":42250936,"centered_body_bench_avg_toffoli":4985518,"centered_body_bench_qubits":2716,"centered_body_bench_emitted_ops":38874541,"centered_body_replay_ccx":873600,"centered_inverse_replay_ccx":873600,"centered_budget_if_folded":2640622,"centered_phase96_fast_mbu_ccx":299616,"centered_phase96_exact_signed_ccx":399264,"centered_phase96_exact_parity_ccx":448800,"centered_phase96_all_exact_ccx":548448,"centered_clean_all_exact_roundtrip_ccx":3199280,"centered_clean_all_exact_peak":2464,"centered_exact_parity_fast_signed_roundtrip_ccx":2618000,"centered_negpatch_phase_saw0":1,"centered_negpatch_phase_saw1":1,"centered_clean_roundtrip_bench_avg_toffoli":7311738,"centered_clean_roundtrip_bench_avg_clifford":32532302.269,"centered_clean_roundtrip_bench_qubits":2976,"centered_clean_roundtrip_bench_emitted_ops":42092380,"centered_clean_roundtrip_bench_altseed_phase":0,"centered_fixed_trace_hook_phase":0,"centered_fast_clean_roundtrip_bench_avg_toffoli":5860218,"centered_fast_clean_roundtrip_bench_avg_clifford":38190533.993,"centered_fast_clean_roundtrip_bench_qubits":3235,"centered_fast_clean_roundtrip_bench_emitted_ops":47024860,"centered_fast_clean_roundtrip_bench_altseed_phase":0,"centered_fast_clean_increment_toffoli":1747760,"centered_denom_controls_bench_avg_toffoli":7868378,"centered_denom_controls_bench_avg_clifford":44313822.825,"centered_denom_controls_bench_qubits":4964,"centered_denom_controls_bench_emitted_ops":55824052,"centered_denom_controls_bench_altseed_phase":0,"centered_live_num_bench_avg_toffoli":7870438,"centered_live_num_bench_avg_clifford":44320460.712,"centered_live_num_bench_qubits":4965,"centered_live_num_bench_emitted_ops":55834807,"centered_live_num_bench_altseed_phase":0,"centered_pair1_replace_avg_toffoli":8172700,"centered_pair1_replace_avg_clifford":40780745.214,"centered_pair1_replace_qubits":5589,"centered_pair1_replace_emitted_ops":51801485,"centered_pair1_replace_altseed_phase":0,"centered_pair1_replace_altseed_classical":0,"centered_pair2_replace_avg_toffoli":8189908,"centered_pair2_replace_avg_clifford":40876699.034,"centered_pair2_replace_qubits":5589,"centered_pair2_replace_emitted_ops":51930771,"centered_pair2_replace_altseed_phase":0,"centered_pair2_replace_altseed_classical":0,"centered_pair12_replace_avg_toffoli":12251174,"centered_pair12_replace_qubits":5589,"centered_pair12_replace_emitted_ops":72970707,"centered_pair1_fast_accum_avg_toffoli":8171417,"centered_pair1_fast_accum_qubits":5589,"centered_pair1_fast_accum_emitted_ops":51826551,"centered_pair2_fast_accum_avg_toffoli":8187601,"centered_pair2_fast_accum_qubits":5589,"centered_pair2_fast_accum_emitted_ops":51944268,"centered_pair12_fast_accum_avg_toffoli":12246560,"centered_pair12_fast_accum_qubits":5589,"centered_pair12_fast_accum_emitted_ops":72997701,"signed_copy_fast_phase_batches":1,"centered_pair1_window_denom_avg_toffoli":8790041,"centered_pair1_window_denom_qubits":5589,"centered_pair1_window_denom_emitted_ops":55077495,"centered_pair2_window_denom_avg_toffoli":8806225,"centered_pair2_window_denom_qubits":5589,"centered_pair2_window_denom_emitted_ops":55195212,"centered_pair12_window_denom_avg_toffoli":13483808,"centered_pair12_window_denom_qubits":5589,"centered_pair12_window_denom_emitted_ops":79499589,"centered_pair1_window_q_payload_avg_toffoli":8790041,"centered_pair1_window_q_payload_qubits":8037,"centered_pair1_window_q_payload_emitted_ops":55084839,"centered_pair2_window_q_payload_avg_toffoli":8806225,"centered_pair2_window_q_payload_qubits":8037,"centered_pair2_window_q_payload_emitted_ops":55202556,"centered_pair12_window_q_payload_avg_toffoli":13483808,"centered_pair12_window_q_payload_qubits":8037,"centered_pair12_window_q_payload_emitted_ops":79514277,"attempted_pair2_560_altseed_phase_batches":1,"attempted_q_local_altseed_phase_batches":1,"attempted_q18_altseed_phase_batches":1,"centered_pair1_window_q18_avg_toffoli":8790881,"centered_pair1_window_q18_qubits":6885,"centered_pair1_window_q18_emitted_ops":55108598,"scaled_pair2_product_avg_toffoli":8038619,"scaled_pair2_product_avg_clifford":35226095.994,"scaled_pair2_product_qubits":4236,"scaled_pair2_product_emitted_ops":49073481},"status":"keep","description":"Document scaled BY product-clean result and verify default exact path unchanged","timestamp":1777440117179,"segment":3,"confidence":5.970334101382488,"iterationTokens":5668,"asi":{"hypothesis":"The scaled product-clean BY path is env-gated, so documenting it should not disturb the default exact benchmark.","result":"Default exact path remains unchanged after BY_SCALED_PAIR2_PRODUCT_REPLACE integration: avg_toffoli=4,111,918, avg_clifford=24,423,006.990, qubits=2,716, emitted_ops=30,748,978, all altseed/classical/phase/ancilla zero. Updated structural notes and ideas with the scaled product-clean result.","structural_learning":"The last-shot product-clean implementation is cleanly isolated and does not affect default. It is the best BY integration shape so far but still confirms direct denominator generation is the fatal bottleneck.","next_action_hint":"Treat centered quotient-add pair2 as superseded. Any remaining BY attempt must attack denominator generation from first principles; otherwise pivot away from BY."}}
{"run":296,"commit":"b1c906d","metric":4111918,"metrics":{"altseed_classical_total":0,"altseed_phase_batches_total":0,"altseed_ancilla_batches_total":0,"avg_clifford":24423006.99,"qubits":2716,"emitted_ops":30748978,"correctness_ok":1,"by_tests_passed":110,"inverse_negr_ccx":1145760,"two_fast_replay_projected":2637286,"by_replay_bench_avg_toffoli":5278510,"by_replay_bench_qubits":2716,"by_replay_bench_emitted_ops":42250936,"centered_body_bench_avg_toffoli":4985518,"centered_body_bench_qubits":2716,"centered_body_bench_emitted_ops":38874541,"centered_body_replay_ccx":873600,"centered_inverse_replay_ccx":873600,"centered_budget_if_folded":2640622,"centered_phase96_fast_mbu_ccx":299616,"centered_phase96_exact_signed_ccx":399264,"centered_phase96_exact_parity_ccx":448800,"centered_phase96_all_exact_ccx":548448,"centered_clean_all_exact_roundtrip_ccx":3199280,"centered_clean_all_exact_peak":2464,"centered_exact_parity_fast_signed_roundtrip_ccx":2618000,"centered_negpatch_phase_saw0":1,"centered_negpatch_phase_saw1":1,"centered_clean_roundtrip_bench_avg_toffoli":7311738,"centered_clean_roundtrip_bench_avg_clifford":32532302.269,"centered_clean_roundtrip_bench_qubits":2976,"centered_clean_roundtrip_bench_emitted_ops":42092380,"centered_clean_roundtrip_bench_altseed_phase":0,"centered_fixed_trace_hook_phase":0,"centered_fast_clean_roundtrip_bench_avg_toffoli":5860218,"centered_fast_clean_roundtrip_bench_avg_clifford":38190533.993,"centered_fast_clean_roundtrip_bench_qubits":3235,"centered_fast_clean_roundtrip_bench_emitted_ops":47024860,"centered_fast_clean_roundtrip_bench_altseed_phase":0,"centered_fast_clean_increment_toffoli":1747760,"centered_denom_controls_bench_avg_toffoli":7868378,"centered_denom_controls_bench_avg_clifford":44313822.825,"centered_denom_controls_bench_qubits":4964,"centered_denom_controls_bench_emitted_ops":55824052,"centered_denom_controls_bench_altseed_phase":0,"centered_live_num_bench_avg_toffoli":7870438,"centered_live_num_bench_avg_clifford":44320460.712,"centered_live_num_bench_qubits":4965,"centered_live_num_bench_emitted_ops":55834807,"centered_live_num_bench_altseed_phase":0,"centered_pair1_replace_avg_toffoli":8172700,"centered_pair1_replace_avg_clifford":40780745.214,"centered_pair1_replace_qubits":5589,"centered_pair1_replace_emitted_ops":51801485,"centered_pair1_replace_altseed_phase":0,"centered_pair1_replace_altseed_classical":0,"centered_pair2_replace_avg_toffoli":8189908,"centered_pair2_replace_avg_clifford":40876699.034,"centered_pair2_replace_qubits":5589,"centered_pair2_replace_emitted_ops":51930771,"centered_pair2_replace_altseed_phase":0,"centered_pair2_replace_altseed_classical":0,"centered_pair12_replace_avg_toffoli":12251174,"centered_pair12_replace_qubits":5589,"centered_pair12_replace_emitted_ops":72970707,"centered_pair1_fast_accum_avg_toffoli":8171417,"centered_pair1_fast_accum_qubits":5589,"centered_pair1_fast_accum_emitted_ops":51826551,"centered_pair2_fast_accum_avg_toffoli":8187601,"centered_pair2_fast_accum_qubits":5589,"centered_pair2_fast_accum_emitted_ops":51944268,"centered_pair12_fast_accum_avg_toffoli":12246560,"centered_pair12_fast_accum_qubits":5589,"centered_pair12_fast_accum_emitted_ops":72997701,"signed_copy_fast_phase_batches":1,"centered_pair1_window_denom_avg_toffoli":8790041,"centered_pair1_window_denom_qubits":5589,"centered_pair1_window_denom_emitted_ops":55077495,"centered_pair2_window_denom_avg_toffoli":8806225,"centered_pair2_window_denom_qubits":5589,"centered_pair2_window_denom_emitted_ops":55195212,"centered_pair12_window_denom_avg_toffoli":13483808,"centered_pair12_window_denom_qubits":5589,"centered_pair12_window_denom_emitted_ops":79499589,"centered_pair1_window_q_payload_avg_toffoli":8790041,"centered_pair1_window_q_payload_qubits":8037,"centered_pair1_window_q_payload_emitted_ops":55084839,"centered_pair2_window_q_payload_avg_toffoli":8806225,"centered_pair2_window_q_payload_qubits":8037,"centered_pair2_window_q_payload_emitted_ops":55202556,"centered_pair12_window_q_payload_avg_toffoli":13483808,"centered_pair12_window_q_payload_qubits":8037,"centered_pair12_window_q_payload_emitted_ops":79514277,"attempted_pair2_560_altseed_phase_batches":1,"attempted_q_local_altseed_phase_batches":1,"attempted_q18_altseed_phase_batches":1,"centered_pair1_window_q18_avg_toffoli":8790881,"centered_pair1_window_q18_qubits":6885,"centered_pair1_window_q18_emitted_ops":55108598,"scaled_pair2_product_avg_toffoli":8038619,"scaled_pair2_product_avg_clifford":35226095.994,"scaled_pair2_product_qubits":4236,"scaled_pair2_product_emitted_ops":49073481,"consumed_branchless_depth16_predecessor_patterns":589824,"consumed_branchless_depth16_predecessor_states":589824},"status":"keep","description":"Invalidate branchless consumed-denominator BY window recovery early","timestamp":1777440404604,"segment":3,"confidence":5.970334101382488,"iterationTokens":26499,"asi":{"hypothesis":"A ground-up BY consumed-denominator design might avoid storing branch history by recovering branch controls from the post-window denominator state. Invalidate this before more point-add wiring.","result":"Added and ran consumed_denominator_window_branchless_recovery_is_exponentially_ambiguous. The test passes and shows poststate (delta,f,g)=(0,1,0) has totals_by_depth=[3,8,20,48,112,256,576,1280,2816,6144,13312,28672,61440,131072,278528,589824]; depth16_states=589,824 and depth16_patterns=589,824. Default exact benchmark remains unchanged and clean at 4,111,918 Toffoli @ 2,716q.","structural_learning":"Branchless consumed-denominator cleanup is not viable: a 16-step window cannot recover branch controls from post-denominator state alone. Any BY denominator architecture that can still beat SOTA must carry compressed pattern/history or consume pattern+q inside a reversible fixed-matrix window with an explicit local inverse. This invalidates a tempting no-history route early, before more production wiring.","caveat":"This is a negative result, not a performance improvement. It narrows the last viable BY route to explicit selected/fixed-matrix window consumption.","next_action_hint":"If one final constructive BY attempt is made, it must be a single-window reversible fixed-matrix/q-consumption circuit with local inverse and strict kill target (~8k-12k Toffoli/window, no raw q history, no 16 full-width microsteps). Otherwise BY should be declared dead for SOTA."}}
