{"run":430,"commit":"4fe707c","metric":4089274,"metrics":{"altseed_ancilla_batches_total":0,"altseed_classical_total":0,"altseed_phase_batches_total":0,"attempted_pair2_560_altseed_phase_batches":1,"attempted_q18_altseed_phase_batches":1,"attempted_q_local_altseed_phase_batches":1,"avg_clifford":24292787.153,"by_denpair_fixed_schedule_sidecar_bits":50,"by_denpair_fixed_schedule_worst_step":560,"by_denpair_history_max_converge":558,"by_denpair_history_samples":8192,"by_denpair_history_selector_bits_with_signs":564,"by_denpair_history_sidecar_bits":50,"by_direct_denpair_projected_total_with_replay_scaffold":3793920,"by_first16_carry_plus_fixed_bits":736,"by_first16_pattern_entropy_bits":195.4,"by_first16_pattern_fixed_bits":208,"by_fixed_matrix_den_compute_ccx":303828,"by_fixed_matrix_den_compute_uncompute_ccx":607657,"by_fixed_matrix_den_peak":3424,"by_full_ratio_bits":560,"by_full_ratio_constmul_add_widths":110720,"by_full_ratio_constmul_roundtrip_1t":221440,"by_full_ratio_constmul_roundtrip_2t":442880,"by_full_ratio_pinverse_popcount":305,"by_full_ratio_samples":64,"by_projective_streaming_failures":64,"by_projective_streaming_state_bits":816,"by_ratio_a_anf_degree":14,"by_ratio_a_anf_density":7268,"by_ratio_a_max_steps":149,"by_ratio_a_mean_steps":132,"by_ratio_a_serial_proxy_max":8892998,"by_ratio_a_serial_proxy_mean":7307490,"by_ratio_window32_samples":1088,"by_ratio_window32_v2_le4":822,"by_ratio_window_m01_v2_1":347,"by_ratio_window_m01_v2_2":673,"by_ratio_window_m01_v2_3":380,"by_ratio_window_m01_v2_ge16":92,"by_ratio_window_samples":2240,"by_replay_bench_avg_toffoli":5278510,"by_replay_bench_emitted_ops":42250936,"by_replay_bench_qubits":2716,"by_selected_varcoeff_one_coeff_ccx":18598,"by_selected_varcoeff_peak":2123,"by_selected_varcoeff_window_lower_ccx":148784,"by_streaming_limb_folded_k16_failures":64,"by_streaming_limb_folded_state_bits":1088,"by_streaming_limb_k8_failures":64,"by_streaming_limb_samples":64,"by_streaming_limb_state_bits":1152,"by_streaming_separate_b8_failures":16,"by_streaming_separate_c1_15_failures":64,"by_streaming_separate_state_bits":816,"by_streaming_tail_b_workspace_bits":288,"by_streaming_tail_c_core_bits":528,"by_tail_ratio_bits":304,"by_tail_ratio_samples":64,"by_tapered_direct_compute_ccx":1004080,"by_tapered_direct_compute_uncompute_ccx":2008160,"by_tapered_direct_peak":3372,"by_tapered_direct_two_denominators_ccx":4016320,"by_tests_passed":111,"by_truncated_xcolumn_width_bits":144,"carry_save_product_mbu_all_degree_n8":16,"carry_save_product_mbu_all_density_n8":20440,"carry_save_product_mbu_top_degree_n8":15,"carry_save_product_mbu_top_density_n8":3602,"centered_body_bench_avg_toffoli":4985518,"centered_body_bench_emitted_ops":38874541,"centered_body_bench_qubits":2716,"centered_body_replay_ccx":873600,"centered_budget_if_folded":2640622,"centered_clean_all_exact_peak":2464,"centered_clean_all_exact_roundtrip_ccx":3199280,"centered_clean_roundtrip_bench_altseed_phase":0,"centered_clean_roundtrip_bench_avg_clifford":32532302.269,"centered_clean_roundtrip_bench_avg_toffoli":7311738,"centered_clean_roundtrip_bench_emitted_ops":42092380,"centered_clean_roundtrip_bench_qubits":2976,"centered_denom_controls_bench_altseed_phase":0,"centered_denom_controls_bench_avg_clifford":44313822.825,"centered_denom_controls_bench_avg_toffoli":7868378,"centered_denom_controls_bench_emitted_ops":55824052,"centered_denom_controls_bench_qubits":4964,"centered_euclid_boundary_scratch_p99":710,"centered_euclid_entropy_scratch_p99":702.493,"centered_euclid_live_recompute_weight_mean":5870567.412,"centered_euclid_live_recompute_weight_p99":6819786,"centered_euclid_mbu_degree_n14":14,"centered_euclid_mbu_density_n14":8320,"centered_euclid_raw_payload_p99":336,"centered_euclid_raw_scratch_p99":592,"centered_euclid_rawq_rank_degree_n14":13,"centered_euclid_rawq_rank_density_n14":7838,"centered_euclid_rawq_rank_max_multiplicity_n14":4,"centered_exact_parity_fast_signed_roundtrip_ccx":2618000,"centered_fast_clean_increment_toffoli":1747760,"centered_fast_clean_roundtrip_bench_altseed_phase":0,"centered_fast_clean_roundtrip_bench_avg_clifford":38190533.993,"centered_fast_clean_roundtrip_bench_avg_toffoli":5860218,"centered_fast_clean_roundtrip_bench_emitted_ops":47024860,"centered_fast_clean_roundtrip_bench_qubits":3235,"centered_fixed_trace_hook_phase":0,"centered_inverse_replay_ccx":873600,"centered_live_num_bench_altseed_phase":0,"centered_live_num_bench_avg_clifford":44320460.712,"centered_live_num_bench_avg_toffoli":7870438,"centered_live_num_bench_emitted_ops":55834807,"centered_live_num_bench_qubits":4965,"centered_negpatch_phase_saw0":1,"centered_negpatch_phase_saw1":1,"centered_pair12_fast_accum_avg_toffoli":12246560,"centered_pair12_fast_accum_emitted_ops":72997701,"centered_pair12_fast_accum_qubits":5589,"centered_pair12_replace_avg_toffoli":12251174,"centered_pair12_replace_emitted_ops":72970707,"centered_pair12_replace_qubits":5589,"centered_pair12_window_denom_avg_toffoli":13483808,"centered_pair12_window_denom_emitted_ops":79499589,"centered_pair12_window_denom_qubits":5589,"centered_pair12_window_q_payload_avg_toffoli":13483808,"centered_pair12_window_q_payload_emitted_ops":79514277,"centered_pair12_window_q_payload_qubits":8037,"centered_pair1_fast_accum_avg_toffoli":8171417,"centered_pair1_fast_accum_emitted_ops":51826551,"centered_pair1_fast_accum_qubits":5589,"centered_pair1_replace_altseed_classical":0,"centered_pair1_replace_altseed_phase":0,"centered_pair1_replace_avg_clifford":40780745.214,"centered_pair1_replace_avg_toffoli":8172700,"centered_pair1_replace_emitted_ops":51801485,"centered_pair1_replace_qubits":5589,"centered_pair1_window_denom_avg_toffoli":8790041,"centered_pair1_window_denom_emitted_ops":55077495,"centered_pair1_window_denom_qubits":5589,"centered_pair1_window_q18_avg_toffoli":8790881,"centered_pair1_window_q18_emitted_ops":55108598,"centered_pair1_window_q18_qubits":6885,"centered_pair1_window_q_payload_avg_toffoli":8790041,"centered_pair1_window_q_payload_emitted_ops":55084839,"centered_pair1_window_q_payload_qubits":8037,"centered_pair2_fast_accum_avg_toffoli":8187601,"centered_pair2_fast_accum_emitted_ops":51944268,"centered_pair2_fast_accum_qubits":5589,"centered_pair2_replace_altseed_classical":0,"centered_pair2_replace_altseed_phase":0,"centered_pair2_replace_avg_clifford":40876699.034,"centered_pair2_replace_avg_toffoli":8189908,"centered_pair2_replace_emitted_ops":51930771,"centered_pair2_replace_qubits":5589,"centered_pair2_window_denom_avg_toffoli":8806225,"centered_pair2_window_denom_emitted_ops":55195212,"centered_pair2_window_denom_qubits":5589,"centered_pair2_window_q_payload_avg_toffoli":8806225,"centered_pair2_window_q_payload_emitted_ops":55202556,"centered_pair2_window_q_payload_qubits":8037,"centered_phase96_all_exact_ccx":548448,"centered_phase96_exact_parity_ccx":448800,"centered_phase96_exact_signed_ccx":399264,"centered_phase96_fast_mbu_ccx":299616,"chord_product_alt_extra_mul_floor":149889,"chord_product_identity_samples":200,"chord_product_second_inverse_moved_not_removed":1,"coefficient_transform_low_qubit_scratch_allowance":663,"coefficient_transform_r_output_floor":768,"coefficient_transform_second_channel_floor":1280,"consumed_branchless_depth16_predecessor_patterns":589824,"consumed_branchless_depth16_predecessor_states":589824,"correctness_ok":1,"curve_collision_event_ambiguous_keys_n10":87,"curve_collision_event_degree_n10":19,"curve_collision_event_density_n10":487716,"curve_mod2_sidecar_lane_bits_n16":6,"curve_mod2_sidecar_linear_extrapolated_pair_bits":192,"curve_mod2_sidecar_pair_bits_n16":12,"curve_mod2_sidecar_slack_bits":88,"curve_redundant_coeff_conflicts_n14_e11":301,"curve_redundant_coeff_extra_bits_n12":11,"curve_redundant_coeff_linear_extra_bits_secp":235,"curve_restricted_kaliski_ambiguity_frac_n14":0.004763,"curve_restricted_kaliski_sidecar_bits_n14":6,"curve_x_membership_degree_n14":14,"curve_x_membership_density_n14":8190,"curve_x_support_inv_min_degree_n14":7,"curve_xy_support_inv_min_degree_n14":4,"destructive_montgomery_reverse_frontier_n10":2042,"destructive_montgomery_reverse_frontier_n12":8186,"destructive_montgomery_test_passed":1,"destructive_montgomery_window_preimages":512,"emitted_ops":30575944,"endomorphism_slope_identity_samples":200,"endomorphism_slope_phase_degree_n10":20,"endomorphism_slope_phase_density_n10":297278,"endomorphism_slope_support_min_degree_n12":4,"endomorphism_slope_y_sum_exceptions":0,"endomorphism_y_support_inv_min_degree_n14":6,"euclid_div_replay_samples":200,"euclid_live_x_recompute_weight_mean":8746311.223,"euclid_live_x_recompute_weight_p99":10391412,"euclid_longdiv_weight_mean":43836.52,"euclid_longdiv_weight_p99":45455,"euclid_quotient_count_p99":172,"euclid_quotient_entropy_mean_bits":513.018,"euclid_quotient_entropy_p99_bits":518.44,"euclid_quotient_entropy_scratch_p99":774.44,"euclid_quotient_mbu_degree_n12":11,"euclid_quotient_mbu_density_n12":2046,"euclid_quotient_one_boundary_scratch_p99":776,"euclid_quotient_payload_max_bits":360,"euclid_quotient_payload_mean_bits":337.458,"euclid_quotient_payload_p99_bits":349,"euclid_quotient_raw_scratch_max":616,"fermat_inv_chain_floor_ccx":37827210,"fermat_inv_square_floor_ccx":148342,"halfgcd_matrix_bits_p99":524,"halfgcd_matrix_mbu_degree_n14":13,"halfgcd_matrix_mbu_density_n14":8162,"halfgcd_matrix_residual_bits_p99":769,"halfgcd_matrix_tail_raw_bits_p99":689,"halfgcd_residual_bits_p99":256,"inplace_mul_cleanup_degree_n10":18,"inplace_mul_cleanup_density_n10":521064,"inverse_negr_ccx":1145760,"kaliski_a_coeff_anf_degree_n12":12,"kaliski_a_coeff_anf_density_n12":2094,"kaliski_branch_history_entropy_floor_bits":256,"kaliski_branch_history_secp_unique_samples":4096,"kaliski_branch_oracle_degree_n12":11,"kaliski_branch_oracle_density_n12":1976,"kaliski_coeff_channel_altseed_phase_batches":1,"kaliski_coeff_pair_affine_relation_det_nonzero":1,"kaliski_iter_trim_fail_frac_384":0.011719,"kaliski_iter_trim_fail_frac_392":0.00061,"kaliski_pair1_terminal_max_iters":394,"kaliski_pair1_terminal_p999_iters":391,"kaliski_pair1_terminal_p99_iters":385,"kaliski_pair2_terminal_max_iters":396,"kaliski_pair2_terminal_p999_iters":392,"kaliski_pair2_terminal_p99_iters":385,"kaliski_persistent_orientation_a_frac":0.447631,"kaliski_persistent_orientation_cswap_ratio":0.272833,"kaliski_persistent_orientation_event_frac":0.244257,"kaliski_selected_matrix_lb_t16":3627936,"kaliski_selected_matrix_lb_t4":4186080,"kaliski_selected_matrix_lb_t8":3767472,"kaliski_selected_matrix_window_ccx_t16":139536,"kaliski_transition_cswap_saving_ccx_per_iter_401":335.808,"kaliski_transition_cswap_saving_ccx_per_iter_404":333.314,"kaliski_transition_orientation_swap_ratio":0.277395,"kaliski_transition_projected_pointadd_loss_ccx":282464,"kaliski_transition_selector_floor_ccx_per_iter":510,"kim_poststate_branch_ambiguity_frac":0.505664,"kim_poststate_branch_ambiguous_steps":5178,"kim_poststate_branch_total_steps":10240,"lambda_output_phase_min_degree_n10":4,"lambda_output_phase_min_degree_n12":4,"lambda_output_phase_min_degree_n8":3,"lambda_sqrt_phase_degree_n12":12,"lambda_sqrt_phase_density_n12":2072,"last_shot_fixed_window_max_ccx":27641,"last_shot_fixed_window_max_peak":2224,"last_shot_fixed_window_mean_ccx":20323.5,"last_shot_fixed_window_p90_ccx":24382,"last_shot_two_denominators_ccx":1463292,"linear_x_tag_ambiguity_frac_n8":0.2432,"linear_x_tag_beta_ambiguity_invariant":1,"luo_pz_per_point_add_toffoli_proxy":31981568,"luo_pz_ratio_google_low_gate":15.23,"luo_pz_ratio_google_low_qubit":11.85,"masked_borrow_qoffset_ccx":1274,"masked_borrow_qoffset_div560":1142400,"masked_borrow_qoffset_peak":771,"masked_borrow_qoffset_scratch_with_history":766,"mbuc_montgomery_qhistory_output_degree":16,"mbuc_montgomery_qhistory_output_density":31032,"mbuc_montgomery_qhistory_xy_degree":16,"mbuc_montgomery_qhistory_xy_density":2440,"mbuc_old_point_phase_degree":15,"mbuc_old_point_phase_density":19540,"mbuc_quotient_phase_anf_density":32518,"mbuc_quotient_phase_degree":15,"mbuc_quotient_phase_truth_table":65536,"mbuc_sequential_old_y_min_degree_n10":3,"mbuc_support_curve_min_degree_n10":4,"mbuc_support_curve_min_degree_n12":4,"one_lane_linear_sidecar_common_eigenvectors_mod256":0,"partial_mask_qoffset_interpolated_add_ccx":2755,"partial_mask_qoffset_mask_budget":90,"partial_mask_qoffset_projected_point_add":2764476,"pencil_slope_root_choice_degree_n12":11,"pencil_slope_root_choice_density_n12":2006,"pencil_slope_root_choice_support_n12":2083,"plusminus_exact_payload_p99":496,"plusminus_exact_scratch_p99":752,"plusminus_k_only_ambiguity_frac_n12":0.323227,"plusminus_kseq_boundary_scratch_p99":759,"plusminus_kseq_direction_max_bits_n16":2,"plusminus_kseq_direction_p99_bits_n16":1,"plusminus_kseq_entropy_scratch_p99":640.213,"plusminus_kseq_live_recompute_weight_mean":9301432.768,"plusminus_kseq_live_recompute_weight_p99":10311726,"plusminus_kseq_unary_scratch_p99":640,"plusminus_rawk_rank_degree_n14":14,"plusminus_rawk_rank_density_n14":8254,"plusminus_rawk_rank_max_multiplicity_n14":21,"plusminus_shift_payload_p99":308,"plusminus_shift_scratch_p99":564,"plusminus_steps_p99":195,"qubits":2713,"raw_product_mbu_fullmask_degree_n10":19,"raw_product_mbu_fullmask_density_n10":427812,"raw_product_mbu_highbit_degree_n10":19,"raw_product_mbu_highbit_density_n10":120581,"rolling_hash_decoder_add_degree_n4":18,"rolling_hash_decoder_add_density_n4":27136,"rolling_hash_sidecar_bits_n8":3,"scale_absorb_chunked_pair1_altseed_phase_batches":1,"scale_absorb_pair1_chunked_prescale_ccx":47276,"scale_absorb_pair1_chunked_projected_delta":-8468,"scale_absorb_pair1_correction_loop_ccx":103020,"scale_absorb_pair1_mixed_prescale_ccx":106136,"scale_absorb_pair2_chunked_prescale_ccx":47276,"scale_absorb_pair2_chunked_projected_delta":-7703,"scale_absorb_pair2_correction_loop_ccx":102255,"scale_absorb_pair2_mixed_prescale_ccx":104606,"scaled_pair2_product_avg_clifford":35226095.994,"scaled_pair2_product_avg_toffoli":8038619,"scaled_pair2_product_emitted_ops":49073481,"scaled_pair2_product_qubits":4236,"scratch600_bare_kaliski_div_scratch":512,"scratch600_extrapolated_sidecar_need":255,"scratch600_remaining_sidecar":88,"scratch600_sidecar_conflicts_n8_b4":9500,"scratch600_sidecar_min_bits_n8":7,"scratch600_unreduced_coeff_bits_secp":663,"scratch600_unreduced_scratch_floor":1326,"secp256k1_order_mod2":1,"secp256k1_order_mod3":1,"secp_curve_local_candidate_ambiguity_frac":0.8836,"secp_curve_local_candidate_ambiguous_steps":23016,"secp_curve_local_candidate_total_steps":26048,"secp_local_poststate_branch_ambiguity_frac":0.885135,"secp_local_poststate_branch_ambiguous_steps":7205,"secp_local_poststate_branch_total_steps":8140,"signed_copy_fast_phase_batches":1,"slope_tag_retarget_full_degree_n10":19,"slope_tag_retarget_full_density_n10":522204,"slope_tag_retarget_support_min_degree_n12":4,"solinas_multihalve_cand22_exact_ccx":8616,"solinas_multihalve_cand22_floor_ccx":4910,"solinas_multihalve_cand22_no_threshold_ccx":4442,"solinas_multihalve_cand8_exact_ccx":2504,"solinas_multihalve_cand8_floor_ccx":1724,"solinas_multihalve_cand8_no_threshold_ccx":1228,"solinas_multihalve_chunk_bits":22,"solinas_multihalve_cur22_ccx":5610,"solinas_multihalve_cur8_ccx":2040,"solinas_multihalve_exact_projected_saving_404_ccx":-54572,"solinas_multihalve_history_bits_401":57,"solinas_multihalve_history_bits_404":58,"solinas_multihalve_history_exact_samples":1024,"solinas_multihalve_output_quotient_degree_n14":13,"solinas_multihalve_output_quotient_density_n14":16,"solinas_multihalve_product_bits":54,"solinas_multihalve_projected_saving_404_ccx":12916,"solinas_multihalve_split22_exact_ccx":7564,"solinas_multihalve_split22_floor_ccx":3858,"solinas_multihalve_split22_no_threshold_ccx":3390,"solinas_multihalve_split8_exact_ccx":2124,"solinas_multihalve_split8_floor_ccx":1344,"solinas_multihalve_split8_no_threshold_ccx":848,"solinas_multihalve_split_exact_best_dp_cost_404_ccx":107296,"solinas_multihalve_split_exact_best_dp_saving_404_ccx":-4276,"solinas_multihalve_split_exact_best_single_k":7,"solinas_multihalve_split_exact_best_single_saving_ccx":-83,"solinas_multihalve_split_exact_projected_saving_404_ccx":-35256,"solinas_multihalve_split_history_best_dp_cost_401_ccx":42341,"solinas_multihalve_split_history_best_dp_cost_404_ccx":42664,"solinas_multihalve_split_history_best_dp_history_bits_401":57,"solinas_multihalve_split_history_best_dp_history_bits_404":58,"solinas_multihalve_split_history_best_dp_roundtrip_saving_401_ccx":119828,"solinas_multihalve_split_history_best_dp_roundtrip_saving_404_ccx":120712,"solinas_multihalve_split_history_best_dp_saving_401_ccx":59914,"solinas_multihalve_split_history_best_dp_saving_404_ccx":60356,"solinas_multihalve_split_history_pair12_history_bits":115,"solinas_multihalve_split_history_pair12_roundtrip_saving_ccx":240540,"solinas_multihalve_split_no_threshold_history_bits_404":19,"solinas_multihalve_split_no_threshold_projected_saving_404_ccx":41152,"solinas_multihalve_split_no_threshold_roundtrip_saving_404_ccx":82304,"solinas_multihalve_split_projected_saving_404_ccx":32232,"solinas_multihalve_split_threshold22_ccx":4174,"solinas_multihalve_split_threshold8_ccx":1276,"solinas_multihalve_threshold22_ccx":4174,"solinas_multihalve_threshold8_ccx":1276,"strategy_e_current_known_total":2988510,"strategy_e_if_new_inplace_mul":2022750,"strategy_e_needed_mul_saving":965760,"strategy_e_tests_passed":2,"streamed_mask_qoffset_ccx":2542,"streamed_mask_qoffset_div560":1852480,"streamed_mask_qoffset_peak":770,"streamed_mask_qoffset_projected_point_add":2645196,"streamed_mask_qoffset_scratch_with_history":510,"streamed_qoffset_lowword_selector_ccx":208320,"streamed_qoffset_projected_with_lowword_selector":2765676,"streamed_qoffset_projected_with_tapered_selector":4565516,"streamed_qoffset_selector_margin":87840,"toy_full_poststate_branch_conflicts_n6":5760,"toy_tagged_poststate_ambiguity_frac_n8":0.2432,"toy_tagged_poststate_ambiguous_occurrences_n8":228000,"toy_tagged_poststate_total_occurrences_n8":937500,"two_adic_inv_correction_degree_n12":11,"two_adic_inv_correction_density_n12":2004,"two_fast_replay_projected":2637286,"unreduced_coeff_highbit_degree_n10":20,"unreduced_coeff_highbit_density_n10":516314,"unreduced_kaliski_max_coeff_bits_n8":23,"unreduced_kaliski_max_coeff_bits_secp":663,"x_only_additive_tag_ambiguity_frac_n8":0.2432,"x_only_additive_tag_ambiguity_invariant":1},"status":"keep","description":"Cost exact Solinas multihalve cleanup and open history-carry chunk route","timestamp":1777574624143,"segment":3,"confidence":3.381589842671819,"iterationTokens":21740,"asi":{"hypothesis":"Direct Solinas multihalve cleanup might become exact cheaply; if threshold recomputation is too expensive, keeping the one-bit residual per chunk through the body may avoid dense cleanup.","result":"Concrete threshold predicate costs kill the clean no-history version (best exact DP for 404 costs 107296 vs current 103020), but history-carry chunks are exact in numeric forward/reverse tests and project 240540 CCX roundtrip saving over pair1+pair2 for 115 residual bits.","next_action_hint":"Do not wire threshold-recompute multihalve. Next isolated step is a real phase-clean long-shift/history-carry circuit skeleton with explicit inverse and peak accounting; only then consider replacing correction loops or repairing chunked prescaler."}}
{"type":"config","name":"quantum_ecc secp256k1 point-add scratch-qubit reduction","metricName":"scratch_q","metricUnit":"","bestDirection":"lower"}
{"run":431,"commit":"7b206cf","metric":1689,"metrics":{"altseed_classical_total":0,"altseed_phase_batches_total":0,"altseed_ancilla_batches_total":0,"avg_toffoli":4089274,"avg_clifford":24292787.153,"qubits":2713,"emitted_ops":30575944,"correctness_ok":1,"scratch_q":1689,"fixed_io_register_qubits":1024},"status":"keep","description":"Baseline scratch-qubit accounting after pivot to low-scratch architectures","timestamp":1777574743873,"segment":4,"confidence":null,"iterationTokens":182,"asi":{"hypothesis":"Reframe optimization around the hard low-scratch target rather than local Toffoli improvements; current exact circuit scratch is total qubits minus four 256-bit I/O registers.","result":"Default clean baseline uses 2713 total qubits, i.e. about 1689 scratch/ancilla over the 1024 input/output/register footprint; this exceeds a 600-scratch target by about 1089 qubits.","next_action_hint":"Stop treating Kaliski polishing as the main path. Build and compare only architectures whose live state can plausibly fit tx,ty plus ~600 scratch, then estimate Toffoli honestly including selector/history/cleanup."}}
{"type":"config","name":"quantum_ecc secp256k1 point-add scratch beyond tx_ty","metricName":"scratch_over_tx_ty_q","metricUnit":"","bestDirection":"lower"}
{"run":432,"commit":"08249b8","metric":2201,"metrics":{"altseed_classical_total":0,"altseed_phase_batches_total":0,"altseed_ancilla_batches_total":0,"avg_toffoli":4089274,"avg_clifford":24292787.153,"qubits":2713,"emitted_ops":30575944,"correctness_ok":1,"scratch_over_tx_ty_q":2201,"fixed_quantum_data_qubits":512,"target_scratch_over_tx_ty_q":600},"status":"keep","description":"Correct scratch baseline as qubits beyond tx,ty only","timestamp":1777574851399,"segment":5,"confidence":null,"iterationTokens":112,"asi":{"hypothesis":"The low-qubit target should count scratch beyond the two quantum point registers tx,ty, not beyond classical offset registers.","result":"Current clean circuit uses 2713 quantum qubits; subtracting tx,ty=512 leaves 2201 scratch/ancilla qubits, about 1601 over the ~600 scratch target.","next_action_hint":"Prioritize architectures with persistent live state <=~600 beyond tx,ty. Kaliski layouts with u,v,r,s/history are excluded except as contrast/baseline."}}
