{"run":287,"commit":"1a4bbd6","metric":8806225,"metrics":{"altseed_classical_total":0,"altseed_phase_batches_total":0,"altseed_ancilla_batches_total":0,"avg_clifford":42949819.049,"qubits":8037,"emitted_ops":55202556,"correctness_ok":1,"by_tests_passed":109,"inverse_negr_ccx":1145760,"two_fast_replay_projected":2637286,"by_replay_bench_avg_toffoli":5278510,"by_replay_bench_qubits":2716,"by_replay_bench_emitted_ops":42250936,"centered_body_bench_avg_toffoli":4985518,"centered_body_bench_qubits":2716,"centered_body_bench_emitted_ops":38874541,"centered_body_replay_ccx":873600,"centered_inverse_replay_ccx":873600,"centered_budget_if_folded":2640622,"centered_phase96_fast_mbu_ccx":299616,"centered_phase96_exact_signed_ccx":399264,"centered_phase96_exact_parity_ccx":448800,"centered_phase96_all_exact_ccx":548448,"centered_clean_all_exact_roundtrip_ccx":3199280,"centered_clean_all_exact_peak":2464,"centered_exact_parity_fast_signed_roundtrip_ccx":2618000,"centered_negpatch_phase_saw0":1,"centered_negpatch_phase_saw1":1,"centered_clean_roundtrip_bench_avg_toffoli":7311738,"centered_clean_roundtrip_bench_avg_clifford":32532302.269,"centered_clean_roundtrip_bench_qubits":2976,"centered_clean_roundtrip_bench_emitted_ops":42092380,"centered_clean_roundtrip_bench_altseed_phase":0,"centered_fixed_trace_hook_phase":0,"centered_fast_clean_roundtrip_bench_avg_toffoli":5860218,"centered_fast_clean_roundtrip_bench_avg_clifford":38190533.993,"centered_fast_clean_roundtrip_bench_qubits":3235,"centered_fast_clean_roundtrip_bench_emitted_ops":47024860,"centered_fast_clean_roundtrip_bench_altseed_phase":0,"centered_fast_clean_increment_toffoli":1747760,"centered_denom_controls_bench_avg_toffoli":7868378,"centered_denom_controls_bench_avg_clifford":44313822.825,"centered_denom_controls_bench_qubits":4964,"centered_denom_controls_bench_emitted_ops":55824052,"centered_denom_controls_bench_altseed_phase":0,"centered_live_num_bench_avg_toffoli":7870438,"centered_live_num_bench_avg_clifford":44320460.712,"centered_live_num_bench_qubits":4965,"centered_live_num_bench_emitted_ops":55834807,"centered_live_num_bench_altseed_phase":0,"centered_pair1_replace_avg_toffoli":8172700,"centered_pair1_replace_avg_clifford":40780745.214,"centered_pair1_replace_qubits":5589,"centered_pair1_replace_emitted_ops":51801485,"centered_pair1_replace_altseed_phase":0,"centered_pair1_replace_altseed_classical":0,"centered_pair2_replace_avg_toffoli":8189908,"centered_pair2_replace_avg_clifford":40876699.034,"centered_pair2_replace_qubits":5589,"centered_pair2_replace_emitted_ops":51930771,"centered_pair2_replace_altseed_phase":0,"centered_pair2_replace_altseed_classical":0,"centered_pair12_replace_avg_toffoli":12251174,"centered_pair12_replace_qubits":5589,"centered_pair12_replace_emitted_ops":72970707,"centered_pair1_fast_accum_avg_toffoli":8171417,"centered_pair1_fast_accum_qubits":5589,"centered_pair1_fast_accum_emitted_ops":51826551,"centered_pair2_fast_accum_avg_toffoli":8187601,"centered_pair2_fast_accum_qubits":5589,"centered_pair2_fast_accum_emitted_ops":51944268,"centered_pair12_fast_accum_avg_toffoli":12246560,"centered_pair12_fast_accum_qubits":5589,"centered_pair12_fast_accum_emitted_ops":72997701,"signed_copy_fast_phase_batches":1,"centered_pair1_window_denom_avg_toffoli":8790041,"centered_pair1_window_denom_qubits":5589,"centered_pair1_window_denom_emitted_ops":55077495,"centered_pair2_window_denom_avg_toffoli":8806225,"centered_pair2_window_denom_qubits":5589,"centered_pair2_window_denom_emitted_ops":55195212,"centered_pair12_window_denom_avg_toffoli":13483808,"centered_pair12_window_denom_qubits":5589,"centered_pair12_window_denom_emitted_ops":79499589,"centered_pair1_window_q_payload_avg_toffoli":8790041,"centered_pair1_window_q_payload_qubits":8037,"centered_pair1_window_q_payload_emitted_ops":55084839,"centered_pair2_window_q_payload_avg_toffoli":8806225,"centered_pair2_window_q_payload_qubits":8037,"centered_pair2_window_q_payload_emitted_ops":55202556},"status":"keep","description":"Validate lowword q-correction payload through pair2 BY window denominator path","timestamp":1777438655766,"segment":3,"confidence":5.970334101382488,"iterationTokens":3902,"asi":{"hypothesis":"The raw q0/q1 window payload should also be clean through the pair2 BY replacement, since it uses the same denominator-window source.","result":"BY_CENTERED_PAIR2_REPLACE=1 BY_CENTERED_WINDOW_Q_DENOM_REPLACE=1 passes: avg_toffoli=8,806,225, avg_clifford=42,949,819.049, qubits=8,037, emitted_ops=55,202,556, all altseed/classical/phase/ancilla zero.","structural_learning":"The q-correction payload wiring is reusable across both quotient-producing BY replacement sites. The raw q history cost is CNOT/qubit-only relative to window controls: Toffoli unchanged and qubits +2448.","caveat":"q payload still not consumed; this is a stepping stone for the selected fixed-matrix window denominator update.","next_action_hint":"Use q histories per window as correction addends for the full f/g scaled-matrix update, replacing the selected-control per-step apply loop."}}
{"run":288,"commit":"62802de","metric":13483808,"metrics":{"altseed_classical_total":0,"altseed_phase_batches_total":0,"altseed_ancilla_batches_total":0,"avg_clifford":61395318.255,"qubits":8037,"emitted_ops":79514277,"correctness_ok":1,"by_tests_passed":109,"inverse_negr_ccx":1145760,"two_fast_replay_projected":2637286,"by_replay_bench_avg_toffoli":5278510,"by_replay_bench_qubits":2716,"by_replay_bench_emitted_ops":42250936,"centered_body_bench_avg_toffoli":4985518,"centered_body_bench_qubits":2716,"centered_body_bench_emitted_ops":38874541,"centered_body_replay_ccx":873600,"centered_inverse_replay_ccx":873600,"centered_budget_if_folded":2640622,"centered_phase96_fast_mbu_ccx":299616,"centered_phase96_exact_signed_ccx":399264,"centered_phase96_exact_parity_ccx":448800,"centered_phase96_all_exact_ccx":548448,"centered_clean_all_exact_roundtrip_ccx":3199280,"centered_clean_all_exact_peak":2464,"centered_exact_parity_fast_signed_roundtrip_ccx":2618000,"centered_negpatch_phase_saw0":1,"centered_negpatch_phase_saw1":1,"centered_clean_roundtrip_bench_avg_toffoli":7311738,"centered_clean_roundtrip_bench_avg_clifford":32532302.269,"centered_clean_roundtrip_bench_qubits":2976,"centered_clean_roundtrip_bench_emitted_ops":42092380,"centered_clean_roundtrip_bench_altseed_phase":0,"centered_fixed_trace_hook_phase":0,"centered_fast_clean_roundtrip_bench_avg_toffoli":5860218,"centered_fast_clean_roundtrip_bench_avg_clifford":38190533.993,"centered_fast_clean_roundtrip_bench_qubits":3235,"centered_fast_clean_roundtrip_bench_emitted_ops":47024860,"centered_fast_clean_roundtrip_bench_altseed_phase":0,"centered_fast_clean_increment_toffoli":1747760,"centered_denom_controls_bench_avg_toffoli":7868378,"centered_denom_controls_bench_avg_clifford":44313822.825,"centered_denom_controls_bench_qubits":4964,"centered_denom_controls_bench_emitted_ops":55824052,"centered_denom_controls_bench_altseed_phase":0,"centered_live_num_bench_avg_toffoli":7870438,"centered_live_num_bench_avg_clifford":44320460.712,"centered_live_num_bench_qubits":4965,"centered_live_num_bench_emitted_ops":55834807,"centered_live_num_bench_altseed_phase":0,"centered_pair1_replace_avg_toffoli":8172700,"centered_pair1_replace_avg_clifford":40780745.214,"centered_pair1_replace_qubits":5589,"centered_pair1_replace_emitted_ops":51801485,"centered_pair1_replace_altseed_phase":0,"centered_pair1_replace_altseed_classical":0,"centered_pair2_replace_avg_toffoli":8189908,"centered_pair2_replace_avg_clifford":40876699.034,"centered_pair2_replace_qubits":5589,"centered_pair2_replace_emitted_ops":51930771,"centered_pair2_replace_altseed_phase":0,"centered_pair2_replace_altseed_classical":0,"centered_pair12_replace_avg_toffoli":12251174,"centered_pair12_replace_qubits":5589,"centered_pair12_replace_emitted_ops":72970707,"centered_pair1_fast_accum_avg_toffoli":8171417,"centered_pair1_fast_accum_qubits":5589,"centered_pair1_fast_accum_emitted_ops":51826551,"centered_pair2_fast_accum_avg_toffoli":8187601,"centered_pair2_fast_accum_qubits":5589,"centered_pair2_fast_accum_emitted_ops":51944268,"centered_pair12_fast_accum_avg_toffoli":12246560,"centered_pair12_fast_accum_qubits":5589,"centered_pair12_fast_accum_emitted_ops":72997701,"signed_copy_fast_phase_batches":1,"centered_pair1_window_denom_avg_toffoli":8790041,"centered_pair1_window_denom_qubits":5589,"centered_pair1_window_denom_emitted_ops":55077495,"centered_pair2_window_denom_avg_toffoli":8806225,"centered_pair2_window_denom_qubits":5589,"centered_pair2_window_denom_emitted_ops":55195212,"centered_pair12_window_denom_avg_toffoli":13483808,"centered_pair12_window_denom_qubits":5589,"centered_pair12_window_denom_emitted_ops":79499589,"centered_pair1_window_q_payload_avg_toffoli":8790041,"centered_pair1_window_q_payload_qubits":8037,"centered_pair1_window_q_payload_emitted_ops":55084839,"centered_pair2_window_q_payload_avg_toffoli":8806225,"centered_pair2_window_q_payload_qubits":8037,"centered_pair2_window_q_payload_emitted_ops":55202556,"centered_pair12_window_q_payload_avg_toffoli":13483808,"centered_pair12_window_q_payload_qubits":8037,"centered_pair12_window_q_payload_emitted_ops":79514277},"status":"keep","description":"Validate q-correction payload with both BY window replacements enabled","timestamp":1777438765550,"segment":3,"confidence":5.970334101382488,"iterationTokens":3878,"asi":{"hypothesis":"The persistent q0/q1 lowword-window payload should compose when both pair1 and pair2 centered BY replacements are active in one full point-add circuit.","result":"BY_CENTERED_PAIR1_REPLACE=1 BY_CENTERED_PAIR2_REPLACE=1 BY_CENTERED_WINDOW_Q_DENOM_REPLACE=1 passes: avg_toffoli=13,483,808, avg_clifford=61,395,318.255, qubits=8,037, emitted_ops=79,514,277, all altseed/classical/phase/ancilla zero.","structural_learning":"The raw q payload can live across both replacement sites without phase/ancilla issues. Peak stays 8,037q because pair1 q histories are freed before pair2 histories allocate. This completes the first real path carrying controls plus q-correction histories through both BY quotient replacements.","caveat":"This is an ugly raw-history integration, not a performance path. The q payload is still not consumed, and qubits are high by 2448 due to raw q histories.","next_action_hint":"Replace q histories with window-local consumption: compute q0/q1, apply a fixed-matrix/high-row update immediately, then clear q before moving to the next window."}}
{"run":289,"commit":"c852544","metric":4111918,"metrics":{"altseed_classical_total":0,"altseed_phase_batches_total":0,"altseed_ancilla_batches_total":0,"avg_clifford":24423006.99,"qubits":2716,"emitted_ops":30748978,"correctness_ok":1,"by_tests_passed":109,"inverse_negr_ccx":1145760,"two_fast_replay_projected":2637286,"by_replay_bench_avg_toffoli":5278510,"by_replay_bench_qubits":2716,"by_replay_bench_emitted_ops":42250936,"centered_body_bench_avg_toffoli":4985518,"centered_body_bench_qubits":2716,"centered_body_bench_emitted_ops":38874541,"centered_body_replay_ccx":873600,"centered_inverse_replay_ccx":873600,"centered_budget_if_folded":2640622,"centered_phase96_fast_mbu_ccx":299616,"centered_phase96_exact_signed_ccx":399264,"centered_phase96_exact_parity_ccx":448800,"centered_phase96_all_exact_ccx":548448,"centered_clean_all_exact_roundtrip_ccx":3199280,"centered_clean_all_exact_peak":2464,"centered_exact_parity_fast_signed_roundtrip_ccx":2618000,"centered_negpatch_phase_saw0":1,"centered_negpatch_phase_saw1":1,"centered_clean_roundtrip_bench_avg_toffoli":7311738,"centered_clean_roundtrip_bench_avg_clifford":32532302.269,"centered_clean_roundtrip_bench_qubits":2976,"centered_clean_roundtrip_bench_emitted_ops":42092380,"centered_clean_roundtrip_bench_altseed_phase":0,"centered_fixed_trace_hook_phase":0,"centered_fast_clean_roundtrip_bench_avg_toffoli":5860218,"centered_fast_clean_roundtrip_bench_avg_clifford":38190533.993,"centered_fast_clean_roundtrip_bench_qubits":3235,"centered_fast_clean_roundtrip_bench_emitted_ops":47024860,"centered_fast_clean_roundtrip_bench_altseed_phase":0,"centered_fast_clean_increment_toffoli":1747760,"centered_denom_controls_bench_avg_toffoli":7868378,"centered_denom_controls_bench_avg_clifford":44313822.825,"centered_denom_controls_bench_qubits":4964,"centered_denom_controls_bench_emitted_ops":55824052,"centered_denom_controls_bench_altseed_phase":0,"centered_live_num_bench_avg_toffoli":7870438,"centered_live_num_bench_avg_clifford":44320460.712,"centered_live_num_bench_qubits":4965,"centered_live_num_bench_emitted_ops":55834807,"centered_live_num_bench_altseed_phase":0,"centered_pair1_replace_avg_toffoli":8172700,"centered_pair1_replace_avg_clifford":40780745.214,"centered_pair1_replace_qubits":5589,"centered_pair1_replace_emitted_ops":51801485,"centered_pair1_replace_altseed_phase":0,"centered_pair1_replace_altseed_classical":0,"centered_pair2_replace_avg_toffoli":8189908,"centered_pair2_replace_avg_clifford":40876699.034,"centered_pair2_replace_qubits":5589,"centered_pair2_replace_emitted_ops":51930771,"centered_pair2_replace_altseed_phase":0,"centered_pair2_replace_altseed_classical":0,"centered_pair12_replace_avg_toffoli":12251174,"centered_pair12_replace_qubits":5589,"centered_pair12_replace_emitted_ops":72970707,"centered_pair1_fast_accum_avg_toffoli":8171417,"centered_pair1_fast_accum_qubits":5589,"centered_pair1_fast_accum_emitted_ops":51826551,"centered_pair2_fast_accum_avg_toffoli":8187601,"centered_pair2_fast_accum_qubits":5589,"centered_pair2_fast_accum_emitted_ops":51944268,"centered_pair12_fast_accum_avg_toffoli":12246560,"centered_pair12_fast_accum_qubits":5589,"centered_pair12_fast_accum_emitted_ops":72997701,"signed_copy_fast_phase_batches":1,"centered_pair1_window_denom_avg_toffoli":8790041,"centered_pair1_window_denom_qubits":5589,"centered_pair1_window_denom_emitted_ops":55077495,"centered_pair2_window_denom_avg_toffoli":8806225,"centered_pair2_window_denom_qubits":5589,"centered_pair2_window_denom_emitted_ops":55195212,"centered_pair12_window_denom_avg_toffoli":13483808,"centered_pair12_window_denom_qubits":5589,"centered_pair12_window_denom_emitted_ops":79499589,"centered_pair1_window_q_payload_avg_toffoli":8790041,"centered_pair1_window_q_payload_qubits":8037,"centered_pair1_window_q_payload_emitted_ops":55084839,"centered_pair2_window_q_payload_avg_toffoli":8806225,"centered_pair2_window_q_payload_qubits":8037,"centered_pair2_window_q_payload_emitted_ops":55202556,"centered_pair12_window_q_payload_avg_toffoli":13483808,"centered_pair12_window_q_payload_qubits":8037,"centered_pair12_window_q_payload_emitted_ops":79514277},"status":"keep","description":"Document q-payload window integration and verify default exact path unchanged","timestamp":1777438863753,"segment":3,"confidence":5.970334101382488,"iterationTokens":9896,"asi":{"hypothesis":"The q-payload integration is fully env-gated, so default exact benchmark should remain unchanged while documentation captures the new raw q-history milestone.","result":"Default exact path after BY_CENTERED_WINDOW_Q_DENOM_REPLACE code remains clean and unchanged: avg_toffoli=4,111,918, avg_clifford=24,423,006.990, qubits=2,716, emitted_ops=30,748,978, all altseed/classical/phase/ancilla zero. Docs updated with pair1/pair2/both q-payload metrics and the +2448q raw-history cost.","structural_learning":"The q payload path is isolated behind BY_CENTERED_WINDOW_Q_DENOM_REPLACE; normal benchmark stays on the existing Kaliski path. Raw q histories are now a known clean-but-wide bridge to the next fixed-matrix window update.","next_action_hint":"Implement window-local q consumption and remove raw q histories: compute q, update high f/g by selected matrix, clear q immediately, then delete the 16 full-width selected microsteps."}}
{"run":290,"commit":"c852544","metric":0,"metrics":{"altseed_classical_total":0,"altseed_phase_batches_total":1,"altseed_ancilla_batches_total":0,"avg_clifford":24423006.99,"qubits":2716,"emitted_ops":30748978,"correctness_ok":0,"by_tests_passed":109,"inverse_negr_ccx":1145760,"two_fast_replay_projected":2637286,"by_replay_bench_avg_toffoli":5278510,"by_replay_bench_qubits":2716,"by_replay_bench_emitted_ops":42250936,"centered_body_bench_avg_toffoli":4985518,"centered_body_bench_qubits":2716,"centered_body_bench_emitted_ops":38874541,"centered_body_replay_ccx":873600,"centered_inverse_replay_ccx":873600,"centered_budget_if_folded":2640622,"centered_phase96_fast_mbu_ccx":299616,"centered_phase96_exact_signed_ccx":399264,"centered_phase96_exact_parity_ccx":448800,"centered_phase96_all_exact_ccx":548448,"centered_clean_all_exact_roundtrip_ccx":3199280,"centered_clean_all_exact_peak":2464,"centered_exact_parity_fast_signed_roundtrip_ccx":2618000,"centered_negpatch_phase_saw0":1,"centered_negpatch_phase_saw1":1,"centered_clean_roundtrip_bench_avg_toffoli":7311738,"centered_clean_roundtrip_bench_avg_clifford":32532302.269,"centered_clean_roundtrip_bench_qubits":2976,"centered_clean_roundtrip_bench_emitted_ops":42092380,"centered_clean_roundtrip_bench_altseed_phase":0,"centered_fixed_trace_hook_phase":0,"centered_fast_clean_roundtrip_bench_avg_toffoli":5860218,"centered_fast_clean_roundtrip_bench_avg_clifford":38190533.993,"centered_fast_clean_roundtrip_bench_qubits":3235,"centered_fast_clean_roundtrip_bench_emitted_ops":47024860,"centered_fast_clean_roundtrip_bench_altseed_phase":0,"centered_fast_clean_increment_toffoli":1747760,"centered_denom_controls_bench_avg_toffoli":7868378,"centered_denom_controls_bench_avg_clifford":44313822.825,"centered_denom_controls_bench_qubits":4964,"centered_denom_controls_bench_emitted_ops":55824052,"centered_denom_controls_bench_altseed_phase":0,"centered_live_num_bench_avg_toffoli":7870438,"centered_live_num_bench_avg_clifford":44320460.712,"centered_live_num_bench_qubits":4965,"centered_live_num_bench_emitted_ops":55834807,"centered_live_num_bench_altseed_phase":0,"centered_pair1_replace_avg_toffoli":8172700,"centered_pair1_replace_avg_clifford":40780745.214,"centered_pair1_replace_qubits":5589,"centered_pair1_replace_emitted_ops":51801485,"centered_pair1_replace_altseed_phase":0,"centered_pair1_replace_altseed_classical":0,"centered_pair2_replace_avg_toffoli":8189908,"centered_pair2_replace_avg_clifford":40876699.034,"centered_pair2_replace_qubits":5589,"centered_pair2_replace_emitted_ops":51930771,"centered_pair2_replace_altseed_phase":0,"centered_pair2_replace_altseed_classical":0,"centered_pair12_replace_avg_toffoli":12251174,"centered_pair12_replace_qubits":5589,"centered_pair12_replace_emitted_ops":72970707,"centered_pair1_fast_accum_avg_toffoli":8171417,"centered_pair1_fast_accum_qubits":5589,"centered_pair1_fast_accum_emitted_ops":51826551,"centered_pair2_fast_accum_avg_toffoli":8187601,"centered_pair2_fast_accum_qubits":5589,"centered_pair2_fast_accum_emitted_ops":51944268,"centered_pair12_fast_accum_avg_toffoli":12246560,"centered_pair12_fast_accum_qubits":5589,"centered_pair12_fast_accum_emitted_ops":72997701,"signed_copy_fast_phase_batches":1,"centered_pair1_window_denom_avg_toffoli":8790041,"centered_pair1_window_denom_qubits":5589,"centered_pair1_window_denom_emitted_ops":55077495,"centered_pair2_window_denom_avg_toffoli":8806225,"centered_pair2_window_denom_qubits":5589,"centered_pair2_window_denom_emitted_ops":55195212,"centered_pair12_window_denom_avg_toffoli":13483808,"centered_pair12_window_denom_qubits":5589,"centered_pair12_window_denom_emitted_ops":79499589,"centered_pair1_window_q_payload_avg_toffoli":8790041,"centered_pair1_window_q_payload_qubits":8037,"centered_pair1_window_q_payload_emitted_ops":55084839,"centered_pair2_window_q_payload_avg_toffoli":8806225,"centered_pair2_window_q_payload_qubits":8037,"centered_pair2_window_q_payload_emitted_ops":55202556,"centered_pair12_window_q_payload_avg_toffoli":13483808,"centered_pair12_window_q_payload_qubits":8037,"centered_pair12_window_q_payload_emitted_ops":79514277,"attempted_pair2_560_altseed_phase_batches":1},"status":"crash","description":"Try shortening pair2 BY replacement to 560 steps","timestamp":1777439333089,"segment":3,"confidence":5.970334101382488,"iterationTokens":4868,"asi":{"hypothesis":"Pair2 centered BY replacement might not need the 576-step safety margin that pair1 needed; shortening pair2 to 560 would immediately reduce replay/denominator cost.","result":"Failed: BY_CENTERED_PAIR2_REPLACE=1 with STEPS=560 had altseed_classical_total=0 but altseed_phase_batches_total=1 and panicked with ALT-SEED PHASE FAILURE before main metrics.","rollback_reason":"560 steps is not phase-clean for pair2 under the full alternate-seed harness, even though it had no classical mismatches in the altseed precheck.","dead_end":"Do not shorten pair2 to 560 under current centered replay/denominator cleanup. Both pair1 and pair2 need 576 for the exact phase-clean contract.","next_action_hint":"Keep the 576-step safety margin. Look for improvements in scaffold arithmetic or q/window local consumption instead of step-count truncation."}}
