{"run":181,"commit":"18a04e6","metric":4132750,"metrics":{"altseed_classical_total":0,"altseed_phase_batches_total":0,"altseed_ancilla_batches_total":0,"avg_clifford":24414411.956,"qubits":2716,"emitted_ops":31193208,"correctness_ok":1},"status":"keep","description":"Compress branch-stream tagged DIV add history to terminal index; invalidates comparator replay","timestamp":1777345280990,"segment":3,"confidence":12.633235724743777,"iterationTokens":23386,"asi":{"hypothesis":"The branch-stream scaffold stores add_hist only to distinguish active VG steps from post-terminal zeros. Replace add_hist with a 9-bit terminal iteration index and reconstruct add during coefficient replay via term_idx > i.","result":"Default benchmark unchanged and passes. Env probe KAL_TAGGED_DIV_BRANCH_TERM=1 passes 9024 shots + 5 alt seeds with 0 failures at 5,267,537 Toffoli / 2,714q. TRACE_PEAK shows peak is pair2 Kaliski, not the branch-DIV scaffold.","structural_learning":"Clean tagged DIV can be wired below the current baseline qubit peak when add history is compressed; the y+x tag + branch histories are functionally sound and phase-clean. The branch-DIV peak is no longer the bottleneck in this scaffold.","invalidated":"Naive terminal-index replay is not a Toffoli path: replacing add_hist by a term index saves qubits but per-iteration 9-bit comparisons during coefficient replay raise cost to 5.27M Toffoli, worse than both baseline and branch-stream.","next_action_hint":"Avoid per-iteration terminal comparators. Possible next steps: carry a rolling active flag through coefficient replay with reversible suffix preprocessing; use windowed branch packets; or derive a local branch predicate to eliminate histories entirely."}}
{"run":182,"commit":"fc1b32f","metric":4132750,"metrics":{"altseed_classical_total":0,"altseed_phase_batches_total":0,"altseed_ancilla_batches_total":0,"avg_clifford":24414411.956,"qubits":2716,"emitted_ops":31193208,"correctness_ok":1},"status":"keep","description":"Add rolling-active compressed branch DIV; same 2714q shape without costly gt replay","timestamp":1777358296876,"segment":3,"confidence":12.633235724743777,"iterationTokens":4774,"asi":{"hypothesis":"The terminal-index branch-DIV variant was expensive because every coefficient iteration did a term_idx>i comparator and two cmod-add candidates. Carry a rolling active flag toggled by term_idx==i, then use a single add control active&!(a xor m).","result":"Default path remains unchanged and passes ./autoresearch.sh. Env probe KAL_TAGGED_DIV_BRANCH_TERM_ROLL=1 passes 9024 shots + 5 alt seeds at 4,733,146 Toffoli / 2,714q / 0 failures. TRACE_PEAK: peak is pair2 Kaliski, not branch-DIV.","structural_learning":"Rolling active preserves the compressed m_hist+a_hist+9-bit-term qubit shape while recovering branch-stream-like Toffoli. It dominates branch_term (5.27M) and matches branch_stream Toffoli at 49 fewer qubits.","invalidated":"Even with add_hist compressed and no per-iter gt comparator, stored-history coefficient replay remains ~600k Toffoli worse than default. History replay must be eliminated/fused; merely encoding branches better is insufficient.","next_action_hint":"Focus on self-cleaning branch recovery or fusing coefficient replay with point-add body. Do not spend more time on branch-history encodings unless they delete a full replay pass."}}
{"run":183,"commit":"8abd40f","metric":4132750,"metrics":{"altseed_classical_total":0,"altseed_phase_batches_total":0,"altseed_ancilla_batches_total":0,"avg_clifford":24414411.956,"qubits":2716,"emitted_ops":31193208,"correctness_ok":1},"status":"keep","description":"Try branch-history replay as compact pair2 inversion; invalidated by 3147q peak","timestamp":1777360224717,"segment":3,"confidence":12.633235724743777,"iterationTokens":59330,"asi":{"hypothesis":"Maybe the branch-history + coefficient replay machinery can replace full Kaliski state for exact pair2 inversion/cleanup, lowering qubits even if Toffoli rises.","result":"Default path unchanged and passes ./autoresearch.sh. Env probe KAL_PAIR2_BRANCH_INV_ROLL=1 passes correctness/alt seeds but costs 5,957,442 Toffoli and 3,147 qubits. TRACE_PEAK shows peak in shift22/cmod-add during coefficient replay.","structural_learning":"Branch-history replay is not a general compact Kaliski inversion replacement. Replaying and then inverse-replaying an explicit (inv_raw, coeff_s) channel requires histories + two coefficient registers + Solinas add transients, wider than full Kaliski.","invalidated":"Do not use branch-history coefficient replay for pair2 exact inversion. It only makes sense when the coefficient channel becomes the output and is not reversed, as in tagged DIV pair1 experiments.","next_action_hint":"Focus on self-cleaning DIV/end-state branch predicate or a true windowed Kaliski matrix step. Avoid branch-replay-as-inversion variants."}}
{"run":184,"commit":"f7f9607","metric":4132750,"metrics":{"altseed_classical_total":0,"altseed_phase_batches_total":0,"altseed_ancilla_batches_total":0,"avg_clifford":24414411.956,"qubits":2716,"emitted_ops":31193208,"correctness_ok":1},"status":"keep","description":"Invalidate bilinear invariant as self-cleaning tagged-DIV branch predicate","timestamp":1777360464282,"segment":3,"confidence":12.633235724743777,"iterationTokens":11097,"asi":{"hypothesis":"Maybe the simple preserved relation r*v+s*u=0 mod p can disambiguate inverse Kaliski branches for a self-cleaning tagged DIV, avoiding stored histories.","result":"Added bilinear_invariant_does_not_recover_inverse_branch. It enumerates local inverse-branch candidates after tagged coefficient steps and shows the bilinear invariant leaves >90% ambiguous. Default benchmark unchanged and passes.","structural_learning":"The obvious algebraic invariant is too weak; self-cleaning needs a stronger end-state predicate or a different update convention, not just candidate filtering by r*v+s*u=0.","invalidated":"Try-all-branches plus bilinear invariant is not a route to history-free reverse Kaliski/DIV.","next_action_hint":"Next pursue true windowed Kaliski matrix steps or search for higher-order invariants involving the initial denominator/tag; avoid spending time on the bilinear invariant alone."}}
{"run":185,"commit":"6170be1","metric":4132750,"metrics":{"altseed_classical_total":0,"altseed_phase_batches_total":0,"altseed_ancilla_batches_total":0,"avg_clifford":24414411.956,"qubits":2716,"emitted_ops":31193208,"correctness_ok":1},"status":"keep","description":"Invalidate one-comparator windowed Kaliski lookup; majority error ~60%","timestamp":1777361133311,"segment":3,"confidence":12.633235724743777,"iterationTokens":6727,"asi":{"hypothesis":"A true windowed Kaliski step might replace t per-step comparators if low bits plus one initial u>v comparator can predict the t-step matrix accurately enough under 1% approximate tolerance.","result":"Added initial_gt_window_classifier_not_approx_good_enough in kaliski_jump.rs. For w=8,t=4, a disjoint train/test majority classifier keyed by (low_u,low_v,u>v) has about 60% window-matrix error, far above the 1% tolerance. Default benchmark unchanged and passes.","structural_learning":"One comparator per Kaliski window is not enough. Any real jumped/windowed Kaliski must compute the comparator sequence coherently, use a BY/divstep variable that avoids full comparisons, or find a different matrix-selection predicate.","invalidated":"Low-bit table plus initial comparator/window majority lookup is not a viable approximate SOTA route.","next_action_hint":"Move to either a matrix-application lower-bound for exact t=2/t=3 windows with full comparator sequence, or Bernstein-Yang/divstep-style update where branch selection is local to low words/delta rather than full u>v comparisons."}}
{"run":186,"commit":"2f9a547","metric":4132750,"metrics":{"altseed_classical_total":0,"altseed_phase_batches_total":0,"altseed_ancilla_batches_total":0,"avg_clifford":24414411.956,"qubits":2716,"emitted_ops":31193208,"correctness_ok":1},"status":"keep","description":"Quantify window matrix hints: t=16 can compress Kaliski history to ~156 bits","timestamp":1777361360655,"segment":3,"confidence":12.633235724743777,"iterationTokens":11826,"asi":{"hypothesis":"Even though low bits + one comparator cannot predict the window matrix, the remaining ambiguity per key may be small enough to store a short per-window hint instead of per-iteration history, giving a qubit-structural route.","result":"Added window_hint_bits_can_compress_history_but_not_select_matrix_alone. On 5k sampled trajectories with key (low8(u),low8(v),u>v): t=4 max 8 matrices/key -> 306 hint bits; t=8 max 23 -> 255 bits; t=16 max 34 -> 156 bits. Default benchmark unchanged and passes.","structural_learning":"Window hints can plausibly save 100-250 qubits versus m_hist and are the first positive windowed-Kaliski qubit lead after low-bit lookup failed. This is not a Toffoli win unless selected matrix application beats replaying microsteps.","invalidated":"Matrix hints alone do not solve matrix selection/prediction; they only compress history. Low-bit+initial-gt predictor remains unusable.","next_action_hint":"Build a lower-bound/synthesis model for applying a selected t=4/t=8/t=16 Kaliski matrix to (u,v,r,s). If application cost is not below microstep replay, window hints are qubit-only and not SOTA."}}
{"run":187,"commit":"09b5c8d","metric":4132750,"metrics":{"altseed_classical_total":0,"altseed_phase_batches_total":0,"altseed_ancilla_batches_total":0,"avg_clifford":24414411.956,"qubits":2716,"emitted_ops":31193208,"correctness_ok":1},"status":"keep","description":"Model selected Kaliski matrix arithmetic intensity; win must delete cswaps","timestamp":1777361732739,"segment":3,"confidence":7.425559380378657,"iterationTokens":8210,"asi":{"hypothesis":"Per-window matrix hints compress history, but to be a Toffoli route the selected matrix application must be cheaper than replaying microsteps. Quantify the arithmetic density of selected matrices.","result":"Added selected_matrix_application_arithmetic_intensity_model. On sampled windows: t=4 mean 5.30 row-popcount add terms vs 3.99 raw odd-step add/sub count; t=8 mean 13.89 vs 7.97; t=16 mean 34.94 vs 15.73. Default benchmark unchanged and passes.","structural_learning":"Selected matrices are arithmetically denser than the raw odd-step add/sub operations. Windowing can only win if it deletes enough generic cswap/comparator/control scaffolding and applies matrices coherently without QROM/control overhead proportional to all candidates.","invalidated":"Do not expect window matrices to save Toffoli merely by reducing arithmetic row terms; the row-add arithmetic is actually heavier.","next_action_hint":"Synthesize/lower-bound coherent selected matrix application with QROM/control costs. If cswap deletion cannot pay for dense row arithmetic, pivot to BY/divstep or different DIV transform."}}
{"run":188,"commit":"603f0d0","metric":4132750,"metrics":{"altseed_classical_total":0,"altseed_phase_batches_total":0,"altseed_ancilla_batches_total":0,"avg_clifford":24414411.956,"qubits":2716,"emitted_ops":31193208,"correctness_ok":1},"status":"keep","description":"Show global window matrix IDs do not compress Kaliski history; QROM needed","timestamp":1777361981328,"segment":3,"confidence":5.258074344911639,"iterationTokens":4659,"asi":{"hypothesis":"Per-key matrix hints looked promising, but maybe a global matrix ID would avoid low-state-keyed QROM. Check whether global IDs compress history.","result":"Added global_window_matrix_indices_do_not_compress_history. On 5k sampled trajectories: t=4 has 125 global matrices -> 714 total ID bits; t=8 has 9478 -> 714 bits; t=16 has 111696 -> 442 bits. All exceed the 407-bit m_hist. Default benchmark unchanged and passes.","structural_learning":"The short-hint qubit lead depends on low-state-keyed QROM/table lookup. Global matrix IDs are too large, so any selected-matrix Kaliski synthesis must budget QROM/control cost explicitly.","invalidated":"Global matrix IDs are not a free history compression. Window hints cannot be evaluated without lookup cost.","next_action_hint":"Include low-keyed QROM/control in selected-matrix lower bounds. If QROM plus dense row arithmetic cannot be amortized by deleting cswaps/comparators, abandon Kaliski window hints for Toffoli and pivot to BY/divstep."}}
{"run":189,"commit":"1e962a6","metric":4132750,"metrics":{"altseed_classical_total":0,"altseed_phase_batches_total":0,"altseed_ancilla_batches_total":0,"avg_clifford":24414411.956,"qubits":2716,"emitted_ops":31193208,"correctness_ok":1},"status":"keep","description":"Reopen BY/divstep with row-intensity and approximate cutoff evidence","timestamp":1777362263717,"segment":3,"confidence":4.919327251995439,"iterationTokens":8137,"asi":{"hypothesis":"Kaliski windowing is struggling because branch selection depends on full comparisons. Bernstein-Yang jumpdivsteps selects matrices from local low words and delta; maybe its matrix row intensity and approximate iteration count are viable under 1% tolerance.","result":"Added jumpdivstep_matrix_arithmetic_intensity_model and approximate_divstep_cutoff_survey. BY w=16 has mean 11.56 row-add terms/window, 47 exact windows, ~543 terms per full-width pair under the 742-step bound. Approximate survey over 20k samples: q99=549, q999=555, fail>550≈0.0062, fail>560≈0.0001. Default benchmark unchanged and passes.","structural_learning":"BY/divstep is a stronger structural lead than Kaliski low-bit windows: it avoids full u>v comparator sequences, has moderate selected-matrix arithmetic intensity, and approximate tolerance can cut the window count from 47 to about 35 for w=16.","invalidated":"Prior pessimism based only on max matrix entry hitting 2^w was too coarse; row-popcount intensity is the more relevant first-order arithmetic model.","next_action_hint":"Build a reversible BY jump prototype/cost model: local low-word divsteps to synthesize matrix, then full-width signed matrix application to coefficient/data pairs. Check peak and Toffoli before wiring into point-add."}}
{"run":190,"commit":"00ffbb1","metric":4132750,"metrics":{"altseed_classical_total":0,"altseed_phase_batches_total":0,"altseed_ancilla_batches_total":0,"avg_clifford":24414411.956,"qubits":2716,"emitted_ops":31193208,"correctness_ok":1},"status":"keep","description":"BY jump budget lower bound suggests live prototype path","timestamp":1777362909285,"segment":3,"confidence":4.6215854311730045,"iterationTokens":5301,"asi":{"hypothesis":"Use a row-popcount lower-bound model for BY jumpdivstep matrices applied to (f,g) plus two coefficient columns to decide whether a live BY prototype is structurally worth building.","result":"Added jumpdivstep_budget_model_suggests_live_prototype. For w=16, mean matrix terms imply an optimistic lower bound of ~416,782 Toffoli under the exact 742-step bound and ~310,370 Toffoli under a 550-step approximate cap, before matrix synthesis/cleanup/sign/reduction overhead. New tests pass locally; default benchmark path unchanged at known 4,132,750 Toffoli / 2716q.","structural_learning":"BY jumpdivsteps now looks like the strongest public structural lead: branch selection is local to low words and delta, approximate 550-step cutoff is within 1% on samples, and the first-order matrix application lower bound is far below current ~1.6M Kaliski invocation cost.","caveat":"This is a lower bound, not a forecast. The live prototype still must budget matrix synthesis, sign handling, reversible cleanup, modular normalization, and qubit peak.","next_action_hint":"Next build a reversible BY jump prototype/cost scaffold behind an env gate or a measured primitive test: synthesize low-word w=16 matrix, apply selected signed 2x2 matrix to full-width pairs, and compare peak/Toffoli against Kaliski."}}
{"run":191,"commit":"7c291cd","metric":4132750,"metrics":{"altseed_classical_total":0,"altseed_phase_batches_total":0,"altseed_ancilla_batches_total":0,"avg_clifford":24414411.956,"qubits":2716,"emitted_ops":31193208,"correctness_ok":1},"status":"keep","description":"Calibrate BY w=16 constant matrix row formation with real add/sub costs","timestamp":1777363127896,"segment":3,"confidence":4.117633023144834,"iterationTokens":3824,"asi":{"hypothesis":"The BY jump lower bound is only useful if real n-bit row formation costs are close to row-popcount estimates. Build constant selected w=16 matrix row-formation circuits using existing add/sub primitives to calibrate CCX per term and peak.","result":"Added constant_jump_matrix_apply_cost_probe. Local test passes: sampled w=16 constant matrix on one 274-bit pair costs mean 3,908 CCX, mean 12.58 terms, 310.6 CCX/term, max peak 1370q. Default point-add code path is unchanged from known passing benchmark 4,132,750 Toffoli / 2716q.","structural_learning":"Real row formation is close enough to the row-popcount model to justify a BY jump prototype. Sequentially applying selected matrices to (f,g) and two coefficient columns projects roughly 0.4-0.55M Toffoli before matrix synthesis/cleanup, far below current 1.6M Kaliski invocation cost.","caveat":"This is row formation only: no reversible matrix synthesis, no sign normalization, no cleanup, no full invariant-compatible BY inversion, and no point-add integration yet.","next_action_hint":"Next build a measured BY jump skeleton: synthesize low-word w=16 matrix from delta,f_low,g_low, apply rows sequentially to one pair, then extend to three pairs and measure peak/Toffoli. If synthesis/control overhead stays below ~1M per inversion, wire an approximate env-gated inversion."}}
{"run":192,"commit":"9cb45ce","metric":4132750,"metrics":{"altseed_classical_total":0,"altseed_phase_batches_total":0,"altseed_ancilla_batches_total":0,"avg_clifford":24414411.956,"qubits":2716,"emitted_ops":31193208,"correctness_ok":1},"status":"keep","description":"Model full-state BY jump inversion peak and row Toffoli; fits 2800q on paper","timestamp":1777363263455,"segment":3,"confidence":3.7127796901893286,"iterationTokens":4920,"asi":{"hypothesis":"A BY jump inversion must fit both Toffoli and qubit budgets. Combine calibrated constant-matrix row formation with a sequential six-register BY state model to estimate peak and row cost before building a full prototype.","result":"Added jumpdivstep_full_state_budget_model. Local test passes: width=274, mean_pair_ccx≈3787.6, exact row cost≈534,049 Toffoli, approximate row cost≈397,696 Toffoli, modeled peak≈2514q. Default point-add path remains unchanged at known passing 4,132,750 Toffoli / 2716q.","structural_learning":"A sequential BY jump state with (f,g) plus two coefficient columns, shared row outputs, and one carry strip plausibly fits under the 2800q cap while row formation is far below current Kaliski cost. BY jump remains the main live prototype candidate.","caveat":"This is still a budget model only: no reversible low-word matrix synthesis, row cleanup/swap, sign normalization, modular reduction, or point-add integration yet. The latest autoresearch run was refused by the harness due context-window exhaustion, so this commit preserves the local tested research checkpoint.","next_action_hint":"Start a fresh session from this commit and build a measured BY jump skeleton: low-word w=16 matrix synthesis, full-width row application with cleanup/swap, then coefficient recovery. Do not continue branch-history/Kaliski-window prediction lines unless BY stalls."}}
{"run":193,"commit":"b93123e","metric":4132750,"metrics":{"altseed_classical_total":0,"altseed_phase_batches_total":0,"altseed_ancilla_batches_total":0,"avg_clifford":24414411.956,"qubits":2716,"emitted_ops":31193208,"correctness_ok":1},"status":"keep","description":"BY tagged-DIV algebra validated; naive jumped modular application invalidated","timestamp":1777364280198,"segment":3,"confidence":3.263118086413917,"iterationTokens":4920,"asi":{"hypothesis":"Bernstein-Yang fixed-cap divsteps may provide a clean approximate tagged-DIV, but the structural question is whether jumped matrices can be applied coherently to the modular coefficient/tag channel without Kaliski-style history or dense constants.","result":"Added run_divsteps_fixed plus BY tagged-DIV algebra and cost-model tests. Fixed K=550 BY recovers y/x from y+x tag when converged with sampled failure 29/5000=0.0058. Jump matrix selection compresses to (delta, g/f mod 2^w), with exact 41*2^w keys for w<=8. Integer denominator jumped replacement with scaled adjugate cleanup costs ~7.7k CCX/window/pair. However naive variable coefficient application is ~5.2M for 35 windows; unscaled modular inverse cleanup is dense (mean popcount ~814 over four entries); raw microsteps are ~3.29M per 550-step tagged DIV; jumped denominator + microstep tag channel is ~2.66M; scaled modular sparse cleanup with current primitives is ~2.05M for the modular pair alone. All BY tests pass locally.","structural_learning":"BY is algebraically compatible with the y+x DIV tag and approximate tolerance, but the modular coefficient channel is the bottleneck. Sparse jumped matrices are easy for the integer denominator because P/2^w has sparse adjugate inverse; the modular channel either has dense 2^-w inverse constants or pays expensive modular halvings/row formation. Jumped BY cannot replace Kaliski without a new small-constant modular row former or batched 2^-w shift.","invalidated":"Naive selected-matrix QROM/variable-coefficient application, unscaled modular sparse cleanup, raw coherent BY microsteps, and the hybrid denominator-jump/modular-microstep path are not SOTA with current primitives.","next_action_hint":"Focus next on a better small-constant modular row former or batched modular shift for scaled BY coefficient channels. If no sub-20k CCX/window modular pair update emerges, pivot away from BY and revisit self-cleaning Kaliski branch predicates or a different DIV transform."}}
