{"run":291,"commit":"c852544","metric":0,"metrics":{"altseed_classical_total":0,"altseed_phase_batches_total":1,"altseed_ancilla_batches_total":0,"avg_clifford":24423006.99,"qubits":2716,"emitted_ops":30748978,"correctness_ok":0,"by_tests_passed":109,"inverse_negr_ccx":1145760,"two_fast_replay_projected":2637286,"by_replay_bench_avg_toffoli":5278510,"by_replay_bench_qubits":2716,"by_replay_bench_emitted_ops":42250936,"centered_body_bench_avg_toffoli":4985518,"centered_body_bench_qubits":2716,"centered_body_bench_emitted_ops":38874541,"centered_body_replay_ccx":873600,"centered_inverse_replay_ccx":873600,"centered_budget_if_folded":2640622,"centered_phase96_fast_mbu_ccx":299616,"centered_phase96_exact_signed_ccx":399264,"centered_phase96_exact_parity_ccx":448800,"centered_phase96_all_exact_ccx":548448,"centered_clean_all_exact_roundtrip_ccx":3199280,"centered_clean_all_exact_peak":2464,"centered_exact_parity_fast_signed_roundtrip_ccx":2618000,"centered_negpatch_phase_saw0":1,"centered_negpatch_phase_saw1":1,"centered_clean_roundtrip_bench_avg_toffoli":7311738,"centered_clean_roundtrip_bench_avg_clifford":32532302.269,"centered_clean_roundtrip_bench_qubits":2976,"centered_clean_roundtrip_bench_emitted_ops":42092380,"centered_clean_roundtrip_bench_altseed_phase":0,"centered_fixed_trace_hook_phase":0,"centered_fast_clean_roundtrip_bench_avg_toffoli":5860218,"centered_fast_clean_roundtrip_bench_avg_clifford":38190533.993,"centered_fast_clean_roundtrip_bench_qubits":3235,"centered_fast_clean_roundtrip_bench_emitted_ops":47024860,"centered_fast_clean_roundtrip_bench_altseed_phase":0,"centered_fast_clean_increment_toffoli":1747760,"centered_denom_controls_bench_avg_toffoli":7868378,"centered_denom_controls_bench_avg_clifford":44313822.825,"centered_denom_controls_bench_qubits":4964,"centered_denom_controls_bench_emitted_ops":55824052,"centered_denom_controls_bench_altseed_phase":0,"centered_live_num_bench_avg_toffoli":7870438,"centered_live_num_bench_avg_clifford":44320460.712,"centered_live_num_bench_qubits":4965,"centered_live_num_bench_emitted_ops":55834807,"centered_live_num_bench_altseed_phase":0,"centered_pair1_replace_avg_toffoli":8172700,"centered_pair1_replace_avg_clifford":40780745.214,"centered_pair1_replace_qubits":5589,"centered_pair1_replace_emitted_ops":51801485,"centered_pair1_replace_altseed_phase":0,"centered_pair1_replace_altseed_classical":0,"centered_pair2_replace_avg_toffoli":8189908,"centered_pair2_replace_avg_clifford":40876699.034,"centered_pair2_replace_qubits":5589,"centered_pair2_replace_emitted_ops":51930771,"centered_pair2_replace_altseed_phase":0,"centered_pair2_replace_altseed_classical":0,"centered_pair12_replace_avg_toffoli":12251174,"centered_pair12_replace_qubits":5589,"centered_pair12_replace_emitted_ops":72970707,"centered_pair1_fast_accum_avg_toffoli":8171417,"centered_pair1_fast_accum_qubits":5589,"centered_pair1_fast_accum_emitted_ops":51826551,"centered_pair2_fast_accum_avg_toffoli":8187601,"centered_pair2_fast_accum_qubits":5589,"centered_pair2_fast_accum_emitted_ops":51944268,"centered_pair12_fast_accum_avg_toffoli":12246560,"centered_pair12_fast_accum_qubits":5589,"centered_pair12_fast_accum_emitted_ops":72997701,"signed_copy_fast_phase_batches":1,"centered_pair1_window_denom_avg_toffoli":8790041,"centered_pair1_window_denom_qubits":5589,"centered_pair1_window_denom_emitted_ops":55077495,"centered_pair2_window_denom_avg_toffoli":8806225,"centered_pair2_window_denom_qubits":5589,"centered_pair2_window_denom_emitted_ops":55195212,"centered_pair12_window_denom_avg_toffoli":13483808,"centered_pair12_window_denom_qubits":5589,"centered_pair12_window_denom_emitted_ops":79499589,"centered_pair1_window_q_payload_avg_toffoli":8790041,"centered_pair1_window_q_payload_qubits":8037,"centered_pair1_window_q_payload_emitted_ops":55084839,"centered_pair2_window_q_payload_avg_toffoli":8806225,"centered_pair2_window_q_payload_qubits":8037,"centered_pair2_window_q_payload_emitted_ops":55202556,"centered_pair12_window_q_payload_avg_toffoli":13483808,"centered_pair12_window_q_payload_qubits":8037,"centered_pair12_window_q_payload_emitted_ops":79514277,"attempted_pair2_560_altseed_phase_batches":1,"attempted_q_local_altseed_phase_batches":1},"status":"crash","description":"Try window-local q scratch for BY denominator path","timestamp":1777439447757,"segment":3,"confidence":5.970334101382488,"iterationTokens":9139,"asi":{"hypothesis":"Compute q0/q1 as window-local scratch and clear it immediately to prove a low-qubit q consumption shape better than raw q histories.","result":"Failed: BY_CENTERED_PAIR1_REPLACE=1 BY_CENTERED_WINDOW_Q_LOCAL_DENOM_REPLACE=1 had altseed_classical_total=0 but altseed_phase_batches_total=1. The q scratch was CNOT-copied and immediately uncomputed, so this looks like a phase/cliff sensitivity to the changed circuit shape rather than a classical algebra error.","rollback_reason":"The window-local q scratch variant is not phase-clean in the main alternate-seed harness as first written.","dead_end":"Do not keep local q identity copy/uncompute in this exact location without a phase-safe variant or adjusted scheduling.","next_action_hint":"If pursuing local q, either make it consumed by real arithmetic instead of an identity CNOT island, or test a fixed exact schedule with KAL_BULK3 override / phase isolation first. Continue looking for a smaller safe improvement."}}
{"run":292,"commit":"c852544","metric":0,"metrics":{"altseed_classical_total":0,"altseed_phase_batches_total":1,"altseed_ancilla_batches_total":0,"avg_clifford":24423006.99,"qubits":2716,"emitted_ops":30748978,"correctness_ok":0,"by_tests_passed":109,"inverse_negr_ccx":1145760,"two_fast_replay_projected":2637286,"by_replay_bench_avg_toffoli":5278510,"by_replay_bench_qubits":2716,"by_replay_bench_emitted_ops":42250936,"centered_body_bench_avg_toffoli":4985518,"centered_body_bench_qubits":2716,"centered_body_bench_emitted_ops":38874541,"centered_body_replay_ccx":873600,"centered_inverse_replay_ccx":873600,"centered_budget_if_folded":2640622,"centered_phase96_fast_mbu_ccx":299616,"centered_phase96_exact_signed_ccx":399264,"centered_phase96_exact_parity_ccx":448800,"centered_phase96_all_exact_ccx":548448,"centered_clean_all_exact_roundtrip_ccx":3199280,"centered_clean_all_exact_peak":2464,"centered_exact_parity_fast_signed_roundtrip_ccx":2618000,"centered_negpatch_phase_saw0":1,"centered_negpatch_phase_saw1":1,"centered_clean_roundtrip_bench_avg_toffoli":7311738,"centered_clean_roundtrip_bench_avg_clifford":32532302.269,"centered_clean_roundtrip_bench_qubits":2976,"centered_clean_roundtrip_bench_emitted_ops":42092380,"centered_clean_roundtrip_bench_altseed_phase":0,"centered_fixed_trace_hook_phase":0,"centered_fast_clean_roundtrip_bench_avg_toffoli":5860218,"centered_fast_clean_roundtrip_bench_avg_clifford":38190533.993,"centered_fast_clean_roundtrip_bench_qubits":3235,"centered_fast_clean_roundtrip_bench_emitted_ops":47024860,"centered_fast_clean_roundtrip_bench_altseed_phase":0,"centered_fast_clean_increment_toffoli":1747760,"centered_denom_controls_bench_avg_toffoli":7868378,"centered_denom_controls_bench_avg_clifford":44313822.825,"centered_denom_controls_bench_qubits":4964,"centered_denom_controls_bench_emitted_ops":55824052,"centered_denom_controls_bench_altseed_phase":0,"centered_live_num_bench_avg_toffoli":7870438,"centered_live_num_bench_avg_clifford":44320460.712,"centered_live_num_bench_qubits":4965,"centered_live_num_bench_emitted_ops":55834807,"centered_live_num_bench_altseed_phase":0,"centered_pair1_replace_avg_toffoli":8172700,"centered_pair1_replace_avg_clifford":40780745.214,"centered_pair1_replace_qubits":5589,"centered_pair1_replace_emitted_ops":51801485,"centered_pair1_replace_altseed_phase":0,"centered_pair1_replace_altseed_classical":0,"centered_pair2_replace_avg_toffoli":8189908,"centered_pair2_replace_avg_clifford":40876699.034,"centered_pair2_replace_qubits":5589,"centered_pair2_replace_emitted_ops":51930771,"centered_pair2_replace_altseed_phase":0,"centered_pair2_replace_altseed_classical":0,"centered_pair12_replace_avg_toffoli":12251174,"centered_pair12_replace_qubits":5589,"centered_pair12_replace_emitted_ops":72970707,"centered_pair1_fast_accum_avg_toffoli":8171417,"centered_pair1_fast_accum_qubits":5589,"centered_pair1_fast_accum_emitted_ops":51826551,"centered_pair2_fast_accum_avg_toffoli":8187601,"centered_pair2_fast_accum_qubits":5589,"centered_pair2_fast_accum_emitted_ops":51944268,"centered_pair12_fast_accum_avg_toffoli":12246560,"centered_pair12_fast_accum_qubits":5589,"centered_pair12_fast_accum_emitted_ops":72997701,"signed_copy_fast_phase_batches":1,"centered_pair1_window_denom_avg_toffoli":8790041,"centered_pair1_window_denom_qubits":5589,"centered_pair1_window_denom_emitted_ops":55077495,"centered_pair2_window_denom_avg_toffoli":8806225,"centered_pair2_window_denom_qubits":5589,"centered_pair2_window_denom_emitted_ops":55195212,"centered_pair12_window_denom_avg_toffoli":13483808,"centered_pair12_window_denom_qubits":5589,"centered_pair12_window_denom_emitted_ops":79499589,"centered_pair1_window_q_payload_avg_toffoli":8790041,"centered_pair1_window_q_payload_qubits":8037,"centered_pair1_window_q_payload_emitted_ops":55084839,"centered_pair2_window_q_payload_avg_toffoli":8806225,"centered_pair2_window_q_payload_qubits":8037,"centered_pair2_window_q_payload_emitted_ops":55202556,"centered_pair12_window_q_payload_avg_toffoli":13483808,"centered_pair12_window_q_payload_qubits":8037,"centered_pair12_window_q_payload_emitted_ops":79514277,"attempted_pair2_560_altseed_phase_batches":1,"attempted_q_local_altseed_phase_batches":1,"attempted_q18_altseed_phase_batches":1},"status":"crash","description":"Try compressing window q payload to 18 signed bits","timestamp":1777439580205,"segment":3,"confidence":5.970334101382488,"iterationTokens":10520,"asi":{"hypothesis":"The q0/q1 lowword correction payload is bounded below 2^17, so raw q histories can be stored in 18 signed bits/window instead of 34, reducing the q-payload peak by 1152 qubits.","result":"Failed at default centered hook KAL_BULK3_ITERS setting: BY_CENTERED_PAIR1_REPLACE=1 BY_CENTERED_WINDOW_Q_DENOM_REPLACE=1 with 18-bit q histories had altseed_classical_total=0 but altseed_phase_batches_total=1. This is likely another circuit-shape/hash phase cliff, because q histories are CNOT-only and not consumed.","rollback_reason":"18-bit q history variant was not phase-clean in the full altseed harness under the current default centered hook prefix.","dead_end":"Do not simply shrink q history width under the existing phase-tuned Kaliski prefix without re-tuning the centered-hook KAL_BULK3_ITERS or replacing remaining Kaliski.","next_action_hint":"Retry 18-bit q histories with a more conservative KAL_BULK3_ITERS (e.g. 360/365) or make the q payload consumed by arithmetic rather than a pure history-width perturbation."}}
{"run":293,"commit":"4197bd5","metric":8790881,"metrics":{"altseed_classical_total":0,"altseed_phase_batches_total":0,"altseed_ancilla_batches_total":0,"avg_clifford":42855978.446,"qubits":6885,"emitted_ops":55108598,"correctness_ok":1,"by_tests_passed":109,"inverse_negr_ccx":1145760,"two_fast_replay_projected":2637286,"by_replay_bench_avg_toffoli":5278510,"by_replay_bench_qubits":2716,"by_replay_bench_emitted_ops":42250936,"centered_body_bench_avg_toffoli":4985518,"centered_body_bench_qubits":2716,"centered_body_bench_emitted_ops":38874541,"centered_body_replay_ccx":873600,"centered_inverse_replay_ccx":873600,"centered_budget_if_folded":2640622,"centered_phase96_fast_mbu_ccx":299616,"centered_phase96_exact_signed_ccx":399264,"centered_phase96_exact_parity_ccx":448800,"centered_phase96_all_exact_ccx":548448,"centered_clean_all_exact_roundtrip_ccx":3199280,"centered_clean_all_exact_peak":2464,"centered_exact_parity_fast_signed_roundtrip_ccx":2618000,"centered_negpatch_phase_saw0":1,"centered_negpatch_phase_saw1":1,"centered_clean_roundtrip_bench_avg_toffoli":7311738,"centered_clean_roundtrip_bench_avg_clifford":32532302.269,"centered_clean_roundtrip_bench_qubits":2976,"centered_clean_roundtrip_bench_emitted_ops":42092380,"centered_clean_roundtrip_bench_altseed_phase":0,"centered_fixed_trace_hook_phase":0,"centered_fast_clean_roundtrip_bench_avg_toffoli":5860218,"centered_fast_clean_roundtrip_bench_avg_clifford":38190533.993,"centered_fast_clean_roundtrip_bench_qubits":3235,"centered_fast_clean_roundtrip_bench_emitted_ops":47024860,"centered_fast_clean_roundtrip_bench_altseed_phase":0,"centered_fast_clean_increment_toffoli":1747760,"centered_denom_controls_bench_avg_toffoli":7868378,"centered_denom_controls_bench_avg_clifford":44313822.825,"centered_denom_controls_bench_qubits":4964,"centered_denom_controls_bench_emitted_ops":55824052,"centered_denom_controls_bench_altseed_phase":0,"centered_live_num_bench_avg_toffoli":7870438,"centered_live_num_bench_avg_clifford":44320460.712,"centered_live_num_bench_qubits":4965,"centered_live_num_bench_emitted_ops":55834807,"centered_live_num_bench_altseed_phase":0,"centered_pair1_replace_avg_toffoli":8172700,"centered_pair1_replace_avg_clifford":40780745.214,"centered_pair1_replace_qubits":5589,"centered_pair1_replace_emitted_ops":51801485,"centered_pair1_replace_altseed_phase":0,"centered_pair1_replace_altseed_classical":0,"centered_pair2_replace_avg_toffoli":8189908,"centered_pair2_replace_avg_clifford":40876699.034,"centered_pair2_replace_qubits":5589,"centered_pair2_replace_emitted_ops":51930771,"centered_pair2_replace_altseed_phase":0,"centered_pair2_replace_altseed_classical":0,"centered_pair12_replace_avg_toffoli":12251174,"centered_pair12_replace_qubits":5589,"centered_pair12_replace_emitted_ops":72970707,"centered_pair1_fast_accum_avg_toffoli":8171417,"centered_pair1_fast_accum_qubits":5589,"centered_pair1_fast_accum_emitted_ops":51826551,"centered_pair2_fast_accum_avg_toffoli":8187601,"centered_pair2_fast_accum_qubits":5589,"centered_pair2_fast_accum_emitted_ops":51944268,"centered_pair12_fast_accum_avg_toffoli":12246560,"centered_pair12_fast_accum_qubits":5589,"centered_pair12_fast_accum_emitted_ops":72997701,"signed_copy_fast_phase_batches":1,"centered_pair1_window_denom_avg_toffoli":8790041,"centered_pair1_window_denom_qubits":5589,"centered_pair1_window_denom_emitted_ops":55077495,"centered_pair2_window_denom_avg_toffoli":8806225,"centered_pair2_window_denom_qubits":5589,"centered_pair2_window_denom_emitted_ops":55195212,"centered_pair12_window_denom_avg_toffoli":13483808,"centered_pair12_window_denom_qubits":5589,"centered_pair12_window_denom_emitted_ops":79499589,"centered_pair1_window_q_payload_avg_toffoli":8790041,"centered_pair1_window_q_payload_qubits":8037,"centered_pair1_window_q_payload_emitted_ops":55084839,"centered_pair2_window_q_payload_avg_toffoli":8806225,"centered_pair2_window_q_payload_qubits":8037,"centered_pair2_window_q_payload_emitted_ops":55202556,"centered_pair12_window_q_payload_avg_toffoli":13483808,"centered_pair12_window_q_payload_qubits":8037,"centered_pair12_window_q_payload_emitted_ops":79514277,"attempted_pair2_560_altseed_phase_batches":1,"attempted_q_local_altseed_phase_batches":1,"attempted_q18_altseed_phase_batches":1,"centered_pair1_window_q18_avg_toffoli":8790881,"centered_pair1_window_q18_qubits":6885,"centered_pair1_window_q18_emitted_ops":55108598},"status":"keep","description":"Compress BY window q payload to 18 signed bits with conservative centered prefix","timestamp":1777439723606,"segment":3,"confidence":5.970334101382488,"iterationTokens":7428,"asi":{"hypothesis":"The q0/q1 lowword correction payload is bounded below 2^17, so raw q histories can be stored in 18 signed bits/window instead of 34 if the remaining Kaliski prefix is made conservative enough to avoid circuit-shape phase cliffs.","result":"BY_CENTERED_PAIR1_REPLACE=1 BY_CENTERED_WINDOW_Q_DENOM_REPLACE=1 now uses 18-bit q histories and a conservative 360 Kaliski bulk prefix for q-payload env paths. Pair1 q-payload path passes: avg_toffoli=8,790,881, avg_clifford=42,855,978.446, qubits=6,885, emitted_ops=55,108,598, all altseed/classical/phase/ancilla zero. This reduces q-payload peak from 8,037q to 6,885q (-1,152q) at the cost of +840 Toffoli vs the previous 34-bit q payload due to Kaliski prefix conservatism.","structural_learning":"Raw q history width can be compressed exactly to 18 signed bits in the real pair1 path, but this does not address the dominant full-width per-step denominator application or Bennett replay. The necessary next improvement is actual q consumption/fixed-matrix update, not more raw-history wiring.","caveat":"This is a qubit reduction for an env-gated integration probe, not a SOTA improvement. It is still 8.79M Toffoli and far above baseline, and the broader current raw-history/full-width BY wiring is not performance-viable as-is.","next_action_hint":"Stop polishing raw q-history scaffolds unless needed for validation. Either implement real fixed-matrix/q window consumption or acknowledge the current wired path is a dead end for beating SOTA."}}
