{"run":444,"commit":"d52a771","metric":-1485064,"metrics":{"plusminus_unary_google_scratch_p99":639,"plusminus_unary_google_scratch_p999":644,"plusminus_unary_google_scratch_max":651,"plusminus_unary_google_over663_frac":0,"plusminus_unary_proxy_one_div_p99_ccx":286110,"plusminus_unary_proxy_one_div_max_ccx":292740,"plusminus_unary_proxy_two_div_p99_ccx":572220,"plusminus_unary_proxy_projected_p99_toffoli":1214936,"plusminus_unary_proxy_gap_p99_to_2700k":-1485064,"altseed_classical_total":0,"altseed_phase_batches_total":0,"altseed_ancilla_batches_total":0,"avg_toffoli":4089274,"avg_clifford":24292787.153,"qubits":2713,"emitted_ops":30575944,"correctness_ok":1,"target_scratch_over_tx_ty_q":663},"status":"keep","description":"Open plusminus unary Google663 replay proxy","timestamp":1777577049920,"segment":11,"confidence":null,"iterationTokens":175,"asi":{"hypothesis":"If the plus-minus unary k stream fits the 663 Google-low-qubit allowance, a scan-style parser might replay one odd-GCD DIV with roughly one add/sub per step and one shift per unary bit, making it worth a real reversible parser experiment.","result":"Optimistic floor is strongly SOTA-shaped on 8192 samples: scratch p99/p999/max=639/644/651, no samples over 663; one-DIV proxy p99=286,110 CCX, two-DIV p99=572,220, projected p99 point-add=1,214,936 (gap -1,485,064). This is deliberately not charged for direction sidecar, exact parser circuit, cleanup, worst-case proof, or phase; it only reopens plus-minus unary under the 663 allowance.","next_action_hint":"Build an isolated reversible unary-scan parser skeleton for plus-minus steps, including direction handling and cleanup. The first kill criteria are scratch >663, dense direction/rank cleanup, or parser cost exceeding roughly 1.5M slack."}}
{"type":"config","name":"plusminus unary controlled parser tax","metricName":"plusminus_unary_controlled_gap_p99_to_2700k","metricUnit":"","bestDirection":"lower"}
{"run":445,"commit":"30df8d3","metric":809916,"metrics":{"plusminus_unary_cadd_ccx":1280,"plusminus_unary_cdouble_ccx":1280,"plusminus_unary_chalve_ccx":1280,"plusminus_unary_controlled_one_div_p99_ccx":1433600,"plusminus_unary_controlled_one_div_max_ccx":1464320,"plusminus_unary_controlled_two_div_p99_ccx":2867200,"plusminus_unary_controlled_projected_p99_toffoli":3509916,"plusminus_unary_controlled_gap_p99_to_2700k":809916,"plusminus_unary_controlled_scratch_max":650,"altseed_classical_total":0,"altseed_phase_batches_total":0,"altseed_ancilla_batches_total":0,"avg_toffoli":4089274,"avg_clifford":24292787.153,"qubits":2713,"emitted_ops":30575944,"correctness_ok":1,"target_scratch_over_tx_ty_q":663},"status":"keep","description":"Charge plusminus unary parser with existing controlled primitives","timestamp":1777577242481,"segment":12,"confidence":null,"iterationTokens":168,"asi":{"hypothesis":"The plus-minus unary state/proxy win may disappear once unary bits are charged as quantum controls for modular adds and shifts using existing primitives.","result":"Existing controlled add/double/halve primitives each cost 1,280 CCX. With the unary scan counts, one-DIV p99 becomes 1,433,600 CCX, two-DIV p99 2,867,200, projected point-add 3,509,916 (gap +809,916). Scratch stays good (max 650). This kills plus-minus unary with current controlled primitives, but leaves a clear target: controlled parser operations must average far below 1,280 CCX, roughly below ~915 CCX for p99 SOTA with this model.","next_action_hint":"Look for Solinas/signed-redundant controlled shift/add fusion for plus-minus unary parser; if no sub-900 CCX controlled step exists, demote plus-minus again."}}
{"type":"config","name":"plusminus scaled integer coefficient width","metricName":"plusminus_scaled_coeff_one_den_one_coeff_scratch_max","metricUnit":"","bestDirection":"lower"}
{"run":446,"commit":"9e08d84","metric":512,"metrics":{"plusminus_scaled_coeff_width_p99":256,"plusminus_scaled_coeff_width_p999":256,"plusminus_scaled_coeff_width_max":256,"plusminus_scaled_coeff_scale_p99":383,"plusminus_scaled_coeff_scale_max":395,"plusminus_scaled_coeff_steps_p99":194,"plusminus_scaled_coeff_two_coeff_scratch_max":512,"plusminus_scaled_coeff_one_den_one_coeff_scratch_max":512,"altseed_classical_total":0,"altseed_phase_batches_total":0,"altseed_ancilla_batches_total":0,"avg_toffoli":4089274,"avg_clifford":24292787.153,"qubits":2713,"emitted_ops":30575944,"correctness_ok":1,"target_scratch_over_tx_ty_q":663},"status":"keep","description":"Find plusminus scaled integer coefficients keep 256-bit width","timestamp":1777577424562,"segment":13,"confidence":null,"iterationTokens":169,"asi":{"hypothesis":"A globally 2^S-scaled integer coefficient representation might make plus-minus unary shifts cheap, but coefficient widths could grow with the accumulated shift count and kill scratch.","result":"Surprise: on 8192 secp samples, scaled integer coefficient width p99/p999/max is exactly 256 bits while scale p99/max is 383/395 and steps p99=194. Two coefficient registers would be 512 bits, and a one-denominator+one-coefficient layout also models at 512 scratch before small controls/history. This reopens cheap-shift plus-minus much more strongly; need verify algebra for quotient recovery and build reversible step circuits.","next_action_hint":"Validate final scaled coefficient recovers x^{-1} after known 2^-S correction, then cost controlled integer shifts/adds (not modular shifts) and direction cleanup under <=663 scratch."}}
{"type":"config","name":"plusminus scaled coefficient inverse algebra","metricName":"plusminus_scaled_coeff_inverse_max_width","metricUnit":"","bestDirection":"lower"}
{"run":447,"commit":"d2b8317","metric":256,"metrics":{"plusminus_scaled_coeff_inverse_samples":2048,"plusminus_scaled_coeff_inverse_max_scale":398,"plusminus_scaled_coeff_inverse_max_width":256,"altseed_classical_total":0,"altseed_phase_batches_total":0,"altseed_ancilla_batches_total":0,"avg_toffoli":4089274,"avg_clifford":24292787.153,"qubits":2713,"emitted_ops":30575944,"correctness_ok":1,"target_scratch_over_tx_ty_q":663},"status":"keep","description":"Validate plusminus scaled coefficient inverse algebra","timestamp":1777577562652,"segment":14,"confidence":null,"iterationTokens":158,"asi":{"hypothesis":"The plus-minus scaled integer coefficient width result is only useful if the final coefficient actually recovers x^{-1} after the known 2^{-S} correction.","result":"2048 secp samples all satisfy x*(coeff*2^{-S})=1 mod p. Max scale 398 and max coefficient width 256. This validates the algebraic cheap-shift representation; next blocker is reversible implementation with controlled integer shifts/adds and direction/history cleanup.","next_action_hint":"Cost a controlled signed-integer plus-minus step: retained coefficient left-shift by k via controlled swaps/relabels, cd=cu-cv via controlled add/sub, with enough sign/range bits. Compare against the 1280-CCX modular-control baseline."}}
{"type":"config","name":"plusminus scaled integer controlled step floor","metricName":"plusminus_scaled_integer_gap_p99_to_2700k","metricUnit":"","bestDirection":"lower"}
{"run":448,"commit":"9c8d2fe","metric":-1288100,"metrics":{"plusminus_scaled_integer_cint_add_ccx":513,"plusminus_scaled_integer_cshift_ccx":257,"plusminus_scaled_integer_one_div_p99_ccx":384592,"plusminus_scaled_integer_one_div_max_ccx":392822,"plusminus_scaled_integer_two_div_p99_ccx":769184,"plusminus_scaled_integer_projected_p99_toffoli":1411900,"plusminus_scaled_integer_gap_p99_to_2700k":-1288100,"altseed_classical_total":0,"altseed_phase_batches_total":0,"altseed_ancilla_batches_total":0,"avg_toffoli":4089274,"avg_clifford":24292787.153,"qubits":2713,"emitted_ops":30575944,"correctness_ok":1,"target_scratch_over_tx_ty_q":663},"status":"keep","description":"Cost plusminus scaled-integer controlled step floor","timestamp":1777577712163,"segment":15,"confidence":null,"iterationTokens":172,"asi":{"hypothesis":"Using globally scaled integer coefficients can replace expensive controlled modular shifts in the plus-minus unary parser with controlled relabel/shift and integer add floors.","result":"Optimistic controlled-step floor is strongly SOTA-shaped: controlled integer add 513 CCX, controlled shift 257 CCX, one-DIV p99 384,592 CCX, two-DIV p99 769,184, projected p99 point-add 1,411,900 (gap -1,288,100). This excludes signed overflow/top-bit recovery, direction muxing, parser cleanup, and exact worst-case proof; those are now the critical blockers.","next_action_hint":"Next build a small reversible signed step with actual two's-complement ranges and overflow/sign recovery, or find a dense/ambiguous direction cleanup that kills the route."}}
{"type":"config","name":"plusminus k-sequence direction preimage rank","metricName":"plusminus_kseq_reverse_rank_bits","metricUnit":"","bestDirection":"lower"}
{"run":449,"commit":"9c8d2fe","metric":20,"metrics":{"plusminus_kseq_reverse_samples":1024,"plusminus_kseq_reverse_p99_preimages":1000001,"plusminus_kseq_reverse_max_preimages":1000001,"plusminus_kseq_reverse_max_frontier":1048576,"plusminus_kseq_reverse_capped":1024,"plusminus_kseq_reverse_rank_bits":20},"status":"crash","description":"Probe plusminus k-sequence direction preimages but frontier exploded","timestamp":1777578162650,"segment":16,"confidence":null,"iterationTokens":165,"asi":{"hypothesis":"Given the full unary k-sequence and modulus p, reversing the ordered plus-minus recurrence from final (1,1) may leave only a tiny number of direction preimages, making direction cleanup cheap.","result":"Negative surprise: every one of 1024 secp samples hit the 1,000,000 preimage cap; p99/max preimages=1,000,001, max frontier=1,048,576, rank_bits>=20 under this crude cap. The toy n=16 small direction sidecar does not extrapolate naively to secp when using only k-sequence and p pruning.","rollback_reason":"The targeted test asserted no capped frontiers and therefore failed after a long run; need re-add a smaller non-crashing metric test if preserving this blocker.","next_action_hint":"Demote plus-minus unless direction is generated/consumed online from live denominator state; k-sequence-only direction rank is too large. If continuing, build an online direction parser rather than a global rank decoder."}}
{"type":"config","name":"plusminus scaled integer state accounting","metricName":"plusminus_scaled_state_over_google_max_bits","metricUnit":"","bestDirection":"lower"}
{"run":450,"commit":"8fc2560","metric":251,"metrics":{"plusminus_scaled_state_unary_p99":385,"plusminus_scaled_state_unary_max":402,"plusminus_scaled_state_scratch_p99":897,"plusminus_scaled_state_scratch_max":914,"plusminus_scaled_state_over_google_max_bits":251,"altseed_classical_total":0,"altseed_phase_batches_total":0,"altseed_ancilla_batches_total":0,"avg_toffoli":4089274,"avg_clifford":24292787.153,"qubits":2713,"emitted_ops":30575944,"correctness_ok":1,"target_scratch_over_tx_ty_q":663},"status":"keep","description":"Charge plusminus scaled state with coefficient pair plus history","timestamp":1777578309373,"segment":17,"confidence":null,"iterationTokens":162,"asi":{"hypothesis":"The scaled-integer plus-minus cost floor may be misleading because it counted only coefficient/denominator width, not simultaneous unary history storage.","result":"With tx/ty hosting one denominator and one coefficient, the apparent remaining live objects are a second denominator (256), second coefficient (256), and unary history (p99 385, max 402), giving scratch p99 897 and max 914: 251 bits over the Google 663 allowance. Thus the cheap-shift route only remains viable if unary history is generated/consumed online or fused into shrinking state; naive stored-history layout is too wide.","next_action_hint":"Investigate online/fused unary history consumption. If direction/history cannot be self-cleaned from live denominator/coefficient state, demote plus-minus despite good arithmetic floor."}}
{"type":"config","name":"plusminus scaled state slack packing","metricName":"plusminus_scaled_slack_over_google_max_bits","metricUnit":"","bestDirection":"lower"}
{"run":451,"commit":"0d9a439","metric":-136,"metrics":{"plusminus_scaled_slack_deficit_p99":8,"plusminus_scaled_slack_deficit_max":15,"plusminus_scaled_slack_scratch_p99":520,"plusminus_scaled_slack_scratch_max":527,"plusminus_scaled_slack_used_max":515,"plusminus_scaled_slack_over_google_max_bits":-136,"altseed_classical_total":0,"altseed_phase_batches_total":0,"altseed_ancilla_batches_total":0,"avg_toffoli":4089274,"avg_clifford":24292787.153,"qubits":2713,"emitted_ops":30575944,"correctness_ok":1,"target_scratch_over_tx_ty_q":663},"status":"keep","description":"Find slack packing for plusminus unary history","timestamp":1777578468432,"segment":18,"confidence":null,"iterationTokens":163,"asi":{"hypothesis":"Although naive plus-minus scaled state plus unary history is 914 scratch, the four live denominator/coefficient lanes may have enough high-bit slack to pack consumed unary history in-place.","result":"Strong positive packing model: unary-history deficit beyond high-bit slack is p99=8 bits, max=15 bits; scratch model 512+deficit gives p99=520 and max=527, 136 bits under Google 663. Used live value bits max=515 across four 256-bit lanes. This reopens plus-minus scaled-integer as a serious low-scratch candidate if the slack packing can be made reversible and direction can be generated online.","next_action_hint":"Next build a reversible toy/slack-packing invariant or step circuit: prove history bits can be inserted/extracted from high slack without corrupting signed coefficients/denominators, and handle direction online rather than global rank."}}
{"type":"config","name":"plusminus scaled full-state direction recovery","metricName":"plusminus_scaled_direction_ambiguous_steps","metricUnit":"","bestDirection":"lower"}
{"run":452,"commit":"cfe9b8c","metric":0,"metrics":{"plusminus_scaled_direction_samples":512,"plusminus_scaled_direction_steps":92494,"plusminus_scaled_direction_ambiguous_steps":0,"plusminus_scaled_direction_max_candidates":1,"altseed_classical_total":0,"altseed_phase_batches_total":0,"altseed_ancilla_batches_total":0,"avg_toffoli":4089274,"avg_clifford":24292787.153,"qubits":2713,"emitted_ops":30575944,"correctness_ok":1,"target_scratch_over_tx_ty_q":663},"status":"keep","description":"Show plusminus scaled full state recovers direction locally","timestamp":1777578633122,"segment":19,"confidence":null,"iterationTokens":161,"asi":{"hypothesis":"Although k-sequence alone has huge global reverse rank, the full scaled plus-minus state may recover branch direction locally from coefficient divisibility, avoiding separate direction history.","result":"Positive: on 512 secp samples covering 92,494 plus-minus steps, reverse candidates from (u,v,cu,cv,k) were unique at every step (ambiguous_steps=0, max_candidates=1). Direction bits need not be stored if both scaled coefficient lanes remain live; this supports the online/slack-packed route.","next_action_hint":"Build a toy reversible step/slack-packing circuit or a stricter finite-width two's-complement simulation to validate overflow/top-bit recovery and history insertion/extraction."}}
{"type":"config","name":"plusminus scaled finite two's-complement width","metricName":"plusminus_scaled_twos_width","metricUnit":"","bestDirection":"lower"}
{"run":453,"commit":"5be2138","metric":257,"metrics":{"plusminus_scaled_twos_width":257,"plusminus_scaled_twos_samples":2048,"plusminus_scaled_twos_steps":370565,"plusminus_scaled_twos_max_mag_bits":256,"altseed_classical_total":0,"altseed_phase_batches_total":0,"altseed_ancilla_batches_total":0,"avg_toffoli":4089274,"avg_clifford":24292787.153,"qubits":2713,"emitted_ops":30575944,"correctness_ok":1,"target_scratch_over_tx_ty_q":663},"status":"keep","description":"Validate plusminus scaled coefficients in 257-bit two's-complement","timestamp":1777578789399,"segment":20,"confidence":null,"iterationTokens":164,"asi":{"hypothesis":"The scaled plus-minus controlled-step floor assumes fixed-width signed integer lanes; verify that 257-bit two's-complement arithmetic matches arbitrary signed coefficients without wrap on secp traces.","result":"257-bit two's-complement coefficients matched the exact signed-magnitude recurrence for 2048 samples / 370,565 steps. Max magnitude width was 256 bits. This closes the immediate overflow objection to the 513-CCX controlled integer add and 257-CCX controlled shift floor, though reversible slack packing is still unbuilt.","next_action_hint":"Move from numeric width checks to a reversible toy circuit for one scaled plus-minus step plus history insertion/extraction in slack bits."}}
{"type":"config","name":"plusminus public step slack envelope","metricName":"plusminus_scaled_public_slack_over_google_bits","metricUnit":"","bestDirection":"lower"}
{"run":454,"commit":"be49afe","metric":-151,"metrics":{"plusminus_scaled_public_slack_max_steps":201,"plusminus_scaled_public_slack_worst_step":0,"plusminus_scaled_public_slack_deficit":0,"plusminus_scaled_public_slack_scratch":512,"plusminus_scaled_public_slack_over_google_bits":-151,"altseed_classical_total":0,"altseed_phase_batches_total":0,"altseed_ancilla_batches_total":0,"avg_toffoli":4089274,"avg_clifford":24292787.153,"qubits":2713,"emitted_ops":30575944,"correctness_ok":1,"target_scratch_over_tx_ty_q":663},"status":"keep","description":"Find public step-index slack envelope for plusminus history","timestamp":1777578956577,"segment":21,"confidence":null,"iterationTokens":161,"asi":{"hypothesis":"Slack packing might require a dense bitlength oracle; check whether a public step-index envelope leaves enough high-bit slack for unary history on all sampled traces.","result":"Positive: across 8192 samples, a per-step worst-case envelope had max_steps=201 and zero history deficit; modeled scratch is just the two extra 256-bit lanes (512), 151 bits under Google. This suggests history packing can be scheduled by public loop index rather than data-dependent bitlength, at least on samples.","next_action_hint":"Use the public envelope to design a fixed packing map for unary bits; then test reversible insertion/extraction and exactness beyond sampled traces."}}
{"type":"config","name":"plusminus lane-specific slack envelope","metricName":"plusminus_scaled_lane_slack_over_google_bits","metricUnit":"","bestDirection":"lower"}
{"run":455,"commit":"7749418","metric":-151,"metrics":{"plusminus_scaled_lane_slack_steps":201,"plusminus_scaled_lane_slack_total_deficit":0,"plusminus_scaled_lane_slack_single_deficit":191,"plusminus_scaled_lane_slack_scratch":512,"plusminus_scaled_lane_slack_over_google_bits":-151,"altseed_classical_total":0,"altseed_phase_batches_total":0,"altseed_ancilla_batches_total":0,"avg_toffoli":4089274,"avg_clifford":24292787.153,"qubits":2713,"emitted_ops":30575944,"correctness_ok":1,"target_scratch_over_tx_ty_q":663},"status":"keep","description":"Validate lane-specific public slack envelope for plusminus history","timestamp":1777579109832,"segment":22,"confidence":null,"iterationTokens":163,"asi":{"hypothesis":"A public total slack envelope may hide lane-level packing conflicts; verify that history fits in the sum of lane high-bit slack bands at each public step index.","result":"Lane-specific public envelope still has total_deficit=0 and scratch=512 (151 under Google) over 8192 samples, but single_lane_deficit=191, so a multi-lane fixed packing map is required; one high-slack lane is not enough.","next_action_hint":"Synthesize a fixed multi-lane packing schedule or at least count move/swap cost between lane slack bands; do not assume a trivial single-stack history layout."}}
{"type":"config","name":"plusminus fixed public packing map","metricName":"plusminus_scaled_packmap_max_step_moves","metricUnit":"","bestDirection":"lower"}
{"run":456,"commit":"c4d8749","metric":402,"metrics":{"plusminus_scaled_packmap_steps":201,"plusminus_scaled_packmap_max_history":403,"plusminus_scaled_packmap_total_slot_moves":47581,"plusminus_scaled_packmap_max_step_moves":402,"altseed_classical_total":0,"altseed_phase_batches_total":0,"altseed_ancilla_batches_total":0,"avg_toffoli":4089274,"avg_clifford":24292787.153,"qubits":2713,"emitted_ops":30575944,"correctness_ok":1,"target_scratch_over_tx_ty_q":663},"status":"keep","description":"Construct fixed public packing map for plusminus history","timestamp":1777579257131,"segment":23,"confidence":null,"iterationTokens":163,"asi":{"hypothesis":"Given lane-specific public slack, a deterministic fixed slot map can place unary history bits without data-dependent bitlength decisions; moving between maps is Clifford-only but may be large.","result":"A simple sorted-slot public packing map exists for 201 steps with max_history=403. It requires 47,581 slot moves total and up to 402 moves in one public transition; this is Clifford/SWAP overhead, not Toffoli, but scheduling is nontrivial. The map stays within the two extra 256-bit lanes plus tx/ty slack model.","next_action_hint":"If pursuing implementation, optimize the packing map to reduce Clifford moves and integrate history insertion/removal with the unary scan; Toffoli focus should remain on signed add/shift and cleanup."}}
{"type":"config","name":"plusminus trailing-zero unary generator tax","metricName":"plusminus_unary_generator_gap_p99_to_2700k","metricUnit":"","bestDirection":"lower"}
