{"run":457,"commit":"ab60903","metric":-892820,"metrics":{"plusminus_unary_generator_ccx":1024,"plusminus_unary_generator_one_div_p99_ccx":582232,"plusminus_unary_generator_one_div_max_ccx":596576,"plusminus_unary_generator_two_div_p99_ccx":1164464,"plusminus_unary_generator_projected_p99_toffoli":1807180,"plusminus_unary_generator_gap_p99_to_2700k":-892820,"altseed_classical_total":0,"altseed_phase_batches_total":0,"altseed_ancilla_batches_total":0,"avg_toffoli":4089274,"avg_clifford":24292787.153,"qubits":2713,"emitted_ops":30575944,"correctness_ok":1,"target_scratch_over_tx_ty_q":663},"status":"keep","description":"Charge trailing-zero unary generator for plusminus parser","timestamp":1777579425031,"segment":24,"confidence":null,"iterationTokens":169,"asi":{"hypothesis":"Computing unary k from d=u-v via a reversible trailing-zero prefix scan may add enough Toffoli to erase the plus-minus scaled-integer margin.","result":"Prefix-zero generator forward+cleanup costs 1,024 CCX per step. Adding it to the scaled integer add/shift floor gives one-DIV p99 582,232 CCX, two-DIV p99 1,164,464, projected p99 point-add 1,807,180 (gap -892,820). The route remains SOTA-shaped with substantial margin before sign/range/packing implementation tax.","next_action_hint":"Next charge subtract d=u-v and controlled ordering/swap/mux costs, or build an actual small reversible scaled plus-minus step with unary generation."}}
{"type":"config","name":"plusminus ordering compare-swap tax","metricName":"plusminus_order_gap_p99_to_2700k","metricUnit":"","bestDirection":"lower"}
{"run":458,"commit":"c1996d8","metric":-594428,"metrics":{"plusminus_order_cmp_ccx":256,"plusminus_order_cswap_ccx":513,"plusminus_order_one_div_p99_ccx":731428,"plusminus_order_one_div_max_ccx":748559,"plusminus_order_two_div_p99_ccx":1462856,"plusminus_order_projected_p99_toffoli":2105572,"plusminus_order_gap_p99_to_2700k":-594428,"altseed_classical_total":0,"altseed_phase_batches_total":0,"altseed_ancilla_batches_total":0,"avg_toffoli":4089274,"avg_clifford":24292787.153,"qubits":2713,"emitted_ops":30575944,"correctness_ok":1,"target_scratch_over_tx_ty_q":663},"status":"keep","description":"Charge plusminus ordering compare and lane-swap tax","timestamp":1777579626232,"segment":25,"confidence":null,"iterationTokens":166,"asi":{"hypothesis":"The plus-minus scaled route may lose its SOTA margin once d-v comparison and ordering swaps are charged per step.","result":"Ordering tax is concrete and still fits: compare 256 CCX, denominator+coefficient lane cswap 513 CCX. Including generator/add/shift/order gives one-DIV p99 731,428 CCX, two-DIV p99 1,462,856, projected p99 point-add 2,105,572 (gap -594,428). Remaining uncharged items are finite-width production circuits, slack-pack moves (Clifford-heavy), exact worst-case/iteration cap, and integration into affine add.","next_action_hint":"Next account for worst-case sample tails and final 2^{-S} scale correction; then consider a toy reversible step circuit with actual operations."}}
{"type":"config","name":"plusminus posthoc variable scale correction","metricName":"plusminus_scale_posthoc_gap_p99_to_2700k","metricUnit":"","bestDirection":"lower"}
{"run":459,"commit":"e4e5feb","metric":336372,"metrics":{"plusminus_scale_halve_ccx":1280,"plusminus_scale_posthoc_one_div_p99_ccx":1196828,"plusminus_scale_posthoc_one_div_max_ccx":1214511,"plusminus_scale_posthoc_two_div_p99_ccx":2393656,"plusminus_scale_posthoc_projected_p99_toffoli":3036372,"plusminus_scale_posthoc_gap_p99_to_2700k":336372,"altseed_classical_total":0,"altseed_phase_batches_total":0,"altseed_ancilla_batches_total":0,"avg_toffoli":4089274,"avg_clifford":24292787.153,"qubits":2713,"emitted_ops":30575944,"correctness_ok":1,"target_scratch_over_tx_ty_q":663},"status":"keep","description":"Show posthoc variable scale correction kills plusminus margin","timestamp":1777579783342,"segment":26,"confidence":null,"iterationTokens":167,"asi":{"hypothesis":"The scaled plus-minus DIV needs a final 2^{-S} correction; doing that post-hoc with controlled modular halves may erase the SOTA margin.","result":"Post-hoc variable scale correction costs 1,280 CCX per unary shift. It raises one-DIV p99 to 1,196,828 CCX, two-DIV p99 to 2,393,656, projected p99 point-add to 3,036,372 (gap +336,372). Thus the scaled plus-minus route must absorb scale into the affine/product-clean algebra or use a cheaper history-carry multihalve; a naive final correction is dead.","next_action_hint":"Try to keep scaled quotient through point-add formulas or adapt Solinas history-carry multihalve to the final scale correction; do not promote plus-minus with post-hoc controlled halves."}}
{"type":"config","name":"plusminus Solinas history-carry scale correction","metricName":"plusminus_solinas_scale_gap_p99_to_2700k","metricUnit":"","bestDirection":"lower"}
{"run":460,"commit":"477be7f","metric":-519190,"metrics":{"plusminus_solinas_scale_max_bits":393,"plusminus_solinas_scale_cost_p99_ccx":40233,"plusminus_solinas_scale_cost_max_ccx":41493,"plusminus_solinas_scale_chunks_max":56,"plusminus_solinas_scale_one_div_p99_ccx":769047,"plusminus_solinas_scale_one_div_max_ccx":785121,"plusminus_solinas_scale_two_div_p99_ccx":1538094,"plusminus_solinas_scale_projected_p99_toffoli":2180810,"plusminus_solinas_scale_gap_p99_to_2700k":-519190,"altseed_classical_total":0,"altseed_phase_batches_total":0,"altseed_ancilla_batches_total":0,"avg_toffoli":4089274,"avg_clifford":24292787.153,"qubits":2713,"emitted_ops":30575944,"correctness_ok":1,"target_scratch_over_tx_ty_q":663},"status":"keep","description":"Restore plusminus margin with Solinas history-carry scale model","timestamp":1777579948647,"segment":27,"confidence":null,"iterationTokens":172,"asi":{"hypothesis":"The post-hoc scale correction killed plus-minus only because controlled modular halves are too expensive; Solinas history-carry multihalve chunks may correct the variable 2^{-S} scale cheaply using the existing unary/history channel.","result":"Optimistic Solinas history-carry scale model restores margin: max sampled S=393, scale cost p99=40,233 CCX (max 41,493, chunks max 56). Including generator/add/shift/order/scale gives one-DIV p99 769,047, two-DIV p99 1,538,094, projected p99 point-add 2,180,810 (gap -519,190). This assumes residual chunk bits pack with history and that a production multihalve circuit is phase-clean.","next_action_hint":"Build or cost a production phase-clean Solinas history-carry multihalve for variable S, including residual bits and inverse cleanup; this is now the key plus-minus scale blocker."}}
{"type":"config","name":"plusminus Solinas all-in stress max","metricName":"plusminus_solinas_stress_gap_max_to_2700k","metricUnit":"","bestDirection":"lower"}
{"run":461,"commit":"57b0615","metric":-469150,"metrics":{"plusminus_solinas_stress_samples":32768,"plusminus_solinas_stress_max_scale":401,"plusminus_solinas_stress_projected_p99":2181354,"plusminus_solinas_stress_projected_p999":2201682,"plusminus_solinas_stress_projected_max":2230850,"plusminus_solinas_stress_gap_max_to_2700k":-469150,"plusminus_solinas_stress_chunks_max":57,"altseed_classical_total":0,"altseed_phase_batches_total":0,"altseed_ancilla_batches_total":0,"avg_toffoli":4089274,"avg_clifford":24292787.153,"qubits":2713,"emitted_ops":30575944,"correctness_ok":1,"target_scratch_over_tx_ty_q":663},"status":"keep","description":"Stress plusminus Solinas all-in model tails","timestamp":1777580102897,"segment":28,"confidence":null,"iterationTokens":170,"asi":{"hypothesis":"The plus-minus Solinas all-in model may have high-tail samples that approach or exceed the 2.7M target despite p99 margin.","result":"32,768-sample stress still has large margin: projected p99=2,181,354, p999=2,201,682, max=2,230,850, max gap=-469,150; max scale=401 and chunks max=57. This supports continuing to a production reversible skeleton, but remains sampled and model-based.","next_action_hint":"Now focus on exact/worst-case bounds and circuit skeletons rather than more sample proxies: phase-clean Solinas history-carry chunks and fixed-envelope slack packing are the key implementation risks."}}
{"type":"config","name":"scratch600 frontier plusminus scaled model accounting","metricName":"plusminus_scaled_solinas_gap_max_to_2700k","metricUnit":"","bestDirection":"lower"}
{"run":462,"commit":"a5dce4d","metric":-469150,"metrics":{"scratch600_frontier_best_scratch_bits":510,"scratch600_frontier_best_charged_scratch_bits":510,"scratch600_frontier_best_charged_toffoli":2765676,"scratch600_frontier_best_charged_gap_to_2700k":65676,"scratch600_streamed_replay_body_projected_toffoli":2645196,"scratch600_streamed_unfunded_selector_budget_ccx":54804,"scratch600_streamed_selector_budget_ccx":87840,"scratch600_streamed_lowword_selector_ccx":208320,"scratch600_streamed_selector_shortfall_ccx":120480,"scratch600_centered_raw_scratch_bits":592,"scratch600_centered_boundary_scratch_p99":710,"scratch600_centered_parser_over_strict_bits":110,"scratch600_plusminus_raw_scratch_bits":564,"scratch600_plusminus_unary_scratch_p99":640,"scratch600_plusminus_parser_over_strict_bits":40,"scratch600_plusminus_scaled_slack_scratch_max":527,"scratch600_plusminus_scaled_solinas_projected_max":2230850,"scratch600_plusminus_scaled_solinas_gap_max_to_2700k":-469150,"scratch600_halfgcd_matrix_only_bits":524,"scratch600_halfgcd_matrix_tail_raw_bits":689,"scratch600_halfgcd_tail_over_google_bits":26,"altseed_classical_total":0,"altseed_phase_batches_total":0,"altseed_ancilla_batches_total":0,"avg_toffoli":4089274,"avg_clifford":24292787.153,"qubits":2713,"emitted_ops":30575944,"correctness_ok":1,"target_scratch_over_tx_ty_q":663},"status":"keep","description":"Add plusminus scaled Solinas model to scratch600 frontier","timestamp":1777580246452,"segment":29,"confidence":null,"iterationTokens":166,"asi":{"hypothesis":"The scratch600 frontier should track the new plus-minus scaled-integer/Solinas model as a promising but unbuilt low-scratch candidate, without counting it as fully charged.","result":"Frontier now records plusminus_scaled_slack_solinas_model_unbuilt: scratch max 527, projected max 2,230,850, gap -469,150. It remains charged_toffoli=None because phase-clean slack packing and variable-S Solinas circuits are not built. Best fully charged row is unchanged: streamed-mask BY lowword selector gap +65,676.","next_action_hint":"Do not promote plus-minus to charged frontier until a reversible slack-packed scaled step and variable-S Solinas multihalve are phase-clean and costed."}}
{"type":"config","name":"plusminus toy worst-case scale steps","metricName":"plusminus_toy_n16_max_scale","metricUnit":"","bestDirection":"lower"}
{"run":463,"commit":"be455be","metric":30,"metrics":{"plusminus_toy_n16_max_scale":30,"plusminus_toy_n16_max_steps":16,"altseed_classical_total":0,"altseed_phase_batches_total":0,"altseed_ancilla_batches_total":0,"avg_toffoli":4089274,"avg_clifford":24292787.153,"qubits":2713,"emitted_ops":30575944,"correctness_ok":1},"status":"keep","description":"Check toy worst-case plusminus scale growth","timestamp":1777580389118,"segment":30,"confidence":null,"iterationTokens":164,"asi":{"hypothesis":"The sampled plus-minus scale S≈400 could hide much worse tails; exhaustive small-n maxima should show whether S and step counts grow roughly linearly.","result":"Exhaustive toy p=65521 (n=16) has max_scale=30 and max_steps=16, consistent with about 1.9n scale and linear steps rather than a superlinear blow-up. This supports but does not prove secp worst-case bounds.","next_action_hint":"Derive or search for a formal binary-GCD bound on total shift sum S for ordered plus-minus; use it to replace sampled max in the scratch/Toffoli accounting."}}
{"type":"config","name":"plusminus conservative bound budget model","metricName":"plusminus_conservative_gap_to_2700k","metricUnit":"","bestDirection":"lower"}
{"run":464,"commit":"0181c5f","metric":20492,"metrics":{"plusminus_conservative_steps256_scale512_projected":2720492,"plusminus_conservative_steps256_scale512_gap":20492,"plusminus_conservative_steps202_scale512_projected":2416040,"plusminus_conservative_steps202_scale512_gap":-283960,"altseed_classical_total":0,"altseed_phase_batches_total":0,"altseed_ancilla_batches_total":0,"avg_toffoli":4089274,"avg_clifford":24292787.153,"qubits":2713,"emitted_ops":30575944,"correctness_ok":1,"target_scratch_over_tx_ty_q":663},"status":"keep","description":"Check conservative S<=512 steps<=256 plusminus budget","timestamp":1777580532132,"segment":31,"confidence":null,"iterationTokens":943,"asi":{"hypothesis":"A future formal worst-case bound may be coarser than sampled tails; test whether S<=512 and steps<=256 still fits the plus-minus/Solinas budget.","result":"Coarse S=512, steps=256 projects 2,720,492 (gap +20,492), just missing Google; S=512 with sampled step envelope 202 projects 2,416,040 (gap -283,960). Thus the route needs either a step bound significantly below 256, slightly cheaper step/scale primitives, or acceptance of a sampled/approx tail. The margin is close enough that small circuit overheads matter.","next_action_hint":"Search for formal bounds coupling total scale and step count, or reduce per-step cost by ~40 CCX/step to make the coarse n-step bound fit."}}
{"type":"config","name":"plusminus active-chain unary generator conservative budget","metricName":"plusminus_active_chain_conservative_gap","metricUnit":"","bestDirection":"lower"}
{"run":465,"commit":"2572a3c","metric":-241652,"metrics":{"plusminus_active_chain_generator_ccx":512,"plusminus_active_chain_conservative_projected":2458348,"plusminus_active_chain_conservative_gap":-241652,"altseed_classical_total":0,"altseed_phase_batches_total":0,"altseed_ancilla_batches_total":0,"avg_toffoli":4089274,"avg_clifford":24292787.153,"qubits":2713,"emitted_ops":30575944,"correctness_ok":1,"target_scratch_over_tx_ty_q":663},"status":"keep","description":"Halve unary generator cost using active-chain history","timestamp":1777580691932,"segment":32,"confidence":null,"iterationTokens":162,"asi":{"hypothesis":"The trailing-zero prefix generator double-counted unary output bits; the active prefix chain itself can serve as unary history, cutting generator Toffoli in half.","result":"Active-chain generator costs 512 CCX instead of 1,024. Under coarse S<=512, steps<=256, the conservative plus-minus/Solinas projection drops from 2,720,492 (gap +20,492) to 2,458,348 (gap -241,652). This gives room for exact worst-case bounds and moderate implementation overhead.","next_action_hint":"Propagate active-chain generator into all plus-minus cost models/frontier; then build a reversible step skeleton using active bits as history controls."}}
{"type":"config","name":"plusminus active-chain Solinas stress max","metricName":"plusminus_active_solinas_stress_gap_max_to_2700k","metricUnit":"","bestDirection":"lower"}
{"run":466,"commit":"d3f5bea","metric":-672962,"metrics":{"plusminus_active_solinas_stress_samples":32768,"plusminus_active_solinas_stress_max_scale":406,"plusminus_active_solinas_stress_max_steps":205,"plusminus_active_solinas_stress_projected_p99":1983040,"plusminus_active_solinas_stress_projected_p999":2001708,"plusminus_active_solinas_stress_projected_max":2027038,"plusminus_active_solinas_stress_gap_max_to_2700k":-672962,"plusminus_active_solinas_stress_chunks_max":58,"altseed_classical_total":0,"altseed_phase_batches_total":0,"altseed_ancilla_batches_total":0,"avg_toffoli":4089274,"avg_clifford":24292787.153,"qubits":2713,"emitted_ops":30575944,"correctness_ok":1,"target_scratch_over_tx_ty_q":663},"status":"keep","description":"Stress active-chain plusminus Solinas model tails","timestamp":1777582020042,"segment":33,"confidence":null,"iterationTokens":167,"asi":{"hypothesis":"After replacing the unary generator with the active prefix chain, the plus-minus/Solinas all-in sampled stress should gain margin and remain SOTA-shaped at the sample maximum.","result":"32,768-sample active-chain stress projects p99=1,983,040, p999=2,001,708, max=2,027,038 (gap -672,962). Max scale=406, max steps=205, chunks max=58. This improves the prior all-in model and leaves substantial implementation margin, but remains model-based.","next_action_hint":"Stop adding sampled proxies; build a reversible toy/production skeleton for one scaled plus-minus step and for variable-S Solinas history-carry cleanup to catch phase/ancilla failures early."}}
{"type":"config","name":"plusminus reversible shift circuit skeleton","metricName":"plusminus_shift_circuit_ccx","metricUnit":"","bestDirection":"lower"}
{"run":467,"commit":"7e43a1b","metric":17,"metrics":{"plusminus_shift_circuit_width":16,"plusminus_shift_circuit_ccx":17,"plusminus_shift_circuit_peak_q":18,"altseed_classical_total":0,"altseed_phase_batches_total":0,"altseed_ancilla_batches_total":0,"avg_toffoli":4089274,"avg_clifford":24292787.153,"qubits":2713,"emitted_ops":30575944,"correctness_ok":1},"status":"keep","description":"Build phase-clean no-overflow controlled shift skeleton","timestamp":1777582233811,"segment":34,"confidence":null,"iterationTokens":160,"asi":{"hypothesis":"The plus-minus scaled-integer model relies on controlled arithmetic left shifts; build an actual reversible circuit that clears the spill via the no-overflow sign-bit promise instead of just counting cswaps.","result":"Width-16 controlled no-overflow shift circuit is exact and phase-clean for signed inputs in [-128,127] and ctrl 0/1. It costs width+1=17 CCX and peak 18q, validating the quantum-compatible shift primitive shape. Production width 257 should cost 258 CCX, one more than the earlier floor.","next_action_hint":"Update plus-minus cost models for +1 CCX per active shift and build the next circuit skeleton: active-chain unary generator feeding repeated no-overflow shifts, with spill cleanup."}}
{"type":"config","name":"plusminus active-chain unary generator circuit","metricName":"plusminus_active_chain_circuit_ccx","metricUnit":"","bestDirection":"lower"}
{"run":468,"commit":"81214e7","metric":32,"metrics":{"plusminus_active_chain_circuit_width":16,"plusminus_active_chain_circuit_ccx":32,"plusminus_active_chain_circuit_peak_q":49,"altseed_classical_total":0,"altseed_phase_batches_total":0,"altseed_ancilla_batches_total":0,"avg_toffoli":4089274,"avg_clifford":24292787.153,"qubits":2713,"emitted_ops":30575944,"correctness_ok":1},"status":"keep","description":"Build phase-clean active-chain unary generator skeleton","timestamp":1777582374514,"segment":35,"confidence":null,"iterationTokens":162,"asi":{"hypothesis":"The active-chain unary generator used in the plus-minus parser model should be realizable as a real reversible circuit: compute prefix-zero chain, copy to history, reverse work bits.","result":"Width-16 active-chain unary generator is exact and phase-clean for 1024 basis inputs. Work active chain returns to zero, input d unchanged, history contains the expected unary trailing-zero prefix. Cost is 2W=32 CCX and peak 49q, matching model.","next_action_hint":"Compose active-chain history controls with repeated no-overflow shifts in one circuit skeleton, then validate spill/work cleanup and phase before attempting full plus-minus step."}}
{"type":"config","name":"plusminus active-chain controlled shift roundtrip circuit","metricName":"plusminus_active_shift_roundtrip_ccx","metricUnit":"","bestDirection":"lower"}
{"run":469,"commit":"10961e6","metric":336,"metrics":{"plusminus_active_shift_roundtrip_width":16,"plusminus_active_shift_roundtrip_ccx":336,"plusminus_active_shift_roundtrip_peak_q":66,"altseed_classical_total":0,"altseed_phase_batches_total":0,"altseed_ancilla_batches_total":0,"avg_toffoli":4089274,"avg_clifford":24292787.153,"qubits":2713,"emitted_ops":30575944,"correctness_ok":1},"status":"keep","description":"Compose active-chain unary controls with clean variable shift","timestamp":1777582517676,"segment":36,"confidence":null,"iterationTokens":165,"asi":{"hypothesis":"The active-chain generator and no-overflow shift primitives may fail when composed because history controls, spill cleanup, or uncomputing the generator could leave garbage/phase.","result":"Width-16 self-contained circuit generated unary controls from d, applied repeated no-overflow controlled shifts to a signed lane, then reran the generator to clear history. It passed for d=1..127 and x=-64..63 with active/history/spill all clean and phase zero. Cost 336 CCX, peak 66q, exactly matching 2 generators plus 16 clean shifts.","next_action_hint":"Next build the signed integer subtract/add plus ordering part of one plus-minus step, then combine with this shift-control skeleton."}}
{"type":"config","name":"plusminus controlled integer addsub circuit","metricName":"plusminus_cint_add_ccx","metricUnit":"","bestDirection":"lower"}
