{"run":371,"commit":"6661d9b","metric":4089274,"metrics":{"altseed_ancilla_batches_total":0,"altseed_classical_total":0,"altseed_phase_batches_total":0,"attempted_pair2_560_altseed_phase_batches":1,"attempted_q18_altseed_phase_batches":1,"attempted_q_local_altseed_phase_batches":1,"avg_clifford":24292787.153,"by_denpair_fixed_schedule_sidecar_bits":50,"by_denpair_fixed_schedule_worst_step":560,"by_denpair_history_max_converge":558,"by_denpair_history_samples":8192,"by_denpair_history_selector_bits_with_signs":564,"by_denpair_history_sidecar_bits":50,"by_direct_denpair_projected_total_with_replay_scaffold":3793920,"by_first16_carry_plus_fixed_bits":736,"by_first16_pattern_entropy_bits":195.4,"by_first16_pattern_fixed_bits":208,"by_fixed_matrix_den_compute_ccx":303828,"by_fixed_matrix_den_compute_uncompute_ccx":607657,"by_fixed_matrix_den_peak":3424,"by_full_ratio_bits":560,"by_full_ratio_constmul_add_widths":110720,"by_full_ratio_constmul_roundtrip_1t":221440,"by_full_ratio_constmul_roundtrip_2t":442880,"by_full_ratio_pinverse_popcount":305,"by_full_ratio_samples":64,"by_projective_streaming_failures":64,"by_projective_streaming_state_bits":816,"by_ratio_a_anf_degree":14,"by_ratio_a_anf_density":7268,"by_ratio_a_max_steps":149,"by_ratio_a_mean_steps":132,"by_ratio_a_serial_proxy_max":8892998,"by_ratio_a_serial_proxy_mean":7307490,"by_ratio_window32_samples":1088,"by_ratio_window32_v2_le4":822,"by_ratio_window_m01_v2_1":347,"by_ratio_window_m01_v2_2":673,"by_ratio_window_m01_v2_3":380,"by_ratio_window_m01_v2_ge16":92,"by_ratio_window_samples":2240,"by_replay_bench_avg_toffoli":5278510,"by_replay_bench_emitted_ops":42250936,"by_replay_bench_qubits":2716,"by_selected_varcoeff_one_coeff_ccx":18598,"by_selected_varcoeff_peak":2123,"by_selected_varcoeff_window_lower_ccx":148784,"by_streaming_limb_folded_k16_failures":64,"by_streaming_limb_folded_state_bits":1088,"by_streaming_limb_k8_failures":64,"by_streaming_limb_samples":64,"by_streaming_limb_state_bits":1152,"by_streaming_separate_b8_failures":16,"by_streaming_separate_c1_15_failures":64,"by_streaming_separate_state_bits":816,"by_streaming_tail_b_workspace_bits":288,"by_streaming_tail_c_core_bits":528,"by_tail_ratio_bits":304,"by_tail_ratio_samples":64,"by_tapered_direct_compute_ccx":1004080,"by_tapered_direct_compute_uncompute_ccx":2008160,"by_tapered_direct_peak":3372,"by_tapered_direct_two_denominators_ccx":4016320,"by_tests_passed":111,"by_truncated_xcolumn_width_bits":144,"centered_body_bench_avg_toffoli":4985518,"centered_body_bench_emitted_ops":38874541,"centered_body_bench_qubits":2716,"centered_body_replay_ccx":873600,"centered_budget_if_folded":2640622,"centered_clean_all_exact_peak":2464,"centered_clean_all_exact_roundtrip_ccx":3199280,"centered_clean_roundtrip_bench_altseed_phase":0,"centered_clean_roundtrip_bench_avg_clifford":32532302.269,"centered_clean_roundtrip_bench_avg_toffoli":7311738,"centered_clean_roundtrip_bench_emitted_ops":42092380,"centered_clean_roundtrip_bench_qubits":2976,"centered_denom_controls_bench_altseed_phase":0,"centered_denom_controls_bench_avg_clifford":44313822.825,"centered_denom_controls_bench_avg_toffoli":7868378,"centered_denom_controls_bench_emitted_ops":55824052,"centered_denom_controls_bench_qubits":4964,"centered_exact_parity_fast_signed_roundtrip_ccx":2618000,"centered_fast_clean_increment_toffoli":1747760,"centered_fast_clean_roundtrip_bench_altseed_phase":0,"centered_fast_clean_roundtrip_bench_avg_clifford":38190533.993,"centered_fast_clean_roundtrip_bench_avg_toffoli":5860218,"centered_fast_clean_roundtrip_bench_emitted_ops":47024860,"centered_fast_clean_roundtrip_bench_qubits":3235,"centered_fixed_trace_hook_phase":0,"centered_inverse_replay_ccx":873600,"centered_live_num_bench_altseed_phase":0,"centered_live_num_bench_avg_clifford":44320460.712,"centered_live_num_bench_avg_toffoli":7870438,"centered_live_num_bench_emitted_ops":55834807,"centered_live_num_bench_qubits":4965,"centered_negpatch_phase_saw0":1,"centered_negpatch_phase_saw1":1,"centered_pair12_fast_accum_avg_toffoli":12246560,"centered_pair12_fast_accum_emitted_ops":72997701,"centered_pair12_fast_accum_qubits":5589,"centered_pair12_replace_avg_toffoli":12251174,"centered_pair12_replace_emitted_ops":72970707,"centered_pair12_replace_qubits":5589,"centered_pair12_window_denom_avg_toffoli":13483808,"centered_pair12_window_denom_emitted_ops":79499589,"centered_pair12_window_denom_qubits":5589,"centered_pair12_window_q_payload_avg_toffoli":13483808,"centered_pair12_window_q_payload_emitted_ops":79514277,"centered_pair12_window_q_payload_qubits":8037,"centered_pair1_fast_accum_avg_toffoli":8171417,"centered_pair1_fast_accum_emitted_ops":51826551,"centered_pair1_fast_accum_qubits":5589,"centered_pair1_replace_altseed_classical":0,"centered_pair1_replace_altseed_phase":0,"centered_pair1_replace_avg_clifford":40780745.214,"centered_pair1_replace_avg_toffoli":8172700,"centered_pair1_replace_emitted_ops":51801485,"centered_pair1_replace_qubits":5589,"centered_pair1_window_denom_avg_toffoli":8790041,"centered_pair1_window_denom_emitted_ops":55077495,"centered_pair1_window_denom_qubits":5589,"centered_pair1_window_q18_avg_toffoli":8790881,"centered_pair1_window_q18_emitted_ops":55108598,"centered_pair1_window_q18_qubits":6885,"centered_pair1_window_q_payload_avg_toffoli":8790041,"centered_pair1_window_q_payload_emitted_ops":55084839,"centered_pair1_window_q_payload_qubits":8037,"centered_pair2_fast_accum_avg_toffoli":8187601,"centered_pair2_fast_accum_emitted_ops":51944268,"centered_pair2_fast_accum_qubits":5589,"centered_pair2_replace_altseed_classical":0,"centered_pair2_replace_altseed_phase":0,"centered_pair2_replace_avg_clifford":40876699.034,"centered_pair2_replace_avg_toffoli":8189908,"centered_pair2_replace_emitted_ops":51930771,"centered_pair2_replace_qubits":5589,"centered_pair2_window_denom_avg_toffoli":8806225,"centered_pair2_window_denom_emitted_ops":55195212,"centered_pair2_window_denom_qubits":5589,"centered_pair2_window_q_payload_avg_toffoli":8806225,"centered_pair2_window_q_payload_emitted_ops":55202556,"centered_pair2_window_q_payload_qubits":8037,"centered_phase96_all_exact_ccx":548448,"centered_phase96_exact_parity_ccx":448800,"centered_phase96_exact_signed_ccx":399264,"centered_phase96_fast_mbu_ccx":299616,"consumed_branchless_depth16_predecessor_patterns":589824,"consumed_branchless_depth16_predecessor_states":589824,"correctness_ok":1,"destructive_montgomery_reverse_frontier_n10":2042,"destructive_montgomery_reverse_frontier_n12":8186,"destructive_montgomery_test_passed":1,"destructive_montgomery_window_preimages":512,"emitted_ops":30575944,"inverse_negr_ccx":1145760,"kaliski_a_coeff_anf_degree_n12":12,"kaliski_a_coeff_anf_density_n12":2094,"kaliski_branch_oracle_degree_n12":11,"kaliski_branch_oracle_density_n12":1976,"kaliski_coeff_channel_altseed_phase_batches":1,"kaliski_coeff_pair_affine_relation_det_nonzero":1,"kaliski_selected_matrix_lb_t16":3627936,"kaliski_selected_matrix_lb_t4":4186080,"kaliski_selected_matrix_lb_t8":3767472,"kaliski_selected_matrix_window_ccx_t16":139536,"lambda_sqrt_phase_degree_n12":12,"lambda_sqrt_phase_density_n12":2072,"last_shot_fixed_window_max_ccx":27641,"last_shot_fixed_window_max_peak":2224,"last_shot_fixed_window_mean_ccx":20323.5,"last_shot_fixed_window_p90_ccx":24382,"last_shot_two_denominators_ccx":1463292,"mbuc_montgomery_qhistory_output_degree":16,"mbuc_montgomery_qhistory_output_density":31032,"mbuc_montgomery_qhistory_xy_degree":16,"mbuc_montgomery_qhistory_xy_density":2440,"mbuc_old_point_phase_degree":15,"mbuc_old_point_phase_density":19540,"mbuc_quotient_phase_anf_density":32518,"mbuc_quotient_phase_degree":15,"mbuc_quotient_phase_truth_table":65536,"mbuc_sequential_old_y_min_degree_n10":3,"mbuc_support_curve_min_degree_n10":4,"mbuc_support_curve_min_degree_n12":4,"qubits":2713,"scaled_pair2_product_avg_clifford":35226095.994,"scaled_pair2_product_avg_toffoli":8038619,"scaled_pair2_product_emitted_ops":49073481,"scaled_pair2_product_qubits":4236,"secp256k1_order_mod2":1,"secp256k1_order_mod3":1,"signed_copy_fast_phase_batches":1,"strategy_e_current_known_total":2988510,"strategy_e_if_new_inplace_mul":2022750,"strategy_e_needed_mul_saving":965760,"strategy_e_tests_passed":2,"toy_full_poststate_branch_conflicts_n6":5760,"two_fast_replay_projected":2637286},"status":"keep","description":"Invalidate direct initial-x branch-history oracle for self-cleaning Kaliski as dense","timestamp":1777485350333,"segment":3,"confidence":7.057315668202765,"iterationTokens":14062,"asi":{"hypothesis":"Although branch history is deterministic from the preserved initial denominator x, maybe a compressed self-cleaning Kaliski can regenerate branch bits from x using a small direct oracle instead of storing history.","result":"Toy branch-history parity as a function of x is high-degree/dense: n=8 degree 8 density 116/256, n=10 degree 10 density 520/1024, n=12 degree 11 density 1976/4096. Direct x-to-history oracle is essentially rerunning Kaliski, not a tiny gadget.","next_action_hint":"Do not rely on direct compressed x-to-branch oracles. Kaliski history compression must use explicit encoded history/pebbling or a different transform, not a cheap Boolean shortcut from x."}}
{"run":372,"commit":"87fc335","metric":4089274,"metrics":{"altseed_ancilla_batches_total":0,"altseed_classical_total":0,"altseed_phase_batches_total":0,"attempted_pair2_560_altseed_phase_batches":1,"attempted_q18_altseed_phase_batches":1,"attempted_q_local_altseed_phase_batches":1,"avg_clifford":24292787.153,"by_denpair_fixed_schedule_sidecar_bits":50,"by_denpair_fixed_schedule_worst_step":560,"by_denpair_history_max_converge":558,"by_denpair_history_samples":8192,"by_denpair_history_selector_bits_with_signs":564,"by_denpair_history_sidecar_bits":50,"by_direct_denpair_projected_total_with_replay_scaffold":3793920,"by_first16_carry_plus_fixed_bits":736,"by_first16_pattern_entropy_bits":195.4,"by_first16_pattern_fixed_bits":208,"by_fixed_matrix_den_compute_ccx":303828,"by_fixed_matrix_den_compute_uncompute_ccx":607657,"by_fixed_matrix_den_peak":3424,"by_full_ratio_bits":560,"by_full_ratio_constmul_add_widths":110720,"by_full_ratio_constmul_roundtrip_1t":221440,"by_full_ratio_constmul_roundtrip_2t":442880,"by_full_ratio_pinverse_popcount":305,"by_full_ratio_samples":64,"by_projective_streaming_failures":64,"by_projective_streaming_state_bits":816,"by_ratio_a_anf_degree":14,"by_ratio_a_anf_density":7268,"by_ratio_a_max_steps":149,"by_ratio_a_mean_steps":132,"by_ratio_a_serial_proxy_max":8892998,"by_ratio_a_serial_proxy_mean":7307490,"by_ratio_window32_samples":1088,"by_ratio_window32_v2_le4":822,"by_ratio_window_m01_v2_1":347,"by_ratio_window_m01_v2_2":673,"by_ratio_window_m01_v2_3":380,"by_ratio_window_m01_v2_ge16":92,"by_ratio_window_samples":2240,"by_replay_bench_avg_toffoli":5278510,"by_replay_bench_emitted_ops":42250936,"by_replay_bench_qubits":2716,"by_selected_varcoeff_one_coeff_ccx":18598,"by_selected_varcoeff_peak":2123,"by_selected_varcoeff_window_lower_ccx":148784,"by_streaming_limb_folded_k16_failures":64,"by_streaming_limb_folded_state_bits":1088,"by_streaming_limb_k8_failures":64,"by_streaming_limb_samples":64,"by_streaming_limb_state_bits":1152,"by_streaming_separate_b8_failures":16,"by_streaming_separate_c1_15_failures":64,"by_streaming_separate_state_bits":816,"by_streaming_tail_b_workspace_bits":288,"by_streaming_tail_c_core_bits":528,"by_tail_ratio_bits":304,"by_tail_ratio_samples":64,"by_tapered_direct_compute_ccx":1004080,"by_tapered_direct_compute_uncompute_ccx":2008160,"by_tapered_direct_peak":3372,"by_tapered_direct_two_denominators_ccx":4016320,"by_tests_passed":111,"by_truncated_xcolumn_width_bits":144,"centered_body_bench_avg_toffoli":4985518,"centered_body_bench_emitted_ops":38874541,"centered_body_bench_qubits":2716,"centered_body_replay_ccx":873600,"centered_budget_if_folded":2640622,"centered_clean_all_exact_peak":2464,"centered_clean_all_exact_roundtrip_ccx":3199280,"centered_clean_roundtrip_bench_altseed_phase":0,"centered_clean_roundtrip_bench_avg_clifford":32532302.269,"centered_clean_roundtrip_bench_avg_toffoli":7311738,"centered_clean_roundtrip_bench_emitted_ops":42092380,"centered_clean_roundtrip_bench_qubits":2976,"centered_denom_controls_bench_altseed_phase":0,"centered_denom_controls_bench_avg_clifford":44313822.825,"centered_denom_controls_bench_avg_toffoli":7868378,"centered_denom_controls_bench_emitted_ops":55824052,"centered_denom_controls_bench_qubits":4964,"centered_exact_parity_fast_signed_roundtrip_ccx":2618000,"centered_fast_clean_increment_toffoli":1747760,"centered_fast_clean_roundtrip_bench_altseed_phase":0,"centered_fast_clean_roundtrip_bench_avg_clifford":38190533.993,"centered_fast_clean_roundtrip_bench_avg_toffoli":5860218,"centered_fast_clean_roundtrip_bench_emitted_ops":47024860,"centered_fast_clean_roundtrip_bench_qubits":3235,"centered_fixed_trace_hook_phase":0,"centered_inverse_replay_ccx":873600,"centered_live_num_bench_altseed_phase":0,"centered_live_num_bench_avg_clifford":44320460.712,"centered_live_num_bench_avg_toffoli":7870438,"centered_live_num_bench_emitted_ops":55834807,"centered_live_num_bench_qubits":4965,"centered_negpatch_phase_saw0":1,"centered_negpatch_phase_saw1":1,"centered_pair12_fast_accum_avg_toffoli":12246560,"centered_pair12_fast_accum_emitted_ops":72997701,"centered_pair12_fast_accum_qubits":5589,"centered_pair12_replace_avg_toffoli":12251174,"centered_pair12_replace_emitted_ops":72970707,"centered_pair12_replace_qubits":5589,"centered_pair12_window_denom_avg_toffoli":13483808,"centered_pair12_window_denom_emitted_ops":79499589,"centered_pair12_window_denom_qubits":5589,"centered_pair12_window_q_payload_avg_toffoli":13483808,"centered_pair12_window_q_payload_emitted_ops":79514277,"centered_pair12_window_q_payload_qubits":8037,"centered_pair1_fast_accum_avg_toffoli":8171417,"centered_pair1_fast_accum_emitted_ops":51826551,"centered_pair1_fast_accum_qubits":5589,"centered_pair1_replace_altseed_classical":0,"centered_pair1_replace_altseed_phase":0,"centered_pair1_replace_avg_clifford":40780745.214,"centered_pair1_replace_avg_toffoli":8172700,"centered_pair1_replace_emitted_ops":51801485,"centered_pair1_replace_qubits":5589,"centered_pair1_window_denom_avg_toffoli":8790041,"centered_pair1_window_denom_emitted_ops":55077495,"centered_pair1_window_denom_qubits":5589,"centered_pair1_window_q18_avg_toffoli":8790881,"centered_pair1_window_q18_emitted_ops":55108598,"centered_pair1_window_q18_qubits":6885,"centered_pair1_window_q_payload_avg_toffoli":8790041,"centered_pair1_window_q_payload_emitted_ops":55084839,"centered_pair1_window_q_payload_qubits":8037,"centered_pair2_fast_accum_avg_toffoli":8187601,"centered_pair2_fast_accum_emitted_ops":51944268,"centered_pair2_fast_accum_qubits":5589,"centered_pair2_replace_altseed_classical":0,"centered_pair2_replace_altseed_phase":0,"centered_pair2_replace_avg_clifford":40876699.034,"centered_pair2_replace_avg_toffoli":8189908,"centered_pair2_replace_emitted_ops":51930771,"centered_pair2_replace_qubits":5589,"centered_pair2_window_denom_avg_toffoli":8806225,"centered_pair2_window_denom_emitted_ops":55195212,"centered_pair2_window_denom_qubits":5589,"centered_pair2_window_q_payload_avg_toffoli":8806225,"centered_pair2_window_q_payload_emitted_ops":55202556,"centered_pair2_window_q_payload_qubits":8037,"centered_phase96_all_exact_ccx":548448,"centered_phase96_exact_parity_ccx":448800,"centered_phase96_exact_signed_ccx":399264,"centered_phase96_fast_mbu_ccx":299616,"consumed_branchless_depth16_predecessor_patterns":589824,"consumed_branchless_depth16_predecessor_states":589824,"correctness_ok":1,"destructive_montgomery_reverse_frontier_n10":2042,"destructive_montgomery_reverse_frontier_n12":8186,"destructive_montgomery_test_passed":1,"destructive_montgomery_window_preimages":512,"emitted_ops":30575944,"inverse_negr_ccx":1145760,"kaliski_a_coeff_anf_degree_n12":12,"kaliski_a_coeff_anf_density_n12":2094,"kaliski_branch_history_entropy_floor_bits":256,"kaliski_branch_history_secp_unique_samples":4096,"kaliski_branch_oracle_degree_n12":11,"kaliski_branch_oracle_density_n12":1976,"kaliski_coeff_channel_altseed_phase_batches":1,"kaliski_coeff_pair_affine_relation_det_nonzero":1,"kaliski_selected_matrix_lb_t16":3627936,"kaliski_selected_matrix_lb_t4":4186080,"kaliski_selected_matrix_lb_t8":3767472,"kaliski_selected_matrix_window_ccx_t16":139536,"lambda_sqrt_phase_degree_n12":12,"lambda_sqrt_phase_density_n12":2072,"last_shot_fixed_window_max_ccx":27641,"last_shot_fixed_window_max_peak":2224,"last_shot_fixed_window_mean_ccx":20323.5,"last_shot_fixed_window_p90_ccx":24382,"last_shot_two_denominators_ccx":1463292,"mbuc_montgomery_qhistory_output_degree":16,"mbuc_montgomery_qhistory_output_density":31032,"mbuc_montgomery_qhistory_xy_degree":16,"mbuc_montgomery_qhistory_xy_density":2440,"mbuc_old_point_phase_degree":15,"mbuc_old_point_phase_density":19540,"mbuc_quotient_phase_anf_density":32518,"mbuc_quotient_phase_degree":15,"mbuc_quotient_phase_truth_table":65536,"mbuc_sequential_old_y_min_degree_n10":3,"mbuc_support_curve_min_degree_n10":4,"mbuc_support_curve_min_degree_n12":4,"qubits":2713,"scaled_pair2_product_avg_clifford":35226095.994,"scaled_pair2_product_avg_toffoli":8038619,"scaled_pair2_product_emitted_ops":49073481,"scaled_pair2_product_qubits":4236,"secp256k1_order_mod2":1,"secp256k1_order_mod3":1,"signed_copy_fast_phase_batches":1,"strategy_e_current_known_total":2988510,"strategy_e_if_new_inplace_mul":2022750,"strategy_e_needed_mul_saving":965760,"strategy_e_tests_passed":2,"toy_full_poststate_branch_conflicts_n6":5760,"two_fast_replay_projected":2637286},"status":"keep","description":"Establish 256-bit information floor for exact Kaliski branch-history compression","timestamp":1777485813468,"segment":3,"confidence":7.057315668202765,"iterationTokens":10784,"asi":{"hypothesis":"Maybe exact Kaliski branch history can be compressed far below raw 407 bits, making branch-stream/pebbled DIV viable without needing a cheap branch oracle.","result":"Complete branch sequences are injective in exhaustive toy fields and collision-free on 4096 secp samples, so exact branch-history payload has a ~log2(p)=256-bit floor. This can save at most ~150 bits from raw m_hist, not collapse to ~64-100 bits.","next_action_hint":"History-only compression is insufficient for low-qubit SOTA unless combined with major state folding. Focus on different transforms or explicit 256-bit history designs only if their arithmetic also beats current Kaliski."}}
