{"run":510,"commit":"9bd7778","metric":13133,"metrics":{"by_tail_carry_fresh_unique_matrices":1116,"by_tail_carry_fresh_window_min_ccx":558,"by_tail_carry_fresh_window_max_ccx":7308,"by_tail_carry_fresh_mean_ccx":75313.797,"by_tail_carry_fresh_p90_ccx":79425,"by_tail_carry_fresh_p99_ccx":89291,"by_tail_carry_fresh_max_ccx":89291,"altseed_classical_total":0,"altseed_phase_batches_total":0,"altseed_ancilla_batches_total":0,"avg_toffoli":4089274,"avg_clifford":24292787.153,"qubits":2713,"emitted_ops":30575944,"correctness_ok":1},"status":"keep","description":"Demote BY first16/tail low-gate after fresh carry circuit cost","timestamp":1777591690341,"segment":76,"confidence":null,"iterationTokens":175,"asi":{"hypothesis":"Run the promised actual-circuit checkpoint for BY first16/tail low-gate before allowing more work on it.","result":"Targeted test and full harness passed. A generous forward-only fresh-row tail carry update circuit, using fixed known matrices and no old-row cleanup/reversibility/control charge, has p90/p99/max 79,425/89,291/89,291 CCX over the 19 tail windows. The low-gate route only had 66,292 CCX left after one-pass first16 pattern generation, so this misses by +13,133 at p90 before real overhead. BY first16/tail is demoted.","next_action_hint":"Do not continue BY first16/tail. BY can only revive through a fundamentally cheaper selected/window-local denominator primitive below ~10k/window, not this tail carry split."}}
{"type":"config","name":"plusminus unordered signed recurrence shift lower bound","metricName":"plusminus_unordered_signed_den_shift_only_gap_ccx","metricUnit":"","bestDirection":"lower"}
{"run":511,"commit":"b55e85a","metric":670736,"metrics":{"plusminus_unordered_signed_p99_steps":570,"plusminus_unordered_signed_max_steps":602,"plusminus_unordered_signed_p99_scale":1080,"plusminus_unordered_signed_max_scale":1131,"plusminus_unordered_signed_max_den_width":256,"plusminus_unordered_signed_max_k":28,"plusminus_unordered_signed_den_shift_only_total_ccx":3370736,"altseed_classical_total":0,"altseed_phase_batches_total":0,"altseed_ancilla_batches_total":0,"avg_toffoli":4089274,"avg_clifford":24292787.153,"qubits":2713,"emitted_ops":30575944,"correctness_ok":1},"status":"keep","description":"Kill no-order signed plusminus by denominator-shift lower bound","timestamp":1777592140041,"segment":77,"confidence":null,"iterationTokens":167,"asi":{"hypothesis":"A signed unordered plus-minus recurrence might remove ordering compare/cswap and persistent direction controls, potentially changing the denominator blocker.","result":"Targeted test and full harness passed. The recurrence keeps denominators within 256 bits and converges, but p99 steps rise to 570 and p99 scale to 1080. Charging only one signed 257-bit denominator barrel shift per step, and ignoring coefficient shifts/history/scale/control, already projects 3,370,736 CCX with gap +670,736 to 2.7M. Thus removing ordering without eliminating denominator shifts is not enough.","next_action_hint":"Do not pursue unordered signed plusminus. Future plusminus revival must genuinely eliminate data-dependent denominator shifts, not merely remove compare/direction."}}
{"type":"config","name":"BY fixed window free m/q lower bound","metricName":"by_fixed_window_free_mq_gap_to_target_ccx","metricUnit":"","bestDirection":"lower"}
{"run":512,"commit":"c11f617","metric":8138.583,"metrics":{"by_fixed_window_free_mq_mean_ccx":18138.583,"by_fixed_window_free_mq_p90_ccx":23933,"by_fixed_window_free_mq_max_ccx":26330,"by_fixed_window_free_mq_max_peak":2224,"altseed_classical_total":0,"altseed_phase_batches_total":0,"altseed_ancilla_batches_total":0,"avg_toffoli":4089274,"avg_clifford":24292787.153,"qubits":2713,"emitted_ops":30575944,"correctness_ok":1},"status":"keep","description":"Show free m/q oracle still leaves BY fixed-window arithmetic over target","timestamp":1777592633185,"segment":78,"confidence":null,"iterationTokens":170,"asi":{"hypothesis":"If BY selected fixed-window denominator generation is only blocked by selector/history production, then granting clean m0/m1/q0/q1 history bits should bring the reversible row-replacement window close to the ~10k CCX target.","result":"Even with m/q provided cleanly, exact row formation plus old-row cleanup costs mean 18138.6 CCX/window, p90 23933, max 26330, +8138.6 over the 10k target before selector or m/q generation.","decision":"Demote current fixed-matrix/q denominator window arithmetic; a BY revival needs a fundamentally different selected/window-local primitive, not a better selector around this row-replacement circuit.","user_tolerance_update":"Future approximate classical-control probes may allow up to ~1% classical mismatches, but phase cleanliness and ancilla cleanup remain mandatory."}}
{"type":"config","name":"BY 1% approximate cutoff lowword near-miss","metricName":"by_approx_1pct_best_projected_gap_ccx","metricUnit":"","bestDirection":"lower"}
{"run":513,"commit":"bdd3f16","metric":23975,"metrics":{"by_approx_1pct_best_cutoff_steps":549,"by_approx_1pct_best_fail_ppm":7720,"by_approx_1pct_aligned_cutoff_steps":560,"by_approx_1pct_aligned_projected_gap_ccx":65676,"by_approx_fail544_ppm":43040,"by_approx_fail550_ppm":6200,"by_approx_fail560_ppm":80,"altseed_classical_total":0,"altseed_phase_batches_total":0,"altseed_ancilla_batches_total":0,"avg_toffoli":4089274,"avg_clifford":24292787.153,"qubits":2713,"emitted_ops":30575944,"correctness_ok":1},"status":"keep","description":"Check 1% classical tolerance on old BY lowword near-miss","timestamp":1777592939603,"segment":79,"confidence":null,"iterationTokens":178,"asi":{"hypothesis":"Given the user's 1% classical-mismatch tolerance and Gidney 2025's approximate-arithmetic framing, maybe a shorter fixed BY cap can close the old fully charged scratch600 lowword-selector near-miss while remaining phase/ancilla clean as a fixed circuit.","result":"Best sampled cutoff with <=1% nonconvergence is 549 steps at 7720 ppm, but the old fully charged lowword-selector BY model still projects +23975 CCX over 2.7M; whole 16-step-window alignment remains 560 steps with the old +65676 gap.","paper_note":"arXiv:2505.15917 suggests clean approximate controls/truncation plus masking, not dirty cleanup. For point-add there is no period-finding mask, so only classical nonconvergence/wrong-output events are relaxable; phase and ancilla must still be exact.","next_action_hint":"Use the 1% tolerance only for routes that produce a clean fixed circuit with bounded classical failure, e.g. approximate branch/control generation; do not drop affine output bits or leave approximation residue entangled."}}
{"type":"config","name":"BY 1% point-add two-denominator cutoff budget","metricName":"by_approx_pointadd_projected_gap_ccx","metricUnit":"","bestDirection":"lower"}
{"run":514,"commit":"494bb80","metric":31557,"metrics":{"by_approx_pointadd_cutoff_steps":551,"by_approx_pointadd_per_den_fail_ppm":4040,"by_approx_pointadd_union_fail_ppm":8080,"by_approx_pointadd_independent_fail_ppm":8064,"by_approx_pointadd_independent_cutoff_steps":551,"by_approx_pointadd_independent_gap_ccx":31557,"by_approx_pointadd_fail550_ppm":6320,"by_approx_pointadd_fail552_ppm":3180,"altseed_classical_total":0,"altseed_phase_batches_total":0,"altseed_ancilla_batches_total":0,"avg_toffoli":4089274,"avg_clifford":24292787.153,"qubits":2713,"emitted_ops":30575944,"correctness_ok":1},"status":"keep","description":"Account two-denominator failure for loose approximate BY cutoff","timestamp":1777593119693,"segment":80,"confidence":null,"iterationTokens":171,"asi":{"hypothesis":"If approximate BY cap errors are allowed, point-add should account for two denominators; a union-bound cutoff may still trim steps enough to fund the old lowword near-miss.","result":"Two-denominator 1% union-bound cutoff is 551 steps, per-denominator failure 4040 ppm, point-add union failure 8080 ppm, and projected gap remains +31557 CCX over 2.7M.","user_correction":"User clarified that 9024 random tests must pass; 1% was only a loose number. Percent-level/8080ppm point-add failure is not acceptable for the harness, so future approximate routes must target well below 1/9024 point-add failure while keeping phase and ancilla exact.","next_action_hint":"Run a stricter harness-scale ppm cutoff model; expect it to require near-560 steps and leave the old lowword BY gap essentially unchanged."}}
{"type":"config","name":"BY harness-scale approximate cutoff budget","metricName":"by_approx_harness_projected_gap_ccx","metricUnit":"","bestDirection":"lower"}
{"run":515,"commit":"ee28c41","metric":80840,"metrics":{"by_approx_harness_100ppm_cutoff_steps":561,"by_approx_harness_100ppm_union_fail_ppm":100,"by_approx_harness_100ppm_projected_gap_ccx":69467,"by_approx_harness_20ppm_cutoff_steps":564,"by_approx_harness_20ppm_union_fail_ppm":0,"by_approx_harness_fail556_ppm":530,"by_approx_harness_fail560_ppm":90,"by_approx_harness_fail564_ppm":0,"by_approx_harness_fail568_ppm":0,"altseed_classical_total":0,"altseed_phase_batches_total":0,"altseed_ancilla_batches_total":0,"avg_toffoli":4089274,"avg_clifford":24292787.153,"qubits":2713,"emitted_ops":30575944,"correctness_ok":1},"status":"keep","description":"Kill approximate BY cutoff savings under harness-scale failure target","timestamp":1777593280770,"segment":81,"confidence":null,"iterationTokens":167,"asi":{"hypothesis":"With the user's clarification that 9024 random tests must pass, a harness-scale ppm target should force BY approximate cutoff close to 560+ steps and erase the apparent percent-level savings.","result":"On 100k denominators, 556 steps still has 530 ppm single-denominator failure and 560 has 90 ppm. A <=20 ppm point-add union target needs 564 steps and leaves +80840 CCX over 2.7M in the old fully charged lowword BY model; even 100 ppm point-add target leaves +69467.","decision":"Approximate fixed BY cutoff does not rescue the old lowword-selector near-miss. Any future approximate route must reduce selector/denominator structure, not rely on percent-level convergence trimming.","user_correction_applied":"All 9024 random tests must pass; use harness-scale ppm-or-better classical failure while preserving exact phase and ancilla cleanup."}}
{"type":"config","name":"BY truncated lowword pattern approximation","metricName":"by_trunc_lowword_trajectory_mismatch_t15_ppm","metricUnit":"","bestDirection":"lower"}
{"run":516,"commit":"3ea9a4e","metric":1000000,"metrics":{"by_trunc_lowword_window_mismatch_t8_ppm":944064,"by_trunc_lowword_window_mismatch_t12_ppm":882697,"by_trunc_lowword_window_mismatch_t14_ppm":703958,"by_trunc_lowword_window_mismatch_t15_ppm":468991,"by_trunc_lowword_trajectory_mismatch_t14_ppm":1000000,"by_trunc_lowword_selector_saving_t14_ccx":26040,"by_trunc_lowword_selector_saving_t15_ccx":13020,"altseed_classical_total":0,"altseed_phase_batches_total":0,"altseed_ancilla_batches_total":0,"avg_toffoli":4089274,"avg_clifford":24292787.153,"qubits":2713,"emitted_ops":30575944,"correctness_ok":1},"status":"keep","description":"Kill truncated lowword BY pattern approximation","timestamp":1777593534605,"segment":82,"confidence":null,"iterationTokens":166,"asi":{"hypothesis":"Gidney-style truncation might reduce BY lowword pattern-oracle cost if a 16-step branch pattern can be predicted from fewer than 16 low bits with harness-scale error.","result":"It fails badly: using 15 low bits mismatches 468991 ppm of windows and every sampled 35-window trajectory while saving only 13020 CCX of selector cost; 14 bits saves 26040 but mismatches every trajectory as well.","decision":"Do not pursue truncated lowword branch patterns. BY selector production depends on exact 2-adic low bits, unlike high-bit approximate residue accumulation in arXiv:2505.15917.","next_action_hint":"If using Gidney 2025 ideas, focus on clean phase-task deferral or underflow-flag arithmetic, not truncating BY branch low bits."}}
{"type":"config","name":"BY partial-prefix qoffset low-scratch replay","metricName":"by_partial_prefix_qoffset_projected32_gap_ccx","metricUnit":"","bestDirection":"lower"}
{"run":517,"commit":"e8a5059","metric":-10204,"metrics":{"by_partial_prefix_qoffset_cost0_ccx":2542,"by_partial_prefix_qoffset_cost32_ccx":2384,"by_partial_prefix_qoffset_cost48_ccx":2304,"by_partial_prefix_qoffset_peak32":802,"by_partial_prefix_qoffset_scratch32":542,"by_partial_prefix_qoffset_scratch48":558,"by_partial_prefix_qoffset_projected48_gap_ccx":-55324,"altseed_classical_total":0,"altseed_phase_batches_total":0,"altseed_ancilla_batches_total":0,"avg_toffoli":4089274,"avg_clifford":24292787.153,"qubits":2713,"emitted_ops":30575944,"correctness_ok":1},"status":"keep","description":"Test partial-prefix qoffset masks for low-scratch BY replay","timestamp":1777593895227,"segment":83,"confidence":null,"iterationTokens":173,"asi":{"hypothesis":"A small clean prefix of ctrl&offset mask bits can reduce the streamed-mask dirty qoffset adder enough to close the old low-scratch BY replay near-miss while keeping scratch under 600.","result":"Targeted test passed: prefix32 cost=2384 CCX, scratch model 542q, projected gap=-10204; prefix48 cost=2304, scratch 558q, projected gap=-55324. Small-n basis/phase/dirty restoration simulation passed.","caveat":"Projection used the old 35-window selector/decode constants while harness-scale cutoff was set to 564 steps; exact whole-window accounting should use 36 windows. Follow-up must correct this before treating the route as active.","next_action_hint":"Immediately rerun with ceil(564/16)=36 selector/decode windows and update ideas/frontier if the margin survives."}}
{"type":"config","name":"BY partial-prefix qoffset exact-window budget","metricName":"by_partial_prefix_qoffset_projected32_gap_ccx","metricUnit":"","bestDirection":"lower"}
{"run":518,"commit":"6573a7b","metric":-2476,"metrics":{"by_partial_prefix_qoffset_cost0_ccx":2542,"by_partial_prefix_qoffset_cost32_ccx":2384,"by_partial_prefix_qoffset_cost48_ccx":2304,"by_partial_prefix_qoffset_cost64_ccx":2224,"by_partial_prefix_qoffset_cost80_ccx":2144,"by_partial_prefix_qoffset_peak32":802,"by_partial_prefix_qoffset_windows":36,"by_partial_prefix_qoffset_selector_ccx":214272,"by_partial_prefix_qoffset_decoder_ccx":63936,"by_partial_prefix_qoffset_scratch32":542,"by_partial_prefix_qoffset_scratch48":558,"by_partial_prefix_qoffset_scratch64":574,"by_partial_prefix_qoffset_scratch80":590,"by_partial_prefix_qoffset_projected48_gap_ccx":-47596,"by_partial_prefix_qoffset_projected64_gap_ccx":-92716,"by_partial_prefix_qoffset_projected80_gap_ccx":-137836,"altseed_classical_total":0,"altseed_phase_batches_total":0,"altseed_ancilla_batches_total":0,"avg_toffoli":4089274,"avg_clifford":24292787.153,"qubits":2713,"emitted_ops":30575944,"correctness_ok":1},"status":"keep","description":"Correct partial-prefix qoffset budget to 36 selector windows","timestamp":1777594100530,"segment":84,"confidence":null,"iterationTokens":172,"asi":{"hypothesis":"After correcting the selector/decode accounting from 35 to ceil(564/16)=36 windows, partial-prefix qoffset masks may still keep the low-scratch BY replay below 2.7M.","result":"Corrected budget still passes: prefix32 scratch 542 projects -2476 CCX; prefix48 scratch 558 projects -47596; prefix64 scratch 574 projects -92716; prefix80 scratch 590 projects -137836. Lowword selector=214272 and decoder=63936 are now charged for 36 windows.","decision":"Partial-prefix qoffset becomes a promising but not-yet-integrated BY hard-piece candidate. It should be pursued only through production scheduling/cleanup tests, not direct full hook-up.","next_action_hint":"Next hardest gate: verify prefix-mask qoffset at more small widths/prefix lengths and then model whether compressed pattern history can coexist with prefix masks and lowword-oracle temporaries without hidden scratch double counting."}}
{"type":"config","name":"BY partial-prefix qoffset width validation","metricName":"by_partial_prefix_qoffset_best_gap_under600_ccx","metricUnit":"","bestDirection":"lower"}
{"run":519,"commit":"aaf3011","metric":-166036,"metrics":{"by_partial_prefix_qoffset_best_prefix_under600":90,"by_partial_prefix_qoffset_best_cost_under600_ccx":2094,"by_partial_prefix_qoffset_best_scratch_under600":600,"altseed_classical_total":0,"altseed_phase_batches_total":0,"altseed_ancilla_batches_total":0,"avg_toffoli":4089274,"avg_clifford":24292787.153,"qubits":2713,"emitted_ops":30575944,"correctness_ok":1},"status":"keep","description":"Validate partial-prefix qoffset across widths and find strict-scratch margin","timestamp":1777594293886,"segment":85,"confidence":null,"iterationTokens":172,"asi":{"hypothesis":"The partial-prefix qoffset primitive should remain phase/dirty clean beyond the original n=8 smoke test, and using the full strict scratch allowance may provide robust BY budget margin.","result":"Validation passed for n=8,10,12,16 across prefix cases including full mask. Best sampled prefix under strict 600 scratch is 90 bits, qoffset cost 2094 CCX, projected gap -166036 after charging 36 lowword selector/decode windows.","decision":"Partial-prefix qoffset remains promising enough for the next hard gate: scratch-overlap/scheduling with compressed pattern history and selector temporaries. Do not integrate into point-add yet.","next_action_hint":"Model/validate whether prefix masks can be allocated without double-counting the 481-bit compressed pattern history and the lowword oracle's 122q/262q local temporaries."}}
{"type":"config","name":"BY partial-prefix qoffset scratch schedule","metricName":"by_partial_prefix_schedule_peak","metricUnit":"","bestDirection":"lower"}
{"run":520,"commit":"c34b96e","metric":600,"metrics":{"by_partial_prefix_schedule_lowword_oracle_peak":122,"by_partial_prefix_schedule_lowword_oracle_ccx":5952,"by_partial_prefix_schedule_selector_peak_reuse":587,"by_partial_prefix_schedule_selector_peak_no_reuse":677,"by_partial_prefix_schedule_replay_peak":600,"altseed_classical_total":0,"altseed_phase_batches_total":0,"altseed_ancilla_batches_total":0,"avg_toffoli":4089274,"avg_clifford":24292787.153,"qubits":2713,"emitted_ops":30575944,"correctness_ok":1},"status":"keep","description":"Gate partial-prefix qoffset by explicit scratch temp-reuse schedule","timestamp":1777594478696,"segment":86,"confidence":null,"iterationTokens":165,"asi":{"hypothesis":"The prefix90 partial-prefix qoffset budget only fits if selector local temporaries reuse the same scratch region as prefix masks instead of being allocated simultaneously; this should be made explicit before any BY promotion.","result":"Schedule ledger passed but is tight: lowword oracle peak=122, selector peak with reuse=587, selector peak without reuse=677, replay peak=600. Therefore strict-600 fit requires explicit temp reuse/phase-clean sequencing.","decision":"Keep as a promising but fragile local hard-piece checkpoint, not a solved BY route. Full integration is still forbidden until compressed history, selector/decode production, denominator failure, and cleanup are all charged together.","user_skepticism":"User warned previous BY wiring blew up and suspects missing accounting. Added an explicit adversarial gate to ideas: no full BY hook-up unless two denominators, 36-window selector/decode, compressed history, prefix masks, temp overlaps, failure bound, and product-clean cleanup are simultaneously charged.","next_action_hint":"Run an adversarial all-in ledger for partial-prefix BY that deliberately includes the prior blow-up classes and tries to falsify the route before any wiring."}}
{"type":"config","name":"BY partial-prefix two-denominator adversarial ledger","metricName":"by_partial_prefix_two_den_gap_ccx","metricUnit":"","bestDirection":"lower"}
{"run":521,"commit":"30d6ce8","metric":1368262,"metrics":{"by_partial_prefix_one_div_total":2533964,"by_partial_prefix_one_div_gap_ccx":-166036,"by_partial_prefix_two_den_scaffold":285766,"by_partial_prefix_two_den_total":4068262,"by_partial_prefix_missing_second_den_swing_ccx":1534298,"altseed_classical_total":0,"altseed_phase_batches_total":0,"altseed_ancilla_batches_total":0,"avg_toffoli":4089274,"avg_clifford":24292787.153,"qubits":2713,"emitted_ops":30575944,"correctness_ok":1},"status":"keep","description":"Block naive BY promotion with two-denominator ledger","timestamp":1777594686289,"segment":87,"confidence":null,"iterationTokens":169,"asi":{"hypothesis":"User skepticism points to the likely missing cost: prior BY wiring blew up because a one-DIV/local replay budget did not charge the second denominator/product-clean replay. An adversarial two-denominator ledger should expose this if present.","result":"Confirmed. Prefix90 one-DIV model is 2533964 (-166036), but charging separate pair1 tagged-DIV and pair2 product-clean replay+selector/decode gives 4068262 (+1368262). Missing second-denominator assumption swings the budget by +1534298.","decision":"Demote partial-prefix qoffset from BY architecture candidate back to local primitive. No full BY hook-up unless a new charged algebra proves one replay/control stream replaces both denominators or otherwise deletes the second replay.","user_skepticism_resolution":"The user was right to be dubious; this was exactly the missing accounting class from prior BY blow-ups. Documentation and scratch frontier now mark partial-prefix rows as one-DIV-only and unsolved for point-add.","next_action_hint":"Pivot away from BY integration. If continuing BY at all, first search for a one-denominator/product-clean algebraic identity; otherwise return to non-BY structural primitives."}}
{"type":"config","name":"Partial-prefix one-DIV Strategy E budget","metricName":"by_partial_prefix_strategy_e_hyp_product_gap_ccx","metricUnit":"","bestDirection":"lower"}
