{"run":194,"commit":"aaf7bd9","metric":4132750,"metrics":{"altseed_classical_total":0,"altseed_phase_batches_total":0,"altseed_ancilla_batches_total":0,"avg_clifford":24414411.956,"qubits":2716,"emitted_ops":31193208,"correctness_ok":1},"status":"keep","description":"Discover approximate batched 2^-16 shift reopening BY jump DIV budget","timestamp":1777364624733,"segment":3,"confidence":2.910608871647833,"iterationTokens":4920,"asi":{"hypothesis":"The scaled BY modular coefficient channel was too expensive because current primitives perform 16 modular halvings and repeated source doubling. For secp256k1, a batched divide-by-2^16 may be cheap: compute m=-T*p^-1 mod 2^16, add sparse m*p, shift, and approximately uncompute m from top output bits.","result":"Added batched halve16 correction and cost-model tests. Classical test over 20k samples had 0 top-bit recovery failures; explicit rare exception T=1 has m=13617 but top=13616, with exception set about 2^48/p. Cost probe gives shift16≈1915 CCX. Combining this with the integer row+cleanup floor gives scaled modular BY pair/window≈10806 CCX and ≈378k for 35 windows, versus ≈2.05M with repeated modular halvings. All BY tests pass locally.","structural_learning":"Approximate batched 2^-16 shift is a concrete new structural primitive for BY: secp256k1's Solinas form makes m*p sparse, and the correction m is almost always recoverable from high output bits. This reopens a SOTA-shaped BY tagged-DIV path; a modular coefficient pair may be updated in the same cost class as the integer denominator pair.","approximation_model":"Failure occurs when T < m*(2^32+977), at most about 2^48/p for canonical row inputs, far below the user's 1% tolerance; still must be validated under actual row-value distributions in a real scaffold.","next_action_hint":"Implement a real env-gated approximate batched-shift row primitive for scaled BY coefficient rows, validate forward/reverse on simulator, then build a BY tagged-DIV scaffold. Watch for noncanonical/lazy row distributions that could increase the top-bit recovery exception rate."}}
{"run":195,"commit":"39801f4","metric":4132750,"metrics":{"altseed_classical_total":0,"altseed_phase_batches_total":0,"altseed_ancilla_batches_total":0,"avg_clifford":24414411.956,"qubits":2716,"emitted_ops":31193208,"correctness_ok":1},"status":"keep","description":"Extend BY batched shift to noncanonical row values with highfold","timestamp":1777364783838,"segment":3,"confidence":2.861699187441269,"iterationTokens":4920,"asi":{"hypothesis":"The cheap top-bit uncompute for batched 2^-16 was proven only for canonical T<p, but BY row accumulators are signed noncanonical values a*x+b*y. A sparse high-fold by k=T>>256 copies of p may canonicalize row values cheaply before the batched shift.","result":"Added highfold_then_batched_halve16_matches_row_distribution and updated the budget. Sampled BY row values had 0/40000 failures after highfold+batched halve16. Cost model: highfold≈1862 CCX, shift16≈1915 CCX, integer row+cleanup≈6976 CCX, scaled modular pair/window≈14530 CCX, 35-window modular pair≈508,553 CCX. Local BY tests pass.","structural_learning":"The approximate batched shift survives the noncanonical row distribution issue by first folding the row's high quotient using the same sparse Solinas p structure. Scaled BY modular row updates remain SOTA-shaped even after paying for highfold, around 0.5M for the modular pair rather than 2.05M.","approximation_model":"Canonical top-bit recovery has rare T<m*c exceptions; sampled BY row highfold had zero failures. Need validate in an actual reversible scaffold and account for signed highfold edge cases, but the probabilistic risk remains far below 1% in sampled distributions.","next_action_hint":"Promote the cost helper into a real approximate highfold+batched-shift primitive over 274-bit row temps. Then assemble one w=16 scaled BY window for the modular tagged channel and simulate basis cases before integrating a full 35-window tagged-DIV probe."}}
{"run":196,"commit":"1c74c18","metric":4132750,"metrics":{"altseed_classical_total":0,"altseed_phase_batches_total":0,"altseed_ancilla_batches_total":0,"avg_clifford":24414411.956,"qubits":2716,"emitted_ops":31193208,"correctness_ok":1},"status":"keep","description":"Validate actual batched-shift circuit and full windowed scaled BY tagged-DIV algebra","timestamp":1777364934940,"segment":3,"confidence":2.814406088611036,"iterationTokens":4920,"asi":{"hypothesis":"The reopened BY path needs more than cost models: the approximate batched 2^-16 shift should simulate correctly on basis states, and the 35-window scaled BY tagged-DIV algebra should match microstep inversion with acceptable failure.","result":"Added approximate_batched_halve16_canonical_circuit_matches_classical and windowed_scaled_by_tagged_division_matches_microstep_algebra. The actual canonical batched-shift circuit matches classical (T+m*p)/2^16 on 64 random basis states. The full w=16, 35-window scaled BY tagged-DIV algebra has 0/3000 sampled convergence failures at 560 steps, bottom channel zero, and output sign(f)*r-1=y/x. All 25 BY tests pass locally.","structural_learning":"The BY route is now a coherent algebraic design rather than only a distributional model: fixed 35 windows with scaled coefficient updates produce a clean tagged DIV under approximate convergence, and the batched-shift subprimitive has been simulated for canonical inputs.","remaining_gap":"This is still not a full point-add circuit. Missing pieces are coherent matrix selection/application for quantum low-key states, signed/noncanonical highfold circuit details, and integration with the affine scaffold under the 2800q cap.","next_action_hint":"Build one actual w=16 scaled BY window circuit for a fixed sampled matrix using row formation + highfold+batched shift on the modular tagged pair and scaled integer denominator update. Simulate forward/reverse for basis states, then generalize to selected matrices or a branch-key scaffold."}}
{"run":197,"commit":"d76a83a","metric":4132750,"metrics":{"altseed_classical_total":0,"altseed_phase_batches_total":0,"altseed_ancilla_batches_total":0,"avg_clifford":24414411.956,"qubits":2716,"emitted_ops":31193208,"correctness_ok":1},"status":"keep","description":"Refine BY batched-shift budget with modular cleanup highfolds","timestamp":1777364998656,"segment":3,"confidence":2.703658249993472,"iterationTokens":4920,"asi":{"hypothesis":"The previous BY modular-pair budget missed the fact that old-row cleanup residuals are modular multiples of p, not literal zero. They should be high-folded too; if cost remains SOTA-shaped, the route survives.","result":"Updated approximate_batched_shift_reopens_scaled_by_jump_budget to include two extra highfolds for old-row cleanup residuals. New model: highfold≈1862 CCX, shift16≈1915 CCX, integer row+cleanup floor≈6976 CCX, scaled modular pair/window≈18,254 CCX, 35-window modular pair≈638,893 CCX. All 25 BY tests pass locally.","structural_learning":"The batched-shift BY route remains viable after correcting modular cleanup: modular coefficient pair update is no longer ~378k but still only ~639k for 35 windows, far below the repeated-halving primitive (~2.05M).","next_action_hint":"Implement/simulate the full fixed-matrix scaled modular window including old-row cleanup highfolds. Verify old registers actually zero for sampled basis states, including signed matrix entries, before attempting selected-matrix integration."}}
{"run":198,"commit":"eee9a57","metric":4132750,"metrics":{"altseed_classical_total":0,"altseed_phase_batches_total":0,"altseed_ancilla_batches_total":0,"avg_clifford":24414411.956,"qubits":2716,"emitted_ops":31193208,"correctness_ok":1},"status":"keep","description":"Identify quotient-cleanup caveat for noncanonical BY batched shift","timestamp":1777365086588,"segment":3,"confidence":2.6012963521254147,"iterationTokens":4920,"asi":{"hypothesis":"The noncanonical highfold+batched-shift budget may still hide a reversibility issue: reducing T=k*p+R to the same scaled residue as R might erase quotient k unless k can be recovered or fused with row cleanup.","result":"Added noncanonical_batched_shift_needs_quotient_uncompute. It proves T and T+p produce the same scaled residue but require different low-word correction m. Therefore the canonical batched-shift circuit is valid, but noncanonical row highfold cannot simply erase quotient state from the output alone. All 26 BY tests pass locally.","structural_learning":"The BY batched-shift route remains promising but the precise missing primitive is now quotient-clean row reduction, not just cheap Solinas highfold. A reversible row circuit must keep the quotient, recover it from row sources, or fuse the quotient with old-row cleanup.","invalidated":"The overly optimistic interpretation that highfold quotient bits can be freely discarded after noncanonical row scaling is invalid.","next_action_hint":"Build a fixed-matrix row replacement circuit that computes scaled rows and zeros old rows while using the original row sources to uncompute quotient bits. If that cannot be done near the ~18k/window model, revise the BY budget upward or pivot."}}
{"run":199,"commit":"a48c293","metric":4132750,"metrics":{"altseed_classical_total":0,"altseed_phase_batches_total":0,"altseed_ancilla_batches_total":0,"avg_clifford":24414411.956,"qubits":2716,"emitted_ops":31193208,"correctness_ok":1},"status":"keep","description":"Quantify and mostly kill low-ratio-only BY branch compression","timestamp":1777365445700,"segment":3,"confidence":2.4821882341659873,"iterationTokens":4920,"asi":{"hypothesis":"Maybe BY matrix selection can avoid full denominator state/history by maintaining only the low ratio h=g/f mod 2^16 and delta; if the h-window map is nearly reversible with tiny rank hints, this could fit the 600-scratch goal.","result":"Added low_ratio_window_state_needs_large_rank_history. The map (delta,h)->(delta',h') is many-to-one. On 2000 sampled secp256k1 35-window trajectories, reversing it needed rank up to 71769 preimages (17 bits/window). A 16-bit/window rank would fail about 10.95% of inversions. All 27 BY tests pass locally.","structural_learning":"h-only BY branch state is not the low-scratch escape. It reduces denominator arithmetic, but the reversibility information is still ~17 bits/window, about 595 bits for 35 windows before arithmetic scratch. That is too tight for the 600-scratch target and does not solve matrix/history cleanup.","invalidated":"Low-ratio-only branch generator with <=16 rank bits/window is beyond the user's 1% failure tolerance. Treat it as a dead end unless combined with a different source of side information.","next_action_hint":"Keep BY focus on fixed-matrix row replacement and quotient cleanup; for branch history either accept a larger operating point, find a new self-cleaning invariant, or pivot to a transform whose branch decisions are output-recoverable."}}
{"run":200,"commit":"1c6d927","metric":4132750,"metrics":{"altseed_classical_total":0,"altseed_phase_batches_total":0,"altseed_ancilla_batches_total":0,"avg_clifford":24414411.956,"qubits":2716,"emitted_ops":31193208,"correctness_ok":1},"status":"keep","description":"Fix BY shifted-row carry model and simulate first noncanonical forward row circuit","timestamp":1777365883570,"segment":3,"confidence":2.3735099944984412,"iterationTokens":4920,"asi":{"hypothesis":"The fixed-matrix BY row path needs a real noncanonical forward-row circuit, and the shifted-row cost helper must propagate carries into slack bits to avoid optimistic/incorrect row arithmetic.","result":"Fixed add_shifted_term_for_cost to extend addends through the remaining row width. This corrected costs/peaks: full 3-pair cleanup model is now ~1.03M Toffoli but ~2852q (over cap); 2-pair optimistic integer-cleanup lower bound is ~575k at 35 windows but ~2304q. Added row_correction_m_from_sources_circuit_matches_classical and fixed_positive_matrix_forward_rows_clean_m_and_match_classical. The positive matrix [[65536,0],[65535,1]] forward rows simulate correctly on 32 random basis states with m computed and uncomputed from original sources: 8772 CCX, peak 1624q. All 30 BY tests pass locally.","structural_learning":"A forward noncanonical BY row can clean its low-word correction m without top-bit recovery by recomputing m from the unchanged row sources. This validates the forward half of fixed-matrix row replacement. However proper carry slack raises qubit peaks and invalidates the earlier full 3-pair under-2800 claim.","invalidated":"Previous shifted-row cost/peak numbers that used truncated addends were optimistic. The full 3-pair BY cleanup no longer fits the 2800q cap after correction.","next_action_hint":"Build old-row cleanup for a fixed positive matrix: compute sparse adjugate rows from the scaled outputs, canonicalize them using quotient recomputation from outputs, subtract from old sources, and simulate zeroing old rows. If this works near the revised 2-pair budget, proceed to signed matrices."}}
{"run":201,"commit":"3e82861","metric":4132750,"metrics":{"altseed_classical_total":0,"altseed_phase_batches_total":0,"altseed_ancilla_batches_total":0,"avg_clifford":24414411.956,"qubits":2716,"emitted_ops":31193208,"correctness_ok":1},"status":"keep","description":"Simulate complete positive fixed-matrix BY row replacement with old-row cleanup","timestamp":1777366013378,"segment":3,"confidence":2.3735099944984412,"iterationTokens":4920,"asi":{"hypothesis":"The noncanonical quotient problem for BY rows may be solvable pairwise: compute m from old sources for forward rows, then during cleanup use the identity s*adj(P)*y = x + p*(s*adj(P)m/2^w) to zero old rows without dense modular inverses.","result":"Added adjugate_m_correction_is_integral_for_sampled_by_matrices and positive_triangular_fixed_matrix_replacement_cleans_old_rows. The general adjugate-m correction is integral on 2000 sampled BY matrices/inputs. A complete fixed-matrix replacement for the positive triangular matrix [[65536,0],[65535,1]] simulates correctly on 32 random basis states: it computes scaled rows, zeros old x0,x1, uncomputes m from residual high bits, and uncomputes residual z. Cost 20,146 CCX, peak 1,898q. All 32 BY tests pass locally.","structural_learning":"The BY quotient cleanup obstacle is not fundamental for fixed matrices: m corrections can be recomputed from old sources and later removed using adjugate residual high bits. This is the first end-to-end reversible noncanonical BY window replacement, albeit for a special positive triangular matrix.","remaining_gap":"Need general signed matrices. The triangular case avoids many sign/canonicalization complications and has a simple m0=0 structure. Branch/matrix history selection also remains unsolved.","next_action_hint":"Generalize the fixed-matrix replacement to arbitrary sampled signed w=16 matrices: compute both m0,m1 from old sources, use qcorr=s*adj(P)m/2^w for old-row cleanup, handle signed residuals, and simulate basis states. If cost stays near 20-30k/window, evaluate a 35-window tagged-DIV scaffold."}}
{"run":202,"commit":"e356c92","metric":4132750,"metrics":{"altseed_classical_total":0,"altseed_phase_batches_total":0,"altseed_ancilla_batches_total":0,"avg_clifford":24414411.956,"qubits":2716,"emitted_ops":31193208,"correctness_ok":1},"status":"keep","description":"Extend BY fixed-matrix forward rows to signed matrices","timestamp":1777366099923,"segment":3,"confidence":2.3735099944984412,"iterationTokens":4920,"asi":{"hypothesis":"The positive triangular BY row prototype may be special because all rows are nonnegative. General BY matrices are signed, so the forward noncanonical row primitive needs two's-complement signed row accumulation and arithmetic shift after adding m*p.","result":"Added signed_matrix_forward_rows_clean_m_and_match_twos_complement. For sampled signed matrix [[-8192,24576],[-3,1]], the forward row circuit computes m from sources, adds m*p, performs arithmetic right shift, uncomputes m from sources, and matches two's-complement classical rows on 32 random basis states. Cost 5,563 CCX, peak 1,624q. All 33 BY tests pass locally.","structural_learning":"Signed forward rows are not a blocker. The m-from-sources technique works with signed coefficients when rows are treated as fixed-width two's-complement integers and shifted arithmetically. The remaining hard part is signed old-row cleanup using the adjugate-m correction.","next_action_hint":"Implement signed old-row cleanup for one sampled signed matrix: compute both m0,m1 from old sources; form signed adjugate residuals from y; use qcorr=s*adj(P)m/2^16 to zero old x rows; uncompute residuals and m. Validate on basis states."}}
{"run":203,"commit":"457ab41","metric":4132750,"metrics":{"altseed_classical_total":0,"altseed_phase_batches_total":0,"altseed_ancilla_batches_total":0,"avg_clifford":24414411.956,"qubits":2716,"emitted_ops":31193208,"correctness_ok":1},"status":"keep","description":"Prove q-correction roundtrip for general BY old-row cleanup","timestamp":1777366188491,"segment":3,"confidence":2.2662843635090177,"iterationTokens":4920,"asi":{"hypothesis":"General signed old-row cleanup needs to remove m registers after old sources are zeroed. If q=s*adj(P)*m/2^w is integral, perhaps P*q=m lets us uncompute m from q rather than from old sources.","result":"Added qcorr_roundtrip_recovers_m_for_sampled_by_matrices. On 5000 sampled BY matrices/low rows, q=s*adj(P)*m/2^16 is integral and P*q exactly recovers m. All 34 BY tests pass locally.","structural_learning":"General BY fixed-matrix cleanup has a clean reversible information flow: compute m from old sources, compute q=s*adj(P)m/2^w, use q to zero old rows, uncompute m from P*q, then uncompute q from residual high bits. This removes the apparent need to store quotient/m histories for a fixed matrix window.","next_action_hint":"Implement the signed old-row cleanup circuit following this information flow for one sampled signed matrix. Key tasks: signed small q register, q*c subtraction from 256-bit old rows, P*q uncompute of m, and q uncompute from signed residual high bits."}}
{"run":204,"commit":"79bdd47","metric":4132750,"metrics":{"altseed_classical_total":0,"altseed_phase_batches_total":0,"altseed_ancilla_batches_total":0,"avg_clifford":24414411.956,"qubits":2716,"emitted_ops":31193208,"correctness_ok":1},"status":"keep","description":"Simulate signed fixed-matrix BY replacement with q-based old-row cleanup","timestamp":1777366532561,"segment":3,"confidence":2.168328028145418,"iterationTokens":4920,"asi":{"hypothesis":"The q-correction roundtrip should enable complete old-row cleanup for signed BY matrices, not just the positive triangular special case. Implement a concrete signed fixed-matrix replacement and simulate basis states.","result":"Added signed_sample_fixed_matrix_replacement_cleans_old_rows. For signed matrix [[-8192,24576],[-3,1]], the circuit computes signed scaled rows, computes m0/m1 from old sources, computes signed q=s*adj(P)m/2^16, zeros old x0/x1, clears m via Pq=m, clears q from residual high bits, and uncomputes residuals. It passes 32 random basis states at 13,110 CCX and peak 2,256q. Full BY test suite: 35 passed. ./autoresearch.sh default path unchanged and passes at 4,132,750 Toffoli / 2716q.","structural_learning":"The fixed-matrix BY replacement mechanism now works end-to-end for a nontrivial signed matrix. Signed q cleanup from residual high bits and m cleanup via Pq=m are viable in circuit, making general fixed-matrix BY windows much more plausible.","remaining_gap":"Only one signed matrix is implemented explicitly. Need a generic matrix-to-circuit generator and a sample distribution of replacement costs/peaks across actual BY matrices; branch/matrix history selection also remains unsolved.","next_action_hint":"Generalize signed_sample_fixed_matrix_replacement_cleans_old_rows into a parameterized fixed_matrix_replacement(mtx) test. Sample many BY matrices and collect CCX/peak distribution; if p90 stays under ~30k/window and peak under 2600q for one pair, build a 35-window tagged-DIV scaffold."}}
