{"run":116,"commit":"eca3fa1","metric":0,"metrics":{},"status":"crash","description":"Started ground-up compact scaffold by folding persistent λ into y-register and materializing Ry in a fresh register, eliminating one persistent 256-qubit λ register from the top-level point-add body. Build succeeded, but alt-seed check found coherent phase defect (1 phase-garbage batch, 0 classical mismatches), so the new scaffold wiring is not yet safe to keep.","timestamp":1776997367496,"segment":3,"confidence":0.6919780522056375,"iterationTokens":165640,"asi":{"hypothesis":"Start a genuinely new low-qubit point-add scaffold by reusing target_y as the lambda register after pair1, and hold Ry in a temporary register until pair2 uncomputes lambda. This is a first register-folding step toward a Google-like compact exact reversible scaffold.","rollback_reason":"Alt-seed phase failure: structural register-folding rewrite introduced coherent phase mismatch despite classical outputs remaining correct on sampled shots.","next_action_hint":"Debug the phase defect at the pair1 lambda-fold / pair2 uncompute boundary. Compare phase behavior of old vs folded scaffold with targeted instrumentation, then continue toward a full compact inversion scaffold once the fold is phase-clean.","learning":"Deep-research pass confirms the exact src/main.rs benchmark rules out compressed-output/RNS/Legendre approaches; the plausible route is a new exact low-qubit scaffold. This first scaffold step successfully reduced persistent top-level state conceptually, but phase-clean reversibility remains the blocker.","error_details":"METRIC altseed_phase_batches_total=1, altseed_classical_total=0, altseed_ancilla_batches_total=0","structural_change":"Top-level point-add rewritten so pair1 swaps lambda into ty and pair2 computes Ry in a temporary register while uncomputing lambda from ty."}}
{"run":117,"commit":"eca3fa1","metric":4188698,"metrics":{},"status":"checks_failed","description":"Fixed the coherent phase issue in the new scaffold by keeping the full Kaliski forward state live across with_kal_inv_raw bodies instead of free/realloc u/v/f around MBUC regions. This makes the circuit fully phase-clean and exact again and hits 4,188,698 Toffoli, but qubits jump to 3230 so it fails the session cap check.","timestamp":1777006949413,"segment":3,"confidence":0.7239556511465876,"iterationTokens":58959,"asi":{"hypothesis":"The phase defect was caused by phase-fragile free/realloc churn of Kaliski state around a body containing additional MBUC. Keep the full forward inversion state alive across the body to preserve phase cancellation exactly.","rollback_reason":"Backpressure checks failed: qubits 3230 > session cap 2800, so cannot keep despite benchmark and phase correctness passing.","next_action_hint":"Use this as the phase-clean reference point. Next reduce qubits by selectively folding/removing state without reintroducing the phase defect, starting from the known-good full-state-live variant.","learning":"This isolates the phase bug: it was not the arithmetic rewrite itself, but freeing and later re-allocating parts of the Kaliski state across an MBUC-heavy body. The exact same arithmetic is phase-clean when the original forward state stays live until backward uncompute.","metrics_snapshot":"avg_toffoli=4188698, qubits=3230, emitted_ops=31352624, altseed_phase_batches_total=0","structural_change":"with_kal_inv_raw no longer frees/re-allocates st.u/st.v_w/st.f_flag around the body; it keeps the full Kaliski state live across the body before running the matching backward pass."}}
{"run":118,"commit":"3bc1a61","metric":4188698,"metrics":{},"status":"keep","description":"Profiling-first phase fix: isolated phase sensitivity in with_kal_inv_raw and found only f_flag must stay live across the MBUC-heavy body. Keeping just f_flag (freeing/re-allocating u and v_w as before) preserves phase-clean exactness, stays under the 2800q checks cap at 2718q, and reaches 4,188,698 Toffoli.","timestamp":1777007661623,"segment":3,"confidence":0.7590319353353131,"iterationTokens":32195,"asi":{"hypothesis":"The phase defect comes from freeing/re-allocating specific Kaliski forward state across a body containing additional MBUC. Profile which subset of {u, v_w, f_flag} must stay live, then keep only that subset.","learning":"Profiling identified f_flag as the only phase-critical piece. Keeping u or v_w live inflates qubits by +256 each with no metric benefit; keeping only f_flag fixes phase with just +1 qubit over baseline-shaped memory management.","state_probe_results":{"baseline":{"qubits":2717,"phase_ok":true},"keep_u":{"qubits":2973,"phase_ok":true},"keep_v":{"qubits":2973,"phase_ok":true},"keep_f":{"qubits":2718,"phase_ok":true},"keep_u_v":{"qubits":3229,"phase_ok":true}},"next_action_hint":"Use KAL_KEEP_F behavior as the new reference scaffold. Next reintroduce compact register folding steps one at a time while leaving f_flag live, to see which transformations remain phase-clean.","structural_change":"with_kal_inv_raw now supports profiling knobs showing only f_flag needs to survive across the body for phase safety; use KAL_KEEP_F=1 behavior for the kept variant.","phase_fix":"Coherent phase issue fixed once-and-for-all at this boundary by preserving f_flag across body instead of free/realloc.","checks":"passed"}}
{"run":119,"commit":"3bc1a61","metric":4188698,"metrics":{},"status":"discard","description":"Profiling-only run (TRACE_PHASES=1) on the current stable 3bc1a61 baseline to map the per-phase Toffoli distribution and find the next large-impact qubit/Toffoli lever. Same metrics as committed stable; no code change kept.","timestamp":1777009570684,"segment":3,"confidence":0.8116180740690428,"iterationTokens":385639,"asi":{"hypothesis":"Before attempting a large structural change, profile the exact per-phase Toffoli breakdown of the new stable baseline (4,188,698 Toffoli @ 2717q) to drive targeted SOTA-oriented restructuring.","rollback_reason":"Profiling run only. No code change to keep.","next_action_hint":"Two dominant buckets account for ~47% of emitted Toffoli: kal/bk step4 (~24.7% combined) and kal/bk step3/9 cswap (~24.5% combined). Both are inside Kaliski. That means any SOTA-oriented restructuring must change the shape of Kaliski rounds (step4 arithmetic and/or step3+9 cswap-based swapping), not just the outer point-add algebra. The pair1/2 mul and halve/double combined are only ~8.4%, so between-pair mul/halve tuning cannot close the SOTA gap alone.","per_phase_breakdown_top":{"bk_bulk_step4":{"ccx":513810,"pct":12.3},"kal_bulk_step4":{"ccx":513810,"pct":12.3},"bk_bulk_step9_cswap":{"ccx":257790,"pct":6.2},"kal_bulk_step9_cswap":{"ccx":257790,"pct":6.2},"bk_bulk_step3_cswap":{"ccx":257280,"pct":6.1},"kal_bulk_step3_cswap":{"ccx":257280,"pct":6.1},"schoolbook_mul_inverse":{"ccx":201216,"pct":4.8},"pair1_halve":{"ccx":104040,"pct":2.5},"pair2_double":{"ccx":103275,"pct":2.5},"pair1_mul1":{"ccx":74739,"pct":1.8},"pair1_mul2":{"ccx":74995,"pct":1.8},"pair2_mul":{"ccx":74995,"pct":1.8}},"kaliski_share_pct":"~80% of total emitted Toffoli (consistent with prior accounting)","total_ccx_emitted":4186144,"learning":"SOTA gap cannot be closed by outer-algebra tweaks. The two Kaliski loops and specifically step4 (~1.03M Toffoli combined) + step3/9 cswaps (~1.03M combined) dominate. Plausible SOTA-grade moves therefore are: (a) cheaper step4 arithmetic, (b) cswap-free round shape (eliminate two cswap passes per round), or (c) fewer Kaliski rounds via windowed/jumped stepping. Everything else is sub-5%."}}
{"run":120,"commit":"3bc1a61","metric":0,"metrics":{},"status":"crash","description":"Small experiment: swap schoolbook multipliers for 1-level Karatsuba at all three remaining mul sites (pair1_mul1, pair1_mul2, pair2_mul). Classical still fine but alt-seed phase check caught 1 phase-garbage batch, so the drop-in Karatsuba path interacts with the current MBUC/phase scaffold in a non-clean way.","timestamp":1777009699379,"segment":3,"confidence":0.8116180740690428,"iterationTokens":15457,"asi":{"hypothesis":"Replacing schoolbook muls with 1-level Karatsuba at the three Kaliski-body mul sites should cut ~10-30k Toffoli per site cheaply, since schoolbook contributes ~224k and Karatsuba has historically been -246k globally. Start from the stable 3bc1a61 base to test this as a small structural experiment.","rollback_reason":"Alt-seed phase failure (1 phase-garbage batch). Drop-in Karatsuba swap is not phase-clean at these sites under the current MBUC layout.","next_action_hint":"Do not try Karatsuba as a blanket drop-in replacement here. Instead: (a) try a single site at a time to localize the phase defect, or (b) try 2-level Karatsuba at the between-pair mul only (non-Kaliski-peak site), where prior experiments already kept similar swaps phase-clean.","learning":"Even small arithmetic-only primitive swaps inside the Kaliski-body mul calls are phase-fragile under the existing bulk_prefix + MBUC Kaliski scaffold. This is another data point that SOTA-scale changes can't be done by blind primitive substitution; they must ride on a phase-isolated interface.","phase_batches":1,"classical_mismatches":0,"ancilla_batches":0}}
{"run":121,"commit":"3bc1a61","metric":4160810,"metrics":{},"status":"checks_failed","description":"Small experiment: swap only pair2_mul from schoolbook to 1-level Karatsuba. Phase-clean and saves ~27,888 Toffoli (4,188,698 → 4,160,810), but pushes peak qubits to 2972 > 2800 cap. One-site localization shows the Kaliski-body mul swap is safe for pair2_mul specifically.","timestamp":1777009842819,"segment":3,"confidence":0.8720329860794366,"iterationTokens":4977,"asi":{"hypothesis":"Replacing only pair2_mul with 1-level Karatsuba localizes the Kaliski-body Karatsuba substitution to one site and avoids the phase defect we saw when swapping all three. If phase-clean, it bounds the per-site Toffoli win and isolates the peak qubit cost.","rollback_reason":"Checks failed: peak 2972 > 2800q cap. Toffoli improvement is real but qubit cost is too high to keep under the session backpressure guard.","next_action_hint":"Two clear levers: (1) find a Karatsuba variant or call-site ordering where the transient 2n tmp_ext overlaps a freed persistent register, so peak doesn't increase. (2) Alternatively, try a compact 2-level Karatsuba at pair2_mul with smaller z1_reg to see if effective peak is lower — z1_inner_a/b (~130q) can substitute for 256q tmp_ext segments if careful.","learning":"Per-site Karatsuba substitution at pair2_mul is phase-clean (the phase crash seen when swapping all three sites is not from pair2_mul alone). Toffoli delta per site is ~-28k. Biggest blocker for qubit headroom is the 2n=512q tmp_ext of the Karatsuba forward, which brings peak from 2717 to 2972 (+255q).","one_site_results":{"site":"pair2_mul","toffoli":4160810,"delta":-27888,"qubits":2972,"phase_clean":true},"next_experiments":["try Karatsuba at pair1_mul2 only","try Karatsuba with deferred free of a persistent register (e.g. m_hist freed partial) to hide the 256q tmp_ext bulge","try 2-level Karatsuba at pair2_mul only"]}}
{"run":122,"commit":"3bc1a61","metric":0,"metrics":{},"status":"crash","description":"Small experiment: drop pair2_iters 405 → 403 on the stable baseline. Alt-seed was clean but main harness caught 1 phase-garbage batch (classical still clean). Current pair2 iter count is right at the phase cliff under stable scaffold.","timestamp":1777009976786,"segment":3,"confidence":0.8720329860794366,"iterationTokens":9444,"asi":{"hypothesis":"Earlier notes said pair1/2 iters are tuned to 408/405; re-probing pair2_iters downwards is the cheapest potential structural win (~n Toffoli per iter * 2 passes) if still phase-clean.","rollback_reason":"Main-harness phase-garbage batch despite alt-seed passing. pair2_iters=403 is below the phase-robust floor under the current Kaliski scaffold.","next_action_hint":"Treat pair2_iters=405 as a phase floor for this Kaliski variant; any further iter reduction needs a different inversion/scale-correction algebra. Try pair2_iters=404 once to bound the cliff, but otherwise pivot away from iter tuning and back to structural changes.","learning":"Bulk iter probing reconfirms that Kaliski iter count is on a coherent phase cliff, not just a correctness boundary. Reducing rounds is not a path to SOTA under this scaffold.","phase_batches":1,"classical_mismatches":0}}
{"run":123,"commit":"4dcc86d","metric":4184582,"metrics":{},"status":"keep","description":"Small structural experiment: lower pair2_iters 405 → 404 on the stable 3bc1a61 baseline. Both alt-seed and main harness pass phase-clean, peak qubits unchanged at 2717, avg Toffoli improves 4,188,698 → 4,184,582 (-4,116). 403 crashes, 404 is safe, so this is the exact pair2 iter floor under the current Kaliski scaffold.","timestamp":1777010082394,"segment":3,"confidence":0.8477350927601007,"iterationTokens":2275,"asi":{"hypothesis":"After the 403 crash, probe pair2_iters=404 to bound the exact phase floor of the stable Kaliski scaffold and capture any free Toffoli win that is still phase-safe.","learning":"pair2_iters=404 is safe and phase-clean under the stable 3bc1a61 scaffold; 403 is not. 404/408 is the current phase-robust Kaliski iter floor for this version.","metrics_snapshot":"avg_toffoli=4184582, qubits=2717, emitted_ops=31323604, altseed_phase_batches=0","checks":"passed"}}
{"run":124,"commit":"3a8b163","metric":4180502,"metrics":{},"status":"keep","description":"Lower pair1_iters 408 → 407 on top of 4dcc86d. 24-seed alt-seed + main-harness phase check and qubit cap check all clean, peak qubits improves 2717 → 2716, avg Toffoli 4,184,582 → 4,180,502 (-4,080). Confirmed phase-robust across 24 seeds before committing per the new testing discipline.","timestamp":1777010284269,"segment":3,"confidence":1.0556807138439792,"iterationTokens":2244,"asi":{"hypothesis":"After pair2_iters=404 was phase-safe, probe pair1_iters=407 to find the next phase-robust iter floor under the stable scaffold.","testing_discipline":"Per updated policy: validate iter-count / structural changes with 5 alt-seeds for fast iteration and 24 alt-seeds (ALT_SEED_COMMIT=1) before committing to keep. This run explicitly used ALT_SEED_COMMIT=1 and passed.","learning":"pair1_iters=407 / pair2_iters=404 is phase-clean across 24 alt seeds. Each single-iter drop pair-side saves ~4k Toffoli with zero qubit cost, but we're approaching the iter cliff — next attempts must be small and individually 24-seed-checked.","metrics_snapshot":"avg_toffoli=4180502, qubits=2716, emitted_ops=31293818, altseed_phase_batches_total=0, altseed_ancilla_batches_total=0, altseed_classical_total=0","checks":"passed"}}
{"run":125,"commit":"3a8b163","metric":0,"metrics":{},"status":"crash","description":"Tried pair1_iters=406 on top of 3a8b163. Passed 5-seed gate but 24-seed gate caught 1 phase-garbage batch and 1 classical mismatch, so pair1_iters=407 is the true phase-robust floor under the stable scaffold per the new two-gate testing discipline.","timestamp":1777010414529,"segment":3,"confidence":1.0556807138439792,"iterationTokens":628,"asi":{"hypothesis":"After pair1_iters=407 landed phase-safe, probe pair1_iters=406 for another small Toffoli win.","rollback_reason":"24-seed alt-seed caught phase defect (1 phase-garbage batch) and 1 classical mismatch; 5-seed gate was clean. This is exactly the scenario the new testing discipline is designed to catch.","testing_discipline":"5-seed pass → 24-seed check revealed a latent phase defect. Keeping this iter drop would have committed an unstable scaffold.","learning":"pair1_iters=406 is below the phase-robust floor despite passing the fast gate. Don't push pair1 iters below 407 on this scaffold. Next qubit/Toffoli gains must come from structural moves, not further iter shaving.","next_action_hint":"Stop shaving iter count and go after structural levers: cheaper pair2_mul that doesn't add 256q to the peak, or Kaliski step4 / step3-9 cswap restructuring. Those dominate the remaining Toffoli budget per profiling (top 4 buckets = ~47%).","phase_batches":1,"classical_mismatches":1}}
{"run":126,"commit":"3a8b163","metric":4152614,"metrics":{},"status":"checks_failed","description":"Small experiment (single-site): swap only pair1_mul2 from schoolbook to 1-level Karatsuba on top of 3a8b163. Saves -27,888 Toffoli (4,180,502 → 4,152,614), stays phase-clean on 5-seed alt-seed, but peak jumps from 2716 to 2974 so checks cap (2800) fails.","timestamp":1777011196196,"segment":3,"confidence":1.0973311140446536,"iterationTokens":31270,"asi":{"hypothesis":"Karatsuba-1 substitution is phase-clean at the pair1_mul2 site (pair2_mul was phase-clean last run), and per-site Toffoli win is ~28k. Isolate the per-site effect on peak qubits so we know where the +256 transient lives.","rollback_reason":"Checks cap violation: peak 2974 > 2800q. Toffoli improvement is genuine but transient 2n=512q tmp_ext of karatsuba_forward pushes peak by +258 at the Kaliski-body mul site.","learning":"pair1_mul2 and pair2_mul both give ~-28k Toffoli with Karatsuba-1 but both also add +258q to peak. That +258 comes from karatsuba_forward's 2n-wide tmp_ext allocated during a Kaliski-body region where the full persistent Kaliski state (u, v, r, s, m_hist, f_flag) is already live. So a simple Karatsuba swap is not affordable under the 2800 cap without first shaving persistent state.","next_action_hint":"To get the Karatsuba win we need to free/reuse ~256 persistent qubits around the mul sites. Most plausible: (1) dirty-borrow late-index m_hist tail as tmp_ext scratch during the mul (requires preserving its pre-mul value, which likely needs a compute/uncompute pair), (2) compute mul via 2-level Karatsuba with narrower z1 inner regs but smaller tmp_ext peak, or (3) redesign pair2_mul so the write-into-zero target can be stripped out of live state.","one_site_results":{"site":"pair1_mul2","toffoli":4152614,"delta_toff":-27888,"qubits":2974,"phase_clean_5seed":true},"checks":"failed (qubit cap)"}}
{"run":127,"commit":"9509e82","metric":4180502,"metrics":{},"status":"keep","description":"Add microbench infrastructure + low-q mul primitives as off-build experimental tools. New `src/point_add/microbench.rs` prints peak qubits + Toffoli counts for Cuccaro/schoolbook/Karatsuba variants under `MICROBENCH=1 cargo test`. New low-q primitives (controlled_add_subtract_lowq, schoolbook_mul_into_addsub_lowq / _inverse, karatsuba_forward_lowq / _inverse, mod_mul_add_into_acc_karatsuba_lowq) are defined but NOT used in build(). Primary metric unchanged at 4,180,502 Toffoli / 2716 qubits (24-seed alt-seed + main-harness pass phase-clean).","timestamp":1777012241436,"segment":3,"confidence":1.142403021104711,"iterationTokens":633,"asi":{"hypothesis":"Per new user policy ('large structural changes, but small experiments not part of top-level benchmark'), add a dedicated microbench harness + low-q primitive variants so we can profile peak qubits and Toffoli of candidate building blocks in isolation before wiring them into build().","testing_discipline":"5-seed fast gate + 24-seed robust gate both passed on the primary build. Primary metric unchanged (4,180,502). Committing the infra is safe because build() does not call the new primitives.","microbench_findings_at_n_256":{"cuccaro_add_fast":{"toffoli":255,"peak_q":768},"cuccaro_add_slow":{"toffoli":510,"peak_q":513},"mul_schoolbook_write_zero":{"toffoli":153369,"peak_q":1797},"mul_karatsuba1_write_zero":{"toffoli":125481,"peak_q":2055},"mul_karatsuba2_write_zero":{"toffoli":113993,"peak_q":2315},"mul_karatsuba1_lowq_add":{"toffoli":228913,"peak_q":2055},"schoolbook_addsub_fast_fwd_only":{"toffoli":67072,"peak_q":1283},"schoolbook_addsub_lowq_fwd_only":{"toffoli":133120,"peak_q":1283}},"learning":"1) non-fast Cuccaro saves ~255q transient at ~2x Toffoli. 2) The peak of karatsuba1 (2055) vs schoolbook (1797) is +258q, which is exactly the outer tmp_ext widening (2n vs 0 extra). lowq Karatsuba does NOT reduce its peak below karatsuba1-fast because the peak driver is the 2n tmp_ext, not the inner Cuccaro carries — so substituting lowq carries at the outer level doesn't help transient peak. 3) Real qubit-saving for Kaliski-body muls must attack the 2n tmp_ext itself, not the carry ancillae. This rules out the lowq-Karatsuba shortcut.","next_action_hint":"Focus next structural experiment on a multiplier with tmp_ext < 2n (e.g. reuse acc as the low half, or direct-into-acc schoolbook avoiding a wide ancilla), or attack persistent state instead (m_hist compression, Kim unconditional, register folding). Use microbench to validate peak+Toffoli before wiring into build().","metrics_snapshot":"avg_toffoli=4180502, qubits=2716, emitted_ops=31293818, altseed_phase_batches_total=0, altseed_ancilla_batches_total=0, altseed_classical_total=0","infra_files":["src/point_add/microbench.rs"],"checks":"passed"}}
