{"run":470,"commit":"f9e8658","metric":31,"metrics":{"plusminus_cint_addsub_width":16,"plusminus_cint_add_ccx":31,"plusminus_cint_sub_ccx":31,"plusminus_cint_addsub_peak_q":65,"altseed_classical_total":0,"altseed_phase_batches_total":0,"altseed_ancilla_batches_total":0,"avg_toffoli":4089274,"avg_clifford":24292787.153,"qubits":2713,"emitted_ops":30575944,"correctness_ok":1},"status":"keep","description":"Validate phase-clean controlled integer add/sub skeleton","timestamp":1777582663915,"segment":37,"confidence":null,"iterationTokens":162,"asi":{"hypothesis":"The scaled plus-minus coefficient update needs controlled two's-complement add/sub; the MBU temporary cleanup may fail phase when used as a signed-integer primitive.","result":"Width-16 controlled integer add followed by controlled subtract is exact, leaves inputs unchanged, and has zero phase for ctrl 0/1 over 4096 basis pairs. Add/sub each cost 2W-1=31 CCX, peak 65q. This validates the quantum-compatible coefficient-add primitive shape.","next_action_hint":"Compose add/sub, active-chain shift, comparison, and cswap into a one-step reversible toy plus-minus update; that is the next meaningful integration-risk test."}}
{"type":"config","name":"plusminus one-step Bennett skeleton phase check","metricName":"plusminus_step_skeleton_ccx","metricUnit":"","bestDirection":"lower"}
{"run":471,"commit":"cb603a2","metric":700,"metrics":{"plusminus_step_skeleton_width":16,"plusminus_step_skeleton_ccx":700,"plusminus_step_skeleton_peak_q":179,"altseed_classical_total":0,"altseed_phase_batches_total":0,"altseed_ancilla_batches_total":0,"avg_toffoli":4089274,"avg_clifford":24292787.153,"qubits":2713,"emitted_ops":30575944,"correctness_ok":1},"status":"keep","description":"Compose one-step plusminus Bennett skeleton with phase-clean primitives","timestamp":1777582838899,"segment":38,"confidence":null,"iterationTokens":163,"asi":{"hypothesis":"The first nontrivial composition of plus-minus primitives may reveal phase/ancilla issues when MBU add/sub, active-chain history, controlled shifts, and inverse shifts are combined.","result":"Width-16 Bennett compute/uncompute skeleton for one plus-minus step passed: computed d=u-v, generated k history, formed cv<<k and cd=cu-cv, then reversed all work. Inputs unchanged; d/cd/cvs/active/hist/spill/one all clean; phase zero. Cost 700 CCX, peak 179q. This validates primitive compatibility but is not the production in-place update.","next_action_hint":"Next implement a productive one-step update in scratch (old lanes -> new lanes) or a small multi-step roundtrip, not just Bennett no-op, to expose ordering and cleanup issues."}}
{"type":"config","name":"plusminus one-step output skeleton","metricName":"plusminus_step_output_ccx","metricUnit":"","bestDirection":"lower"}
{"run":472,"commit":"cb603a2","metric":0,"metrics":{"altseed_classical_total":0,"altseed_phase_batches_total":0,"altseed_ancilla_batches_total":0,"correctness_ok":0},"status":"crash","description":"First one-step output skeleton failed coefficient ordering","timestamp":1777583422085,"segment":39,"confidence":null,"iterationTokens":158,"asi":{"hypothesis":"A productive plus-minus one-step output skeleton with fresh output lanes should match the classical ordered update while keeping work clean and phase zero.","result":"Targeted test failed immediately: ncu mismatch left=97 right=96 at src/point_add/single_inv_numeric.rs:3887. The output ordering/cswap under with_lt likely used a flag that was toggled inside the body, so local_cswap saw the wrong control (or expected direction convention is off). This is a useful integration failure, not a model proxy.","rollback_reason":"Crash in targeted one-step output circuit; uncommitted skeleton should be reverted and reworked with a stable ordering flag/control convention.","next_action_hint":"Rebuild smaller: compute dsh, cd, cvs, copy ordered outputs using a stable external flag from with_lt body; verify flag semantics by outputting flag or testing both order branches separately."}}
{"run":473,"commit":"55ebb15","metric":1276,"metrics":{"plusminus_step_output_width":16,"plusminus_step_output_ccx":1276,"plusminus_step_output_peak_q":260,"altseed_classical_total":0,"altseed_phase_batches_total":0,"altseed_ancilla_batches_total":0,"avg_toffoli":4089274,"avg_clifford":24292787.153,"qubits":2713,"emitted_ops":30575944,"correctness_ok":1},"status":"keep","description":"Fix and validate productive one-step plusminus output skeleton","timestamp":1777583695330,"segment":39,"confidence":null,"iterationTokens":8358,"asi":{"hypothesis":"The failed one-step plus-minus output skeleton can be repaired by cleaning temporaries and using the right stable ordering convention; a productive fresh-output step should be phase-clean before any in-place wiring.","result":"Targeted autoresearch.sh run passed. Width-16 one-step output skeleton computes ordered (u',v',cu',cv') into fresh lanes, then cleans d/dsh/cd/cvs/active/hist/spill/one/flag with phase zero. Cost 1276 CCX, peak 260q. This validates a non-noop reversible quantum-compatible plus-minus step shell; still not low-scratch production because old and new lanes coexist.","next_action_hint":"Next convert from fresh-output Bennett shell to in-place replacement or two-step roundtrip, accounting old-lane cleanup and slack packing. Kill route if productive cleanup requires keeping old+new lanes beyond 663 scratch."}}
{"type":"config","name":"plusminus in-place one-step forward circuit","metricName":"plusminus_inplace_step_ccx","metricUnit":"","bestDirection":"lower"}
{"type":"config","name":"plusminus in-place one-step forward circuit","metricName":"plusminus_inplace_step_ccx","metricUnit":"","bestDirection":"lower"}
{"run":474,"commit":"85fd18f","metric":670,"metrics":{"plusminus_inplace_step_width":16,"plusminus_inplace_step_ccx":670,"plusminus_inplace_step_peak_q":132,"altseed_classical_total":0,"altseed_phase_batches_total":0,"altseed_ancilla_batches_total":0,"avg_toffoli":4089274,"avg_clifford":24292787.153,"qubits":2713,"emitted_ops":30575944,"correctness_ok":1},"status":"keep","description":"Validate low-scratch in-place plusminus one-step forward circuit","timestamp":1777584003796,"segment":41,"confidence":null,"iterationTokens":8358,"asi":{"hypothesis":"The productive plus-minus step should be implemented in place, not as an old+new Bennett shell; compute u=(u-v)/2^k, cu=cu-cv, cv=cv<<k, then ordered-swap live lanes while leaving only k and direction history.","result":"Width-16 in-place forward circuit passed targeted autoresearch.sh and full harness. It mutates (u,v,cu,cv) to the classical ordered next state, leaves unary k history and one direction flag, and cleans active/spill/one with phase zero. Cost 670 CCX and peak 132q. This catches the earlier comparator mistake: the ordering flag must be persistent history, not uncomputed with with_lt after swapping compared lanes.","next_action_hint":"Build the inverse/roundtrip using k history and direction flag to restore old lanes and clear histories. If inverse cleanup needs extra full lanes, the route dies; if it is clean, proceed to multi-step toy DIV."}}
{"type":"config","name":"plusminus in-place one-step roundtrip circuit","metricName":"plusminus_inplace_roundtrip_ccx","metricUnit":"","bestDirection":"lower"}
{"run":475,"commit":"abd73e9","metric":1356,"metrics":{"plusminus_inplace_roundtrip_width":16,"plusminus_inplace_roundtrip_ccx":1356,"plusminus_inplace_roundtrip_peak_q":132,"altseed_classical_total":0,"altseed_phase_batches_total":0,"altseed_ancilla_batches_total":0,"avg_toffoli":4089274,"avg_clifford":24292787.153,"qubits":2713,"emitted_ops":30575944,"correctness_ok":1},"status":"keep","description":"Validate in-place plusminus one-step forward/inverse roundtrip","timestamp":1777584323684,"segment":42,"confidence":null,"iterationTokens":8358,"asi":{"hypothesis":"A truly wireable plus-minus step must run forward in place, then use its k history and ordering bit to reverse and clear all work/history without old+new copies.","result":"Width-16 explicit forward+inverse roundtrip passed targeted autoresearch.sh and full benchmark. It restores u,v,cu,cv and clears unary history, ordering flag, active chain, spill and one with zero phase. Cost 1356 CCX, peak 132q. The earlier failed attempt showed with_lt cannot uncompute a comparator after swapping the compared registers; keeping the direction bit as history fixes that integration bug.","next_action_hint":"Next compose multiple in-place steps sharing one active/spill/flag lane per stored step-history, or build a two-step toy DIV with separate history slots. Also update scratch/cost model to charge one direction bit per step unless local reverse recovery can later clear it without storage."}}
{"type":"config","name":"plusminus in-place three-step roundtrip circuit","metricName":"plusminus_inplace_three_step_ccx","metricUnit":"","bestDirection":"lower"}
{"run":476,"commit":"0f1db22","metric":4068,"metrics":{"plusminus_inplace_three_step_width":16,"plusminus_inplace_three_step_steps":3,"plusminus_inplace_three_step_ccx":4068,"plusminus_inplace_three_step_peak_q":166,"altseed_classical_total":0,"altseed_phase_batches_total":0,"altseed_ancilla_batches_total":0,"avg_toffoli":4089274,"avg_clifford":24292787.153,"qubits":2713,"emitted_ops":30575944,"correctness_ok":1},"status":"keep","description":"Chain three in-place plusminus steps with reversible history cleanup","timestamp":1777584430387,"segment":43,"confidence":null,"iterationTokens":8358,"asi":{"hypothesis":"If the in-place plus-minus step is actually wireable, multiple steps should compose using separate history slots and a shared active/spill workspace, then reverse cleanly in LIFO order.","result":"Width-16 three-step forward+reverse circuit passed targeted autoresearch.sh and the full exact harness. It uses no old+new output lanes, reuses active/spill/one workspace, stores per-step unary k plus direction flag, and clears all histories/flags/ancilla with phase zero. Cost is exactly 3*1356=4068 CCX; peak grows from 132 to 166q due to extra history slots and flags.","next_action_hint":"Next pressure-test with more steps and/or width-32 cost scaling, then decide whether direction flags can be cleared by online local recovery or must be added to the slack-packed history budget."}}
{"type":"config","name":"plusminus slack envelope with direction bits","metricName":"plusminus_scaled_dir_slack_over_google_bits","metricUnit":"","bestDirection":"lower"}
{"run":477,"commit":"fe05a6e","metric":7,"metrics":{"plusminus_scaled_dir_slack_steps":200,"plusminus_scaled_dir_slack_total_deficit":158,"plusminus_scaled_dir_slack_scratch":670,"plusminus_scaled_dir_slack_over_google_bits":7,"altseed_classical_total":0,"altseed_phase_batches_total":0,"altseed_ancilla_batches_total":0,"avg_toffoli":4089274,"avg_clifford":24292787.153,"qubits":2713,"emitted_ops":30575944,"correctness_ok":1},"status":"keep","description":"Charge persistent direction bits in plusminus slack envelope","timestamp":1777584602463,"segment":44,"confidence":null,"iterationTokens":8358,"asi":{"hypothesis":"The in-place circuit uses a persistent ordering bit per step; if those bits are charged as history, the public lane slack may still fit or may expose a scratch blocker.","result":"Sampled public lane envelope with unary k history plus one direction bit per completed step gives steps=200, deficit=158, scratch=670, over Google663 by 7 bits. The first version asserted fit and failed; the committed probe asserts this near-miss explicitly. This means naive stored direction flags miss the strict 663 target unless we recover direction online, trim/envelope tighten, or pack into additional slack not modeled.","next_action_hint":"Prioritize an online reversible direction recovery/flag-clear circuit from full scaled state, or search for a tighter direction-bit packing/envelope. Do not claim the plus-minus route fits 663 if direction flags remain persistent at this envelope."}}
{"type":"config","name":"plusminus slack with ambiguous direction bits","metricName":"plusminus_scaled_ambig_dir_over_google_bits","metricUnit":"","bestDirection":"lower"}
{"run":478,"commit":"2d10d8a","metric":-146,"metrics":{"plusminus_scaled_ambig_dir_steps":204,"plusminus_scaled_ambig_dir_max_bits":0,"plusminus_scaled_ambig_dir_total_deficit":5,"plusminus_scaled_ambig_dir_scratch":517,"plusminus_scaled_ambig_dir_over_google_bits":-146,"altseed_classical_total":0,"altseed_phase_batches_total":0,"altseed_ancilla_batches_total":0,"avg_toffoli":4089274,"avg_clifford":24292787.153,"qubits":2713,"emitted_ops":30575944,"correctness_ok":1},"status":"keep","description":"Show coefficient-divisibility recovers plusminus direction without flags","timestamp":1777584724204,"segment":45,"confidence":null,"iterationTokens":8358,"asi":{"hypothesis":"The persistent direction-bit scratch blocker can be avoided if the reverse parser recovers direction locally from coefficient divisibility by 2^k, storing only ambiguous direction bits.","result":"Sampled lane slack envelope with ambiguous-only direction history found max_ambig=0 over 8192 secp samples, scratch=517 and over_google=-146. This validates the algebraic direction-recovery idea at model level and removes the 670q persistent-flag blocker for sampled traces. It is still not a wired quantum circuit for clearing direction flags; it shows exactly what circuit to build next: a reversible divisibility-based direction recovery during inverse.","next_action_hint":"Implement a toy reversible inverse that clears direction flag by recomputing it from k and coefficient lanes via divisibility/equality logic instead of storing it; then wire a multi-step forward/inverse with only k history."}}
{"type":"config","name":"plusminus k-only direction recovery roundtrip circuit","metricName":"plusminus_konly_three_step_ccx","metricUnit":"","bestDirection":"lower"}
{"run":479,"commit":"2d10d8a","metric":0,"metrics":{"altseed_classical_total":0,"altseed_phase_batches_total":0,"altseed_ancilla_batches_total":0,"correctness_ok":0},"status":"crash","description":"First k-only direction recovery roundtrip left shift spill dirty","timestamp":1777584922224,"segment":46,"confidence":null,"iterationTokens":165,"asi":{"hypothesis":"Coefficient low-bit divisibility can clear the per-step direction flag so multi-step plusminus only stores k-history.","result":"Targeted k-only three-step roundtrip failed with spill=1. The recovery flag itself likely worked, but an inverse/forward controlled shift was applied on an invalid no-overflow/evenness promise after using only cu divisibility on arbitrary toy signed lanes or after an unrecovered direction in one case. The failure is exactly the kind of wiring-level issue this loop should catch before integration.","rollback_reason":"Uncommitted k-only circuit failed phase-clean/ancilla-clean targeted test; revert and rebuild with a smaller forward-only debug and actual odd-GCD coefficient trace invariants.","next_action_hint":"Add a one-step k-only forward test that asserts flag is clean and output matches classical before inverse; include per-case labels. If spill dirties, inspect whether right-shift exact promise or signed left-shift no-overflow fails for negative coefficient lanes, and test direction recovery separately before chaining."}}
{"type":"config","name":"plusminus k-only direction recovery roundtrip circuit v2","metricName":"plusminus_konly_three_step_ccx","metricUnit":"","bestDirection":"lower"}
{"run":480,"commit":"6e7e761","metric":4812,"metrics":{"plusminus_konly_three_step_width":16,"plusminus_konly_three_step_steps":3,"plusminus_konly_three_step_forward_ccx":2382,"plusminus_konly_three_step_forward_peak_q":164,"plusminus_konly_three_step_peak_q":164,"altseed_classical_total":0,"altseed_phase_batches_total":0,"altseed_ancilla_batches_total":0,"avg_toffoli":4089274,"avg_clifford":24292787.153,"qubits":2713,"emitted_ops":30575944,"correctness_ok":1},"status":"keep","description":"Validate k-only plusminus direction recovery in multi-step circuit","timestamp":1777585102526,"segment":47,"confidence":null,"iterationTokens":167,"asi":{"hypothesis":"Persistent plus-minus direction flags can be eliminated by recomputing direction from unary k-history and coefficient divisibility, allowing multi-step in-place circuits to store only k history.","result":"Width-16 three-step k-only circuit passed targeted autoresearch.sh and full checks. Forward-only half matches the classical three-step odd-GCD recurrence with flag/spill/active clean and phase zero; forward+inverse restores all lanes and clears all k histories using a single reusable flag. Cost: forward 2382 CCX, roundtrip 4812 CCX, peak 164q. The previous crash was a too-broad toy case including invalid k=0/near-boundary promises; this test restricts to the odd-GCD domain used by the real scaled route.","next_action_hint":"Next test a longer width-16/32 k-only trace and then build a slack-packed history layout that stores these k bits in fixed public high-bit slots instead of separate hist registers."}}
{"type":"config","name":"plusminus width32 eight-step k-only roundtrip circuit","metricName":"plusminus_konly_w32_steps8_ccx","metricUnit":"","bestDirection":"lower"}
{"run":481,"commit":"6e7e761","metric":0,"metrics":{"altseed_classical_total":0,"altseed_phase_batches_total":0,"altseed_ancilla_batches_total":0,"correctness_ok":0},"status":"crash","description":"Width32 k-only stress exposed unsigned denominator shift bug","timestamp":1777585190569,"segment":48,"confidence":null,"iterationTokens":172,"asi":{"hypothesis":"The k-only direction recovery circuit should scale to wider/longer odd-GCD traces when only k history is stored.","result":"Width-32 eight-step roundtrip failed with spill=1 for case=(4294967281,12345). This exposed a real wiring bug: the inverse path reused the signed no-overflow left-shift helper for the denominator lane u, but u is an unsigned denominator. Near the high end of the word, signed top-bit preservation is the wrong cleanup promise; unsigned exact left shift should clear spill from known zero shifted-out high bits instead.","rollback_reason":"Uncommitted width32 stress test failed; revert and introduce a separate unsigned exact left-shift inverse for denominator restoration before rerunning.","next_action_hint":"Keep signed no-overflow left shift for coefficient lanes, but use an unsigned controlled left shift exact helper for u in inverse/roundtrip. Then rerun width32 eight-step stress including the failing near-boundary case."}}
{"type":"config","name":"plusminus width32 eight-step k-only roundtrip circuit fixed unsigned shift","metricName":"plusminus_konly_w32_steps8_ccx","metricUnit":"","bestDirection":"lower"}
{"run":482,"commit":"4b26d2c","metric":41888,"metrics":{"plusminus_konly_w32_steps8_width":32,"plusminus_konly_w32_steps8_steps":8,"plusminus_konly_w32_steps8_peak_q":484,"altseed_classical_total":0,"altseed_phase_batches_total":0,"altseed_ancilla_batches_total":0,"avg_toffoli":4089274,"avg_clifford":24292787.153,"qubits":2713,"emitted_ops":30575944,"correctness_ok":1},"status":"keep","description":"Fix denominator shift and validate width32 k-only plusminus trace","timestamp":1777585348318,"segment":49,"confidence":null,"iterationTokens":175,"asi":{"hypothesis":"Using an unsigned exact left-shift for denominator restoration should fix the width32 k-only spill failure while preserving the signed no-overflow shift for coefficient lanes.","result":"Width-32 eight-step k-only forward+inverse roundtrip passed targeted autoresearch.sh and full checks, including the previous near-boundary failing case. Cost 41,888 CCX, peak 484q. This validates a wider/longer wireable plusminus trace with no direction history and exposes/fixes an important type distinction: denominator lanes need unsigned exact shifts, coefficient lanes need signed no-overflow shifts.","next_action_hint":"Move from separate hist registers to a fixed public slack-packing layout: first implement a toy reversible slot-map copy/extract using public slots, then combine with k-only multi-step cleanup."}}
{"type":"config","name":"plusminus fixed high-bit slack slot history circuit","metricName":"plusminus_slack_slot_roundtrip_ccx","metricUnit":"","bestDirection":"lower"}
{"run":483,"commit":"89df048","metric":2988,"metrics":{"plusminus_slack_slot_live_width":12,"plusminus_slack_slot_total_width":24,"plusminus_slack_slot_steps":3,"plusminus_slack_slot_packed_slots":36,"plusminus_slack_slot_roundtrip_peak_q":136,"altseed_classical_total":0,"altseed_phase_batches_total":0,"altseed_ancilla_batches_total":0,"avg_toffoli":4089274,"avg_clifford":24292787.153,"qubits":2713,"emitted_ops":30575944,"correctness_ok":1},"status":"keep","description":"Validate toy high-bit slack slots as plusminus k-history storage","timestamp":1777585519528,"segment":50,"confidence":null,"iterationTokens":164,"asi":{"hypothesis":"The plus-minus k-history does not need separate qubit registers if public high-bit slack slots inside the live lanes are passed directly as the history qubits.","result":"Toy fixed-slot circuit passed targeted autoresearch.sh and full checks. Three 12-bit k-only steps use 36 packed history qubits drawn from high bits of the four 24-bit live lanes; forward+inverse restores low live lanes and clears every packed slot, active/spill/flag/one with zero phase. Cost 2988 CCX, peak 136q. This validates the actual reversible packing shape (hist slots are the lane slack qubits themselves), not just a cost table.","next_action_hint":"Scale this to a variable public envelope: build a step-index slot allocator over four lanes and run a toy multi-step trace where each step receives its fixed slot slice from the public map."}}
